{"experiment_num": 142, "backbone": "mlp", "description": "Exp142 MLP add is_severe on Exp136 recipe (MLP cycle 18/50)", "config": {"paths": {"results_dir": "C:\\Users\\abhir\\autoresearch-uci\\beijing_pm25\\autoresearch_results"}, "task_type": "regression", "primary_metric": "rmse", "backbone": "mlp", "backbone_config": {"seed": 0, "n_jobs": 4, "weight_decay": 0.0001, "batch_size": 16}, "data": {"format": "csv", "path": "C:\\Users\\abhir\\autoresearch-uci\\beijing_pm25\\data\\features_full.csv", "target_columns": ["pm25"], "feature_columns": ["DEWP", "TEMP", "PRES", "Iws", "Is", "Ir", "cbwd_NE", "cbwd_NW", "cbwd_SE", "cbwd_cv", "pm25_lag1", "pm25_lag2", "pm25_lag3", "pm25_lag4", "pm25_lag5", "pm25_lag6", "pm25_lag7", "pm25_lag8", "pm25_lag9", "pm25_lag10", "pm25_lag11", "pm25_lag12", "pm25_lag13", "pm25_lag14", "pm25_lag15", "pm25_lag16", "pm25_lag17", "pm25_lag18", "pm25_lag19", "pm25_lag20", "pm25_lag21", "pm25_lag22", "pm25_lag23", "pm25_lag24", "hour_sin", "hour_cos", "dow", "is_weekend", "pm25_delta1", "inversion_spread", "rh_magnus", "dewp_delta", "is_heating", "log_iws", "month_sin", "pm25_accel", "vent_index", "is_severe"]}, "split": {"name": "calendar_year", "manifest_dir": "C:\\Users\\abhir\\autoresearch-uci\\beijing_pm25\\data"}, "composite": {"higher_is_better": false, "penalty_weight": 0.1, "below_threshold": -40.0}, "hardware": {"n_threads": 4, "cpu_affinity": [0, 2, 4, 6]}, "description": "Exp142 MLP add is_severe on Exp136 recipe (MLP cycle 18/50)", "seed": 0}, "composite": -22.437582595116787, "val_primary": 22.437582595116787, "test_primary": 20.469028416547335, "per_fold_test": [20.469028416547335], "per_fold_val": [22.437582595116787], "status": "DISCARD", "seconds_elapsed": 146.4055061340332, "timestamp": "2026-08-19T22:41:05", "secondary_metrics": {"mae": 11.279198952261007, "mape": 0.1990319361601552, "r2": 0.9515969779515292, "ic": 0.9732949580017606}, "per_fold_test_reports": [{"fold_id": 0, "regime": "calendar_2014_test", "task_type": "regression", "n": 7950, "rmse": 20.469028416547335, "mae": 11.279198952261007, "mape": 0.1990319361601552, "r2": 0.9515969779515292, "ic": 0.9732949580017606}], "composite_fingerprint": "a12fd381fe9bbefb"}
{"experiment_num": 143, "backbone": "mlp", "description": "Exp143 MLP add cbwd_prev_NW on Exp136 recipe (MLP cycle 19/50)", "config": {"paths": {"results_dir": "C:\\Users\\abhir\\autoresearch-uci\\beijing_pm25\\autoresearch_results"}, "task_type": "regression", "primary_metric": "rmse", "backbone": "mlp", "backbone_config": {"seed": 0, "n_jobs": 4, "weight_decay": 0.0001, "batch_size": 16}, "data": {"format": "csv", "path": "C:\\Users\\abhir\\autoresearch-uci\\beijing_pm25\\data\\features_full.csv", "target_columns": ["pm25"], "feature_columns": ["DEWP", "TEMP", "PRES", "Iws", "Is", "Ir", "cbwd_NE", "cbwd_NW", "cbwd_SE", "cbwd_cv", "pm25_lag1", "pm25_lag2", "pm25_lag3", "pm25_lag4", "pm25_lag5", "pm25_lag6", "pm25_lag7", "pm25_lag8", "pm25_lag9", "pm25_lag10", "pm25_lag11", "pm25_lag12", "pm25_lag13", "pm25_lag14", "pm25_lag15", "pm25_lag16", "pm25_lag17", "pm25_lag18", "pm25_lag19", "pm25_lag20", "pm25_lag21", "pm25_lag22", "pm25_lag23", "pm25_lag24", "hour_sin", "hour_cos", "dow", "is_weekend", "pm25_delta1", "inversion_spread", "rh_magnus", "dewp_delta", "is_heating", "log_iws", "month_sin", "pm25_accel", "vent_index", "cbwd_prev_NW"]}, "split": {"name": "calendar_year", "manifest_dir": "C:\\Users\\abhir\\autoresearch-uci\\beijing_pm25\\data"}, "composite": {"higher_is_better": false, "penalty_weight": 0.1, "below_threshold": -40.0}, "hardware": {"n_threads": 4, "cpu_affinity": [0, 2, 4, 6]}, "description": "Exp143 MLP add cbwd_prev_NW on Exp136 recipe (MLP cycle 19/50)", "seed": 0}, "composite": -22.38136410774712, "val_primary": 22.38136410774712, "test_primary": 20.383380748727056, "per_fold_test": [20.383380748727056], "per_fold_val": [22.38136410774712], "status": "DISCARD", "seconds_elapsed": 132.13184690475464, "timestamp": "2026-08-19T23:11:09", "secondary_metrics": {"mae": 11.236775660064986, "mape": 0.20197661953251736, "r2": 0.9520011918428897, "ic": 0.9735761984455589}, "per_fold_test_reports": [{"fold_id": 0, "regime": "calendar_2014_test", "task_type": "regression", "n": 7950, "rmse": 20.383380748727056, "mae": 11.236775660064986, "mape": 0.20197661953251736, "r2": 0.9520011918428897, "ic": 0.9735761984455589}], "composite_fingerprint": "a12fd381fe9bbefb"}
{"experiment_num": 144, "backbone": "mlp", "description": "Exp144 MLP add is_janfeb on Exp136 recipe (MLP cycle 20/50)", "config": {"paths": {"results_dir": "C:\\Users\\abhir\\autoresearch-uci\\beijing_pm25\\autoresearch_results"}, "task_type": "regression", "primary_metric": "rmse", "backbone": "mlp", "backbone_config": {"seed": 0, "n_jobs": 4, "weight_decay": 0.0001, "batch_size": 16}, "data": {"format": "csv", "path": "C:\\Users\\abhir\\autoresearch-uci\\beijing_pm25\\data\\features_full.csv", "target_columns": ["pm25"], "feature_columns": ["DEWP", "TEMP", "PRES", "Iws", "Is", "Ir", "cbwd_NE", "cbwd_NW", "cbwd_SE", "cbwd_cv", "pm25_lag1", "pm25_lag2", "pm25_lag3", "pm25_lag4", "pm25_lag5", "pm25_lag6", "pm25_lag7", "pm25_lag8", "pm25_lag9", "pm25_lag10", "pm25_lag11", "pm25_lag12", "pm25_lag13", "pm25_lag14", "pm25_lag15", "pm25_lag16", "pm25_lag17", "pm25_lag18", "pm25_lag19", "pm25_lag20", "pm25_lag21", "pm25_lag22", "pm25_lag23", "pm25_lag24", "hour_sin", "hour_cos", "dow", "is_weekend", "pm25_delta1", "inversion_spread", "rh_magnus", "dewp_delta", "is_heating", "log_iws", "month_sin", "pm25_accel", "vent_index", "is_janfeb"]}, "split": {"name": "calendar_year", "manifest_dir": "C:\\Users\\abhir\\autoresearch-uci\\beijing_pm25\\data"}, "composite": {"higher_is_better": false, "penalty_weight": 0.1, "below_threshold": -40.0}, "hardware": {"n_threads": 4, "cpu_affinity": [0, 2, 4, 6]}, "description": "Exp144 MLP add is_janfeb on Exp136 recipe (MLP cycle 20/50)", "seed": 0}, "composite": -22.52786231927297, "val_primary": 22.52786231927297, "test_primary": 20.67100209310541, "per_fold_test": [20.67100209310541], "per_fold_val": [22.52786231927297], "status": "DISCARD", "seconds_elapsed": 98.46123933792114, "timestamp": "2026-08-19T23:40:16", "secondary_metrics": {"mae": 11.33506882715525, "mape": 0.20940106999977798, "r2": 0.9506370527350598, "ic": 0.9727678264926213}, "per_fold_test_reports": [{"fold_id": 0, "regime": "calendar_2014_test", "task_type": "regression", "n": 7950, "rmse": 20.67100209310541, "mae": 11.33506882715525, "mape": 0.20940106999977798, "r2": 0.9506370527350598, "ic": 0.9727678264926213}], "composite_fingerprint": "a12fd381fe9bbefb"}
{"experiment_num": 145, "backbone": "mlp", "description": "Exp145 MLP add iws_clip100 on Exp136 recipe (MLP cycle 21/50)", "config": {"paths": {"results_dir": "C:\\Users\\abhir\\autoresearch-uci\\beijing_pm25\\autoresearch_results"}, "task_type": "regression", "primary_metric": "rmse", "backbone": "mlp", "backbone_config": {"seed": 0, "n_jobs": 4, "weight_decay": 0.0001, "batch_size": 16}, "data": {"format": "csv", "path": "C:\\Users\\abhir\\autoresearch-uci\\beijing_pm25\\data\\features_full.csv", "target_columns": ["pm25"], "feature_columns": ["DEWP", "TEMP", "PRES", "Iws", "Is", "Ir", "cbwd_NE", "cbwd_NW", "cbwd_SE", "cbwd_cv", "pm25_lag1", "pm25_lag2", "pm25_lag3", "pm25_lag4", "pm25_lag5", "pm25_lag6", "pm25_lag7", "pm25_lag8", "pm25_lag9", "pm25_lag10", "pm25_lag11", "pm25_lag12", "pm25_lag13", "pm25_lag14", "pm25_lag15", "pm25_lag16", "pm25_lag17", "pm25_lag18", "pm25_lag19", "pm25_lag20", "pm25_lag21", "pm25_lag22", "pm25_lag23", "pm25_lag24", "hour_sin", "hour_cos", "dow", "is_weekend", "pm25_delta1", "inversion_spread", "rh_magnus", "dewp_delta", "is_heating", "log_iws", "month_sin", "pm25_accel", "vent_index", "iws_clip100"]}, "split": {"name": "calendar_year", "manifest_dir": "C:\\Users\\abhir\\autoresearch-uci\\beijing_pm25\\data"}, "composite": {"higher_is_better": false, "penalty_weight": 0.1, "below_threshold": -40.0}, "hardware": {"n_threads": 4, "cpu_affinity": [0, 2, 4, 6]}, "description": "Exp145 MLP add iws_clip100 on Exp136 recipe (MLP cycle 21/50)", "seed": 0}, "composite": -22.473031951631793, "val_primary": 22.473031951631793, "test_primary": 20.49419012718721, "per_fold_test": [20.49419012718721], "per_fold_val": [22.473031951631793], "status": "DISCARD", "seconds_elapsed": 130.66482067108154, "timestamp": "2026-08-20T00:11:07", "secondary_metrics": {"mae": 11.292813151317572, "mape": 0.20092784091179733, "r2": 0.9514779052365675, "ic": 0.9732380960036716}, "per_fold_test_reports": [{"fold_id": 0, "regime": "calendar_2014_test", "task_type": "regression", "n": 7950, "rmse": 20.49419012718721, "mae": 11.292813151317572, "mape": 0.20092784091179733, "r2": 0.9514779052365675, "ic": 0.9732380960036716}], "composite_fingerprint": "a12fd381fe9bbefb"}
{"experiment_num": 146, "backbone": "mlp", "description": "Exp146 MLP add dow_sin on Exp136 recipe (MLP cycle 22/50)", "config": {"paths": {"results_dir": "C:\\Users\\abhir\\autoresearch-uci\\beijing_pm25\\autoresearch_results"}, "task_type": "regression", "primary_metric": "rmse", "backbone": "mlp", "backbone_config": {"seed": 0, "n_jobs": 4, "weight_decay": 0.0001, "batch_size": 16}, "data": {"format": "csv", "path": "C:\\Users\\abhir\\autoresearch-uci\\beijing_pm25\\data\\features_full.csv", "target_columns": ["pm25"], "feature_columns": ["DEWP", "TEMP", "PRES", "Iws", "Is", "Ir", "cbwd_NE", "cbwd_NW", "cbwd_SE", "cbwd_cv", "pm25_lag1", "pm25_lag2", "pm25_lag3", "pm25_lag4", "pm25_lag5", "pm25_lag6", "pm25_lag7", "pm25_lag8", "pm25_lag9", "pm25_lag10", "pm25_lag11", "pm25_lag12", "pm25_lag13", "pm25_lag14", "pm25_lag15", "pm25_lag16", "pm25_lag17", "pm25_lag18", "pm25_lag19", "pm25_lag20", "pm25_lag21", "pm25_lag22", "pm25_lag23", "pm25_lag24", "hour_sin", "hour_cos", "dow", "is_weekend", "pm25_delta1", "inversion_spread", "rh_magnus", "dewp_delta", "is_heating", "log_iws", "month_sin", "pm25_accel", "vent_index", "dow_sin"]}, "split": {"name": "calendar_year", "manifest_dir": "C:\\Users\\abhir\\autoresearch-uci\\beijing_pm25\\data"}, "composite": {"higher_is_better": false, "penalty_weight": 0.1, "below_threshold": -40.0}, "hardware": {"n_threads": 4, "cpu_affinity": [0, 2, 4, 6]}, "description": "Exp146 MLP add dow_sin on Exp136 recipe (MLP cycle 22/50)", "seed": 0}, "composite": -22.716020146993024, "val_primary": 22.716020146993024, "test_primary": 20.826246842246803, "per_fold_test": [20.826246842246803], "per_fold_val": [22.716020146993024], "status": "DISCARD", "seconds_elapsed": 88.38400936126709, "timestamp": "2026-08-20T00:41:33", "secondary_metrics": {"mae": 11.33536327284087, "mape": 0.20414837899663385, "r2": 0.9498928106136779, "ic": 0.9727289369150024}, "per_fold_test_reports": [{"fold_id": 0, "regime": "calendar_2014_test", "task_type": "regression", "n": 7950, "rmse": 20.826246842246803, "mae": 11.33536327284087, "mape": 0.20414837899663385, "r2": 0.9498928106136779, "ic": 0.9727289369150024}], "composite_fingerprint": "a12fd381fe9bbefb"}
{"experiment_num": 147, "backbone": "mlp", "description": "Exp147 MLP add cv_inv on Exp136 recipe (MLP cycle 23/50)", "config": {"paths": {"results_dir": "C:\\Users\\abhir\\autoresearch-uci\\beijing_pm25\\autoresearch_results"}, "task_type": "regression", "primary_metric": "rmse", "backbone": "mlp", "backbone_config": {"seed": 0, "n_jobs": 4, "weight_decay": 0.0001, "batch_size": 16}, "data": {"format": "csv", "path": "C:\\Users\\abhir\\autoresearch-uci\\beijing_pm25\\data\\features_full.csv", "target_columns": ["pm25"], "feature_columns": ["DEWP", "TEMP", "PRES", "Iws", "Is", "Ir", "cbwd_NE", "cbwd_NW", "cbwd_SE", "cbwd_cv", "pm25_lag1", "pm25_lag2", "pm25_lag3", "pm25_lag4", "pm25_lag5", "pm25_lag6", "pm25_lag7", "pm25_lag8", "pm25_lag9", "pm25_lag10", "pm25_lag11", "pm25_lag12", "pm25_lag13", "pm25_lag14", "pm25_lag15", "pm25_lag16", "pm25_lag17", "pm25_lag18", "pm25_lag19", "pm25_lag20", "pm25_lag21", "pm25_lag22", "pm25_lag23", "pm25_lag24", "hour_sin", "hour_cos", "dow", "is_weekend", "pm25_delta1", "inversion_spread", "rh_magnus", "dewp_delta", "is_heating", "log_iws", "month_sin", "pm25_accel", "vent_index", "cv_inv"]}, "split": {"name": "calendar_year", "manifest_dir": "C:\\Users\\abhir\\autoresearch-uci\\beijing_pm25\\data"}, "composite": {"higher_is_better": false, "penalty_weight": 0.1, "below_threshold": -40.0}, "hardware": {"n_threads": 4, "cpu_affinity": [0, 2, 4, 6]}, "description": "Exp147 MLP add cv_inv on Exp136 recipe (MLP cycle 23/50)", "seed": 0}, "composite": -22.32711184158033, "val_primary": 22.32711184158033, "test_primary": 20.57277803550758, "per_fold_test": [20.57277803550758], "per_fold_val": [22.32711184158033], "status": "DISCARD", "seconds_elapsed": 128.27954745292664, "timestamp": "2026-08-20T01:11:19", "secondary_metrics": {"mae": 11.273387164289847, "mape": 0.19740630202640175, "r2": 0.9511050618953399, "ic": 0.9730360201869578}, "per_fold_test_reports": [{"fold_id": 0, "regime": "calendar_2014_test", "task_type": "regression", "n": 7950, "rmse": 20.57277803550758, "mae": 11.273387164289847, "mape": 0.19740630202640175, "r2": 0.9511050618953399, "ic": 0.9730360201869578}], "composite_fingerprint": "a12fd381fe9bbefb"}
{"experiment_num": 148, "backbone": "mlp", "description": "Exp148 MLP extra hidden 256-128-64-32 on Exp136 recipe (MLP cycle 24/50)", "config": {"paths": {"results_dir": "C:\\Users\\abhir\\autoresearch-uci\\beijing_pm25\\autoresearch_results"}, "task_type": "regression", "primary_metric": "rmse", "backbone": "mlp", "backbone_config": {"seed": 0, "n_jobs": 4, "weight_decay": 0.0001, "batch_size": 16, "hidden": [256, 128, 64, 32]}, "data": {"format": "csv", "path": "C:\\Users\\abhir\\autoresearch-uci\\beijing_pm25\\data\\features_full.csv", "target_columns": ["pm25"], "feature_columns": ["DEWP", "TEMP", "PRES", "Iws", "Is", "Ir", "cbwd_NE", "cbwd_NW", "cbwd_SE", "cbwd_cv", "pm25_lag1", "pm25_lag2", "pm25_lag3", "pm25_lag4", "pm25_lag5", "pm25_lag6", "pm25_lag7", "pm25_lag8", "pm25_lag9", "pm25_lag10", "pm25_lag11", "pm25_lag12", "pm25_lag13", "pm25_lag14", "pm25_lag15", "pm25_lag16", "pm25_lag17", "pm25_lag18", "pm25_lag19", "pm25_lag20", "pm25_lag21", "pm25_lag22", "pm25_lag23", "pm25_lag24", "hour_sin", "hour_cos", "dow", "is_weekend", "pm25_delta1", "inversion_spread", "rh_magnus", "dewp_delta", "is_heating", "log_iws", "month_sin", "pm25_accel", "vent_index"]}, "split": {"name": "calendar_year", "manifest_dir": "C:\\Users\\abhir\\autoresearch-uci\\beijing_pm25\\data"}, "composite": {"higher_is_better": false, "penalty_weight": 0.1, "below_threshold": -40.0}, "hardware": {"n_threads": 4, "cpu_affinity": [0, 2, 4, 6]}, "description": "Exp148 MLP extra hidden 256-128-64-32 on Exp136 recipe (MLP cycle 24/50)", "seed": 0}, "composite": -23.289058121971728, "val_primary": 23.289058121971728, "test_primary": 21.33044307915665, "per_fold_test": [21.33044307915665], "per_fold_val": [23.289058121971728], "status": "DISCARD", "seconds_elapsed": 79.61636233329773, "timestamp": "2026-08-20T01:41:16", "secondary_metrics": {"mae": 11.747003751490851, "mape": 0.22159235995949975, "r2": 0.9474372869527206, "ic": 0.9725149008117183}, "per_fold_test_reports": [{"fold_id": 0, "regime": "calendar_2014_test", "task_type": "regression", "n": 7950, "rmse": 21.33044307915665, "mae": 11.747003751490851, "mape": 0.22159235995949975, "r2": 0.9474372869527206, "ic": 0.9725149008117183}], "composite_fingerprint": "a12fd381fe9bbefb"}
{"experiment_num": 149, "backbone": "mlp", "description": "Exp149 MLP hetero_loss on Exp136 recipe (MLP cycle 25/50)", "config": {"paths": {"results_dir": "C:\\Users\\abhir\\autoresearch-uci\\beijing_pm25\\autoresearch_results"}, "task_type": "regression", "primary_metric": "rmse", "backbone": "mlp", "backbone_config": {"seed": 0, "n_jobs": 4, "weight_decay": 0.0001, "batch_size": 16, "hetero_loss": true}, "data": {"format": "csv", "path": "C:\\Users\\abhir\\autoresearch-uci\\beijing_pm25\\data\\features_full.csv", "target_columns": ["pm25"], "feature_columns": ["DEWP", "TEMP", "PRES", "Iws", "Is", "Ir", "cbwd_NE", "cbwd_NW", "cbwd_SE", "cbwd_cv", "pm25_lag1", "pm25_lag2", "pm25_lag3", "pm25_lag4", "pm25_lag5", "pm25_lag6", "pm25_lag7", "pm25_lag8", "pm25_lag9", "pm25_lag10", "pm25_lag11", "pm25_lag12", "pm25_lag13", "pm25_lag14", "pm25_lag15", "pm25_lag16", "pm25_lag17", "pm25_lag18", "pm25_lag19", "pm25_lag20", "pm25_lag21", "pm25_lag22", "pm25_lag23", "pm25_lag24", "hour_sin", "hour_cos", "dow", "is_weekend", "pm25_delta1", "inversion_spread", "rh_magnus", "dewp_delta", "is_heating", "log_iws", "month_sin", "pm25_accel", "vent_index"]}, "split": {"name": "calendar_year", "manifest_dir": "C:\\Users\\abhir\\autoresearch-uci\\beijing_pm25\\data"}, "composite": {"higher_is_better": false, "penalty_weight": 0.1, "below_threshold": -40.0}, "hardware": {"n_threads": 4, "cpu_affinity": [0, 2, 4, 6]}, "description": "Exp149 MLP hetero_loss on Exp136 recipe (MLP cycle 25/50)", "seed": 0}, "composite": -22.770971282871034, "val_primary": 22.770971282871034, "test_primary": 21.104178896409234, "per_fold_test": [21.104178896409234], "per_fold_val": [22.770971282871034], "status": "DISCARD", "seconds_elapsed": 83.33336353302002, "timestamp": "2026-08-20T02:09:08", "secondary_metrics": {"mae": 11.574303817509106, "mape": 0.19997607139183626, "r2": 0.9485464979553301, "ic": 0.9724612139448281}, "per_fold_test_reports": [{"fold_id": 0, "regime": "calendar_2014_test", "task_type": "regression", "n": 7950, "rmse": 21.104178896409234, "mae": 11.574303817509106, "mape": 0.19997607139183626, "r2": 0.9485464979553301, "ic": 0.9724612139448281}], "composite_fingerprint": "a12fd381fe9bbefb"}
{"experiment_num": 150, "backbone": "mlp", "description": "Exp150 MLP grad_clip=0 on Exp136 recipe (MLP cycle 26/50)", "config": {"paths": {"results_dir": "C:\\Users\\abhir\\autoresearch-uci\\beijing_pm25\\autoresearch_results"}, "task_type": "regression", "primary_metric": "rmse", "backbone": "mlp", "backbone_config": {"seed": 0, "n_jobs": 4, "weight_decay": 0.0001, "batch_size": 16, "grad_clip": 0}, "data": {"format": "csv", "path": "C:\\Users\\abhir\\autoresearch-uci\\beijing_pm25\\data\\features_full.csv", "target_columns": ["pm25"], "feature_columns": ["DEWP", "TEMP", "PRES", "Iws", "Is", "Ir", "cbwd_NE", "cbwd_NW", "cbwd_SE", "cbwd_cv", "pm25_lag1", "pm25_lag2", "pm25_lag3", "pm25_lag4", "pm25_lag5", "pm25_lag6", "pm25_lag7", "pm25_lag8", "pm25_lag9", "pm25_lag10", "pm25_lag11", "pm25_lag12", "pm25_lag13", "pm25_lag14", "pm25_lag15", "pm25_lag16", "pm25_lag17", "pm25_lag18", "pm25_lag19", "pm25_lag20", "pm25_lag21", "pm25_lag22", "pm25_lag23", "pm25_lag24", "hour_sin", "hour_cos", "dow", "is_weekend", "pm25_delta1", "inversion_spread", "rh_magnus", "dewp_delta", "is_heating", "log_iws", "month_sin", "pm25_accel", "vent_index"]}, "split": {"name": "calendar_year", "manifest_dir": "C:\\Users\\abhir\\autoresearch-uci\\beijing_pm25\\data"}, "composite": {"higher_is_better": false, "penalty_weight": 0.1, "below_threshold": -40.0}, "hardware": {"n_threads": 4, "cpu_affinity": [0, 2, 4, 6]}, "description": "Exp150 MLP grad_clip=0 on Exp136 recipe (MLP cycle 26/50)", "seed": 0}, "composite": -22.402045172149407, "val_primary": 22.402045172149407, "test_primary": 20.399767690482893, "per_fold_test": [20.399767690482893], "per_fold_val": [22.402045172149407], "status": "DISCARD", "seconds_elapsed": 115.00430512428284, "timestamp": "2026-08-20T02:40:27", "secondary_metrics": {"mae": 11.338783583611063, "mape": 0.20282229668741106, "r2": 0.951923984842453, "ic": 0.9733410623406723}, "per_fold_test_reports": [{"fold_id": 0, "regime": "calendar_2014_test", "task_type": "regression", "n": 7950, "rmse": 20.399767690482893, "mae": 11.338783583611063, "mape": 0.20282229668741106, "r2": 0.951923984842453, "ic": 0.9733410623406723}], "composite_fingerprint": "a12fd381fe9bbefb"}
