{"experiment_num": 178, "backbone": "ft_transformer", "description": "Exp178 FT-Transformer Pre-LN norm_first on Exp167 features (FT cycle 4/50)", "config": {"paths": {"results_dir": "C:\\Users\\abhir\\autoresearch-uci\\beijing_pm25\\autoresearch_results"}, "task_type": "regression", "primary_metric": "rmse", "backbone": "ft_transformer", "backbone_config": {"seed": 0, "n_jobs": 4, "d_model": 64, "n_heads": 4, "n_layers": 3, "dropout": 0.1, "lr": 0.0001, "epochs": 100, "patience": 15, "batch_size": 32, "weight_decay": 1e-05, "warmup": 10, "norm_first": true}, "data": {"format": "csv", "path": "C:\\Users\\abhir\\autoresearch-uci\\beijing_pm25\\data\\features_full.csv", "target_columns": ["pm25"], "feature_columns": ["DEWP", "TEMP", "PRES", "Iws", "Is", "Ir", "cbwd_NE", "cbwd_NW", "cbwd_SE", "cbwd_cv", "pm25_lag1", "pm25_lag2", "pm25_lag3", "pm25_lag4", "pm25_lag5", "pm25_lag6", "pm25_lag7", "pm25_lag8", "pm25_lag9", "pm25_lag10", "pm25_lag11", "pm25_lag12", "pm25_lag13", "pm25_lag14", "pm25_lag15", "pm25_lag16", "pm25_lag17", "pm25_lag18", "pm25_lag19", "pm25_lag20", "pm25_lag21", "pm25_lag22", "pm25_lag23", "pm25_lag24", "hour_sin", "hour_cos", "dow", "is_weekend", "pm25_delta1", "inversion_spread", "rh_magnus", "dewp_delta", "is_heating", "log_iws", "month_sin", "pm25_accel", "vent_index"]}, "split": {"name": "calendar_year", "manifest_dir": "C:\\Users\\abhir\\autoresearch-uci\\beijing_pm25\\data"}, "composite": {"higher_is_better": false, "penalty_weight": 0.1, "below_threshold": -40.0}, "hardware": {"n_threads": 4, "cpu_affinity": [0, 2, 4, 6]}, "description": "Exp178 FT-Transformer Pre-LN norm_first on Exp167 features (FT cycle 4/50)", "seed": 0}, "composite": -22.139814825407495, "val_primary": 22.139814825407495, "test_primary": 20.673762763503042, "per_fold_test": [20.673762763503042], "per_fold_val": [22.139814825407495], "status": "DISCARD", "seconds_elapsed": 3185.4747154712677, "timestamp": "2026-08-21T06:12:23", "secondary_metrics": {"mae": 11.27959428712257, "mape": 0.1895093011898283, "r2": 0.9506238667340539, "ic": 0.9732350148023627}, "per_fold_test_reports": [{"fold_id": 0, "regime": "calendar_2014_test", "task_type": "regression", "n": 7950, "rmse": 20.673762763503042, "mae": 11.27959428712257, "mape": 0.1895093011898283, "r2": 0.9506238667340539, "ic": 0.9732350148023627}], "composite_fingerprint": "a12fd381fe9bbefb"}
{"experiment_num": 179, "backbone": "ft_transformer", "description": "Exp179 FT-Transformer Pre-LN dropout=0 on Exp167 features (FT cycle 5/50)", "config": {"paths": {"results_dir": "C:\\Users\\abhir\\autoresearch-uci\\beijing_pm25\\autoresearch_results"}, "task_type": "regression", "primary_metric": "rmse", "backbone": "ft_transformer", "backbone_config": {"seed": 0, "n_jobs": 4, "d_model": 64, "n_heads": 4, "n_layers": 3, "dropout": 0, "lr": 0.0001, "epochs": 100, "patience": 15, "batch_size": 32, "weight_decay": 1e-05, "warmup": 10, "norm_first": true}, "data": {"format": "csv", "path": "C:\\Users\\abhir\\autoresearch-uci\\beijing_pm25\\data\\features_full.csv", "target_columns": ["pm25"], "feature_columns": ["DEWP", "TEMP", "PRES", "Iws", "Is", "Ir", "cbwd_NE", "cbwd_NW", "cbwd_SE", "cbwd_cv", "pm25_lag1", "pm25_lag2", "pm25_lag3", "pm25_lag4", "pm25_lag5", "pm25_lag6", "pm25_lag7", "pm25_lag8", "pm25_lag9", "pm25_lag10", "pm25_lag11", "pm25_lag12", "pm25_lag13", "pm25_lag14", "pm25_lag15", "pm25_lag16", "pm25_lag17", "pm25_lag18", "pm25_lag19", "pm25_lag20", "pm25_lag21", "pm25_lag22", "pm25_lag23", "pm25_lag24", "hour_sin", "hour_cos", "dow", "is_weekend", "pm25_delta1", "inversion_spread", "rh_magnus", "dewp_delta", "is_heating", "log_iws", "month_sin", "pm25_accel", "vent_index"]}, "split": {"name": "calendar_year", "manifest_dir": "C:\\Users\\abhir\\autoresearch-uci\\beijing_pm25\\data"}, "composite": {"higher_is_better": false, "penalty_weight": 0.1, "below_threshold": -40.0}, "hardware": {"n_threads": 4, "cpu_affinity": [0, 2, 4, 6]}, "description": "Exp179 FT-Transformer Pre-LN dropout=0 on Exp167 features (FT cycle 5/50)", "seed": 0}, "composite": -22.199982863321686, "val_primary": 22.199982863321686, "test_primary": 20.50923778803338, "per_fold_test": [20.50923778803338], "per_fold_val": [22.199982863321686], "status": "DISCARD", "seconds_elapsed": 1682.400815486908, "timestamp": "2026-08-21T06:46:27", "secondary_metrics": {"mae": 11.215302337010701, "mape": 0.18857435838914793, "r2": 0.9514066253204931, "ic": 0.9730978961257915}, "per_fold_test_reports": [{"fold_id": 0, "regime": "calendar_2014_test", "task_type": "regression", "n": 7950, "rmse": 20.50923778803338, "mae": 11.215302337010701, "mape": 0.18857435838914793, "r2": 0.9514066253204931, "ic": 0.9730978961257915}], "composite_fingerprint": "a12fd381fe9bbefb"}
{"experiment_num": 180, "backbone": "ft_transformer", "description": "Exp180 FT-Transformer Pre-LN dropout=0.2 on Exp167 features (FT cycle 6/50)", "config": {"paths": {"results_dir": "C:\\Users\\abhir\\autoresearch-uci\\beijing_pm25\\autoresearch_results"}, "task_type": "regression", "primary_metric": "rmse", "backbone": "ft_transformer", "backbone_config": {"seed": 0, "n_jobs": 4, "d_model": 64, "n_heads": 4, "n_layers": 3, "dropout": 0.2, "lr": 0.0001, "epochs": 100, "patience": 15, "batch_size": 32, "weight_decay": 1e-05, "warmup": 10, "norm_first": true}, "data": {"format": "csv", "path": "C:\\Users\\abhir\\autoresearch-uci\\beijing_pm25\\data\\features_full.csv", "target_columns": ["pm25"], "feature_columns": ["DEWP", "TEMP", "PRES", "Iws", "Is", "Ir", "cbwd_NE", "cbwd_NW", "cbwd_SE", "cbwd_cv", "pm25_lag1", "pm25_lag2", "pm25_lag3", "pm25_lag4", "pm25_lag5", "pm25_lag6", "pm25_lag7", "pm25_lag8", "pm25_lag9", "pm25_lag10", "pm25_lag11", "pm25_lag12", "pm25_lag13", "pm25_lag14", "pm25_lag15", "pm25_lag16", "pm25_lag17", "pm25_lag18", "pm25_lag19", "pm25_lag20", "pm25_lag21", "pm25_lag22", "pm25_lag23", "pm25_lag24", "hour_sin", "hour_cos", "dow", "is_weekend", "pm25_delta1", "inversion_spread", "rh_magnus", "dewp_delta", "is_heating", "log_iws", "month_sin", "pm25_accel", "vent_index"]}, "split": {"name": "calendar_year", "manifest_dir": "C:\\Users\\abhir\\autoresearch-uci\\beijing_pm25\\data"}, "composite": {"higher_is_better": false, "penalty_weight": 0.1, "below_threshold": -40.0}, "hardware": {"n_threads": 4, "cpu_affinity": [0, 2, 4, 6]}, "description": "Exp180 FT-Transformer Pre-LN dropout=0.2 on Exp167 features (FT cycle 6/50)", "seed": 0}, "composite": -22.568385822586624, "val_primary": 22.568385822586624, "test_primary": 21.48586157697664, "per_fold_test": [21.48586157697664], "per_fold_val": [22.568385822586624], "status": "DISCARD", "seconds_elapsed": 2860.5854210853577, "timestamp": "2026-08-21T08:06:15", "secondary_metrics": {"mae": 11.647132551865008, "mape": 0.21452837521010357, "r2": 0.946668528491412, "ic": 0.9723664772083809}, "per_fold_test_reports": [{"fold_id": 0, "regime": "calendar_2014_test", "task_type": "regression", "n": 7950, "rmse": 21.48586157697664, "mae": 11.647132551865008, "mape": 0.21452837521010357, "r2": 0.946668528491412, "ic": 0.9723664772083809}], "composite_fingerprint": "a12fd381fe9bbefb"}
{"experiment_num": 181, "backbone": "ft_transformer", "description": "Exp181 FT-Transformer Pre-LN batch_size=64 on Exp167 features (FT cycle 7/50)", "config": {"paths": {"results_dir": "C:\\Users\\abhir\\autoresearch-uci\\beijing_pm25\\autoresearch_results"}, "task_type": "regression", "primary_metric": "rmse", "backbone": "ft_transformer", "backbone_config": {"seed": 0, "n_jobs": 4, "d_model": 64, "n_heads": 4, "n_layers": 3, "dropout": 0.1, "lr": 0.0001, "epochs": 100, "patience": 15, "batch_size": 64, "weight_decay": 1e-05, "warmup": 10, "norm_first": true}, "data": {"format": "csv", "path": "C:\\Users\\abhir\\autoresearch-uci\\beijing_pm25\\data\\features_full.csv", "target_columns": ["pm25"], "feature_columns": ["DEWP", "TEMP", "PRES", "Iws", "Is", "Ir", "cbwd_NE", "cbwd_NW", "cbwd_SE", "cbwd_cv", "pm25_lag1", "pm25_lag2", "pm25_lag3", "pm25_lag4", "pm25_lag5", "pm25_lag6", "pm25_lag7", "pm25_lag8", "pm25_lag9", "pm25_lag10", "pm25_lag11", "pm25_lag12", "pm25_lag13", "pm25_lag14", "pm25_lag15", "pm25_lag16", "pm25_lag17", "pm25_lag18", "pm25_lag19", "pm25_lag20", "pm25_lag21", "pm25_lag22", "pm25_lag23", "pm25_lag24", "hour_sin", "hour_cos", "dow", "is_weekend", "pm25_delta1", "inversion_spread", "rh_magnus", "dewp_delta", "is_heating", "log_iws", "month_sin", "pm25_accel", "vent_index"]}, "split": {"name": "calendar_year", "manifest_dir": "C:\\Users\\abhir\\autoresearch-uci\\beijing_pm25\\data"}, "composite": {"higher_is_better": false, "penalty_weight": 0.1, "below_threshold": -40.0}, "hardware": {"n_threads": 4, "cpu_affinity": [0, 2, 4, 6]}, "description": "Exp181 FT-Transformer Pre-LN batch_size=64 on Exp167 features (FT cycle 7/50)", "seed": 0}, "composite": -23.038880550320936, "val_primary": 23.038880550320936, "test_primary": 21.596685813115375, "per_fold_test": [21.596685813115375], "per_fold_val": [23.038880550320936], "status": "DISCARD", "seconds_elapsed": 1859.7186722755432, "timestamp": "2026-08-21T08:49:26", "secondary_metrics": {"mae": 11.761227088079513, "mape": 0.20987570824736296, "r2": 0.9461169413404578, "ic": 0.9719414046443691}, "per_fold_test_reports": [{"fold_id": 0, "regime": "calendar_2014_test", "task_type": "regression", "n": 7950, "rmse": 21.596685813115375, "mae": 11.761227088079513, "mape": 0.20987570824736296, "r2": 0.9461169413404578, "ic": 0.9719414046443691}], "composite_fingerprint": "a12fd381fe9bbefb"}
{"experiment_num": 182, "backbone": "ft_transformer", "description": "Exp182 FT-Transformer Pre-LN weight_decay=1e-4 on Exp167 features (FT cycle 8/50)", "config": {"paths": {"results_dir": "C:\\Users\\abhir\\autoresearch-uci\\beijing_pm25\\autoresearch_results"}, "task_type": "regression", "primary_metric": "rmse", "backbone": "ft_transformer", "backbone_config": {"seed": 0, "n_jobs": 4, "d_model": 64, "n_heads": 4, "n_layers": 3, "dropout": 0.1, "lr": 0.0001, "epochs": 100, "patience": 15, "batch_size": 32, "weight_decay": 0.0001, "warmup": 10, "norm_first": true}, "data": {"format": "csv", "path": "C:\\Users\\abhir\\autoresearch-uci\\beijing_pm25\\data\\features_full.csv", "target_columns": ["pm25"], "feature_columns": ["DEWP", "TEMP", "PRES", "Iws", "Is", "Ir", "cbwd_NE", "cbwd_NW", "cbwd_SE", "cbwd_cv", "pm25_lag1", "pm25_lag2", "pm25_lag3", "pm25_lag4", "pm25_lag5", "pm25_lag6", "pm25_lag7", "pm25_lag8", "pm25_lag9", "pm25_lag10", "pm25_lag11", "pm25_lag12", "pm25_lag13", "pm25_lag14", "pm25_lag15", "pm25_lag16", "pm25_lag17", "pm25_lag18", "pm25_lag19", "pm25_lag20", "pm25_lag21", "pm25_lag22", "pm25_lag23", "pm25_lag24", "hour_sin", "hour_cos", "dow", "is_weekend", "pm25_delta1", "inversion_spread", "rh_magnus", "dewp_delta", "is_heating", "log_iws", "month_sin", "pm25_accel", "vent_index"]}, "split": {"name": "calendar_year", "manifest_dir": "C:\\Users\\abhir\\autoresearch-uci\\beijing_pm25\\data"}, "composite": {"higher_is_better": false, "penalty_weight": 0.1, "below_threshold": -40.0}, "hardware": {"n_threads": 4, "cpu_affinity": [0, 2, 4, 6]}, "description": "Exp182 FT-Transformer Pre-LN weight_decay=1e-4 on Exp167 features (FT cycle 8/50)", "seed": 0}, "composite": -22.400157226811572, "val_primary": 22.400157226811572, "test_primary": 20.74589109240111, "per_fold_test": [20.74589109240111], "per_fold_val": [22.400157226811572], "status": "DISCARD", "seconds_elapsed": 3127.9568240642548, "timestamp": "2026-08-21T19:42:01", "secondary_metrics": {"mae": 11.341613934131914, "mape": 0.19018818967322065, "r2": 0.9502787306593928, "ic": 0.9725467458147709}, "per_fold_test_reports": [{"fold_id": 0, "regime": "calendar_2014_test", "task_type": "regression", "n": 7950, "rmse": 20.74589109240111, "mae": 11.341613934131914, "mape": 0.19018818967322065, "r2": 0.9502787306593928, "ic": 0.9725467458147709}], "composite_fingerprint": "a12fd381fe9bbefb"}
{"experiment_num": 183, "backbone": "ft_transformer", "description": "Exp183 FT-Transformer Pre-LN lr=3e-4 on Exp167 features (FT cycle 9/50)", "config": {"paths": {"results_dir": "C:\\Users\\abhir\\autoresearch-uci\\beijing_pm25\\autoresearch_results"}, "task_type": "regression", "primary_metric": "rmse", "backbone": "ft_transformer", "backbone_config": {"seed": 0, "n_jobs": 4, "d_model": 64, "n_heads": 4, "n_layers": 3, "dropout": 0.1, "lr": 0.0003, "epochs": 100, "patience": 15, "batch_size": 32, "weight_decay": 1e-05, "warmup": 10, "norm_first": true}, "data": {"format": "csv", "path": "C:\\Users\\abhir\\autoresearch-uci\\beijing_pm25\\data\\features_full.csv", "target_columns": ["pm25"], "feature_columns": ["DEWP", "TEMP", "PRES", "Iws", "Is", "Ir", "cbwd_NE", "cbwd_NW", "cbwd_SE", "cbwd_cv", "pm25_lag1", "pm25_lag2", "pm25_lag3", "pm25_lag4", "pm25_lag5", "pm25_lag6", "pm25_lag7", "pm25_lag8", "pm25_lag9", "pm25_lag10", "pm25_lag11", "pm25_lag12", "pm25_lag13", "pm25_lag14", "pm25_lag15", "pm25_lag16", "pm25_lag17", "pm25_lag18", "pm25_lag19", "pm25_lag20", "pm25_lag21", "pm25_lag22", "pm25_lag23", "pm25_lag24", "hour_sin", "hour_cos", "dow", "is_weekend", "pm25_delta1", "inversion_spread", "rh_magnus", "dewp_delta", "is_heating", "log_iws", "month_sin", "pm25_accel", "vent_index"]}, "split": {"name": "calendar_year", "manifest_dir": "C:\\Users\\abhir\\autoresearch-uci\\beijing_pm25\\data"}, "composite": {"higher_is_better": false, "penalty_weight": 0.1, "below_threshold": -40.0}, "hardware": {"n_threads": 4, "cpu_affinity": [0, 2, 4, 6]}, "description": "Exp183 FT-Transformer Pre-LN lr=3e-4 on Exp167 features (FT cycle 9/50)", "seed": 0}, "composite": -22.476529530448392, "val_primary": 22.476529530448392, "test_primary": 20.952179358654554, "per_fold_test": [20.952179358654554], "per_fold_val": [22.476529530448392], "status": "DISCARD", "seconds_elapsed": 2140.346221446991, "timestamp": "2026-08-21T20:24:02", "secondary_metrics": {"mae": 11.50511891702436, "mape": 0.1864522281994676, "r2": 0.9492850004226876, "ic": 0.9725858832211383}, "per_fold_test_reports": [{"fold_id": 0, "regime": "calendar_2014_test", "task_type": "regression", "n": 7950, "rmse": 20.952179358654554, "mae": 11.50511891702436, "mape": 0.1864522281994676, "r2": 0.9492850004226876, "ic": 0.9725858832211383}], "composite_fingerprint": "a12fd381fe9bbefb"}
{"experiment_num": 184, "backbone": "ft_transformer", "description": "Exp184 FT-Transformer Pre-LN warmup=0 on Exp167 features (FT cycle 10/50)", "config": {"paths": {"results_dir": "C:\\Users\\abhir\\autoresearch-uci\\beijing_pm25\\autoresearch_results"}, "task_type": "regression", "primary_metric": "rmse", "backbone": "ft_transformer", "backbone_config": {"seed": 0, "n_jobs": 4, "d_model": 64, "n_heads": 4, "n_layers": 3, "dropout": 0.1, "lr": 0.0001, "epochs": 100, "patience": 15, "batch_size": 32, "weight_decay": 1e-05, "warmup": 0, "norm_first": true}, "data": {"format": "csv", "path": "C:\\Users\\abhir\\autoresearch-uci\\beijing_pm25\\data\\features_full.csv", "target_columns": ["pm25"], "feature_columns": ["DEWP", "TEMP", "PRES", "Iws", "Is", "Ir", "cbwd_NE", "cbwd_NW", "cbwd_SE", "cbwd_cv", "pm25_lag1", "pm25_lag2", "pm25_lag3", "pm25_lag4", "pm25_lag5", "pm25_lag6", "pm25_lag7", "pm25_lag8", "pm25_lag9", "pm25_lag10", "pm25_lag11", "pm25_lag12", "pm25_lag13", "pm25_lag14", "pm25_lag15", "pm25_lag16", "pm25_lag17", "pm25_lag18", "pm25_lag19", "pm25_lag20", "pm25_lag21", "pm25_lag22", "pm25_lag23", "pm25_lag24", "hour_sin", "hour_cos", "dow", "is_weekend", "pm25_delta1", "inversion_spread", "rh_magnus", "dewp_delta", "is_heating", "log_iws", "month_sin", "pm25_accel", "vent_index"]}, "split": {"name": "calendar_year", "manifest_dir": "C:\\Users\\abhir\\autoresearch-uci\\beijing_pm25\\data"}, "composite": {"higher_is_better": false, "penalty_weight": 0.1, "below_threshold": -40.0}, "hardware": {"n_threads": 4, "cpu_affinity": [0, 2, 4, 6]}, "description": "Exp184 FT-Transformer Pre-LN warmup=0 on Exp167 features (FT cycle 10/50)", "seed": 0}, "composite": -22.892424387627962, "val_primary": 22.892424387627962, "test_primary": 21.312353669772808, "per_fold_test": [21.312353669772808], "per_fold_val": [22.892424387627962], "status": "DISCARD", "seconds_elapsed": 2233.290627717972, "timestamp": "2026-08-21T21:25:09", "secondary_metrics": {"mae": 11.90735509947411, "mape": 0.1934182071178974, "r2": 0.9475264013938272, "ic": 0.9723509248976144}, "per_fold_test_reports": [{"fold_id": 0, "regime": "calendar_2014_test", "task_type": "regression", "n": 7950, "rmse": 21.312353669772808, "mae": 11.90735509947411, "mape": 0.1934182071178974, "r2": 0.9475264013938272, "ic": 0.9723509248976144}], "composite_fingerprint": "a12fd381fe9bbefb"}
{"experiment_num": 185, "backbone": "ft_transformer", "description": "Exp185 FT-Transformer Pre-LN warmup=20 on Exp167 features (FT cycle 11/50)", "config": {"paths": {"results_dir": "C:\\Users\\abhir\\autoresearch-uci\\beijing_pm25\\autoresearch_results"}, "task_type": "regression", "primary_metric": "rmse", "backbone": "ft_transformer", "backbone_config": {"seed": 0, "n_jobs": 4, "d_model": 64, "n_heads": 4, "n_layers": 3, "dropout": 0.1, "lr": 0.0001, "epochs": 100, "patience": 15, "batch_size": 32, "weight_decay": 1e-05, "warmup": 20, "norm_first": true}, "data": {"format": "csv", "path": "C:\\Users\\abhir\\autoresearch-uci\\beijing_pm25\\data\\features_full.csv", "target_columns": ["pm25"], "feature_columns": ["DEWP", "TEMP", "PRES", "Iws", "Is", "Ir", "cbwd_NE", "cbwd_NW", "cbwd_SE", "cbwd_cv", "pm25_lag1", "pm25_lag2", "pm25_lag3", "pm25_lag4", "pm25_lag5", "pm25_lag6", "pm25_lag7", "pm25_lag8", "pm25_lag9", "pm25_lag10", "pm25_lag11", "pm25_lag12", "pm25_lag13", "pm25_lag14", "pm25_lag15", "pm25_lag16", "pm25_lag17", "pm25_lag18", "pm25_lag19", "pm25_lag20", "pm25_lag21", "pm25_lag22", "pm25_lag23", "pm25_lag24", "hour_sin", "hour_cos", "dow", "is_weekend", "pm25_delta1", "inversion_spread", "rh_magnus", "dewp_delta", "is_heating", "log_iws", "month_sin", "pm25_accel", "vent_index"]}, "split": {"name": "calendar_year", "manifest_dir": "C:\\Users\\abhir\\autoresearch-uci\\beijing_pm25\\data"}, "composite": {"higher_is_better": false, "penalty_weight": 0.1, "below_threshold": -40.0}, "hardware": {"n_threads": 4, "cpu_affinity": [0, 2, 4, 6]}, "description": "Exp185 FT-Transformer Pre-LN warmup=20 on Exp167 features (FT cycle 11/50)", "seed": 0}, "composite": -23.134221846997846, "val_primary": 23.134221846997846, "test_primary": 21.53642460483394, "per_fold_test": [21.53642460483394], "per_fold_val": [23.134221846997846], "status": "DISCARD", "seconds_elapsed": 2486.1108677387238, "timestamp": "2026-08-21T22:29:24", "secondary_metrics": {"mae": 12.026976020696027, "mape": 0.1930795406856953, "r2": 0.9464172214961558, "ic": 0.9719833536185702}, "per_fold_test_reports": [{"fold_id": 0, "regime": "calendar_2014_test", "task_type": "regression", "n": 7950, "rmse": 21.53642460483394, "mae": 12.026976020696027, "mape": 0.1930795406856953, "r2": 0.9464172214961558, "ic": 0.9719833536185702}], "composite_fingerprint": "a12fd381fe9bbefb"}
{"experiment_num": 186, "backbone": "ft_transformer", "description": "Exp186 FT-Transformer Pre-LN add cbwd_prev_NW on Exp167 features (FT cycle 12/50)", "config": {"paths": {"results_dir": "C:\\Users\\abhir\\autoresearch-uci\\beijing_pm25\\autoresearch_results"}, "task_type": "regression", "primary_metric": "rmse", "backbone": "ft_transformer", "backbone_config": {"seed": 0, "n_jobs": 4, "d_model": 64, "n_heads": 4, "n_layers": 3, "dropout": 0.1, "lr": 0.0001, "epochs": 100, "patience": 15, "batch_size": 32, "weight_decay": 1e-05, "warmup": 10, "norm_first": true}, "data": {"format": "csv", "path": "C:\\Users\\abhir\\autoresearch-uci\\beijing_pm25\\data\\features_full.csv", "target_columns": ["pm25"], "feature_columns": ["DEWP", "TEMP", "PRES", "Iws", "Is", "Ir", "cbwd_NE", "cbwd_NW", "cbwd_SE", "cbwd_cv", "pm25_lag1", "pm25_lag2", "pm25_lag3", "pm25_lag4", "pm25_lag5", "pm25_lag6", "pm25_lag7", "pm25_lag8", "pm25_lag9", "pm25_lag10", "pm25_lag11", "pm25_lag12", "pm25_lag13", "pm25_lag14", "pm25_lag15", "pm25_lag16", "pm25_lag17", "pm25_lag18", "pm25_lag19", "pm25_lag20", "pm25_lag21", "pm25_lag22", "pm25_lag23", "pm25_lag24", "hour_sin", "hour_cos", "dow", "is_weekend", "pm25_delta1", "inversion_spread", "rh_magnus", "dewp_delta", "is_heating", "log_iws", "month_sin", "pm25_accel", "vent_index", "cbwd_prev_NW"]}, "split": {"name": "calendar_year", "manifest_dir": "C:\\Users\\abhir\\autoresearch-uci\\beijing_pm25\\data"}, "composite": {"higher_is_better": false, "penalty_weight": 0.1, "below_threshold": -40.0}, "hardware": {"n_threads": 4, "cpu_affinity": [0, 2, 4, 6]}, "description": "Exp186 FT-Transformer Pre-LN add cbwd_prev_NW on Exp167 features (FT cycle 12/50)", "seed": 0}, "composite": -22.066105601051298, "val_primary": 22.066105601051298, "test_primary": 20.48313174709662, "per_fold_test": [20.48313174709662], "per_fold_val": [22.066105601051298], "status": "DISCARD", "seconds_elapsed": 4441.890399217606, "timestamp": "2026-08-22T00:02:45", "secondary_metrics": {"mae": 11.243720347266526, "mape": 0.18314158100610248, "r2": 0.9515302548048056, "ic": 0.9733183739614651}, "per_fold_test_reports": [{"fold_id": 0, "regime": "calendar_2014_test", "task_type": "regression", "n": 7950, "rmse": 20.48313174709662, "mae": 11.243720347266526, "mape": 0.18314158100610248, "r2": 0.9515302548048056, "ic": 0.9733183739614651}], "composite_fingerprint": "a12fd381fe9bbefb"}
