{"experiment_num": 151, "backbone": "mlp", "description": "Exp151 MLP Adam lr=1e-3 on Exp136 recipe (MLP cycle 27/50)", "config": {"paths": {"results_dir": "C:\\Users\\abhir\\autoresearch-uci\\beijing_pm25\\autoresearch_results"}, "task_type": "regression", "primary_metric": "rmse", "backbone": "mlp", "backbone_config": {"seed": 0, "n_jobs": 4, "weight_decay": 0.0001, "batch_size": 16, "lr": 0.001}, "data": {"format": "csv", "path": "C:\\Users\\abhir\\autoresearch-uci\\beijing_pm25\\data\\features_full.csv", "target_columns": ["pm25"], "feature_columns": ["DEWP", "TEMP", "PRES", "Iws", "Is", "Ir", "cbwd_NE", "cbwd_NW", "cbwd_SE", "cbwd_cv", "pm25_lag1", "pm25_lag2", "pm25_lag3", "pm25_lag4", "pm25_lag5", "pm25_lag6", "pm25_lag7", "pm25_lag8", "pm25_lag9", "pm25_lag10", "pm25_lag11", "pm25_lag12", "pm25_lag13", "pm25_lag14", "pm25_lag15", "pm25_lag16", "pm25_lag17", "pm25_lag18", "pm25_lag19", "pm25_lag20", "pm25_lag21", "pm25_lag22", "pm25_lag23", "pm25_lag24", "hour_sin", "hour_cos", "dow", "is_weekend", "pm25_delta1", "inversion_spread", "rh_magnus", "dewp_delta", "is_heating", "log_iws", "month_sin", "pm25_accel", "vent_index"]}, "split": {"name": "calendar_year", "manifest_dir": "C:\\Users\\abhir\\autoresearch-uci\\beijing_pm25\\data"}, "composite": {"higher_is_better": false, "penalty_weight": 0.1, "below_threshold": -40.0}, "hardware": {"n_threads": 4, "cpu_affinity": [0, 2, 4, 6]}, "description": "Exp151 MLP Adam lr=1e-3 on Exp136 recipe (MLP cycle 27/50)", "seed": 0}, "composite": -22.449258233047555, "val_primary": 22.449258233047555, "test_primary": 20.516133379421465, "per_fold_test": [20.516133379421465], "per_fold_val": [22.449258233047555], "status": "DISCARD", "seconds_elapsed": 70.69043254852295, "timestamp": "2026-08-20T03:10:51", "secondary_metrics": {"mae": 11.414386553074579, "mape": 0.20185382474475855, "r2": 0.9513739438147707, "ic": 0.9721716011786298}, "per_fold_test_reports": [{"fold_id": 0, "regime": "calendar_2014_test", "task_type": "regression", "n": 7950, "rmse": 20.516133379421465, "mae": 11.414386553074579, "mape": 0.20185382474475855, "r2": 0.9513739438147707, "ic": 0.9721716011786298}], "composite_fingerprint": "a12fd381fe9bbefb"}
{"experiment_num": 152, "backbone": "mlp", "description": "Exp152 MLP dropout=0.1 on Exp136 recipe (MLP cycle 28/50)", "config": {"paths": {"results_dir": "C:\\Users\\abhir\\autoresearch-uci\\beijing_pm25\\autoresearch_results"}, "task_type": "regression", "primary_metric": "rmse", "backbone": "mlp", "backbone_config": {"seed": 0, "n_jobs": 4, "weight_decay": 0.0001, "batch_size": 16, "dropout": 0.1}, "data": {"format": "csv", "path": "C:\\Users\\abhir\\autoresearch-uci\\beijing_pm25\\data\\features_full.csv", "target_columns": ["pm25"], "feature_columns": ["DEWP", "TEMP", "PRES", "Iws", "Is", "Ir", "cbwd_NE", "cbwd_NW", "cbwd_SE", "cbwd_cv", "pm25_lag1", "pm25_lag2", "pm25_lag3", "pm25_lag4", "pm25_lag5", "pm25_lag6", "pm25_lag7", "pm25_lag8", "pm25_lag9", "pm25_lag10", "pm25_lag11", "pm25_lag12", "pm25_lag13", "pm25_lag14", "pm25_lag15", "pm25_lag16", "pm25_lag17", "pm25_lag18", "pm25_lag19", "pm25_lag20", "pm25_lag21", "pm25_lag22", "pm25_lag23", "pm25_lag24", "hour_sin", "hour_cos", "dow", "is_weekend", "pm25_delta1", "inversion_spread", "rh_magnus", "dewp_delta", "is_heating", "log_iws", "month_sin", "pm25_accel", "vent_index"]}, "split": {"name": "calendar_year", "manifest_dir": "C:\\Users\\abhir\\autoresearch-uci\\beijing_pm25\\data"}, "composite": {"higher_is_better": false, "penalty_weight": 0.1, "below_threshold": -40.0}, "hardware": {"n_threads": 4, "cpu_affinity": [0, 2, 4, 6]}, "description": "Exp152 MLP dropout=0.1 on Exp136 recipe (MLP cycle 28/50)", "seed": 0}, "composite": -22.2904367225599, "val_primary": 22.2904367225599, "test_primary": 20.277413472888778, "per_fold_test": [20.277413472888778], "per_fold_val": [22.2904367225599], "status": "DISCARD", "seconds_elapsed": 130.87773966789246, "timestamp": "2026-08-20T03:40:36", "secondary_metrics": {"mae": 11.198082016698969, "mape": 0.20094014093097176, "r2": 0.9524989583224179, "ic": 0.9732796700703183}, "per_fold_test_reports": [{"fold_id": 0, "regime": "calendar_2014_test", "task_type": "regression", "n": 7950, "rmse": 20.277413472888778, "mae": 11.198082016698969, "mape": 0.20094014093097176, "r2": 0.9524989583224179, "ic": 0.9732796700703183}], "composite_fingerprint": "a12fd381fe9bbefb"}
{"experiment_num": 153, "backbone": "mlp", "description": "Exp153 MLP batch_size=64 on Exp136 recipe (MLP cycle 29/50)", "config": {"paths": {"results_dir": "C:\\Users\\abhir\\autoresearch-uci\\beijing_pm25\\autoresearch_results"}, "task_type": "regression", "primary_metric": "rmse", "backbone": "mlp", "backbone_config": {"seed": 0, "n_jobs": 4, "weight_decay": 0.0001, "batch_size": 64}, "data": {"format": "csv", "path": "C:\\Users\\abhir\\autoresearch-uci\\beijing_pm25\\data\\features_full.csv", "target_columns": ["pm25"], "feature_columns": ["DEWP", "TEMP", "PRES", "Iws", "Is", "Ir", "cbwd_NE", "cbwd_NW", "cbwd_SE", "cbwd_cv", "pm25_lag1", "pm25_lag2", "pm25_lag3", "pm25_lag4", "pm25_lag5", "pm25_lag6", "pm25_lag7", "pm25_lag8", "pm25_lag9", "pm25_lag10", "pm25_lag11", "pm25_lag12", "pm25_lag13", "pm25_lag14", "pm25_lag15", "pm25_lag16", "pm25_lag17", "pm25_lag18", "pm25_lag19", "pm25_lag20", "pm25_lag21", "pm25_lag22", "pm25_lag23", "pm25_lag24", "hour_sin", "hour_cos", "dow", "is_weekend", "pm25_delta1", "inversion_spread", "rh_magnus", "dewp_delta", "is_heating", "log_iws", "month_sin", "pm25_accel", "vent_index"]}, "split": {"name": "calendar_year", "manifest_dir": "C:\\Users\\abhir\\autoresearch-uci\\beijing_pm25\\data"}, "composite": {"higher_is_better": false, "penalty_weight": 0.1, "below_threshold": -40.0}, "hardware": {"n_threads": 4, "cpu_affinity": [0, 2, 4, 6]}, "description": "Exp153 MLP batch_size=64 on Exp136 recipe (MLP cycle 29/50)", "seed": 0}, "composite": -22.637577464273054, "val_primary": 22.637577464273054, "test_primary": 20.744054390784264, "per_fold_test": [20.744054390784264], "per_fold_val": [22.637577464273054], "status": "DISCARD", "seconds_elapsed": 44.21978044509888, "timestamp": "2026-08-20T04:08:52", "secondary_metrics": {"mae": 11.38207725698843, "mape": 0.20496756858433565, "r2": 0.9502875342429858, "ic": 0.9730591655101223}, "per_fold_test_reports": [{"fold_id": 0, "regime": "calendar_2014_test", "task_type": "regression", "n": 7950, "rmse": 20.744054390784264, "mae": 11.38207725698843, "mape": 0.20496756858433565, "r2": 0.9502875342429858, "ic": 0.9730591655101223}], "composite_fingerprint": "a12fd381fe9bbefb"}
{"experiment_num": 154, "backbone": "mlp", "description": "Exp154 MLP weight_decay=0 on Exp136 recipe (MLP cycle 30/50)", "config": {"paths": {"results_dir": "C:\\Users\\abhir\\autoresearch-uci\\beijing_pm25\\autoresearch_results"}, "task_type": "regression", "primary_metric": "rmse", "backbone": "mlp", "backbone_config": {"seed": 0, "n_jobs": 4, "weight_decay": 0, "batch_size": 16}, "data": {"format": "csv", "path": "C:\\Users\\abhir\\autoresearch-uci\\beijing_pm25\\data\\features_full.csv", "target_columns": ["pm25"], "feature_columns": ["DEWP", "TEMP", "PRES", "Iws", "Is", "Ir", "cbwd_NE", "cbwd_NW", "cbwd_SE", "cbwd_cv", "pm25_lag1", "pm25_lag2", "pm25_lag3", "pm25_lag4", "pm25_lag5", "pm25_lag6", "pm25_lag7", "pm25_lag8", "pm25_lag9", "pm25_lag10", "pm25_lag11", "pm25_lag12", "pm25_lag13", "pm25_lag14", "pm25_lag15", "pm25_lag16", "pm25_lag17", "pm25_lag18", "pm25_lag19", "pm25_lag20", "pm25_lag21", "pm25_lag22", "pm25_lag23", "pm25_lag24", "hour_sin", "hour_cos", "dow", "is_weekend", "pm25_delta1", "inversion_spread", "rh_magnus", "dewp_delta", "is_heating", "log_iws", "month_sin", "pm25_accel", "vent_index"]}, "split": {"name": "calendar_year", "manifest_dir": "C:\\Users\\abhir\\autoresearch-uci\\beijing_pm25\\data"}, "composite": {"higher_is_better": false, "penalty_weight": 0.1, "below_threshold": -40.0}, "hardware": {"n_threads": 4, "cpu_affinity": [0, 2, 4, 6]}, "description": "Exp154 MLP weight_decay=0 on Exp136 recipe (MLP cycle 30/50)", "seed": 0}, "composite": -22.436209623446686, "val_primary": 22.436209623446686, "test_primary": 20.49304238532127, "per_fold_test": [20.49304238532127], "per_fold_val": [22.436209623446686], "status": "DISCARD", "seconds_elapsed": 137.71060752868652, "timestamp": "2026-08-20T04:41:09", "secondary_metrics": {"mae": 11.32631482460214, "mape": 0.20103607477595842, "r2": 0.9514833398772928, "ic": 0.9732030445116919}, "per_fold_test_reports": [{"fold_id": 0, "regime": "calendar_2014_test", "task_type": "regression", "n": 7950, "rmse": 20.49304238532127, "mae": 11.32631482460214, "mape": 0.20103607477595842, "r2": 0.9514833398772928, "ic": 0.9732030445116919}], "composite_fingerprint": "a12fd381fe9bbefb"}
{"experiment_num": 155, "backbone": "mlp", "description": "Exp155 MLP add heating_build on Exp136 recipe (MLP cycle 31/50)", "config": {"paths": {"results_dir": "C:\\Users\\abhir\\autoresearch-uci\\beijing_pm25\\autoresearch_results"}, "task_type": "regression", "primary_metric": "rmse", "backbone": "mlp", "backbone_config": {"seed": 0, "n_jobs": 4, "weight_decay": 0.0001, "batch_size": 16}, "data": {"format": "csv", "path": "C:\\Users\\abhir\\autoresearch-uci\\beijing_pm25\\data\\features_full.csv", "target_columns": ["pm25"], "feature_columns": ["DEWP", "TEMP", "PRES", "Iws", "Is", "Ir", "cbwd_NE", "cbwd_NW", "cbwd_SE", "cbwd_cv", "pm25_lag1", "pm25_lag2", "pm25_lag3", "pm25_lag4", "pm25_lag5", "pm25_lag6", "pm25_lag7", "pm25_lag8", "pm25_lag9", "pm25_lag10", "pm25_lag11", "pm25_lag12", "pm25_lag13", "pm25_lag14", "pm25_lag15", "pm25_lag16", "pm25_lag17", "pm25_lag18", "pm25_lag19", "pm25_lag20", "pm25_lag21", "pm25_lag22", "pm25_lag23", "pm25_lag24", "hour_sin", "hour_cos", "dow", "is_weekend", "pm25_delta1", "inversion_spread", "rh_magnus", "dewp_delta", "is_heating", "log_iws", "month_sin", "pm25_accel", "vent_index", "heating_build"]}, "split": {"name": "calendar_year", "manifest_dir": "C:\\Users\\abhir\\autoresearch-uci\\beijing_pm25\\data"}, "composite": {"higher_is_better": false, "penalty_weight": 0.1, "below_threshold": -40.0}, "hardware": {"n_threads": 4, "cpu_affinity": [0, 2, 4, 6]}, "description": "Exp155 MLP add heating_build on Exp136 recipe (MLP cycle 31/50)", "seed": 0}, "composite": -22.51846295795204, "val_primary": 22.51846295795204, "test_primary": 20.963245360385496, "per_fold_test": [20.963245360385496], "per_fold_val": [22.51846295795204], "status": "DISCARD", "seconds_elapsed": 70.11968064308167, "timestamp": "2026-08-20T05:09:48", "secondary_metrics": {"mae": 11.38219893263571, "mape": 0.20694358203443328, "r2": 0.9492314154979808, "ic": 0.9726304560705707}, "per_fold_test_reports": [{"fold_id": 0, "regime": "calendar_2014_test", "task_type": "regression", "n": 7950, "rmse": 20.963245360385496, "mae": 11.38219893263571, "mape": 0.20694358203443328, "r2": 0.9492314154979808, "ic": 0.9726304560705707}], "composite_fingerprint": "a12fd381fe9bbefb"}
{"experiment_num": 156, "backbone": "mlp", "description": "Exp156 MLP add rh_iws on Exp136 recipe (MLP cycle 32/50)", "config": {"paths": {"results_dir": "C:\\Users\\abhir\\autoresearch-uci\\beijing_pm25\\autoresearch_results"}, "task_type": "regression", "primary_metric": "rmse", "backbone": "mlp", "backbone_config": {"seed": 0, "n_jobs": 4, "weight_decay": 0.0001, "batch_size": 16}, "data": {"format": "csv", "path": "C:\\Users\\abhir\\autoresearch-uci\\beijing_pm25\\data\\features_full.csv", "target_columns": ["pm25"], "feature_columns": ["DEWP", "TEMP", "PRES", "Iws", "Is", "Ir", "cbwd_NE", "cbwd_NW", "cbwd_SE", "cbwd_cv", "pm25_lag1", "pm25_lag2", "pm25_lag3", "pm25_lag4", "pm25_lag5", "pm25_lag6", "pm25_lag7", "pm25_lag8", "pm25_lag9", "pm25_lag10", "pm25_lag11", "pm25_lag12", "pm25_lag13", "pm25_lag14", "pm25_lag15", "pm25_lag16", "pm25_lag17", "pm25_lag18", "pm25_lag19", "pm25_lag20", "pm25_lag21", "pm25_lag22", "pm25_lag23", "pm25_lag24", "hour_sin", "hour_cos", "dow", "is_weekend", "pm25_delta1", "inversion_spread", "rh_magnus", "dewp_delta", "is_heating", "log_iws", "month_sin", "pm25_accel", "vent_index", "rh_iws"]}, "split": {"name": "calendar_year", "manifest_dir": "C:\\Users\\abhir\\autoresearch-uci\\beijing_pm25\\data"}, "composite": {"higher_is_better": false, "penalty_weight": 0.1, "below_threshold": -40.0}, "hardware": {"n_threads": 4, "cpu_affinity": [0, 2, 4, 6]}, "description": "Exp156 MLP add rh_iws on Exp136 recipe (MLP cycle 32/50)", "seed": 0}, "composite": -22.43018556055322, "val_primary": 22.43018556055322, "test_primary": 20.399087607704484, "per_fold_test": [20.399087607704484], "per_fold_val": [22.43018556055322], "status": "DISCARD", "seconds_elapsed": 136.1556694507599, "timestamp": "2026-08-20T05:41:17", "secondary_metrics": {"mae": 11.23244797334731, "mape": 0.2007825913859473, "r2": 0.9519271902833637, "ic": 0.973351171661502}, "per_fold_test_reports": [{"fold_id": 0, "regime": "calendar_2014_test", "task_type": "regression", "n": 7950, "rmse": 20.399087607704484, "mae": 11.23244797334731, "mape": 0.2007825913859473, "r2": 0.9519271902833637, "ic": 0.973351171661502}], "composite_fingerprint": "a12fd381fe9bbefb"}
{"experiment_num": 157, "backbone": "mlp", "description": "Exp157 MLP drop Iws keep log_iws on Exp136 recipe (MLP cycle 33/50)", "config": {"paths": {"results_dir": "C:\\Users\\abhir\\autoresearch-uci\\beijing_pm25\\autoresearch_results"}, "task_type": "regression", "primary_metric": "rmse", "backbone": "mlp", "backbone_config": {"seed": 0, "n_jobs": 4, "weight_decay": 0.0001, "batch_size": 16}, "data": {"format": "csv", "path": "C:\\Users\\abhir\\autoresearch-uci\\beijing_pm25\\data\\features_full.csv", "target_columns": ["pm25"], "feature_columns": ["DEWP", "TEMP", "PRES", "Is", "Ir", "cbwd_NE", "cbwd_NW", "cbwd_SE", "cbwd_cv", "pm25_lag1", "pm25_lag2", "pm25_lag3", "pm25_lag4", "pm25_lag5", "pm25_lag6", "pm25_lag7", "pm25_lag8", "pm25_lag9", "pm25_lag10", "pm25_lag11", "pm25_lag12", "pm25_lag13", "pm25_lag14", "pm25_lag15", "pm25_lag16", "pm25_lag17", "pm25_lag18", "pm25_lag19", "pm25_lag20", "pm25_lag21", "pm25_lag22", "pm25_lag23", "pm25_lag24", "hour_sin", "hour_cos", "dow", "is_weekend", "pm25_delta1", "inversion_spread", "rh_magnus", "dewp_delta", "is_heating", "log_iws", "month_sin", "pm25_accel", "vent_index"]}, "split": {"name": "calendar_year", "manifest_dir": "C:\\Users\\abhir\\autoresearch-uci\\beijing_pm25\\data"}, "composite": {"higher_is_better": false, "penalty_weight": 0.1, "below_threshold": -40.0}, "hardware": {"n_threads": 4, "cpu_affinity": [0, 2, 4, 6]}, "description": "Exp157 MLP drop Iws keep log_iws on Exp136 recipe (MLP cycle 33/50)", "seed": 0}, "composite": -22.335954491258175, "val_primary": 22.335954491258175, "test_primary": 20.42532616461309, "per_fold_test": [20.42532616461309], "per_fold_val": [22.335954491258175], "status": "DISCARD", "seconds_elapsed": 131.41326260566711, "timestamp": "2026-08-20T06:10:50", "secondary_metrics": {"mae": 11.277396489689185, "mape": 0.20352686898850103, "r2": 0.9518034423591627, "ic": 0.9729445178580854}, "per_fold_test_reports": [{"fold_id": 0, "regime": "calendar_2014_test", "task_type": "regression", "n": 7950, "rmse": 20.42532616461309, "mae": 11.277396489689185, "mape": 0.20352686898850103, "r2": 0.9518034423591627, "ic": 0.9729445178580854}], "composite_fingerprint": "a12fd381fe9bbefb"}
{"experiment_num": 158, "backbone": "mlp", "description": "Exp158 MLP drop Is keep Iws on Exp136 recipe (MLP cycle 34/50)", "config": {"paths": {"results_dir": "C:\\Users\\abhir\\autoresearch-uci\\beijing_pm25\\autoresearch_results"}, "task_type": "regression", "primary_metric": "rmse", "backbone": "mlp", "backbone_config": {"seed": 0, "n_jobs": 4, "weight_decay": 0.0001, "batch_size": 16}, "data": {"format": "csv", "path": "C:\\Users\\abhir\\autoresearch-uci\\beijing_pm25\\data\\features_full.csv", "target_columns": ["pm25"], "feature_columns": ["DEWP", "TEMP", "PRES", "Iws", "Ir", "cbwd_NE", "cbwd_NW", "cbwd_SE", "cbwd_cv", "pm25_lag1", "pm25_lag2", "pm25_lag3", "pm25_lag4", "pm25_lag5", "pm25_lag6", "pm25_lag7", "pm25_lag8", "pm25_lag9", "pm25_lag10", "pm25_lag11", "pm25_lag12", "pm25_lag13", "pm25_lag14", "pm25_lag15", "pm25_lag16", "pm25_lag17", "pm25_lag18", "pm25_lag19", "pm25_lag20", "pm25_lag21", "pm25_lag22", "pm25_lag23", "pm25_lag24", "hour_sin", "hour_cos", "dow", "is_weekend", "pm25_delta1", "inversion_spread", "rh_magnus", "dewp_delta", "is_heating", "log_iws", "month_sin", "pm25_accel", "vent_index"]}, "split": {"name": "calendar_year", "manifest_dir": "C:\\Users\\abhir\\autoresearch-uci\\beijing_pm25\\data"}, "composite": {"higher_is_better": false, "penalty_weight": 0.1, "below_threshold": -40.0}, "hardware": {"n_threads": 4, "cpu_affinity": [0, 2, 4, 6]}, "description": "Exp158 MLP drop Is keep Iws on Exp136 recipe (MLP cycle 34/50)", "seed": 0}, "composite": -22.3938759295325, "val_primary": 22.3938759295325, "test_primary": 20.394992789489443, "per_fold_test": [20.394992789489443], "per_fold_val": [22.3938759295325], "status": "DISCARD", "seconds_elapsed": 143.76799201965332, "timestamp": "2026-08-20T06:42:40", "secondary_metrics": {"mae": 11.266236820640804, "mape": 0.20313991854767122, "r2": 0.9519464881719106, "ic": 0.9732461760519824}, "per_fold_test_reports": [{"fold_id": 0, "regime": "calendar_2014_test", "task_type": "regression", "n": 7950, "rmse": 20.394992789489443, "mae": 11.266236820640804, "mape": 0.20313991854767122, "r2": 0.9519464881719106, "ic": 0.9732461760519824}], "composite_fingerprint": "a12fd381fe9bbefb"}
{"experiment_num": 159, "backbone": "mlp", "description": "Exp159 MLP drop PRES keep TEMP on Exp136 recipe (MLP cycle 35/50)", "config": {"paths": {"results_dir": "C:\\Users\\abhir\\autoresearch-uci\\beijing_pm25\\autoresearch_results"}, "task_type": "regression", "primary_metric": "rmse", "backbone": "mlp", "backbone_config": {"seed": 0, "n_jobs": 4, "weight_decay": 0.0001, "batch_size": 16}, "data": {"format": "csv", "path": "C:\\Users\\abhir\\autoresearch-uci\\beijing_pm25\\data\\features_full.csv", "target_columns": ["pm25"], "feature_columns": ["DEWP", "TEMP", "Iws", "Is", "Ir", "cbwd_NE", "cbwd_NW", "cbwd_SE", "cbwd_cv", "pm25_lag1", "pm25_lag2", "pm25_lag3", "pm25_lag4", "pm25_lag5", "pm25_lag6", "pm25_lag7", "pm25_lag8", "pm25_lag9", "pm25_lag10", "pm25_lag11", "pm25_lag12", "pm25_lag13", "pm25_lag14", "pm25_lag15", "pm25_lag16", "pm25_lag17", "pm25_lag18", "pm25_lag19", "pm25_lag20", "pm25_lag21", "pm25_lag22", "pm25_lag23", "pm25_lag24", "hour_sin", "hour_cos", "dow", "is_weekend", "pm25_delta1", "inversion_spread", "rh_magnus", "dewp_delta", "is_heating", "log_iws", "month_sin", "pm25_accel", "vent_index"]}, "split": {"name": "calendar_year", "manifest_dir": "C:\\Users\\abhir\\autoresearch-uci\\beijing_pm25\\data"}, "composite": {"higher_is_better": false, "penalty_weight": 0.1, "below_threshold": -40.0}, "hardware": {"n_threads": 4, "cpu_affinity": [0, 2, 4, 6]}, "description": "Exp159 MLP drop PRES keep TEMP on Exp136 recipe (MLP cycle 35/50)", "seed": 0}, "composite": -22.436831250077166, "val_primary": 22.436831250077166, "test_primary": 20.353814495824203, "per_fold_test": [20.353814495824203], "per_fold_val": [22.436831250077166], "status": "DISCARD", "seconds_elapsed": 155.02396512031555, "timestamp": "2026-08-20T07:11:52", "secondary_metrics": {"mae": 11.220602657090193, "mape": 0.20072377610410289, "r2": 0.9521403361465861, "ic": 0.9733685982950983}, "per_fold_test_reports": [{"fold_id": 0, "regime": "calendar_2014_test", "task_type": "regression", "n": 7950, "rmse": 20.353814495824203, "mae": 11.220602657090193, "mape": 0.20072377610410289, "r2": 0.9521403361465861, "ic": 0.9733685982950983}], "composite_fingerprint": "a12fd381fe9bbefb"}
{"experiment_num": 160, "backbone": "mlp", "description": "Exp160 MLP drop is_weekend keep dow on Exp136 recipe (MLP cycle 36/50)", "config": {"paths": {"results_dir": "C:\\Users\\abhir\\autoresearch-uci\\beijing_pm25\\autoresearch_results"}, "task_type": "regression", "primary_metric": "rmse", "backbone": "mlp", "backbone_config": {"seed": 0, "n_jobs": 4, "weight_decay": 0.0001, "batch_size": 16}, "data": {"format": "csv", "path": "C:\\Users\\abhir\\autoresearch-uci\\beijing_pm25\\data\\features_full.csv", "target_columns": ["pm25"], "feature_columns": ["DEWP", "TEMP", "PRES", "Iws", "Is", "Ir", "cbwd_NE", "cbwd_NW", "cbwd_SE", "cbwd_cv", "pm25_lag1", "pm25_lag2", "pm25_lag3", "pm25_lag4", "pm25_lag5", "pm25_lag6", "pm25_lag7", "pm25_lag8", "pm25_lag9", "pm25_lag10", "pm25_lag11", "pm25_lag12", "pm25_lag13", "pm25_lag14", "pm25_lag15", "pm25_lag16", "pm25_lag17", "pm25_lag18", "pm25_lag19", "pm25_lag20", "pm25_lag21", "pm25_lag22", "pm25_lag23", "pm25_lag24", "hour_sin", "hour_cos", "dow", "pm25_delta1", "inversion_spread", "rh_magnus", "dewp_delta", "is_heating", "log_iws", "month_sin", "pm25_accel", "vent_index"]}, "split": {"name": "calendar_year", "manifest_dir": "C:\\Users\\abhir\\autoresearch-uci\\beijing_pm25\\data"}, "composite": {"higher_is_better": false, "penalty_weight": 0.1, "below_threshold": -40.0}, "hardware": {"n_threads": 4, "cpu_affinity": [0, 2, 4, 6]}, "description": "Exp160 MLP drop is_weekend keep dow on Exp136 recipe (MLP cycle 36/50)", "seed": 0}, "composite": -22.492050000843786, "val_primary": 22.492050000843786, "test_primary": 20.428317774668155, "per_fold_test": [20.428317774668155], "per_fold_val": [22.492050000843786], "status": "DISCARD", "seconds_elapsed": 182.0446639060974, "timestamp": "2026-08-20T07:41:24", "secondary_metrics": {"mae": 11.253097089731469, "mape": 0.20176023378350535, "r2": 0.9517893230384333, "ic": 0.9732869199150099}, "per_fold_test_reports": [{"fold_id": 0, "regime": "calendar_2014_test", "task_type": "regression", "n": 7950, "rmse": 20.428317774668155, "mae": 11.253097089731469, "mape": 0.20176023378350535, "r2": 0.9517893230384333, "ic": 0.9732869199150099}], "composite_fingerprint": "a12fd381fe9bbefb"}
