{"experiment_num": 13, "backbone": "xgboost", "description": "Exp13 from champion: n_estimators 4000", "config": {"paths": {"results_dir": "C:\\Users\\abhir\\autoresearch-uci\\beijing_pm25\\autoresearch_results"}, "task_type": "regression", "primary_metric": "rmse", "backbone": "xgboost", "backbone_config": {"n_estimators": 4000, "max_depth": 4, "learning_rate": 0.01, "subsample": 0.6, "colsample_bytree": 0.8, "reg_lambda": 1.0, "early_stopping_rounds": 50, "seed": 0, "n_jobs": 4, "tree_method": "hist", "uncertainty_samples": 1}, "data": {"format": "csv", "path": "C:\\Users\\abhir\\grok-autoresearch\\benchmarks\\beijing_pm25\\data\\features.csv", "target_columns": ["pm25"], "feature_columns": null}, "split": {"name": "calendar_year", "manifest_dir": "C:\\Users\\abhir\\autoresearch-uci\\beijing_pm25\\data"}, "composite": {"higher_is_better": false, "penalty_weight": 0.1, "below_threshold": -40.0}, "hardware": {"n_threads": 4, "cpu_affinity": [0, 2, 4, 6]}, "description": "Exp13 from champion: n_estimators 4000", "seed": 0}, "composite": -22.98348984706462, "val_primary": 22.98348984706462, "test_primary": 22.034103235088445, "per_fold_test": [22.034103235088445], "per_fold_val": [22.98348984706462], "status": "DISCARD", "seconds_elapsed": 3.500898838043213, "timestamp": "2026-08-18T01:16:17", "secondary_metrics": {"mae": 11.918383711449005, "mape": 0.22710932391969638, "r2": 0.9439121516796297, "ic": 0.9715027131538543}, "per_fold_test_reports": [{"fold_id": 0, "regime": "calendar_2014_test", "task_type": "regression", "n": 7950, "rmse": 22.034103235088445, "mae": 11.918383711449005, "mape": 0.22710932391969638, "r2": 0.9439121516796297, "ic": 0.9715027131538543}], "composite_fingerprint": "a12fd381fe9bbefb"}
{"experiment_num": 14, "backbone": "xgboost", "description": "Exp14 from champion: add inversion_spread TEMP-DEWP", "config": {"paths": {"results_dir": "C:\\Users\\abhir\\autoresearch-uci\\beijing_pm25\\autoresearch_results"}, "task_type": "regression", "primary_metric": "rmse", "backbone": "xgboost", "backbone_config": {"n_estimators": 1500, "max_depth": 4, "learning_rate": 0.01, "subsample": 0.6, "colsample_bytree": 0.8, "reg_lambda": 1.0, "early_stopping_rounds": 50, "seed": 0, "n_jobs": 4, "tree_method": "hist", "uncertainty_samples": 1}, "data": {"format": "csv", "path": "C:\\Users\\abhir\\autoresearch-uci\\beijing_pm25\\data\\features_full.csv", "target_columns": ["pm25"], "feature_columns": ["DEWP", "TEMP", "PRES", "Iws", "Is", "Ir", "cbwd_NE", "cbwd_NW", "cbwd_SE", "cbwd_cv", "pm25_lag1", "pm25_lag2", "pm25_lag3", "pm25_lag4", "pm25_lag5", "pm25_lag6", "pm25_lag7", "pm25_lag8", "pm25_lag9", "pm25_lag10", "pm25_lag11", "pm25_lag12", "pm25_lag13", "pm25_lag14", "pm25_lag15", "pm25_lag16", "pm25_lag17", "pm25_lag18", "pm25_lag19", "pm25_lag20", "pm25_lag21", "pm25_lag22", "pm25_lag23", "pm25_lag24", "hour_sin", "hour_cos", "dow", "is_weekend", "inversion_spread"]}, "split": {"name": "calendar_year", "manifest_dir": "C:\\Users\\abhir\\autoresearch-uci\\beijing_pm25\\data"}, "composite": {"higher_is_better": false, "penalty_weight": 0.1, "below_threshold": -40.0}, "hardware": {"n_threads": 4, "cpu_affinity": [0, 2, 4, 6]}, "description": "Exp14 from champion: add inversion_spread TEMP-DEWP", "seed": 0}, "composite": -22.884663819943817, "val_primary": 22.884663819943817, "test_primary": 21.822917445719696, "per_fold_test": [21.822917445719696], "per_fold_val": [22.884663819943817], "status": "KEEP", "seconds_elapsed": 2.6941840648651123, "timestamp": "2026-08-18T01:16:24", "secondary_metrics": {"mae": 11.93338586180465, "mape": 0.22969651202093955, "r2": 0.9449821468977255, "ic": 0.9715635630764153}, "per_fold_test_reports": [{"fold_id": 0, "regime": "calendar_2014_test", "task_type": "regression", "n": 7950, "rmse": 21.822917445719696, "mae": 11.93338586180465, "mape": 0.22969651202093955, "r2": 0.9449821468977255, "ic": 0.9715635630764153}], "composite_fingerprint": "a12fd381fe9bbefb"}
{"experiment_num": 15, "backbone": "xgboost", "description": "Exp15 from champion: add pm25_delta1 momentum", "config": {"paths": {"results_dir": "C:\\Users\\abhir\\autoresearch-uci\\beijing_pm25\\autoresearch_results"}, "task_type": "regression", "primary_metric": "rmse", "backbone": "xgboost", "backbone_config": {"n_estimators": 1500, "max_depth": 4, "learning_rate": 0.01, "subsample": 0.6, "colsample_bytree": 0.8, "reg_lambda": 1.0, "early_stopping_rounds": 50, "seed": 0, "n_jobs": 4, "tree_method": "hist", "uncertainty_samples": 1}, "data": {"format": "csv", "path": "C:\\Users\\abhir\\autoresearch-uci\\beijing_pm25\\data\\features_full.csv", "target_columns": ["pm25"], "feature_columns": ["DEWP", "TEMP", "PRES", "Iws", "Is", "Ir", "cbwd_NE", "cbwd_NW", "cbwd_SE", "cbwd_cv", "pm25_lag1", "pm25_lag2", "pm25_lag3", "pm25_lag4", "pm25_lag5", "pm25_lag6", "pm25_lag7", "pm25_lag8", "pm25_lag9", "pm25_lag10", "pm25_lag11", "pm25_lag12", "pm25_lag13", "pm25_lag14", "pm25_lag15", "pm25_lag16", "pm25_lag17", "pm25_lag18", "pm25_lag19", "pm25_lag20", "pm25_lag21", "pm25_lag22", "pm25_lag23", "pm25_lag24", "hour_sin", "hour_cos", "dow", "is_weekend", "pm25_delta1"]}, "split": {"name": "calendar_year", "manifest_dir": "C:\\Users\\abhir\\autoresearch-uci\\beijing_pm25\\data"}, "composite": {"higher_is_better": false, "penalty_weight": 0.1, "below_threshold": -40.0}, "hardware": {"n_threads": 4, "cpu_affinity": [0, 2, 4, 6]}, "description": "Exp15 from champion: add pm25_delta1 momentum", "seed": 0}, "composite": -22.68433815456602, "val_primary": 22.68433815456602, "test_primary": 21.290340796471725, "per_fold_test": [21.290340796471725], "per_fold_val": [22.68433815456602], "status": "KEEP", "seconds_elapsed": 2.993771553039551, "timestamp": "2026-08-18T01:16:30", "secondary_metrics": {"mae": 11.608862270919031, "mape": 0.22221171074382223, "r2": 0.9476347421397449, "ic": 0.9722371434162483}, "per_fold_test_reports": [{"fold_id": 0, "regime": "calendar_2014_test", "task_type": "regression", "n": 7950, "rmse": 21.290340796471725, "mae": 11.608862270919031, "mape": 0.22221171074382223, "r2": 0.9476347421397449, "ic": 0.9722371434162483}], "composite_fingerprint": "a12fd381fe9bbefb"}
{"experiment_num": 16, "backbone": "xgboost", "description": "Exp16 from champion: add Iws_lag1 TEMP_lag1 DEWP_lag1", "config": {"paths": {"results_dir": "C:\\Users\\abhir\\autoresearch-uci\\beijing_pm25\\autoresearch_results"}, "task_type": "regression", "primary_metric": "rmse", "backbone": "xgboost", "backbone_config": {"n_estimators": 1500, "max_depth": 4, "learning_rate": 0.01, "subsample": 0.6, "colsample_bytree": 0.8, "reg_lambda": 1.0, "early_stopping_rounds": 50, "seed": 0, "n_jobs": 4, "tree_method": "hist", "uncertainty_samples": 1}, "data": {"format": "csv", "path": "C:\\Users\\abhir\\autoresearch-uci\\beijing_pm25\\data\\features_full.csv", "target_columns": ["pm25"], "feature_columns": ["DEWP", "TEMP", "PRES", "Iws", "Is", "Ir", "cbwd_NE", "cbwd_NW", "cbwd_SE", "cbwd_cv", "pm25_lag1", "pm25_lag2", "pm25_lag3", "pm25_lag4", "pm25_lag5", "pm25_lag6", "pm25_lag7", "pm25_lag8", "pm25_lag9", "pm25_lag10", "pm25_lag11", "pm25_lag12", "pm25_lag13", "pm25_lag14", "pm25_lag15", "pm25_lag16", "pm25_lag17", "pm25_lag18", "pm25_lag19", "pm25_lag20", "pm25_lag21", "pm25_lag22", "pm25_lag23", "pm25_lag24", "hour_sin", "hour_cos", "dow", "is_weekend", "Iws_lag1", "TEMP_lag1", "DEWP_lag1"]}, "split": {"name": "calendar_year", "manifest_dir": "C:\\Users\\abhir\\autoresearch-uci\\beijing_pm25\\data"}, "composite": {"higher_is_better": false, "penalty_weight": 0.1, "below_threshold": -40.0}, "hardware": {"n_threads": 4, "cpu_affinity": [0, 2, 4, 6]}, "description": "Exp16 from champion: add Iws_lag1 TEMP_lag1 DEWP_lag1", "seed": 0}, "composite": -23.13676932901869, "val_primary": 23.13676932901869, "test_primary": 21.867777597877442, "per_fold_test": [21.867777597877442], "per_fold_val": [23.13676932901869], "status": "DISCARD", "seconds_elapsed": 8.867577314376831, "timestamp": "2026-08-18T01:16:43", "secondary_metrics": {"mae": 11.939902378912992, "mape": 0.22712020894831467, "r2": 0.9447557201566755, "ic": 0.9714855156728878}, "per_fold_test_reports": [{"fold_id": 0, "regime": "calendar_2014_test", "task_type": "regression", "n": 7950, "rmse": 21.867777597877442, "mae": 11.939902378912992, "mape": 0.22712020894831467, "r2": 0.9447557201566755, "ic": 0.9714855156728878}], "composite_fingerprint": "a12fd381fe9bbefb"}
{"experiment_num": 17, "backbone": "xgboost", "description": "Exp17 from champion: max_depth 3", "config": {"paths": {"results_dir": "C:\\Users\\abhir\\autoresearch-uci\\beijing_pm25\\autoresearch_results"}, "task_type": "regression", "primary_metric": "rmse", "backbone": "xgboost", "backbone_config": {"n_estimators": 1500, "max_depth": 3, "learning_rate": 0.01, "subsample": 0.6, "colsample_bytree": 0.8, "reg_lambda": 1.0, "early_stopping_rounds": 50, "seed": 0, "n_jobs": 4, "tree_method": "hist", "uncertainty_samples": 1}, "data": {"format": "csv", "path": "C:\\Users\\abhir\\autoresearch-uci\\beijing_pm25\\data\\features_full.csv", "target_columns": ["pm25"], "feature_columns": ["DEWP", "TEMP", "PRES", "Iws", "Is", "Ir", "cbwd_NE", "cbwd_NW", "cbwd_SE", "cbwd_cv", "pm25_lag1", "pm25_lag2", "pm25_lag3", "pm25_lag4", "pm25_lag5", "pm25_lag6", "pm25_lag7", "pm25_lag8", "pm25_lag9", "pm25_lag10", "pm25_lag11", "pm25_lag12", "pm25_lag13", "pm25_lag14", "pm25_lag15", "pm25_lag16", "pm25_lag17", "pm25_lag18", "pm25_lag19", "pm25_lag20", "pm25_lag21", "pm25_lag22", "pm25_lag23", "pm25_lag24", "hour_sin", "hour_cos", "dow", "is_weekend", "pm25_delta1"]}, "split": {"name": "calendar_year", "manifest_dir": "C:\\Users\\abhir\\autoresearch-uci\\beijing_pm25\\data"}, "composite": {"higher_is_better": false, "penalty_weight": 0.1, "below_threshold": -40.0}, "hardware": {"n_threads": 4, "cpu_affinity": [0, 2, 4, 6]}, "description": "Exp17 from champion: max_depth 3", "seed": 0}, "composite": -22.81505671836324, "val_primary": 22.81505671836324, "test_primary": 21.367142993353347, "per_fold_test": [21.367142993353347], "per_fold_val": [22.81505671836324], "status": "DISCARD", "seconds_elapsed": 11.61943006515503, "timestamp": "2026-08-18T01:17:01", "secondary_metrics": {"mae": 11.678110914380296, "mape": 0.22901466143986113, "r2": 0.9472562586867393, "ic": 0.9715519172507808}, "per_fold_test_reports": [{"fold_id": 0, "regime": "calendar_2014_test", "task_type": "regression", "n": 7950, "rmse": 21.367142993353347, "mae": 11.678110914380296, "mape": 0.22901466143986113, "r2": 0.9472562586867393, "ic": 0.9715519172507808}], "composite_fingerprint": "a12fd381fe9bbefb"}
{"experiment_num": 18, "backbone": "xgboost", "description": "Exp18 from champion: subsample 1.0", "config": {"paths": {"results_dir": "C:\\Users\\abhir\\autoresearch-uci\\beijing_pm25\\autoresearch_results"}, "task_type": "regression", "primary_metric": "rmse", "backbone": "xgboost", "backbone_config": {"n_estimators": 1500, "max_depth": 4, "learning_rate": 0.01, "subsample": 1.0, "colsample_bytree": 0.8, "reg_lambda": 1.0, "early_stopping_rounds": 50, "seed": 0, "n_jobs": 4, "tree_method": "hist", "uncertainty_samples": 1}, "data": {"format": "csv", "path": "C:\\Users\\abhir\\autoresearch-uci\\beijing_pm25\\data\\features_full.csv", "target_columns": ["pm25"], "feature_columns": ["DEWP", "TEMP", "PRES", "Iws", "Is", "Ir", "cbwd_NE", "cbwd_NW", "cbwd_SE", "cbwd_cv", "pm25_lag1", "pm25_lag2", "pm25_lag3", "pm25_lag4", "pm25_lag5", "pm25_lag6", "pm25_lag7", "pm25_lag8", "pm25_lag9", "pm25_lag10", "pm25_lag11", "pm25_lag12", "pm25_lag13", "pm25_lag14", "pm25_lag15", "pm25_lag16", "pm25_lag17", "pm25_lag18", "pm25_lag19", "pm25_lag20", "pm25_lag21", "pm25_lag22", "pm25_lag23", "pm25_lag24", "hour_sin", "hour_cos", "dow", "is_weekend", "pm25_delta1"]}, "split": {"name": "calendar_year", "manifest_dir": "C:\\Users\\abhir\\autoresearch-uci\\beijing_pm25\\data"}, "composite": {"higher_is_better": false, "penalty_weight": 0.1, "below_threshold": -40.0}, "hardware": {"n_threads": 4, "cpu_affinity": [0, 2, 4, 6]}, "description": "Exp18 from champion: subsample 1.0", "seed": 0}, "composite": -22.789609624496542, "val_primary": 22.789609624496542, "test_primary": 21.397064342916376, "per_fold_test": [21.397064342916376], "per_fold_val": [22.789609624496542], "status": "DISCARD", "seconds_elapsed": 3.2599096298217773, "timestamp": "2026-08-18T01:17:10", "secondary_metrics": {"mae": 11.587717790483678, "mape": 0.21354076583028447, "r2": 0.9471084364993985, "ic": 0.972448491161539}, "per_fold_test_reports": [{"fold_id": 0, "regime": "calendar_2014_test", "task_type": "regression", "n": 7950, "rmse": 21.397064342916376, "mae": 11.587717790483678, "mape": 0.21354076583028447, "r2": 0.9471084364993985, "ic": 0.972448491161539}], "composite_fingerprint": "a12fd381fe9bbefb"}
{"experiment_num": 19, "backbone": "xgboost", "description": "Exp19 from champion: min_child_weight 50", "config": {"paths": {"results_dir": "C:\\Users\\abhir\\autoresearch-uci\\beijing_pm25\\autoresearch_results"}, "task_type": "regression", "primary_metric": "rmse", "backbone": "xgboost", "backbone_config": {"n_estimators": 1500, "max_depth": 4, "learning_rate": 0.01, "subsample": 0.6, "colsample_bytree": 0.8, "reg_lambda": 1.0, "early_stopping_rounds": 50, "seed": 0, "n_jobs": 4, "tree_method": "hist", "uncertainty_samples": 1, "min_child_weight": 50}, "data": {"format": "csv", "path": "C:\\Users\\abhir\\autoresearch-uci\\beijing_pm25\\data\\features_full.csv", "target_columns": ["pm25"], "feature_columns": ["DEWP", "TEMP", "PRES", "Iws", "Is", "Ir", "cbwd_NE", "cbwd_NW", "cbwd_SE", "cbwd_cv", "pm25_lag1", "pm25_lag2", "pm25_lag3", "pm25_lag4", "pm25_lag5", "pm25_lag6", "pm25_lag7", "pm25_lag8", "pm25_lag9", "pm25_lag10", "pm25_lag11", "pm25_lag12", "pm25_lag13", "pm25_lag14", "pm25_lag15", "pm25_lag16", "pm25_lag17", "pm25_lag18", "pm25_lag19", "pm25_lag20", "pm25_lag21", "pm25_lag22", "pm25_lag23", "pm25_lag24", "hour_sin", "hour_cos", "dow", "is_weekend", "pm25_delta1"]}, "split": {"name": "calendar_year", "manifest_dir": "C:\\Users\\abhir\\autoresearch-uci\\beijing_pm25\\data"}, "composite": {"higher_is_better": false, "penalty_weight": 0.1, "below_threshold": -40.0}, "hardware": {"n_threads": 4, "cpu_affinity": [0, 2, 4, 6]}, "description": "Exp19 from champion: min_child_weight 50", "seed": 0}, "composite": -22.89980237941168, "val_primary": 22.89980237941168, "test_primary": 21.15335672522214, "per_fold_test": [21.15335672522214], "per_fold_val": [22.89980237941168], "status": "DISCARD", "seconds_elapsed": 3.753952741622925, "timestamp": "2026-08-18T01:17:45", "secondary_metrics": {"mae": 11.611368070878322, "mape": 0.22430602204114786, "r2": 0.9483064204127837, "ic": 0.9721760180806464}, "per_fold_test_reports": [{"fold_id": 0, "regime": "calendar_2014_test", "task_type": "regression", "n": 7950, "rmse": 21.15335672522214, "mae": 11.611368070878322, "mape": 0.22430602204114786, "r2": 0.9483064204127837, "ic": 0.9721760180806464}], "composite_fingerprint": "a12fd381fe9bbefb"}
{"experiment_num": 20, "backbone": "lightgbm", "description": "Exp20 from champion: lightgbm leafwise default start", "config": {"paths": {"results_dir": "C:\\Users\\abhir\\autoresearch-uci\\beijing_pm25\\autoresearch_results"}, "task_type": "regression", "primary_metric": "rmse", "backbone": "lightgbm", "backbone_config": {"n_estimators": 2000, "num_leaves": 63, "learning_rate": 0.03, "feature_fraction": 0.8, "bagging_fraction": 0.8, "early_stopping_rounds": 50, "seed": 0, "n_jobs": 4}, "data": {"format": "csv", "path": "C:\\Users\\abhir\\autoresearch-uci\\beijing_pm25\\data\\features_full.csv", "target_columns": ["pm25"], "feature_columns": ["DEWP", "TEMP", "PRES", "Iws", "Is", "Ir", "cbwd_NE", "cbwd_NW", "cbwd_SE", "cbwd_cv", "pm25_lag1", "pm25_lag2", "pm25_lag3", "pm25_lag4", "pm25_lag5", "pm25_lag6", "pm25_lag7", "pm25_lag8", "pm25_lag9", "pm25_lag10", "pm25_lag11", "pm25_lag12", "pm25_lag13", "pm25_lag14", "pm25_lag15", "pm25_lag16", "pm25_lag17", "pm25_lag18", "pm25_lag19", "pm25_lag20", "pm25_lag21", "pm25_lag22", "pm25_lag23", "pm25_lag24", "hour_sin", "hour_cos", "dow", "is_weekend", "pm25_delta1"]}, "split": {"name": "calendar_year", "manifest_dir": "C:\\Users\\abhir\\autoresearch-uci\\beijing_pm25\\data"}, "composite": {"higher_is_better": false, "penalty_weight": 0.1, "below_threshold": -40.0}, "hardware": {"n_threads": 4, "cpu_affinity": [0, 2, 4, 6]}, "description": "Exp20 from champion: lightgbm leafwise default start", "seed": 0}, "composite": -22.810370783678668, "val_primary": 22.810370783678668, "test_primary": 21.050144573277006, "per_fold_test": [21.050144573277006], "per_fold_val": [22.810370783678668], "status": "DISCARD", "seconds_elapsed": 3.1019484996795654, "timestamp": "2026-08-18T01:17:52", "secondary_metrics": {"mae": 11.559838209985166, "mape": 0.2096526890245108, "r2": 0.9488096397662984, "ic": 0.9727317613077411}, "per_fold_test_reports": [{"fold_id": 0, "regime": "calendar_2014_test", "task_type": "regression", "n": 7950, "rmse": 21.050144573277006, "mae": 11.559838209985166, "mape": 0.2096526890245108, "r2": 0.9488096397662984, "ic": 0.9727317613077411}], "composite_fingerprint": "a12fd381fe9bbefb"}
{"experiment_num": 21, "backbone": "catboost", "description": "Exp21 from champion: catboost ordered boosting start", "config": {"paths": {"results_dir": "C:\\Users\\abhir\\autoresearch-uci\\beijing_pm25\\autoresearch_results"}, "task_type": "regression", "primary_metric": "rmse", "backbone": "catboost", "backbone_config": {"iterations": 2000, "depth": 6, "learning_rate": 0.03, "l2_leaf_reg": 3.0, "early_stopping_rounds": 100, "seed": 0}, "data": {"format": "csv", "path": "C:\\Users\\abhir\\autoresearch-uci\\beijing_pm25\\data\\features_full.csv", "target_columns": ["pm25"], "feature_columns": ["DEWP", "TEMP", "PRES", "Iws", "Is", "Ir", "cbwd_NE", "cbwd_NW", "cbwd_SE", "cbwd_cv", "pm25_lag1", "pm25_lag2", "pm25_lag3", "pm25_lag4", "pm25_lag5", "pm25_lag6", "pm25_lag7", "pm25_lag8", "pm25_lag9", "pm25_lag10", "pm25_lag11", "pm25_lag12", "pm25_lag13", "pm25_lag14", "pm25_lag15", "pm25_lag16", "pm25_lag17", "pm25_lag18", "pm25_lag19", "pm25_lag20", "pm25_lag21", "pm25_lag22", "pm25_lag23", "pm25_lag24", "hour_sin", "hour_cos", "dow", "is_weekend", "pm25_delta1"]}, "split": {"name": "calendar_year", "manifest_dir": "C:\\Users\\abhir\\autoresearch-uci\\beijing_pm25\\data"}, "composite": {"higher_is_better": false, "penalty_weight": 0.1, "below_threshold": -40.0}, "hardware": {"n_threads": 4, "cpu_affinity": [0, 2, 4, 6]}, "description": "Exp21 from champion: catboost ordered boosting start", "seed": 0}, "composite": -22.794351853228275, "val_primary": 22.794351853228275, "test_primary": 21.210694625084475, "per_fold_test": [21.210694625084475], "per_fold_val": [22.794351853228275], "status": "DISCARD", "seconds_elapsed": 8.64176058769226, "timestamp": "2026-08-18T01:18:07", "secondary_metrics": {"mae": 11.573617973130391, "mape": 0.22559431256620918, "r2": 0.9480258012739723, "ic": 0.9717722722109692}, "per_fold_test_reports": [{"fold_id": 0, "regime": "calendar_2014_test", "task_type": "regression", "n": 7950, "rmse": 21.210694625084475, "mae": 11.573617973130391, "mape": 0.22559431256620918, "r2": 0.9480258012739723, "ic": 0.9717722722109692}], "composite_fingerprint": "a12fd381fe9bbefb"}
{"experiment_num": 22, "backbone": "xgboost", "description": "Exp22 from champion: stack inversion_spread onto delta champion", "config": {"paths": {"results_dir": "C:\\Users\\abhir\\autoresearch-uci\\beijing_pm25\\autoresearch_results"}, "task_type": "regression", "primary_metric": "rmse", "backbone": "xgboost", "backbone_config": {"n_estimators": 1500, "max_depth": 4, "learning_rate": 0.01, "subsample": 0.6, "colsample_bytree": 0.8, "reg_lambda": 1.0, "early_stopping_rounds": 50, "seed": 0, "n_jobs": 4, "tree_method": "hist", "uncertainty_samples": 1}, "data": {"format": "csv", "path": "C:\\Users\\abhir\\autoresearch-uci\\beijing_pm25\\data\\features_full.csv", "target_columns": ["pm25"], "feature_columns": ["DEWP", "TEMP", "PRES", "Iws", "Is", "Ir", "cbwd_NE", "cbwd_NW", "cbwd_SE", "cbwd_cv", "pm25_lag1", "pm25_lag2", "pm25_lag3", "pm25_lag4", "pm25_lag5", "pm25_lag6", "pm25_lag7", "pm25_lag8", "pm25_lag9", "pm25_lag10", "pm25_lag11", "pm25_lag12", "pm25_lag13", "pm25_lag14", "pm25_lag15", "pm25_lag16", "pm25_lag17", "pm25_lag18", "pm25_lag19", "pm25_lag20", "pm25_lag21", "pm25_lag22", "pm25_lag23", "pm25_lag24", "hour_sin", "hour_cos", "dow", "is_weekend", "pm25_delta1", "inversion_spread"]}, "split": {"name": "calendar_year", "manifest_dir": "C:\\Users\\abhir\\autoresearch-uci\\beijing_pm25\\data"}, "composite": {"higher_is_better": false, "penalty_weight": 0.1, "below_threshold": -40.0}, "hardware": {"n_threads": 4, "cpu_affinity": [0, 2, 4, 6]}, "description": "Exp22 from champion: stack inversion_spread onto delta champion", "seed": 0}, "composite": -22.469763603422706, "val_primary": 22.469763603422706, "test_primary": 21.121840308894136, "per_fold_test": [21.121840308894136], "per_fold_val": [22.469763603422706], "status": "KEEP", "seconds_elapsed": 3.8121702671051025, "timestamp": "2026-08-18T01:18:51", "secondary_metrics": {"mae": 11.544569138580899, "mape": 0.2177944999479967, "r2": 0.9484603423388309, "ic": 0.9724834909001315}, "per_fold_test_reports": [{"fold_id": 0, "regime": "calendar_2014_test", "task_type": "regression", "n": 7950, "rmse": 21.121840308894136, "mae": 11.544569138580899, "mape": 0.2177944999479967, "r2": 0.9484603423388309, "ic": 0.9724834909001315}], "composite_fingerprint": "a12fd381fe9bbefb"}
