{"experiment_num": 132, "backbone": "mlp", "description": "Exp132 MLP patience=5 on Exp130 recipe (MLP cycle 8/50)", "config": {"paths": {"results_dir": "C:\\Users\\abhir\\autoresearch-uci\\beijing_pm25\\autoresearch_results"}, "task_type": "regression", "primary_metric": "rmse", "backbone": "mlp", "backbone_config": {"seed": 0, "n_jobs": 4, "weight_decay": 0.0001, "batch_size": 16, "patience": 5}, "data": {"format": "csv", "path": "C:\\Users\\abhir\\autoresearch-uci\\beijing_pm25\\data\\features_full.csv", "target_columns": ["pm25"], "feature_columns": ["DEWP", "TEMP", "PRES", "Iws", "Is", "Ir", "cbwd_NE", "cbwd_NW", "cbwd_SE", "cbwd_cv", "pm25_lag1", "pm25_lag2", "pm25_lag3", "pm25_lag4", "pm25_lag5", "pm25_lag6", "pm25_lag7", "pm25_lag8", "pm25_lag9", "pm25_lag10", "pm25_lag11", "pm25_lag12", "pm25_lag13", "pm25_lag14", "pm25_lag15", "pm25_lag16", "pm25_lag17", "pm25_lag18", "pm25_lag19", "pm25_lag20", "pm25_lag21", "pm25_lag22", "pm25_lag23", "pm25_lag24", "hour_sin", "hour_cos", "dow", "is_weekend", "pm25_delta1", "inversion_spread", "rh_magnus", "dewp_delta", "is_heating"]}, "split": {"name": "calendar_year", "manifest_dir": "C:\\Users\\abhir\\autoresearch-uci\\beijing_pm25\\data"}, "composite": {"higher_is_better": false, "penalty_weight": 0.1, "below_threshold": -40.0}, "hardware": {"n_threads": 4, "cpu_affinity": [0, 2, 4, 6]}, "description": "Exp132 MLP patience=5 on Exp130 recipe (MLP cycle 8/50)", "seed": 0}, "composite": -22.75651550349263, "val_primary": 22.75651550349263, "test_primary": 20.76357850967923, "per_fold_test": [20.76357850967923], "per_fold_val": [22.75651550349263], "status": "DISCARD", "seconds_elapsed": 72.7492458820343, "timestamp": "2026-08-19T17:42:26", "secondary_metrics": {"mae": 11.388394628980624, "mape": 0.20182824040855438, "r2": 0.9501939123472833, "ic": 0.9727834608397903}, "per_fold_test_reports": [{"fold_id": 0, "regime": "calendar_2014_test", "task_type": "regression", "n": 7950, "rmse": 20.76357850967923, "mae": 11.388394628980624, "mape": 0.20182824040855438, "r2": 0.9501939123472833, "ic": 0.9727834608397903}], "composite_fingerprint": "a12fd381fe9bbefb"}
{"experiment_num": 133, "backbone": "mlp", "description": "Exp133 MLP add log_iws on Exp130 recipe (MLP cycle 9/50)", "config": {"paths": {"results_dir": "C:\\Users\\abhir\\autoresearch-uci\\beijing_pm25\\autoresearch_results"}, "task_type": "regression", "primary_metric": "rmse", "backbone": "mlp", "backbone_config": {"seed": 0, "n_jobs": 4, "weight_decay": 0.0001, "batch_size": 16}, "data": {"format": "csv", "path": "C:\\Users\\abhir\\autoresearch-uci\\beijing_pm25\\data\\features_full.csv", "target_columns": ["pm25"], "feature_columns": ["DEWP", "TEMP", "PRES", "Iws", "Is", "Ir", "cbwd_NE", "cbwd_NW", "cbwd_SE", "cbwd_cv", "pm25_lag1", "pm25_lag2", "pm25_lag3", "pm25_lag4", "pm25_lag5", "pm25_lag6", "pm25_lag7", "pm25_lag8", "pm25_lag9", "pm25_lag10", "pm25_lag11", "pm25_lag12", "pm25_lag13", "pm25_lag14", "pm25_lag15", "pm25_lag16", "pm25_lag17", "pm25_lag18", "pm25_lag19", "pm25_lag20", "pm25_lag21", "pm25_lag22", "pm25_lag23", "pm25_lag24", "hour_sin", "hour_cos", "dow", "is_weekend", "pm25_delta1", "inversion_spread", "rh_magnus", "dewp_delta", "is_heating", "log_iws"]}, "split": {"name": "calendar_year", "manifest_dir": "C:\\Users\\abhir\\autoresearch-uci\\beijing_pm25\\data"}, "composite": {"higher_is_better": false, "penalty_weight": 0.1, "below_threshold": -40.0}, "hardware": {"n_threads": 4, "cpu_affinity": [0, 2, 4, 6]}, "description": "Exp133 MLP add log_iws on Exp130 recipe (MLP cycle 9/50)", "seed": 0}, "composite": -22.502140533400055, "val_primary": 22.502140533400055, "test_primary": 20.586655874281465, "per_fold_test": [20.586655874281465], "per_fold_val": [22.502140533400055], "status": "DISCARD", "seconds_elapsed": 128.2936189174652, "timestamp": "2026-08-19T18:11:37", "secondary_metrics": {"mae": 11.390635199816721, "mape": 0.19814266113576967, "r2": 0.9510390732442715, "ic": 0.9728114305960269}, "per_fold_test_reports": [{"fold_id": 0, "regime": "calendar_2014_test", "task_type": "regression", "n": 7950, "rmse": 20.586655874281465, "mae": 11.390635199816721, "mape": 0.19814266113576967, "r2": 0.9510390732442715, "ic": 0.9728114305960269}], "composite_fingerprint": "a12fd381fe9bbefb"}
{"experiment_num": 134, "backbone": "mlp", "description": "Exp134 MLP add month_sin on Exp133 recipe (MLP cycle 10/50)", "config": {"paths": {"results_dir": "C:\\Users\\abhir\\autoresearch-uci\\beijing_pm25\\autoresearch_results"}, "task_type": "regression", "primary_metric": "rmse", "backbone": "mlp", "backbone_config": {"seed": 0, "n_jobs": 4, "weight_decay": 0.0001, "batch_size": 16}, "data": {"format": "csv", "path": "C:\\Users\\abhir\\autoresearch-uci\\beijing_pm25\\data\\features_full.csv", "target_columns": ["pm25"], "feature_columns": ["DEWP", "TEMP", "PRES", "Iws", "Is", "Ir", "cbwd_NE", "cbwd_NW", "cbwd_SE", "cbwd_cv", "pm25_lag1", "pm25_lag2", "pm25_lag3", "pm25_lag4", "pm25_lag5", "pm25_lag6", "pm25_lag7", "pm25_lag8", "pm25_lag9", "pm25_lag10", "pm25_lag11", "pm25_lag12", "pm25_lag13", "pm25_lag14", "pm25_lag15", "pm25_lag16", "pm25_lag17", "pm25_lag18", "pm25_lag19", "pm25_lag20", "pm25_lag21", "pm25_lag22", "pm25_lag23", "pm25_lag24", "hour_sin", "hour_cos", "dow", "is_weekend", "pm25_delta1", "inversion_spread", "rh_magnus", "dewp_delta", "is_heating", "log_iws", "month_sin"]}, "split": {"name": "calendar_year", "manifest_dir": "C:\\Users\\abhir\\autoresearch-uci\\beijing_pm25\\data"}, "composite": {"higher_is_better": false, "penalty_weight": 0.1, "below_threshold": -40.0}, "hardware": {"n_threads": 4, "cpu_affinity": [0, 2, 4, 6]}, "description": "Exp134 MLP add month_sin on Exp133 recipe (MLP cycle 10/50)", "seed": 0}, "composite": -22.431543089570805, "val_primary": 22.431543089570805, "test_primary": 20.44956246067674, "per_fold_test": [20.44956246067674], "per_fold_val": [22.431543089570805], "status": "DISCARD", "seconds_elapsed": 137.93714141845703, "timestamp": "2026-08-19T18:41:06", "secondary_metrics": {"mae": 11.27971033030336, "mape": 0.19873706740609615, "r2": 0.9516889962977579, "ic": 0.9732686776222399}, "per_fold_test_reports": [{"fold_id": 0, "regime": "calendar_2014_test", "task_type": "regression", "n": 7950, "rmse": 20.44956246067674, "mae": 11.27971033030336, "mape": 0.19873706740609615, "r2": 0.9516889962977579, "ic": 0.9732686776222399}], "composite_fingerprint": "a12fd381fe9bbefb"}
{"experiment_num": 135, "backbone": "mlp", "description": "Exp135 MLP add pm25_accel on Exp134 recipe (MLP cycle 11/50)", "config": {"paths": {"results_dir": "C:\\Users\\abhir\\autoresearch-uci\\beijing_pm25\\autoresearch_results"}, "task_type": "regression", "primary_metric": "rmse", "backbone": "mlp", "backbone_config": {"seed": 0, "n_jobs": 4, "weight_decay": 0.0001, "batch_size": 16}, "data": {"format": "csv", "path": "C:\\Users\\abhir\\autoresearch-uci\\beijing_pm25\\data\\features_full.csv", "target_columns": ["pm25"], "feature_columns": ["DEWP", "TEMP", "PRES", "Iws", "Is", "Ir", "cbwd_NE", "cbwd_NW", "cbwd_SE", "cbwd_cv", "pm25_lag1", "pm25_lag2", "pm25_lag3", "pm25_lag4", "pm25_lag5", "pm25_lag6", "pm25_lag7", "pm25_lag8", "pm25_lag9", "pm25_lag10", "pm25_lag11", "pm25_lag12", "pm25_lag13", "pm25_lag14", "pm25_lag15", "pm25_lag16", "pm25_lag17", "pm25_lag18", "pm25_lag19", "pm25_lag20", "pm25_lag21", "pm25_lag22", "pm25_lag23", "pm25_lag24", "hour_sin", "hour_cos", "dow", "is_weekend", "pm25_delta1", "inversion_spread", "rh_magnus", "dewp_delta", "is_heating", "log_iws", "month_sin", "pm25_accel"]}, "split": {"name": "calendar_year", "manifest_dir": "C:\\Users\\abhir\\autoresearch-uci\\beijing_pm25\\data"}, "composite": {"higher_is_better": false, "penalty_weight": 0.1, "below_threshold": -40.0}, "hardware": {"n_threads": 4, "cpu_affinity": [0, 2, 4, 6]}, "description": "Exp135 MLP add pm25_accel on Exp134 recipe (MLP cycle 11/50)", "seed": 0}, "composite": -22.34996288393599, "val_primary": 22.34996288393599, "test_primary": 20.41745308941653, "per_fold_test": [20.41745308941653], "per_fold_val": [22.34996288393599], "status": "DISCARD", "seconds_elapsed": 135.10699486732483, "timestamp": "2026-08-19T19:10:40", "secondary_metrics": {"mae": 11.275790991453254, "mape": 0.20101043578244007, "r2": 0.9518405905532956, "ic": 0.9733385641351792}, "per_fold_test_reports": [{"fold_id": 0, "regime": "calendar_2014_test", "task_type": "regression", "n": 7950, "rmse": 20.41745308941653, "mae": 11.275790991453254, "mape": 0.20101043578244007, "r2": 0.9518405905532956, "ic": 0.9733385641351792}], "composite_fingerprint": "a12fd381fe9bbefb"}
{"experiment_num": 136, "backbone": "mlp", "description": "Exp136 MLP add vent_index on Exp135 recipe (MLP cycle 12/50)", "config": {"paths": {"results_dir": "C:\\Users\\abhir\\autoresearch-uci\\beijing_pm25\\autoresearch_results"}, "task_type": "regression", "primary_metric": "rmse", "backbone": "mlp", "backbone_config": {"seed": 0, "n_jobs": 4, "weight_decay": 0.0001, "batch_size": 16}, "data": {"format": "csv", "path": "C:\\Users\\abhir\\autoresearch-uci\\beijing_pm25\\data\\features_full.csv", "target_columns": ["pm25"], "feature_columns": ["DEWP", "TEMP", "PRES", "Iws", "Is", "Ir", "cbwd_NE", "cbwd_NW", "cbwd_SE", "cbwd_cv", "pm25_lag1", "pm25_lag2", "pm25_lag3", "pm25_lag4", "pm25_lag5", "pm25_lag6", "pm25_lag7", "pm25_lag8", "pm25_lag9", "pm25_lag10", "pm25_lag11", "pm25_lag12", "pm25_lag13", "pm25_lag14", "pm25_lag15", "pm25_lag16", "pm25_lag17", "pm25_lag18", "pm25_lag19", "pm25_lag20", "pm25_lag21", "pm25_lag22", "pm25_lag23", "pm25_lag24", "hour_sin", "hour_cos", "dow", "is_weekend", "pm25_delta1", "inversion_spread", "rh_magnus", "dewp_delta", "is_heating", "log_iws", "month_sin", "pm25_accel", "vent_index"]}, "split": {"name": "calendar_year", "manifest_dir": "C:\\Users\\abhir\\autoresearch-uci\\beijing_pm25\\data"}, "composite": {"higher_is_better": false, "penalty_weight": 0.1, "below_threshold": -40.0}, "hardware": {"n_threads": 4, "cpu_affinity": [0, 2, 4, 6]}, "description": "Exp136 MLP add vent_index on Exp135 recipe (MLP cycle 12/50)", "seed": 0}, "composite": -22.259362517942957, "val_primary": 22.259362517942957, "test_primary": 20.509087921684426, "per_fold_test": [20.509087921684426], "per_fold_val": [22.259362517942957], "status": "DISCARD", "seconds_elapsed": 122.36972141265869, "timestamp": "2026-08-19T19:40:24", "secondary_metrics": {"mae": 11.299736913345145, "mape": 0.20057891633838906, "r2": 0.9514073354868205, "ic": 0.9730404073313738}, "per_fold_test_reports": [{"fold_id": 0, "regime": "calendar_2014_test", "task_type": "regression", "n": 7950, "rmse": 20.509087921684426, "mae": 11.299736913345145, "mape": 0.20057891633838906, "r2": 0.9514073354868205, "ic": 0.9730404073313738}], "composite_fingerprint": "a12fd381fe9bbefb"}
{"experiment_num": 137, "backbone": "mlp", "description": "Exp137 MLP add pm25_roll6max on Exp136 recipe (MLP cycle 13/50)", "config": {"paths": {"results_dir": "C:\\Users\\abhir\\autoresearch-uci\\beijing_pm25\\autoresearch_results"}, "task_type": "regression", "primary_metric": "rmse", "backbone": "mlp", "backbone_config": {"seed": 0, "n_jobs": 4, "weight_decay": 0.0001, "batch_size": 16}, "data": {"format": "csv", "path": "C:\\Users\\abhir\\autoresearch-uci\\beijing_pm25\\data\\features_full.csv", "target_columns": ["pm25"], "feature_columns": ["DEWP", "TEMP", "PRES", "Iws", "Is", "Ir", "cbwd_NE", "cbwd_NW", "cbwd_SE", "cbwd_cv", "pm25_lag1", "pm25_lag2", "pm25_lag3", "pm25_lag4", "pm25_lag5", "pm25_lag6", "pm25_lag7", "pm25_lag8", "pm25_lag9", "pm25_lag10", "pm25_lag11", "pm25_lag12", "pm25_lag13", "pm25_lag14", "pm25_lag15", "pm25_lag16", "pm25_lag17", "pm25_lag18", "pm25_lag19", "pm25_lag20", "pm25_lag21", "pm25_lag22", "pm25_lag23", "pm25_lag24", "hour_sin", "hour_cos", "dow", "is_weekend", "pm25_delta1", "inversion_spread", "rh_magnus", "dewp_delta", "is_heating", "log_iws", "month_sin", "pm25_accel", "vent_index", "pm25_roll6max"]}, "split": {"name": "calendar_year", "manifest_dir": "C:\\Users\\abhir\\autoresearch-uci\\beijing_pm25\\data"}, "composite": {"higher_is_better": false, "penalty_weight": 0.1, "below_threshold": -40.0}, "hardware": {"n_threads": 4, "cpu_affinity": [0, 2, 4, 6]}, "description": "Exp137 MLP add pm25_roll6max on Exp136 recipe (MLP cycle 13/50)", "seed": 0}, "composite": -22.450667089600113, "val_primary": 22.450667089600113, "test_primary": 20.47795304721041, "per_fold_test": [20.47795304721041], "per_fold_val": [22.450667089600113], "status": "DISCARD", "seconds_elapsed": 92.90881252288818, "timestamp": "2026-08-19T20:10:42", "secondary_metrics": {"mae": 11.286755483855242, "mape": 0.20901940231620117, "r2": 0.9515547606797735, "ic": 0.9731257071350212}, "per_fold_test_reports": [{"fold_id": 0, "regime": "calendar_2014_test", "task_type": "regression", "n": 7950, "rmse": 20.47795304721041, "mae": 11.286755483855242, "mape": 0.20901940231620117, "r2": 0.9515547606797735, "ic": 0.9731257071350212}], "composite_fingerprint": "a12fd381fe9bbefb"}
{"experiment_num": 138, "backbone": "mlp", "description": "Exp138 MLP add pres_delta on Exp136 recipe (MLP cycle 14/50)", "config": {"paths": {"results_dir": "C:\\Users\\abhir\\autoresearch-uci\\beijing_pm25\\autoresearch_results"}, "task_type": "regression", "primary_metric": "rmse", "backbone": "mlp", "backbone_config": {"seed": 0, "n_jobs": 4, "weight_decay": 0.0001, "batch_size": 16}, "data": {"format": "csv", "path": "C:\\Users\\abhir\\autoresearch-uci\\beijing_pm25\\data\\features_full.csv", "target_columns": ["pm25"], "feature_columns": ["DEWP", "TEMP", "PRES", "Iws", "Is", "Ir", "cbwd_NE", "cbwd_NW", "cbwd_SE", "cbwd_cv", "pm25_lag1", "pm25_lag2", "pm25_lag3", "pm25_lag4", "pm25_lag5", "pm25_lag6", "pm25_lag7", "pm25_lag8", "pm25_lag9", "pm25_lag10", "pm25_lag11", "pm25_lag12", "pm25_lag13", "pm25_lag14", "pm25_lag15", "pm25_lag16", "pm25_lag17", "pm25_lag18", "pm25_lag19", "pm25_lag20", "pm25_lag21", "pm25_lag22", "pm25_lag23", "pm25_lag24", "hour_sin", "hour_cos", "dow", "is_weekend", "pm25_delta1", "inversion_spread", "rh_magnus", "dewp_delta", "is_heating", "log_iws", "month_sin", "pm25_accel", "vent_index", "pres_delta"]}, "split": {"name": "calendar_year", "manifest_dir": "C:\\Users\\abhir\\autoresearch-uci\\beijing_pm25\\data"}, "composite": {"higher_is_better": false, "penalty_weight": 0.1, "below_threshold": -40.0}, "hardware": {"n_threads": 4, "cpu_affinity": [0, 2, 4, 6]}, "description": "Exp138 MLP add pres_delta on Exp136 recipe (MLP cycle 14/50)", "seed": 0}, "composite": -22.43813412653448, "val_primary": 22.43813412653448, "test_primary": 20.439694792364556, "per_fold_test": [20.439694792364556], "per_fold_val": [22.43813412653448], "status": "DISCARD", "seconds_elapsed": 138.28064155578613, "timestamp": "2026-08-19T20:44:34", "secondary_metrics": {"mae": 11.274880397964573, "mape": 0.19998578465551536, "r2": 0.9517356087320845, "ic": 0.9731809775791325}, "per_fold_test_reports": [{"fold_id": 0, "regime": "calendar_2014_test", "task_type": "regression", "n": 7950, "rmse": 20.439694792364556, "mae": 11.274880397964573, "mape": 0.19998578465551536, "r2": 0.9517356087320845, "ic": 0.9731809775791325}], "composite_fingerprint": "a12fd381fe9bbefb"}
{"experiment_num": 139, "backbone": "mlp", "description": "Exp139 MLP add evening_peak on Exp136 recipe (MLP cycle 15/50)", "config": {"paths": {"results_dir": "C:\\Users\\abhir\\autoresearch-uci\\beijing_pm25\\autoresearch_results"}, "task_type": "regression", "primary_metric": "rmse", "backbone": "mlp", "backbone_config": {"seed": 0, "n_jobs": 4, "weight_decay": 0.0001, "batch_size": 16}, "data": {"format": "csv", "path": "C:\\Users\\abhir\\autoresearch-uci\\beijing_pm25\\data\\features_full.csv", "target_columns": ["pm25"], "feature_columns": ["DEWP", "TEMP", "PRES", "Iws", "Is", "Ir", "cbwd_NE", "cbwd_NW", "cbwd_SE", "cbwd_cv", "pm25_lag1", "pm25_lag2", "pm25_lag3", "pm25_lag4", "pm25_lag5", "pm25_lag6", "pm25_lag7", "pm25_lag8", "pm25_lag9", "pm25_lag10", "pm25_lag11", "pm25_lag12", "pm25_lag13", "pm25_lag14", "pm25_lag15", "pm25_lag16", "pm25_lag17", "pm25_lag18", "pm25_lag19", "pm25_lag20", "pm25_lag21", "pm25_lag22", "pm25_lag23", "pm25_lag24", "hour_sin", "hour_cos", "dow", "is_weekend", "pm25_delta1", "inversion_spread", "rh_magnus", "dewp_delta", "is_heating", "log_iws", "month_sin", "pm25_accel", "vent_index", "evening_peak"]}, "split": {"name": "calendar_year", "manifest_dir": "C:\\Users\\abhir\\autoresearch-uci\\beijing_pm25\\data"}, "composite": {"higher_is_better": false, "penalty_weight": 0.1, "below_threshold": -40.0}, "hardware": {"n_threads": 4, "cpu_affinity": [0, 2, 4, 6]}, "description": "Exp139 MLP add evening_peak on Exp136 recipe (MLP cycle 15/50)", "seed": 0}, "composite": -22.42495595503246, "val_primary": 22.42495595503246, "test_primary": 20.500829699277137, "per_fold_test": [20.500829699277137], "per_fold_val": [22.42495595503246], "status": "DISCARD", "seconds_elapsed": 139.75041675567627, "timestamp": "2026-08-19T21:15:15", "secondary_metrics": {"mae": 11.267322788358484, "mape": 0.20061069412439542, "r2": 0.95144646040945, "ic": 0.9732679362615374}, "per_fold_test_reports": [{"fold_id": 0, "regime": "calendar_2014_test", "task_type": "regression", "n": 7950, "rmse": 20.500829699277137, "mae": 11.267322788358484, "mape": 0.20061069412439542, "r2": 0.95144646040945, "ic": 0.9732679362615374}], "composite_fingerprint": "a12fd381fe9bbefb"}
{"experiment_num": 140, "backbone": "mlp", "description": "Exp140 MLP add se_iws on Exp136 recipe (MLP cycle 16/50)", "config": {"paths": {"results_dir": "C:\\Users\\abhir\\autoresearch-uci\\beijing_pm25\\autoresearch_results"}, "task_type": "regression", "primary_metric": "rmse", "backbone": "mlp", "backbone_config": {"seed": 0, "n_jobs": 4, "weight_decay": 0.0001, "batch_size": 16}, "data": {"format": "csv", "path": "C:\\Users\\abhir\\autoresearch-uci\\beijing_pm25\\data\\features_full.csv", "target_columns": ["pm25"], "feature_columns": ["DEWP", "TEMP", "PRES", "Iws", "Is", "Ir", "cbwd_NE", "cbwd_NW", "cbwd_SE", "cbwd_cv", "pm25_lag1", "pm25_lag2", "pm25_lag3", "pm25_lag4", "pm25_lag5", "pm25_lag6", "pm25_lag7", "pm25_lag8", "pm25_lag9", "pm25_lag10", "pm25_lag11", "pm25_lag12", "pm25_lag13", "pm25_lag14", "pm25_lag15", "pm25_lag16", "pm25_lag17", "pm25_lag18", "pm25_lag19", "pm25_lag20", "pm25_lag21", "pm25_lag22", "pm25_lag23", "pm25_lag24", "hour_sin", "hour_cos", "dow", "is_weekend", "pm25_delta1", "inversion_spread", "rh_magnus", "dewp_delta", "is_heating", "log_iws", "month_sin", "pm25_accel", "vent_index", "se_iws"]}, "split": {"name": "calendar_year", "manifest_dir": "C:\\Users\\abhir\\autoresearch-uci\\beijing_pm25\\data"}, "composite": {"higher_is_better": false, "penalty_weight": 0.1, "below_threshold": -40.0}, "hardware": {"n_threads": 4, "cpu_affinity": [0, 2, 4, 6]}, "description": "Exp140 MLP add se_iws on Exp136 recipe (MLP cycle 16/50)", "seed": 0}, "composite": -22.439356647780844, "val_primary": 22.439356647780844, "test_primary": 20.51921145109444, "per_fold_test": [20.51921145109444], "per_fold_val": [22.439356647780844], "status": "DISCARD", "seconds_elapsed": 121.27489471435547, "timestamp": "2026-08-19T21:41:03", "secondary_metrics": {"mae": 11.264722039204724, "mape": 0.2018350724398565, "r2": 0.9513593518142892, "ic": 0.973078063616464}, "per_fold_test_reports": [{"fold_id": 0, "regime": "calendar_2014_test", "task_type": "regression", "n": 7950, "rmse": 20.51921145109444, "mae": 11.264722039204724, "mape": 0.2018350724398565, "r2": 0.9513593518142892, "ic": 0.973078063616464}], "composite_fingerprint": "a12fd381fe9bbefb"}
{"experiment_num": 141, "backbone": "mlp", "description": "Exp141 MLP add pm25_delta6 on Exp136 recipe (MLP cycle 17/50)", "config": {"paths": {"results_dir": "C:\\Users\\abhir\\autoresearch-uci\\beijing_pm25\\autoresearch_results"}, "task_type": "regression", "primary_metric": "rmse", "backbone": "mlp", "backbone_config": {"seed": 0, "n_jobs": 4, "weight_decay": 0.0001, "batch_size": 16}, "data": {"format": "csv", "path": "C:\\Users\\abhir\\autoresearch-uci\\beijing_pm25\\data\\features_full.csv", "target_columns": ["pm25"], "feature_columns": ["DEWP", "TEMP", "PRES", "Iws", "Is", "Ir", "cbwd_NE", "cbwd_NW", "cbwd_SE", "cbwd_cv", "pm25_lag1", "pm25_lag2", "pm25_lag3", "pm25_lag4", "pm25_lag5", "pm25_lag6", "pm25_lag7", "pm25_lag8", "pm25_lag9", "pm25_lag10", "pm25_lag11", "pm25_lag12", "pm25_lag13", "pm25_lag14", "pm25_lag15", "pm25_lag16", "pm25_lag17", "pm25_lag18", "pm25_lag19", "pm25_lag20", "pm25_lag21", "pm25_lag22", "pm25_lag23", "pm25_lag24", "hour_sin", "hour_cos", "dow", "is_weekend", "pm25_delta1", "inversion_spread", "rh_magnus", "dewp_delta", "is_heating", "log_iws", "month_sin", "pm25_accel", "vent_index", "pm25_delta6"]}, "split": {"name": "calendar_year", "manifest_dir": "C:\\Users\\abhir\\autoresearch-uci\\beijing_pm25\\data"}, "composite": {"higher_is_better": false, "penalty_weight": 0.1, "below_threshold": -40.0}, "hardware": {"n_threads": 4, "cpu_affinity": [0, 2, 4, 6]}, "description": "Exp141 MLP add pm25_delta6 on Exp136 recipe (MLP cycle 17/50)", "seed": 0}, "composite": -22.355519772634448, "val_primary": 22.355519772634448, "test_primary": 20.2736974265415, "per_fold_test": [20.2736974265415], "per_fold_val": [22.355519772634448], "status": "DISCARD", "seconds_elapsed": 128.8007926940918, "timestamp": "2026-08-19T22:10:49", "secondary_metrics": {"mae": 11.26134775935479, "mape": 0.1994797610984256, "r2": 0.9525163668443138, "ic": 0.9732127356259864}, "per_fold_test_reports": [{"fold_id": 0, "regime": "calendar_2014_test", "task_type": "regression", "n": 7950, "rmse": 20.2736974265415, "mae": 11.26134775935479, "mape": 0.1994797610984256, "r2": 0.9525163668443138, "ic": 0.9732127356259864}], "composite_fingerprint": "a12fd381fe9bbefb"}
