{"experiment_num": 68, "backbone": "lightgbm", "description": "Exp68 t+6 extra_trees=True on Exp59 recipe (LGB side ladder 42/50)", "config": {"paths": {"results_dir": "C:\\Users\\abhir\\autoresearch-uci\\beijing_pm25\\autoresearch_results"}, "task_type": "regression", "primary_metric": "rmse", "backbone": "lightgbm", "backbone_config": {"seed": 0, "n_jobs": 4, "n_estimators": 2000, "num_leaves": 31, "learning_rate": 0.01, "feature_fraction": 0.8, "bagging_fraction": 0.6, "early_stopping_rounds": 50, "extra_trees": true}, "data": {"format": "csv", "path": "C:\\Users\\abhir\\autoresearch-uci\\beijing_pm25\\data\\features_horizon6.csv", "target_columns": ["pm25"], "feature_columns": ["DEWP", "TEMP", "PRES", "Iws", "Is", "Ir", "cbwd_NE", "cbwd_NW", "cbwd_SE", "cbwd_cv", "pm25_lag1", "pm25_lag2", "pm25_lag3", "pm25_lag4", "pm25_lag5", "pm25_lag6", "pm25_lag7", "pm25_lag8", "pm25_lag9", "pm25_lag10", "pm25_lag11", "pm25_lag12", "pm25_lag13", "pm25_lag14", "pm25_lag15", "pm25_lag16", "pm25_lag17", "pm25_lag18", "pm25_lag19", "pm25_lag20", "pm25_lag21", "pm25_lag22", "pm25_lag23", "pm25_lag24", "hour_sin", "hour_cos", "dow", "is_weekend", "pm25_delta1", "inversion_spread", "month_sin", "pres_delta", "dewp_delta", "cbwd_prev_NW"]}, "split": {"name": "calendar_year", "manifest_dir": "C:\\Users\\abhir\\autoresearch-uci\\beijing_pm25\\data"}, "composite": {"higher_is_better": false, "penalty_weight": 0.1, "below_threshold": -40.0}, "hardware": {"n_threads": 4, "cpu_affinity": [0, 2, 4, 6]}, "description": "Exp68 t+6 extra_trees=True on Exp59 recipe (LGB side ladder 42/50)", "seed": 0}, "composite": -57.597535561342866, "val_primary": 57.497535561342865, "test_primary": 54.48150349639271, "per_fold_test": [54.48150349639271], "per_fold_val": [57.497535561342865], "status": "DISCARD", "seconds_elapsed": 13.768204689025879, "timestamp": "2026-08-18T13:36:09", "secondary_metrics": {"mae": 35.309077972879166, "mape": 0.9017500072730988, "r2": 0.6570931285127358, "ic": 0.7950817534771306}, "per_fold_test_reports": [{"fold_id": 0, "regime": "calendar_2014_test", "task_type": "regression", "n": 7950, "rmse": 54.48150349639271, "mae": 35.309077972879166, "mape": 0.9017500072730988, "r2": 0.6570931285127358, "ic": 0.7950817534771306}], "composite_fingerprint": "a12fd381fe9bbefb"}
{"experiment_num": 69, "backbone": "lightgbm", "description": "Exp69 t+6 min_data_in_leaf=50 on Exp68 extra_trees (LGB side ladder 43/50)", "config": {"paths": {"results_dir": "C:\\Users\\abhir\\autoresearch-uci\\beijing_pm25\\autoresearch_results"}, "task_type": "regression", "primary_metric": "rmse", "backbone": "lightgbm", "backbone_config": {"seed": 0, "n_jobs": 4, "n_estimators": 2000, "num_leaves": 31, "learning_rate": 0.01, "feature_fraction": 0.8, "bagging_fraction": 0.6, "early_stopping_rounds": 50, "extra_trees": true, "min_data_in_leaf": 50}, "data": {"format": "csv", "path": "C:\\Users\\abhir\\autoresearch-uci\\beijing_pm25\\data\\features_horizon6.csv", "target_columns": ["pm25"], "feature_columns": ["DEWP", "TEMP", "PRES", "Iws", "Is", "Ir", "cbwd_NE", "cbwd_NW", "cbwd_SE", "cbwd_cv", "pm25_lag1", "pm25_lag2", "pm25_lag3", "pm25_lag4", "pm25_lag5", "pm25_lag6", "pm25_lag7", "pm25_lag8", "pm25_lag9", "pm25_lag10", "pm25_lag11", "pm25_lag12", "pm25_lag13", "pm25_lag14", "pm25_lag15", "pm25_lag16", "pm25_lag17", "pm25_lag18", "pm25_lag19", "pm25_lag20", "pm25_lag21", "pm25_lag22", "pm25_lag23", "pm25_lag24", "hour_sin", "hour_cos", "dow", "is_weekend", "pm25_delta1", "inversion_spread", "month_sin", "pres_delta", "dewp_delta", "cbwd_prev_NW"]}, "split": {"name": "calendar_year", "manifest_dir": "C:\\Users\\abhir\\autoresearch-uci\\beijing_pm25\\data"}, "composite": {"higher_is_better": false, "penalty_weight": 0.1, "below_threshold": -40.0}, "hardware": {"n_threads": 4, "cpu_affinity": [0, 2, 4, 6]}, "description": "Exp69 t+6 min_data_in_leaf=50 on Exp68 extra_trees (LGB side ladder 43/50)", "seed": 0}, "composite": -57.72029645276288, "val_primary": 57.62029645276288, "test_primary": 54.42534620546325, "per_fold_test": [54.42534620546325], "per_fold_val": [57.62029645276288], "status": "DISCARD", "seconds_elapsed": 12.546000480651855, "timestamp": "2026-08-18T14:04:39", "secondary_metrics": {"mae": 35.29165684740055, "mape": 0.902528326305117, "r2": 0.657799672759537, "ic": 0.7963043792912216}, "per_fold_test_reports": [{"fold_id": 0, "regime": "calendar_2014_test", "task_type": "regression", "n": 7950, "rmse": 54.42534620546325, "mae": 35.29165684740055, "mape": 0.902528326305117, "r2": 0.657799672759537, "ic": 0.7963043792912216}], "composite_fingerprint": "a12fd381fe9bbefb"}
{"experiment_num": 70, "backbone": "lightgbm", "description": "Exp70 t+6 feature_fraction 1.0 on Exp68 extra_trees (LGB side ladder 44/50)", "config": {"paths": {"results_dir": "C:\\Users\\abhir\\autoresearch-uci\\beijing_pm25\\autoresearch_results"}, "task_type": "regression", "primary_metric": "rmse", "backbone": "lightgbm", "backbone_config": {"seed": 0, "n_jobs": 4, "n_estimators": 2000, "num_leaves": 31, "learning_rate": 0.01, "feature_fraction": 1.0, "bagging_fraction": 0.6, "early_stopping_rounds": 50, "extra_trees": true}, "data": {"format": "csv", "path": "C:\\Users\\abhir\\autoresearch-uci\\beijing_pm25\\data\\features_horizon6.csv", "target_columns": ["pm25"], "feature_columns": ["DEWP", "TEMP", "PRES", "Iws", "Is", "Ir", "cbwd_NE", "cbwd_NW", "cbwd_SE", "cbwd_cv", "pm25_lag1", "pm25_lag2", "pm25_lag3", "pm25_lag4", "pm25_lag5", "pm25_lag6", "pm25_lag7", "pm25_lag8", "pm25_lag9", "pm25_lag10", "pm25_lag11", "pm25_lag12", "pm25_lag13", "pm25_lag14", "pm25_lag15", "pm25_lag16", "pm25_lag17", "pm25_lag18", "pm25_lag19", "pm25_lag20", "pm25_lag21", "pm25_lag22", "pm25_lag23", "pm25_lag24", "hour_sin", "hour_cos", "dow", "is_weekend", "pm25_delta1", "inversion_spread", "month_sin", "pres_delta", "dewp_delta", "cbwd_prev_NW"]}, "split": {"name": "calendar_year", "manifest_dir": "C:\\Users\\abhir\\autoresearch-uci\\beijing_pm25\\data"}, "composite": {"higher_is_better": false, "penalty_weight": 0.1, "below_threshold": -40.0}, "hardware": {"n_threads": 4, "cpu_affinity": [0, 2, 4, 6]}, "description": "Exp70 t+6 feature_fraction 1.0 on Exp68 extra_trees (LGB side ladder 44/50)", "seed": 0}, "composite": -57.54109043746747, "val_primary": 57.441090437467466, "test_primary": 54.619661688838185, "per_fold_test": [54.619661688838185], "per_fold_val": [57.441090437467466], "status": "DISCARD", "seconds_elapsed": 16.764382362365723, "timestamp": "2026-08-18T14:34:50", "secondary_metrics": {"mae": 35.31867713589775, "mape": 0.9000688672111429, "r2": 0.6553517866078168, "ic": 0.7946834333064571}, "per_fold_test_reports": [{"fold_id": 0, "regime": "calendar_2014_test", "task_type": "regression", "n": 7950, "rmse": 54.619661688838185, "mae": 35.31867713589775, "mape": 0.9000688672111429, "r2": 0.6553517866078168, "ic": 0.7946834333064571}], "composite_fingerprint": "a12fd381fe9bbefb"}
{"experiment_num": 71, "backbone": "lightgbm", "description": "Exp71 t+6 add anticyclone PRES>=1020 on Exp70 extra_trees (LGB side ladder 45/50)", "config": {"paths": {"results_dir": "C:\\Users\\abhir\\autoresearch-uci\\beijing_pm25\\autoresearch_results"}, "task_type": "regression", "primary_metric": "rmse", "backbone": "lightgbm", "backbone_config": {"seed": 0, "n_jobs": 4, "n_estimators": 2000, "num_leaves": 31, "learning_rate": 0.01, "feature_fraction": 1.0, "bagging_fraction": 0.6, "early_stopping_rounds": 50, "extra_trees": true}, "data": {"format": "csv", "path": "C:\\Users\\abhir\\autoresearch-uci\\beijing_pm25\\data\\features_horizon6.csv", "target_columns": ["pm25"], "feature_columns": ["DEWP", "TEMP", "PRES", "Iws", "Is", "Ir", "cbwd_NE", "cbwd_NW", "cbwd_SE", "cbwd_cv", "pm25_lag1", "pm25_lag2", "pm25_lag3", "pm25_lag4", "pm25_lag5", "pm25_lag6", "pm25_lag7", "pm25_lag8", "pm25_lag9", "pm25_lag10", "pm25_lag11", "pm25_lag12", "pm25_lag13", "pm25_lag14", "pm25_lag15", "pm25_lag16", "pm25_lag17", "pm25_lag18", "pm25_lag19", "pm25_lag20", "pm25_lag21", "pm25_lag22", "pm25_lag23", "pm25_lag24", "hour_sin", "hour_cos", "dow", "is_weekend", "pm25_delta1", "inversion_spread", "month_sin", "pres_delta", "dewp_delta", "cbwd_prev_NW", "anticyclone"]}, "split": {"name": "calendar_year", "manifest_dir": "C:\\Users\\abhir\\autoresearch-uci\\beijing_pm25\\data"}, "composite": {"higher_is_better": false, "penalty_weight": 0.1, "below_threshold": -40.0}, "hardware": {"n_threads": 4, "cpu_affinity": [0, 2, 4, 6]}, "description": "Exp71 t+6 add anticyclone PRES>=1020 on Exp70 extra_trees (LGB side ladder 45/50)", "seed": 0}, "composite": -57.61788403521472, "val_primary": 57.51788403521472, "test_primary": 54.32040171675079, "per_fold_test": [54.32040171675079], "per_fold_val": [57.51788403521472], "status": "DISCARD", "seconds_elapsed": 16.10219383239746, "timestamp": "2026-08-18T15:06:08", "secondary_metrics": {"mae": 35.16953846685982, "mape": 0.897026088195258, "r2": 0.6591180810960142, "ic": 0.7956770813821357}, "per_fold_test_reports": [{"fold_id": 0, "regime": "calendar_2014_test", "task_type": "regression", "n": 7950, "rmse": 54.32040171675079, "mae": 35.16953846685982, "mape": 0.897026088195258, "r2": 0.6591180810960142, "ic": 0.7956770813821357}], "composite_fingerprint": "a12fd381fe9bbefb"}
{"experiment_num": 72, "backbone": "lightgbm", "description": "Exp72 t+6 linear_tree=True on Exp70 extra_trees (LGB side ladder 46/50)", "config": {"paths": {"results_dir": "C:\\Users\\abhir\\autoresearch-uci\\beijing_pm25\\autoresearch_results"}, "task_type": "regression", "primary_metric": "rmse", "backbone": "lightgbm", "backbone_config": {"seed": 0, "n_jobs": 4, "n_estimators": 2000, "num_leaves": 31, "learning_rate": 0.01, "feature_fraction": 1.0, "bagging_fraction": 0.6, "early_stopping_rounds": 50, "extra_trees": true, "linear_tree": true}, "data": {"format": "csv", "path": "C:\\Users\\abhir\\autoresearch-uci\\beijing_pm25\\data\\features_horizon6.csv", "target_columns": ["pm25"], "feature_columns": ["DEWP", "TEMP", "PRES", "Iws", "Is", "Ir", "cbwd_NE", "cbwd_NW", "cbwd_SE", "cbwd_cv", "pm25_lag1", "pm25_lag2", "pm25_lag3", "pm25_lag4", "pm25_lag5", "pm25_lag6", "pm25_lag7", "pm25_lag8", "pm25_lag9", "pm25_lag10", "pm25_lag11", "pm25_lag12", "pm25_lag13", "pm25_lag14", "pm25_lag15", "pm25_lag16", "pm25_lag17", "pm25_lag18", "pm25_lag19", "pm25_lag20", "pm25_lag21", "pm25_lag22", "pm25_lag23", "pm25_lag24", "hour_sin", "hour_cos", "dow", "is_weekend", "pm25_delta1", "inversion_spread", "month_sin", "pres_delta", "dewp_delta", "cbwd_prev_NW"]}, "split": {"name": "calendar_year", "manifest_dir": "C:\\Users\\abhir\\autoresearch-uci\\beijing_pm25\\data"}, "composite": {"higher_is_better": false, "penalty_weight": 0.1, "below_threshold": -40.0}, "hardware": {"n_threads": 4, "cpu_affinity": [0, 2, 4, 6]}, "description": "Exp72 t+6 linear_tree=True on Exp70 extra_trees (LGB side ladder 46/50)", "seed": 0}, "composite": -57.52877754309372, "val_primary": 57.428777543093716, "test_primary": 54.32966011672015, "per_fold_test": [54.32966011672015], "per_fold_val": [57.428777543093716], "status": "DISCARD", "seconds_elapsed": 14.525669574737549, "timestamp": "2026-08-18T15:35:50", "secondary_metrics": {"mae": 35.007386073167055, "mape": 0.8676583309538599, "r2": 0.6590018709795645, "ic": 0.7958399950502075}, "per_fold_test_reports": [{"fold_id": 0, "regime": "calendar_2014_test", "task_type": "regression", "n": 7950, "rmse": 54.32966011672015, "mae": 35.007386073167055, "mape": 0.8676583309538599, "r2": 0.6590018709795645, "ic": 0.7958399950502075}], "composite_fingerprint": "a12fd381fe9bbefb"}
{"experiment_num": 73, "backbone": "lightgbm", "description": "Exp73 t+6 max_bin=127 on Exp72 extra_trees linear (LGB side ladder 47/50)", "config": {"paths": {"results_dir": "C:\\Users\\abhir\\autoresearch-uci\\beijing_pm25\\autoresearch_results"}, "task_type": "regression", "primary_metric": "rmse", "backbone": "lightgbm", "backbone_config": {"seed": 0, "n_jobs": 4, "n_estimators": 2000, "num_leaves": 31, "learning_rate": 0.01, "feature_fraction": 1.0, "bagging_fraction": 0.6, "early_stopping_rounds": 50, "extra_trees": true, "linear_tree": true, "max_bin": 127}, "data": {"format": "csv", "path": "C:\\Users\\abhir\\autoresearch-uci\\beijing_pm25\\data\\features_horizon6.csv", "target_columns": ["pm25"], "feature_columns": ["DEWP", "TEMP", "PRES", "Iws", "Is", "Ir", "cbwd_NE", "cbwd_NW", "cbwd_SE", "cbwd_cv", "pm25_lag1", "pm25_lag2", "pm25_lag3", "pm25_lag4", "pm25_lag5", "pm25_lag6", "pm25_lag7", "pm25_lag8", "pm25_lag9", "pm25_lag10", "pm25_lag11", "pm25_lag12", "pm25_lag13", "pm25_lag14", "pm25_lag15", "pm25_lag16", "pm25_lag17", "pm25_lag18", "pm25_lag19", "pm25_lag20", "pm25_lag21", "pm25_lag22", "pm25_lag23", "pm25_lag24", "hour_sin", "hour_cos", "dow", "is_weekend", "pm25_delta1", "inversion_spread", "month_sin", "pres_delta", "dewp_delta", "cbwd_prev_NW"]}, "split": {"name": "calendar_year", "manifest_dir": "C:\\Users\\abhir\\autoresearch-uci\\beijing_pm25\\data"}, "composite": {"higher_is_better": false, "penalty_weight": 0.1, "below_threshold": -40.0}, "hardware": {"n_threads": 4, "cpu_affinity": [0, 2, 4, 6]}, "description": "Exp73 t+6 max_bin=127 on Exp72 extra_trees linear (LGB side ladder 47/50)", "seed": 0}, "composite": -57.537148175963964, "val_primary": 57.43714817596396, "test_primary": 54.320419835057024, "per_fold_test": [54.320419835057024], "per_fold_val": [57.43714817596396], "status": "DISCARD", "seconds_elapsed": 13.427412509918213, "timestamp": "2026-08-18T16:04:26", "secondary_metrics": {"mae": 34.98531103271074, "mape": 0.8643587052739865, "r2": 0.6591178536969586, "ic": 0.7967980180000327}, "per_fold_test_reports": [{"fold_id": 0, "regime": "calendar_2014_test", "task_type": "regression", "n": 7950, "rmse": 54.320419835057024, "mae": 34.98531103271074, "mape": 0.8643587052739865, "r2": 0.6591178536969586, "ic": 0.7967980180000327}], "composite_fingerprint": "a12fd381fe9bbefb"}
{"experiment_num": 74, "backbone": "lightgbm", "description": "Exp74 t+6 bagging_freq=1 on Exp72 extra_trees linear (LGB side ladder 48/50)", "config": {"paths": {"results_dir": "C:\\Users\\abhir\\autoresearch-uci\\beijing_pm25\\autoresearch_results"}, "task_type": "regression", "primary_metric": "rmse", "backbone": "lightgbm", "backbone_config": {"seed": 0, "n_jobs": 4, "n_estimators": 2000, "num_leaves": 31, "learning_rate": 0.01, "feature_fraction": 1.0, "bagging_fraction": 0.6, "early_stopping_rounds": 50, "extra_trees": true, "linear_tree": true, "bagging_freq": 1}, "data": {"format": "csv", "path": "C:\\Users\\abhir\\autoresearch-uci\\beijing_pm25\\data\\features_horizon6.csv", "target_columns": ["pm25"], "feature_columns": ["DEWP", "TEMP", "PRES", "Iws", "Is", "Ir", "cbwd_NE", "cbwd_NW", "cbwd_SE", "cbwd_cv", "pm25_lag1", "pm25_lag2", "pm25_lag3", "pm25_lag4", "pm25_lag5", "pm25_lag6", "pm25_lag7", "pm25_lag8", "pm25_lag9", "pm25_lag10", "pm25_lag11", "pm25_lag12", "pm25_lag13", "pm25_lag14", "pm25_lag15", "pm25_lag16", "pm25_lag17", "pm25_lag18", "pm25_lag19", "pm25_lag20", "pm25_lag21", "pm25_lag22", "pm25_lag23", "pm25_lag24", "hour_sin", "hour_cos", "dow", "is_weekend", "pm25_delta1", "inversion_spread", "month_sin", "pres_delta", "dewp_delta", "cbwd_prev_NW"]}, "split": {"name": "calendar_year", "manifest_dir": "C:\\Users\\abhir\\autoresearch-uci\\beijing_pm25\\data"}, "composite": {"higher_is_better": false, "penalty_weight": 0.1, "below_threshold": -40.0}, "hardware": {"n_threads": 4, "cpu_affinity": [0, 2, 4, 6]}, "description": "Exp74 t+6 bagging_freq=1 on Exp72 extra_trees linear (LGB side ladder 48/50)", "seed": 0}, "composite": -57.60233599678543, "val_primary": 57.502335996785426, "test_primary": 54.58116033751693, "per_fold_test": [54.58116033751693], "per_fold_val": [57.502335996785426], "status": "DISCARD", "seconds_elapsed": 9.109293460845947, "timestamp": "2026-08-18T16:34:53", "secondary_metrics": {"mae": 35.25416383212836, "mape": 0.8758446543253737, "r2": 0.6558374998009785, "ic": 0.7958912770921969}, "per_fold_test_reports": [{"fold_id": 0, "regime": "calendar_2014_test", "task_type": "regression", "n": 7950, "rmse": 54.58116033751693, "mae": 35.25416383212836, "mape": 0.8758446543253737, "r2": 0.6558374998009785, "ic": 0.7958912770921969}], "composite_fingerprint": "a12fd381fe9bbefb"}
{"experiment_num": 75, "backbone": "lightgbm", "description": "Exp75 t+6 add rh_magnus Magnus RH on Exp72 extra_trees linear (LGB side ladder 49/50)", "config": {"paths": {"results_dir": "C:\\Users\\abhir\\autoresearch-uci\\beijing_pm25\\autoresearch_results"}, "task_type": "regression", "primary_metric": "rmse", "backbone": "lightgbm", "backbone_config": {"seed": 0, "n_jobs": 4, "n_estimators": 2000, "num_leaves": 31, "learning_rate": 0.01, "feature_fraction": 1.0, "bagging_fraction": 0.6, "early_stopping_rounds": 50, "extra_trees": true, "linear_tree": true}, "data": {"format": "csv", "path": "C:\\Users\\abhir\\autoresearch-uci\\beijing_pm25\\data\\features_horizon6.csv", "target_columns": ["pm25"], "feature_columns": ["DEWP", "TEMP", "PRES", "Iws", "Is", "Ir", "cbwd_NE", "cbwd_NW", "cbwd_SE", "cbwd_cv", "pm25_lag1", "pm25_lag2", "pm25_lag3", "pm25_lag4", "pm25_lag5", "pm25_lag6", "pm25_lag7", "pm25_lag8", "pm25_lag9", "pm25_lag10", "pm25_lag11", "pm25_lag12", "pm25_lag13", "pm25_lag14", "pm25_lag15", "pm25_lag16", "pm25_lag17", "pm25_lag18", "pm25_lag19", "pm25_lag20", "pm25_lag21", "pm25_lag22", "pm25_lag23", "pm25_lag24", "hour_sin", "hour_cos", "dow", "is_weekend", "pm25_delta1", "inversion_spread", "month_sin", "pres_delta", "dewp_delta", "cbwd_prev_NW", "rh_magnus"]}, "split": {"name": "calendar_year", "manifest_dir": "C:\\Users\\abhir\\autoresearch-uci\\beijing_pm25\\data"}, "composite": {"higher_is_better": false, "penalty_weight": 0.1, "below_threshold": -40.0}, "hardware": {"n_threads": 4, "cpu_affinity": [0, 2, 4, 6]}, "description": "Exp75 t+6 add rh_magnus Magnus RH on Exp72 extra_trees linear (LGB side ladder 49/50)", "seed": 0}, "composite": -57.291273316032076, "val_primary": 57.191273316032074, "test_primary": 54.72969148966259, "per_fold_test": [54.72969148966259], "per_fold_val": [57.191273316032074], "status": "DISCARD", "seconds_elapsed": 15.168216228485107, "timestamp": "2026-08-18T17:11:36", "secondary_metrics": {"mae": 35.10834144196666, "mape": 0.8702358401733579, "r2": 0.6539618193658884, "ic": 0.7969784092192004}, "per_fold_test_reports": [{"fold_id": 0, "regime": "calendar_2014_test", "task_type": "regression", "n": 7950, "rmse": 54.72969148966259, "mae": 35.10834144196666, "mape": 0.8702358401733579, "r2": 0.6539618193658884, "ic": 0.7969784092192004}], "composite_fingerprint": "a12fd381fe9bbefb"}
{"experiment_num": 76, "backbone": "lightgbm", "description": "Exp76 t+6 linear_lambda=1 on Exp75 extra_trees linear rh_magnus (LGB side ladder 50/50)", "config": {"paths": {"results_dir": "C:\\Users\\abhir\\autoresearch-uci\\beijing_pm25\\autoresearch_results"}, "task_type": "regression", "primary_metric": "rmse", "backbone": "lightgbm", "backbone_config": {"seed": 0, "n_jobs": 4, "n_estimators": 2000, "num_leaves": 31, "learning_rate": 0.01, "feature_fraction": 1.0, "bagging_fraction": 0.6, "early_stopping_rounds": 50, "extra_trees": true, "linear_tree": true, "linear_lambda": 1}, "data": {"format": "csv", "path": "C:\\Users\\abhir\\autoresearch-uci\\beijing_pm25\\data\\features_horizon6.csv", "target_columns": ["pm25"], "feature_columns": ["DEWP", "TEMP", "PRES", "Iws", "Is", "Ir", "cbwd_NE", "cbwd_NW", "cbwd_SE", "cbwd_cv", "pm25_lag1", "pm25_lag2", "pm25_lag3", "pm25_lag4", "pm25_lag5", "pm25_lag6", "pm25_lag7", "pm25_lag8", "pm25_lag9", "pm25_lag10", "pm25_lag11", "pm25_lag12", "pm25_lag13", "pm25_lag14", "pm25_lag15", "pm25_lag16", "pm25_lag17", "pm25_lag18", "pm25_lag19", "pm25_lag20", "pm25_lag21", "pm25_lag22", "pm25_lag23", "pm25_lag24", "hour_sin", "hour_cos", "dow", "is_weekend", "pm25_delta1", "inversion_spread", "month_sin", "pres_delta", "dewp_delta", "cbwd_prev_NW", "rh_magnus"]}, "split": {"name": "calendar_year", "manifest_dir": "C:\\Users\\abhir\\autoresearch-uci\\beijing_pm25\\data"}, "composite": {"higher_is_better": false, "penalty_weight": 0.1, "below_threshold": -40.0}, "hardware": {"n_threads": 4, "cpu_affinity": [0, 2, 4, 6]}, "description": "Exp76 t+6 linear_lambda=1 on Exp75 extra_trees linear rh_magnus (LGB side ladder 50/50)", "seed": 0}, "composite": -57.26128069097798, "val_primary": 57.16128069097798, "test_primary": 54.312357669721564, "per_fold_test": [54.312357669721564], "per_fold_val": [57.16128069097798], "status": "DISCARD", "seconds_elapsed": 14.826656818389893, "timestamp": "2026-08-18T17:14:32", "secondary_metrics": {"mae": 35.13695531453787, "mape": 0.8713304061222384, "r2": 0.659219032748448, "ic": 0.7963327810580807}, "per_fold_test_reports": [{"fold_id": 0, "regime": "calendar_2014_test", "task_type": "regression", "n": 7950, "rmse": 54.312357669721564, "mae": 35.13695531453787, "mape": 0.8713304061222384, "r2": 0.659219032748448, "ic": 0.7963327810580807}], "composite_fingerprint": "a12fd381fe9bbefb"}
