{"experiment_num": 23, "backbone": "xgboost", "description": "Exp23 from champion: stack weather lags onto delta champion", "config": {"paths": {"results_dir": "C:\\Users\\abhir\\autoresearch-uci\\beijing_pm25\\autoresearch_results"}, "task_type": "regression", "primary_metric": "rmse", "backbone": "xgboost", "backbone_config": {"n_estimators": 1500, "max_depth": 4, "learning_rate": 0.01, "subsample": 0.6, "colsample_bytree": 0.8, "reg_lambda": 1.0, "early_stopping_rounds": 50, "seed": 0, "n_jobs": 4, "tree_method": "hist", "uncertainty_samples": 1}, "data": {"format": "csv", "path": "C:\\Users\\abhir\\autoresearch-uci\\beijing_pm25\\data\\features_full.csv", "target_columns": ["pm25"], "feature_columns": ["DEWP", "TEMP", "PRES", "Iws", "Is", "Ir", "cbwd_NE", "cbwd_NW", "cbwd_SE", "cbwd_cv", "pm25_lag1", "pm25_lag2", "pm25_lag3", "pm25_lag4", "pm25_lag5", "pm25_lag6", "pm25_lag7", "pm25_lag8", "pm25_lag9", "pm25_lag10", "pm25_lag11", "pm25_lag12", "pm25_lag13", "pm25_lag14", "pm25_lag15", "pm25_lag16", "pm25_lag17", "pm25_lag18", "pm25_lag19", "pm25_lag20", "pm25_lag21", "pm25_lag22", "pm25_lag23", "pm25_lag24", "hour_sin", "hour_cos", "dow", "is_weekend", "pm25_delta1", "Iws_lag1", "TEMP_lag1", "DEWP_lag1"]}, "split": {"name": "calendar_year", "manifest_dir": "C:\\Users\\abhir\\autoresearch-uci\\beijing_pm25\\data"}, "composite": {"higher_is_better": false, "penalty_weight": 0.1, "below_threshold": -40.0}, "hardware": {"n_threads": 4, "cpu_affinity": [0, 2, 4, 6]}, "description": "Exp23 from champion: stack weather lags onto delta champion", "seed": 0}, "composite": -22.727226653783458, "val_primary": 22.727226653783458, "test_primary": 21.252299471071918, "per_fold_test": [21.252299471071918], "per_fold_val": [22.727226653783458], "status": "DISCARD", "seconds_elapsed": 5.162601709365845, "timestamp": "2026-08-18T01:19:00", "secondary_metrics": {"mae": 11.633011433223508, "mape": 0.2257937977805763, "r2": 0.9478217061862995, "ic": 0.9722542483047452}, "per_fold_test_reports": [{"fold_id": 0, "regime": "calendar_2014_test", "task_type": "regression", "n": 7950, "rmse": 21.252299471071918, "mae": 11.633011433223508, "mape": 0.2257937977805763, "r2": 0.9478217061862995, "ic": 0.9722542483047452}], "composite_fingerprint": "a12fd381fe9bbefb"}
{"experiment_num": 24, "backbone": "xgboost", "description": "Exp24 from champion: stack raw hour onto delta champion", "config": {"paths": {"results_dir": "C:\\Users\\abhir\\autoresearch-uci\\beijing_pm25\\autoresearch_results"}, "task_type": "regression", "primary_metric": "rmse", "backbone": "xgboost", "backbone_config": {"n_estimators": 1500, "max_depth": 4, "learning_rate": 0.01, "subsample": 0.6, "colsample_bytree": 0.8, "reg_lambda": 1.0, "early_stopping_rounds": 50, "seed": 0, "n_jobs": 4, "tree_method": "hist", "uncertainty_samples": 1}, "data": {"format": "csv", "path": "C:\\Users\\abhir\\autoresearch-uci\\beijing_pm25\\data\\features_full.csv", "target_columns": ["pm25"], "feature_columns": ["DEWP", "TEMP", "PRES", "Iws", "Is", "Ir", "cbwd_NE", "cbwd_NW", "cbwd_SE", "cbwd_cv", "pm25_lag1", "pm25_lag2", "pm25_lag3", "pm25_lag4", "pm25_lag5", "pm25_lag6", "pm25_lag7", "pm25_lag8", "pm25_lag9", "pm25_lag10", "pm25_lag11", "pm25_lag12", "pm25_lag13", "pm25_lag14", "pm25_lag15", "pm25_lag16", "pm25_lag17", "pm25_lag18", "pm25_lag19", "pm25_lag20", "pm25_lag21", "pm25_lag22", "pm25_lag23", "pm25_lag24", "hour_sin", "hour_cos", "dow", "is_weekend", "pm25_delta1", "hour"]}, "split": {"name": "calendar_year", "manifest_dir": "C:\\Users\\abhir\\autoresearch-uci\\beijing_pm25\\data"}, "composite": {"higher_is_better": false, "penalty_weight": 0.1, "below_threshold": -40.0}, "hardware": {"n_threads": 4, "cpu_affinity": [0, 2, 4, 6]}, "description": "Exp24 from champion: stack raw hour onto delta champion", "seed": 0}, "composite": -22.651139693205792, "val_primary": 22.651139693205792, "test_primary": 21.34800563444184, "per_fold_test": [21.34800563444184], "per_fold_val": [22.651139693205792], "status": "DISCARD", "seconds_elapsed": 9.118719816207886, "timestamp": "2026-08-18T01:19:15", "secondary_metrics": {"mae": 11.591323996729821, "mape": 0.2197213082049117, "r2": 0.9473506956348418, "ic": 0.9723009826402411}, "per_fold_test_reports": [{"fold_id": 0, "regime": "calendar_2014_test", "task_type": "regression", "n": 7950, "rmse": 21.34800563444184, "mae": 11.591323996729821, "mape": 0.2197213082049117, "r2": 0.9473506956348418, "ic": 0.9723009826402411}], "composite_fingerprint": "a12fd381fe9bbefb"}
{"experiment_num": 25, "backbone": "lightgbm", "description": "Exp25 from champion: lightgbm on delta champion features", "config": {"paths": {"results_dir": "C:\\Users\\abhir\\autoresearch-uci\\beijing_pm25\\autoresearch_results"}, "task_type": "regression", "primary_metric": "rmse", "backbone": "lightgbm", "backbone_config": {"n_estimators": 2000, "num_leaves": 31, "learning_rate": 0.01, "feature_fraction": 0.8, "bagging_fraction": 0.6, "early_stopping_rounds": 50, "seed": 0, "n_jobs": 4}, "data": {"format": "csv", "path": "C:\\Users\\abhir\\autoresearch-uci\\beijing_pm25\\data\\features_full.csv", "target_columns": ["pm25"], "feature_columns": ["DEWP", "TEMP", "PRES", "Iws", "Is", "Ir", "cbwd_NE", "cbwd_NW", "cbwd_SE", "cbwd_cv", "pm25_lag1", "pm25_lag2", "pm25_lag3", "pm25_lag4", "pm25_lag5", "pm25_lag6", "pm25_lag7", "pm25_lag8", "pm25_lag9", "pm25_lag10", "pm25_lag11", "pm25_lag12", "pm25_lag13", "pm25_lag14", "pm25_lag15", "pm25_lag16", "pm25_lag17", "pm25_lag18", "pm25_lag19", "pm25_lag20", "pm25_lag21", "pm25_lag22", "pm25_lag23", "pm25_lag24", "hour_sin", "hour_cos", "dow", "is_weekend", "pm25_delta1"]}, "split": {"name": "calendar_year", "manifest_dir": "C:\\Users\\abhir\\autoresearch-uci\\beijing_pm25\\data"}, "composite": {"higher_is_better": false, "penalty_weight": 0.1, "below_threshold": -40.0}, "hardware": {"n_threads": 4, "cpu_affinity": [0, 2, 4, 6]}, "description": "Exp25 from champion: lightgbm on delta champion features", "seed": 0}, "composite": -22.711018618862706, "val_primary": 22.711018618862706, "test_primary": 20.904819903458257, "per_fold_test": [20.904819903458257], "per_fold_val": [22.711018618862706], "status": "DISCARD", "seconds_elapsed": 14.037916660308838, "timestamp": "2026-08-18T01:19:36", "secondary_metrics": {"mae": 11.510388422704715, "mape": 0.2158555063470915, "r2": 0.9495140095586192, "ic": 0.9726117022384383}, "per_fold_test_reports": [{"fold_id": 0, "regime": "calendar_2014_test", "task_type": "regression", "n": 7950, "rmse": 20.904819903458257, "mae": 11.510388422704715, "mape": 0.2158555063470915, "r2": 0.9495140095586192, "ic": 0.9726117022384383}], "composite_fingerprint": "a12fd381fe9bbefb"}
{"experiment_num": 26, "backbone": "catboost", "description": "Exp26 from champion: catboost on delta champion features", "config": {"paths": {"results_dir": "C:\\Users\\abhir\\autoresearch-uci\\beijing_pm25\\autoresearch_results"}, "task_type": "regression", "primary_metric": "rmse", "backbone": "catboost", "backbone_config": {"iterations": 2000, "depth": 4, "learning_rate": 0.01, "l2_leaf_reg": 3.0, "early_stopping_rounds": 100, "seed": 0}, "data": {"format": "csv", "path": "C:\\Users\\abhir\\autoresearch-uci\\beijing_pm25\\data\\features_full.csv", "target_columns": ["pm25"], "feature_columns": ["DEWP", "TEMP", "PRES", "Iws", "Is", "Ir", "cbwd_NE", "cbwd_NW", "cbwd_SE", "cbwd_cv", "pm25_lag1", "pm25_lag2", "pm25_lag3", "pm25_lag4", "pm25_lag5", "pm25_lag6", "pm25_lag7", "pm25_lag8", "pm25_lag9", "pm25_lag10", "pm25_lag11", "pm25_lag12", "pm25_lag13", "pm25_lag14", "pm25_lag15", "pm25_lag16", "pm25_lag17", "pm25_lag18", "pm25_lag19", "pm25_lag20", "pm25_lag21", "pm25_lag22", "pm25_lag23", "pm25_lag24", "hour_sin", "hour_cos", "dow", "is_weekend", "pm25_delta1"]}, "split": {"name": "calendar_year", "manifest_dir": "C:\\Users\\abhir\\autoresearch-uci\\beijing_pm25\\data"}, "composite": {"higher_is_better": false, "penalty_weight": 0.1, "below_threshold": -40.0}, "hardware": {"n_threads": 4, "cpu_affinity": [0, 2, 4, 6]}, "description": "Exp26 from champion: catboost on delta champion features", "seed": 0}, "composite": -22.96916561452439, "val_primary": 22.96916561452439, "test_primary": 21.247536812554426, "per_fold_test": [21.247536812554426], "per_fold_val": [22.96916561452439], "status": "DISCARD", "seconds_elapsed": 10.248512744903564, "timestamp": "2026-08-18T01:19:53", "secondary_metrics": {"mae": 11.58945559428731, "mape": 0.2316627664423202, "r2": 0.9478450899665288, "ic": 0.9713694038800346}, "per_fold_test_reports": [{"fold_id": 0, "regime": "calendar_2014_test", "task_type": "regression", "n": 7950, "rmse": 21.247536812554426, "mae": 11.58945559428731, "mape": 0.2316627664423202, "r2": 0.9478450899665288, "ic": 0.9713694038800346}], "composite_fingerprint": "a12fd381fe9bbefb"}
{"experiment_num": 27, "backbone": "xgboost", "description": "Exp27 from champion: subsample 0.5 on delta champion", "config": {"paths": {"results_dir": "C:\\Users\\abhir\\autoresearch-uci\\beijing_pm25\\autoresearch_results"}, "task_type": "regression", "primary_metric": "rmse", "backbone": "xgboost", "backbone_config": {"n_estimators": 1500, "max_depth": 4, "learning_rate": 0.01, "subsample": 0.5, "colsample_bytree": 0.8, "reg_lambda": 1.0, "early_stopping_rounds": 50, "seed": 0, "n_jobs": 4, "tree_method": "hist", "uncertainty_samples": 1}, "data": {"format": "csv", "path": "C:\\Users\\abhir\\autoresearch-uci\\beijing_pm25\\data\\features_full.csv", "target_columns": ["pm25"], "feature_columns": ["DEWP", "TEMP", "PRES", "Iws", "Is", "Ir", "cbwd_NE", "cbwd_NW", "cbwd_SE", "cbwd_cv", "pm25_lag1", "pm25_lag2", "pm25_lag3", "pm25_lag4", "pm25_lag5", "pm25_lag6", "pm25_lag7", "pm25_lag8", "pm25_lag9", "pm25_lag10", "pm25_lag11", "pm25_lag12", "pm25_lag13", "pm25_lag14", "pm25_lag15", "pm25_lag16", "pm25_lag17", "pm25_lag18", "pm25_lag19", "pm25_lag20", "pm25_lag21", "pm25_lag22", "pm25_lag23", "pm25_lag24", "hour_sin", "hour_cos", "dow", "is_weekend", "pm25_delta1", "inversion_spread"]}, "split": {"name": "calendar_year", "manifest_dir": "C:\\Users\\abhir\\autoresearch-uci\\beijing_pm25\\data"}, "composite": {"higher_is_better": false, "penalty_weight": 0.1, "below_threshold": -40.0}, "hardware": {"n_threads": 4, "cpu_affinity": [0, 2, 4, 6]}, "description": "Exp27 from champion: subsample 0.5 on delta champion", "seed": 0}, "composite": -22.487905919796454, "val_primary": 22.487905919796454, "test_primary": 21.080508675831314, "per_fold_test": [21.080508675831314], "per_fold_val": [22.487905919796454], "status": "DISCARD", "seconds_elapsed": 5.055413722991943, "timestamp": "2026-08-18T01:20:02", "secondary_metrics": {"mae": 11.555855565640911, "mape": 0.2204817676054072, "r2": 0.94866185262023, "ic": 0.9723677800467626}, "per_fold_test_reports": [{"fold_id": 0, "regime": "calendar_2014_test", "task_type": "regression", "n": 7950, "rmse": 21.080508675831314, "mae": 11.555855565640911, "mape": 0.2204817676054072, "r2": 0.94866185262023, "ic": 0.9723677800467626}], "composite_fingerprint": "a12fd381fe9bbefb"}
{"experiment_num": 28, "backbone": "xgboost", "description": "Exp28 from champion: learning_rate 0.005 on delta champion", "config": {"paths": {"results_dir": "C:\\Users\\abhir\\autoresearch-uci\\beijing_pm25\\autoresearch_results"}, "task_type": "regression", "primary_metric": "rmse", "backbone": "xgboost", "backbone_config": {"n_estimators": 1500, "max_depth": 4, "learning_rate": 0.005, "subsample": 0.6, "colsample_bytree": 0.8, "reg_lambda": 1.0, "early_stopping_rounds": 50, "seed": 0, "n_jobs": 4, "tree_method": "hist", "uncertainty_samples": 1}, "data": {"format": "csv", "path": "C:\\Users\\abhir\\autoresearch-uci\\beijing_pm25\\data\\features_full.csv", "target_columns": ["pm25"], "feature_columns": ["DEWP", "TEMP", "PRES", "Iws", "Is", "Ir", "cbwd_NE", "cbwd_NW", "cbwd_SE", "cbwd_cv", "pm25_lag1", "pm25_lag2", "pm25_lag3", "pm25_lag4", "pm25_lag5", "pm25_lag6", "pm25_lag7", "pm25_lag8", "pm25_lag9", "pm25_lag10", "pm25_lag11", "pm25_lag12", "pm25_lag13", "pm25_lag14", "pm25_lag15", "pm25_lag16", "pm25_lag17", "pm25_lag18", "pm25_lag19", "pm25_lag20", "pm25_lag21", "pm25_lag22", "pm25_lag23", "pm25_lag24", "hour_sin", "hour_cos", "dow", "is_weekend", "pm25_delta1", "inversion_spread"]}, "split": {"name": "calendar_year", "manifest_dir": "C:\\Users\\abhir\\autoresearch-uci\\beijing_pm25\\data"}, "composite": {"higher_is_better": false, "penalty_weight": 0.1, "below_threshold": -40.0}, "hardware": {"n_threads": 4, "cpu_affinity": [0, 2, 4, 6]}, "description": "Exp28 from champion: learning_rate 0.005 on delta champion", "seed": 0}, "composite": -22.56331559320229, "val_primary": 22.56331559320229, "test_primary": 21.18153400410633, "per_fold_test": [21.18153400410633], "per_fold_val": [22.56331559320229], "status": "DISCARD", "seconds_elapsed": 7.8572938442230225, "timestamp": "2026-08-18T01:20:14", "secondary_metrics": {"mae": 11.58986822488173, "mape": 0.22354391474071025, "r2": 0.9481686120689454, "ic": 0.972413098675161}, "per_fold_test_reports": [{"fold_id": 0, "regime": "calendar_2014_test", "task_type": "regression", "n": 7950, "rmse": 21.18153400410633, "mae": 11.58986822488173, "mape": 0.22354391474071025, "r2": 0.9481686120689454, "ic": 0.972413098675161}], "composite_fingerprint": "a12fd381fe9bbefb"}
{"experiment_num": 29, "backbone": "lightgbm", "description": "Exp29 LightGBM on Exp22 inversion+delta features", "config": {"paths": {"results_dir": "C:\\Users\\abhir\\autoresearch-uci\\beijing_pm25\\autoresearch_results"}, "task_type": "regression", "primary_metric": "rmse", "backbone": "lightgbm", "backbone_config": {"seed": 0, "n_jobs": 4, "n_estimators": 2000, "num_leaves": 31, "learning_rate": 0.01, "feature_fraction": 0.8, "bagging_fraction": 0.6, "early_stopping_rounds": 50}, "data": {"format": "csv", "path": "C:\\Users\\abhir\\autoresearch-uci\\beijing_pm25\\data\\features_full.csv", "target_columns": ["pm25"], "feature_columns": ["DEWP", "TEMP", "PRES", "Iws", "Is", "Ir", "cbwd_NE", "cbwd_NW", "cbwd_SE", "cbwd_cv", "pm25_lag1", "pm25_lag2", "pm25_lag3", "pm25_lag4", "pm25_lag5", "pm25_lag6", "pm25_lag7", "pm25_lag8", "pm25_lag9", "pm25_lag10", "pm25_lag11", "pm25_lag12", "pm25_lag13", "pm25_lag14", "pm25_lag15", "pm25_lag16", "pm25_lag17", "pm25_lag18", "pm25_lag19", "pm25_lag20", "pm25_lag21", "pm25_lag22", "pm25_lag23", "pm25_lag24", "hour_sin", "hour_cos", "dow", "is_weekend", "pm25_delta1", "inversion_spread"]}, "split": {"name": "calendar_year", "manifest_dir": "C:\\Users\\abhir\\autoresearch-uci\\beijing_pm25\\data"}, "composite": {"higher_is_better": false, "penalty_weight": 0.1, "below_threshold": -40.0}, "hardware": {"n_threads": 4, "cpu_affinity": [0, 2, 4, 6]}, "description": "Exp29 LightGBM on Exp22 inversion+delta features", "seed": 0}, "composite": -22.428124918573495, "val_primary": 22.428124918573495, "test_primary": 20.783761143148627, "per_fold_test": [20.783761143148627], "per_fold_val": [22.428124918573495], "status": "KEEP", "seconds_elapsed": 16.14075779914856, "timestamp": "2026-08-18T01:30:53", "secondary_metrics": {"mae": 11.47847352336066, "mape": 0.21218501876093726, "r2": 0.950097040167215, "ic": 0.972902684116968}, "per_fold_test_reports": [{"fold_id": 0, "regime": "calendar_2014_test", "task_type": "regression", "n": 7950, "rmse": 20.783761143148627, "mae": 11.47847352336066, "mape": 0.21218501876093726, "r2": 0.950097040167215, "ic": 0.972902684116968}], "composite_fingerprint": "a12fd381fe9bbefb"}
{"experiment_num": 30, "backbone": "lightgbm", "description": "Exp30 LightGBM num_leaves 31 to 63 on Exp29 champion", "config": {"paths": {"results_dir": "C:\\Users\\abhir\\autoresearch-uci\\beijing_pm25\\autoresearch_results"}, "task_type": "regression", "primary_metric": "rmse", "backbone": "lightgbm", "backbone_config": {"seed": 0, "n_jobs": 4, "n_estimators": 2000, "num_leaves": 63, "learning_rate": 0.01, "feature_fraction": 0.8, "bagging_fraction": 0.6, "early_stopping_rounds": 50}, "data": {"format": "csv", "path": "C:\\Users\\abhir\\autoresearch-uci\\beijing_pm25\\data\\features_full.csv", "target_columns": ["pm25"], "feature_columns": ["DEWP", "TEMP", "PRES", "Iws", "Is", "Ir", "cbwd_NE", "cbwd_NW", "cbwd_SE", "cbwd_cv", "pm25_lag1", "pm25_lag2", "pm25_lag3", "pm25_lag4", "pm25_lag5", "pm25_lag6", "pm25_lag7", "pm25_lag8", "pm25_lag9", "pm25_lag10", "pm25_lag11", "pm25_lag12", "pm25_lag13", "pm25_lag14", "pm25_lag15", "pm25_lag16", "pm25_lag17", "pm25_lag18", "pm25_lag19", "pm25_lag20", "pm25_lag21", "pm25_lag22", "pm25_lag23", "pm25_lag24", "hour_sin", "hour_cos", "dow", "is_weekend", "pm25_delta1", "inversion_spread"]}, "split": {"name": "calendar_year", "manifest_dir": "C:\\Users\\abhir\\autoresearch-uci\\beijing_pm25\\data"}, "composite": {"higher_is_better": false, "penalty_weight": 0.1, "below_threshold": -40.0}, "hardware": {"n_threads": 4, "cpu_affinity": [0, 2, 4, 6]}, "description": "Exp30 LightGBM num_leaves 31 to 63 on Exp29 champion", "seed": 0}, "composite": -22.39674091100119, "val_primary": 22.39674091100119, "test_primary": 20.94459608844015, "per_fold_test": [20.94459608844015], "per_fold_val": [22.39674091100119], "status": "KEEP", "seconds_elapsed": 21.42032551765442, "timestamp": "2026-08-18T01:32:21", "secondary_metrics": {"mae": 11.550451664759013, "mape": 0.21029296174561984, "r2": 0.9493217045709457, "ic": 0.9729213093656968}, "per_fold_test_reports": [{"fold_id": 0, "regime": "calendar_2014_test", "task_type": "regression", "n": 7950, "rmse": 20.94459608844015, "mae": 11.550451664759013, "mape": 0.21029296174561984, "r2": 0.9493217045709457, "ic": 0.9729213093656968}], "composite_fingerprint": "a12fd381fe9bbefb"}
{"experiment_num": 31, "backbone": "lightgbm", "description": "Exp31 add is_heating Nov-Feb flag to Exp30 LightGBM", "config": {"paths": {"results_dir": "C:\\Users\\abhir\\autoresearch-uci\\beijing_pm25\\autoresearch_results"}, "task_type": "regression", "primary_metric": "rmse", "backbone": "lightgbm", "backbone_config": {"seed": 0, "n_jobs": 4, "n_estimators": 2000, "num_leaves": 63, "learning_rate": 0.01, "feature_fraction": 0.8, "bagging_fraction": 0.6, "early_stopping_rounds": 50}, "data": {"format": "csv", "path": "C:\\Users\\abhir\\autoresearch-uci\\beijing_pm25\\data\\features_full.csv", "target_columns": ["pm25"], "feature_columns": ["DEWP", "TEMP", "PRES", "Iws", "Is", "Ir", "cbwd_NE", "cbwd_NW", "cbwd_SE", "cbwd_cv", "pm25_lag1", "pm25_lag2", "pm25_lag3", "pm25_lag4", "pm25_lag5", "pm25_lag6", "pm25_lag7", "pm25_lag8", "pm25_lag9", "pm25_lag10", "pm25_lag11", "pm25_lag12", "pm25_lag13", "pm25_lag14", "pm25_lag15", "pm25_lag16", "pm25_lag17", "pm25_lag18", "pm25_lag19", "pm25_lag20", "pm25_lag21", "pm25_lag22", "pm25_lag23", "pm25_lag24", "hour_sin", "hour_cos", "dow", "is_weekend", "pm25_delta1", "inversion_spread", "is_heating"]}, "split": {"name": "calendar_year", "manifest_dir": "C:\\Users\\abhir\\autoresearch-uci\\beijing_pm25\\data"}, "composite": {"higher_is_better": false, "penalty_weight": 0.1, "below_threshold": -40.0}, "hardware": {"n_threads": 4, "cpu_affinity": [0, 2, 4, 6]}, "description": "Exp31 add is_heating Nov-Feb flag to Exp30 LightGBM", "seed": 0}, "composite": -22.417261822654925, "val_primary": 22.417261822654925, "test_primary": 20.990855965483245, "per_fold_test": [20.990855965483245], "per_fold_val": [22.417261822654925], "status": "DISCARD", "seconds_elapsed": 19.318954706192017, "timestamp": "2026-08-18T01:33:16", "secondary_metrics": {"mae": 11.590553912525058, "mape": 0.21384469937387424, "r2": 0.949097593235785, "ic": 0.9728031334079857}, "per_fold_test_reports": [{"fold_id": 0, "regime": "calendar_2014_test", "task_type": "regression", "n": 7950, "rmse": 20.990855965483245, "mae": 11.590553912525058, "mape": 0.21384469937387424, "r2": 0.949097593235785, "ic": 0.9728031334079857}], "composite_fingerprint": "a12fd381fe9bbefb"}
