{"experiment_num": 161, "backbone": "mlp", "description": "Exp161 MLP drop inversion_spread keep TEMP DEWP on Exp136 recipe (MLP cycle 37/50)", "config": {"paths": {"results_dir": "C:\\Users\\abhir\\autoresearch-uci\\beijing_pm25\\autoresearch_results"}, "task_type": "regression", "primary_metric": "rmse", "backbone": "mlp", "backbone_config": {"seed": 0, "n_jobs": 4, "weight_decay": 0.0001, "batch_size": 16}, "data": {"format": "csv", "path": "C:\\Users\\abhir\\autoresearch-uci\\beijing_pm25\\data\\features_full.csv", "target_columns": ["pm25"], "feature_columns": ["DEWP", "TEMP", "PRES", "Iws", "Is", "Ir", "cbwd_NE", "cbwd_NW", "cbwd_SE", "cbwd_cv", "pm25_lag1", "pm25_lag2", "pm25_lag3", "pm25_lag4", "pm25_lag5", "pm25_lag6", "pm25_lag7", "pm25_lag8", "pm25_lag9", "pm25_lag10", "pm25_lag11", "pm25_lag12", "pm25_lag13", "pm25_lag14", "pm25_lag15", "pm25_lag16", "pm25_lag17", "pm25_lag18", "pm25_lag19", "pm25_lag20", "pm25_lag21", "pm25_lag22", "pm25_lag23", "pm25_lag24", "hour_sin", "hour_cos", "dow", "is_weekend", "pm25_delta1", "rh_magnus", "dewp_delta", "is_heating", "log_iws", "month_sin", "pm25_accel", "vent_index"]}, "split": {"name": "calendar_year", "manifest_dir": "C:\\Users\\abhir\\autoresearch-uci\\beijing_pm25\\data"}, "composite": {"higher_is_better": false, "penalty_weight": 0.1, "below_threshold": -40.0}, "hardware": {"n_threads": 4, "cpu_affinity": [0, 2, 4, 6]}, "description": "Exp161 MLP drop inversion_spread keep TEMP DEWP on Exp136 recipe (MLP cycle 37/50)", "seed": 0}, "composite": -22.486653257783207, "val_primary": 22.486653257783207, "test_primary": 20.45491194503027, "per_fold_test": [20.45491194503027], "per_fold_val": [22.486653257783207], "status": "DISCARD", "seconds_elapsed": 165.08128428459167, "timestamp": "2026-08-20T08:11:27", "secondary_metrics": {"mae": 11.346560325022763, "mape": 0.20171610951832603, "r2": 0.9516637172472203, "ic": 0.9730917400998024}, "per_fold_test_reports": [{"fold_id": 0, "regime": "calendar_2014_test", "task_type": "regression", "n": 7950, "rmse": 20.45491194503027, "mae": 11.346560325022763, "mape": 0.20171610951832603, "r2": 0.9516637172472203, "ic": 0.9730917400998024}], "composite_fingerprint": "a12fd381fe9bbefb"}
{"experiment_num": 162, "backbone": "mlp", "description": "Exp162 MLP drop is_heating keep month_sin on Exp136 recipe (MLP cycle 38/50)", "config": {"paths": {"results_dir": "C:\\Users\\abhir\\autoresearch-uci\\beijing_pm25\\autoresearch_results"}, "task_type": "regression", "primary_metric": "rmse", "backbone": "mlp", "backbone_config": {"seed": 0, "n_jobs": 4, "weight_decay": 0.0001, "batch_size": 16}, "data": {"format": "csv", "path": "C:\\Users\\abhir\\autoresearch-uci\\beijing_pm25\\data\\features_full.csv", "target_columns": ["pm25"], "feature_columns": ["DEWP", "TEMP", "PRES", "Iws", "Is", "Ir", "cbwd_NE", "cbwd_NW", "cbwd_SE", "cbwd_cv", "pm25_lag1", "pm25_lag2", "pm25_lag3", "pm25_lag4", "pm25_lag5", "pm25_lag6", "pm25_lag7", "pm25_lag8", "pm25_lag9", "pm25_lag10", "pm25_lag11", "pm25_lag12", "pm25_lag13", "pm25_lag14", "pm25_lag15", "pm25_lag16", "pm25_lag17", "pm25_lag18", "pm25_lag19", "pm25_lag20", "pm25_lag21", "pm25_lag22", "pm25_lag23", "pm25_lag24", "hour_sin", "hour_cos", "dow", "is_weekend", "pm25_delta1", "inversion_spread", "rh_magnus", "dewp_delta", "log_iws", "month_sin", "pm25_accel", "vent_index"]}, "split": {"name": "calendar_year", "manifest_dir": "C:\\Users\\abhir\\autoresearch-uci\\beijing_pm25\\data"}, "composite": {"higher_is_better": false, "penalty_weight": 0.1, "below_threshold": -40.0}, "hardware": {"n_threads": 4, "cpu_affinity": [0, 2, 4, 6]}, "description": "Exp162 MLP drop is_heating keep month_sin on Exp136 recipe (MLP cycle 38/50)", "seed": 0}, "composite": -22.42551665511007, "val_primary": 22.42551665511007, "test_primary": 20.33324512290535, "per_fold_test": [20.33324512290535], "per_fold_val": [22.42551665511007], "status": "DISCARD", "seconds_elapsed": 114.8371434211731, "timestamp": "2026-08-20T08:40:55", "secondary_metrics": {"mae": 11.263812996006612, "mape": 0.19744155099912208, "r2": 0.9522370203174308, "ic": 0.9734154384778538}, "per_fold_test_reports": [{"fold_id": 0, "regime": "calendar_2014_test", "task_type": "regression", "n": 7950, "rmse": 20.33324512290535, "mae": 11.263812996006612, "mape": 0.19744155099912208, "r2": 0.9522370203174308, "ic": 0.9734154384778538}], "composite_fingerprint": "a12fd381fe9bbefb"}
{"experiment_num": 163, "backbone": "mlp", "description": "Exp163 MLP drop cbwd_cv keep directed winds on Exp136 recipe (MLP cycle 39/50)", "config": {"paths": {"results_dir": "C:\\Users\\abhir\\autoresearch-uci\\beijing_pm25\\autoresearch_results"}, "task_type": "regression", "primary_metric": "rmse", "backbone": "mlp", "backbone_config": {"seed": 0, "n_jobs": 4, "weight_decay": 0.0001, "batch_size": 16}, "data": {"format": "csv", "path": "C:\\Users\\abhir\\autoresearch-uci\\beijing_pm25\\data\\features_full.csv", "target_columns": ["pm25"], "feature_columns": ["DEWP", "TEMP", "PRES", "Iws", "Is", "Ir", "cbwd_NE", "cbwd_NW", "cbwd_SE", "pm25_lag1", "pm25_lag2", "pm25_lag3", "pm25_lag4", "pm25_lag5", "pm25_lag6", "pm25_lag7", "pm25_lag8", "pm25_lag9", "pm25_lag10", "pm25_lag11", "pm25_lag12", "pm25_lag13", "pm25_lag14", "pm25_lag15", "pm25_lag16", "pm25_lag17", "pm25_lag18", "pm25_lag19", "pm25_lag20", "pm25_lag21", "pm25_lag22", "pm25_lag23", "pm25_lag24", "hour_sin", "hour_cos", "dow", "is_weekend", "pm25_delta1", "inversion_spread", "rh_magnus", "dewp_delta", "is_heating", "log_iws", "month_sin", "pm25_accel", "vent_index"]}, "split": {"name": "calendar_year", "manifest_dir": "C:\\Users\\abhir\\autoresearch-uci\\beijing_pm25\\data"}, "composite": {"higher_is_better": false, "penalty_weight": 0.1, "below_threshold": -40.0}, "hardware": {"n_threads": 4, "cpu_affinity": [0, 2, 4, 6]}, "description": "Exp163 MLP drop cbwd_cv keep directed winds on Exp136 recipe (MLP cycle 39/50)", "seed": 0}, "composite": -22.349864807797253, "val_primary": 22.349864807797253, "test_primary": 20.55593741019174, "per_fold_test": [20.55593741019174], "per_fold_val": [22.349864807797253], "status": "DISCARD", "seconds_elapsed": 104.60050201416016, "timestamp": "2026-08-20T09:10:29", "secondary_metrics": {"mae": 11.314567389098354, "mape": 0.20154212382780595, "r2": 0.9511850787321238, "ic": 0.9731295583321552}, "per_fold_test_reports": [{"fold_id": 0, "regime": "calendar_2014_test", "task_type": "regression", "n": 7950, "rmse": 20.55593741019174, "mae": 11.314567389098354, "mape": 0.20154212382780595, "r2": 0.9511850787321238, "ic": 0.9731295583321552}], "composite_fingerprint": "a12fd381fe9bbefb"}
{"experiment_num": 164, "backbone": "mlp", "description": "Exp164 MLP hidden 512-256-128 on Exp136 recipe (MLP cycle 40/50)", "config": {"paths": {"results_dir": "C:\\Users\\abhir\\autoresearch-uci\\beijing_pm25\\autoresearch_results"}, "task_type": "regression", "primary_metric": "rmse", "backbone": "mlp", "backbone_config": {"seed": 0, "n_jobs": 4, "weight_decay": 0.0001, "batch_size": 16, "hidden": [512, 256, 128]}, "data": {"format": "csv", "path": "C:\\Users\\abhir\\autoresearch-uci\\beijing_pm25\\data\\features_full.csv", "target_columns": ["pm25"], "feature_columns": ["DEWP", "TEMP", "PRES", "Iws", "Is", "Ir", "cbwd_NE", "cbwd_NW", "cbwd_SE", "cbwd_cv", "pm25_lag1", "pm25_lag2", "pm25_lag3", "pm25_lag4", "pm25_lag5", "pm25_lag6", "pm25_lag7", "pm25_lag8", "pm25_lag9", "pm25_lag10", "pm25_lag11", "pm25_lag12", "pm25_lag13", "pm25_lag14", "pm25_lag15", "pm25_lag16", "pm25_lag17", "pm25_lag18", "pm25_lag19", "pm25_lag20", "pm25_lag21", "pm25_lag22", "pm25_lag23", "pm25_lag24", "hour_sin", "hour_cos", "dow", "is_weekend", "pm25_delta1", "inversion_spread", "rh_magnus", "dewp_delta", "is_heating", "log_iws", "month_sin", "pm25_accel", "vent_index"]}, "split": {"name": "calendar_year", "manifest_dir": "C:\\Users\\abhir\\autoresearch-uci\\beijing_pm25\\data"}, "composite": {"higher_is_better": false, "penalty_weight": 0.1, "below_threshold": -40.0}, "hardware": {"n_threads": 4, "cpu_affinity": [0, 2, 4, 6]}, "description": "Exp164 MLP hidden 512-256-128 on Exp136 recipe (MLP cycle 40/50)", "seed": 0}, "composite": -22.180006038932795, "val_primary": 22.180006038932795, "test_primary": 20.200980481819208, "per_fold_test": [20.200980481819208], "per_fold_val": [22.180006038932795], "status": "DISCARD", "seconds_elapsed": 161.74666285514832, "timestamp": "2026-08-20T09:41:29", "secondary_metrics": {"mae": 11.300194983272432, "mape": 0.2002939287930428, "r2": 0.9528563810362413, "ic": 0.9729537331134792}, "per_fold_test_reports": [{"fold_id": 0, "regime": "calendar_2014_test", "task_type": "regression", "n": 7950, "rmse": 20.200980481819208, "mae": 11.300194983272432, "mape": 0.2002939287930428, "r2": 0.9528563810362413, "ic": 0.9729537331134792}], "composite_fingerprint": "a12fd381fe9bbefb"}
{"experiment_num": 165, "backbone": "mlp", "description": "Exp165 MLP drop pm25_accel keep lags delta1 on Exp164 recipe (MLP cycle 41/50)", "config": {"paths": {"results_dir": "C:\\Users\\abhir\\autoresearch-uci\\beijing_pm25\\autoresearch_results"}, "task_type": "regression", "primary_metric": "rmse", "backbone": "mlp", "backbone_config": {"seed": 0, "n_jobs": 4, "weight_decay": 0.0001, "batch_size": 16, "hidden": [512, 256, 128]}, "data": {"format": "csv", "path": "C:\\Users\\abhir\\autoresearch-uci\\beijing_pm25\\data\\features_full.csv", "target_columns": ["pm25"], "feature_columns": ["DEWP", "TEMP", "PRES", "Iws", "Is", "Ir", "cbwd_NE", "cbwd_NW", "cbwd_SE", "cbwd_cv", "pm25_lag1", "pm25_lag2", "pm25_lag3", "pm25_lag4", "pm25_lag5", "pm25_lag6", "pm25_lag7", "pm25_lag8", "pm25_lag9", "pm25_lag10", "pm25_lag11", "pm25_lag12", "pm25_lag13", "pm25_lag14", "pm25_lag15", "pm25_lag16", "pm25_lag17", "pm25_lag18", "pm25_lag19", "pm25_lag20", "pm25_lag21", "pm25_lag22", "pm25_lag23", "pm25_lag24", "hour_sin", "hour_cos", "dow", "is_weekend", "pm25_delta1", "inversion_spread", "rh_magnus", "dewp_delta", "is_heating", "log_iws", "month_sin", "vent_index"]}, "split": {"name": "calendar_year", "manifest_dir": "C:\\Users\\abhir\\autoresearch-uci\\beijing_pm25\\data"}, "composite": {"higher_is_better": false, "penalty_weight": 0.1, "below_threshold": -40.0}, "hardware": {"n_threads": 4, "cpu_affinity": [0, 2, 4, 6]}, "description": "Exp165 MLP drop pm25_accel keep lags delta1 on Exp164 recipe (MLP cycle 41/50)", "seed": 0}, "composite": -22.448210686728615, "val_primary": 22.448210686728615, "test_primary": 20.46678213533779, "per_fold_test": [20.46678213533779], "per_fold_val": [22.448210686728615], "status": "DISCARD", "seconds_elapsed": 119.90578007698059, "timestamp": "2026-08-20T10:12:08", "secondary_metrics": {"mae": 11.389349563706595, "mape": 0.21116782029341968, "r2": 0.9516076009113331, "ic": 0.9727713702263935}, "per_fold_test_reports": [{"fold_id": 0, "regime": "calendar_2014_test", "task_type": "regression", "n": 7950, "rmse": 20.46678213533779, "mae": 11.389349563706595, "mape": 0.21116782029341968, "r2": 0.9516076009113331, "ic": 0.9727713702263935}], "composite_fingerprint": "a12fd381fe9bbefb"}
{"experiment_num": 166, "backbone": "mlp", "description": "Exp166 MLP LayerNorm on Exp164 recipe (MLP cycle 42/50)", "config": {"paths": {"results_dir": "C:\\Users\\abhir\\autoresearch-uci\\beijing_pm25\\autoresearch_results"}, "task_type": "regression", "primary_metric": "rmse", "backbone": "mlp", "backbone_config": {"seed": 0, "n_jobs": 4, "weight_decay": 0.0001, "batch_size": 16, "hidden": [512, 256, 128], "layer_norm": true}, "data": {"format": "csv", "path": "C:\\Users\\abhir\\autoresearch-uci\\beijing_pm25\\data\\features_full.csv", "target_columns": ["pm25"], "feature_columns": ["DEWP", "TEMP", "PRES", "Iws", "Is", "Ir", "cbwd_NE", "cbwd_NW", "cbwd_SE", "cbwd_cv", "pm25_lag1", "pm25_lag2", "pm25_lag3", "pm25_lag4", "pm25_lag5", "pm25_lag6", "pm25_lag7", "pm25_lag8", "pm25_lag9", "pm25_lag10", "pm25_lag11", "pm25_lag12", "pm25_lag13", "pm25_lag14", "pm25_lag15", "pm25_lag16", "pm25_lag17", "pm25_lag18", "pm25_lag19", "pm25_lag20", "pm25_lag21", "pm25_lag22", "pm25_lag23", "pm25_lag24", "hour_sin", "hour_cos", "dow", "is_weekend", "pm25_delta1", "inversion_spread", "rh_magnus", "dewp_delta", "is_heating", "log_iws", "month_sin", "pm25_accel", "vent_index"]}, "split": {"name": "calendar_year", "manifest_dir": "C:\\Users\\abhir\\autoresearch-uci\\beijing_pm25\\data"}, "composite": {"higher_is_better": false, "penalty_weight": 0.1, "below_threshold": -40.0}, "hardware": {"n_threads": 4, "cpu_affinity": [0, 2, 4, 6]}, "description": "Exp166 MLP LayerNorm on Exp164 recipe (MLP cycle 42/50)", "seed": 0}, "composite": -22.441522797369, "val_primary": 22.441522797369, "test_primary": 21.338373919046052, "per_fold_test": [21.338373919046052], "per_fold_val": [22.441522797369], "status": "DISCARD", "seconds_elapsed": 227.2504312992096, "timestamp": "2026-08-20T10:43:07", "secondary_metrics": {"mae": 11.702833539135051, "mape": 0.2108180884034382, "r2": 0.9473981931601511, "ic": 0.9727876478010543}, "per_fold_test_reports": [{"fold_id": 0, "regime": "calendar_2014_test", "task_type": "regression", "n": 7950, "rmse": 21.338373919046052, "mae": 11.702833539135051, "mape": 0.2108180884034382, "r2": 0.9473981931601511, "ic": 0.9727876478010543}], "composite_fingerprint": "a12fd381fe9bbefb"}
{"experiment_num": 167, "backbone": "mlp", "description": "Exp167 MLP residual skips on Exp164 recipe (MLP cycle 43/50)", "config": {"paths": {"results_dir": "C:\\Users\\abhir\\autoresearch-uci\\beijing_pm25\\autoresearch_results"}, "task_type": "regression", "primary_metric": "rmse", "backbone": "mlp", "backbone_config": {"seed": 0, "n_jobs": 4, "weight_decay": 0.0001, "batch_size": 16, "hidden": [512, 256, 128], "residual": true}, "data": {"format": "csv", "path": "C:\\Users\\abhir\\autoresearch-uci\\beijing_pm25\\data\\features_full.csv", "target_columns": ["pm25"], "feature_columns": ["DEWP", "TEMP", "PRES", "Iws", "Is", "Ir", "cbwd_NE", "cbwd_NW", "cbwd_SE", "cbwd_cv", "pm25_lag1", "pm25_lag2", "pm25_lag3", "pm25_lag4", "pm25_lag5", "pm25_lag6", "pm25_lag7", "pm25_lag8", "pm25_lag9", "pm25_lag10", "pm25_lag11", "pm25_lag12", "pm25_lag13", "pm25_lag14", "pm25_lag15", "pm25_lag16", "pm25_lag17", "pm25_lag18", "pm25_lag19", "pm25_lag20", "pm25_lag21", "pm25_lag22", "pm25_lag23", "pm25_lag24", "hour_sin", "hour_cos", "dow", "is_weekend", "pm25_delta1", "inversion_spread", "rh_magnus", "dewp_delta", "is_heating", "log_iws", "month_sin", "pm25_accel", "vent_index"]}, "split": {"name": "calendar_year", "manifest_dir": "C:\\Users\\abhir\\autoresearch-uci\\beijing_pm25\\data"}, "composite": {"higher_is_better": false, "penalty_weight": 0.1, "below_threshold": -40.0}, "hardware": {"n_threads": 4, "cpu_affinity": [0, 2, 4, 6]}, "description": "Exp167 MLP residual skips on Exp164 recipe (MLP cycle 43/50)", "seed": 0}, "composite": -21.972015597737606, "val_primary": 21.972015597737606, "test_primary": 20.072104634476492, "per_fold_test": [20.072104634476492], "per_fold_val": [21.972015597737606], "status": "KEEP", "seconds_elapsed": 311.12923097610474, "timestamp": "2026-08-20T11:14:34", "secondary_metrics": {"mae": 11.061248615312877, "mape": 0.20307969465804582, "r2": 0.9534559849426274, "ic": 0.9731591905495249}, "per_fold_test_reports": [{"fold_id": 0, "regime": "calendar_2014_test", "task_type": "regression", "n": 7950, "rmse": 20.072104634476492, "mae": 11.061248615312877, "mape": 0.20307969465804582, "r2": 0.9534559849426274, "ic": 0.9731591905495249}], "composite_fingerprint": "a12fd381fe9bbefb"}
{"experiment_num": 168, "backbone": "mlp", "description": "Exp168 MLP huber_beta=20 on Exp167 residual recipe (MLP cycle 44/50)", "config": {"paths": {"results_dir": "C:\\Users\\abhir\\autoresearch-uci\\beijing_pm25\\autoresearch_results"}, "task_type": "regression", "primary_metric": "rmse", "backbone": "mlp", "backbone_config": {"seed": 0, "n_jobs": 4, "weight_decay": 0.0001, "batch_size": 16, "hidden": [512, 256, 128], "residual": true, "huber_beta": 20}, "data": {"format": "csv", "path": "C:\\Users\\abhir\\autoresearch-uci\\beijing_pm25\\data\\features_full.csv", "target_columns": ["pm25"], "feature_columns": ["DEWP", "TEMP", "PRES", "Iws", "Is", "Ir", "cbwd_NE", "cbwd_NW", "cbwd_SE", "cbwd_cv", "pm25_lag1", "pm25_lag2", "pm25_lag3", "pm25_lag4", "pm25_lag5", "pm25_lag6", "pm25_lag7", "pm25_lag8", "pm25_lag9", "pm25_lag10", "pm25_lag11", "pm25_lag12", "pm25_lag13", "pm25_lag14", "pm25_lag15", "pm25_lag16", "pm25_lag17", "pm25_lag18", "pm25_lag19", "pm25_lag20", "pm25_lag21", "pm25_lag22", "pm25_lag23", "pm25_lag24", "hour_sin", "hour_cos", "dow", "is_weekend", "pm25_delta1", "inversion_spread", "rh_magnus", "dewp_delta", "is_heating", "log_iws", "month_sin", "pm25_accel", "vent_index"]}, "split": {"name": "calendar_year", "manifest_dir": "C:\\Users\\abhir\\autoresearch-uci\\beijing_pm25\\data"}, "composite": {"higher_is_better": false, "penalty_weight": 0.1, "below_threshold": -40.0}, "hardware": {"n_threads": 4, "cpu_affinity": [0, 2, 4, 6]}, "description": "Exp168 MLP huber_beta=20 on Exp167 residual recipe (MLP cycle 44/50)", "seed": 0}, "composite": -22.580501559126407, "val_primary": 22.580501559126407, "test_primary": 20.75154255215773, "per_fold_test": [20.75154255215773], "per_fold_val": [22.580501559126407], "status": "DISCARD", "seconds_elapsed": 83.19536280632019, "timestamp": "2026-08-20T11:43:29", "secondary_metrics": {"mae": 11.77418212541994, "mape": 0.22441137703854805, "r2": 0.9502516374846279, "ic": 0.9701613894776832}, "per_fold_test_reports": [{"fold_id": 0, "regime": "calendar_2014_test", "task_type": "regression", "n": 7950, "rmse": 20.75154255215773, "mae": 11.77418212541994, "mape": 0.22441137703854805, "r2": 0.9502516374846279, "ic": 0.9701613894776832}], "composite_fingerprint": "a12fd381fe9bbefb"}
{"experiment_num": 169, "backbone": "mlp", "description": "Exp169 MLP add se_pm25 on Exp167 residual recipe (MLP cycle 45/50)", "config": {"paths": {"results_dir": "C:\\Users\\abhir\\autoresearch-uci\\beijing_pm25\\autoresearch_results"}, "task_type": "regression", "primary_metric": "rmse", "backbone": "mlp", "backbone_config": {"seed": 0, "n_jobs": 4, "weight_decay": 0.0001, "batch_size": 16, "hidden": [512, 256, 128], "residual": true}, "data": {"format": "csv", "path": "C:\\Users\\abhir\\autoresearch-uci\\beijing_pm25\\data\\features_full.csv", "target_columns": ["pm25"], "feature_columns": ["DEWP", "TEMP", "PRES", "Iws", "Is", "Ir", "cbwd_NE", "cbwd_NW", "cbwd_SE", "cbwd_cv", "pm25_lag1", "pm25_lag2", "pm25_lag3", "pm25_lag4", "pm25_lag5", "pm25_lag6", "pm25_lag7", "pm25_lag8", "pm25_lag9", "pm25_lag10", "pm25_lag11", "pm25_lag12", "pm25_lag13", "pm25_lag14", "pm25_lag15", "pm25_lag16", "pm25_lag17", "pm25_lag18", "pm25_lag19", "pm25_lag20", "pm25_lag21", "pm25_lag22", "pm25_lag23", "pm25_lag24", "hour_sin", "hour_cos", "dow", "is_weekend", "pm25_delta1", "inversion_spread", "rh_magnus", "dewp_delta", "is_heating", "log_iws", "month_sin", "pm25_accel", "vent_index", "se_pm25"]}, "split": {"name": "calendar_year", "manifest_dir": "C:\\Users\\abhir\\autoresearch-uci\\beijing_pm25\\data"}, "composite": {"higher_is_better": false, "penalty_weight": 0.1, "below_threshold": -40.0}, "hardware": {"n_threads": 4, "cpu_affinity": [0, 2, 4, 6]}, "description": "Exp169 MLP add se_pm25 on Exp167 residual recipe (MLP cycle 45/50)", "seed": 0}, "composite": -22.116613531739603, "val_primary": 22.116613531739603, "test_primary": 20.13266776245421, "per_fold_test": [20.13266776245421], "per_fold_val": [22.116613531739603], "status": "DISCARD", "seconds_elapsed": 460.8864815235138, "timestamp": "2026-08-20T12:17:06", "secondary_metrics": {"mae": 11.079783413845039, "mape": 0.20211554131418505, "r2": 0.9531746887037653, "ic": 0.9733381228581448}, "per_fold_test_reports": [{"fold_id": 0, "regime": "calendar_2014_test", "task_type": "regression", "n": 7950, "rmse": 20.13266776245421, "mae": 11.079783413845039, "mape": 0.20211554131418505, "r2": 0.9531746887037653, "ic": 0.9733381228581448}], "composite_fingerprint": "a12fd381fe9bbefb"}
