{"experiment_num": 77, "backbone": "catboost", "description": "Exp77 CatBoost Ordered boosting on Exp30 inversion+delta features (CatBoost cycle 3/50)", "config": {"paths": {"results_dir": "C:\\Users\\abhir\\autoresearch-uci\\beijing_pm25\\autoresearch_results"}, "task_type": "regression", "primary_metric": "rmse", "backbone": "catboost", "backbone_config": {"seed": 0, "n_jobs": 4, "iterations": 2000, "depth": 6, "learning_rate": 0.03, "l2_leaf_reg": 3, "early_stopping_rounds": 100, "boosting_type": "Ordered"}, "data": {"format": "csv", "path": "C:\\Users\\abhir\\autoresearch-uci\\beijing_pm25\\data\\features_full.csv", "target_columns": ["pm25"], "feature_columns": ["DEWP", "TEMP", "PRES", "Iws", "Is", "Ir", "cbwd_NE", "cbwd_NW", "cbwd_SE", "cbwd_cv", "pm25_lag1", "pm25_lag2", "pm25_lag3", "pm25_lag4", "pm25_lag5", "pm25_lag6", "pm25_lag7", "pm25_lag8", "pm25_lag9", "pm25_lag10", "pm25_lag11", "pm25_lag12", "pm25_lag13", "pm25_lag14", "pm25_lag15", "pm25_lag16", "pm25_lag17", "pm25_lag18", "pm25_lag19", "pm25_lag20", "pm25_lag21", "pm25_lag22", "pm25_lag23", "pm25_lag24", "hour_sin", "hour_cos", "dow", "is_weekend", "pm25_delta1", "inversion_spread"]}, "split": {"name": "calendar_year", "manifest_dir": "C:\\Users\\abhir\\autoresearch-uci\\beijing_pm25\\data"}, "composite": {"higher_is_better": false, "penalty_weight": 0.1, "below_threshold": -40.0}, "hardware": {"n_threads": 4, "cpu_affinity": [0, 2, 4, 6]}, "description": "Exp77 CatBoost Ordered boosting on Exp30 inversion+delta features (CatBoost cycle 3/50)", "seed": 0}, "composite": -23.189695761638774, "val_primary": 23.189695761638774, "test_primary": 21.519628000787456, "per_fold_test": [21.519628000787456], "per_fold_val": [23.189695761638774], "status": "DISCARD", "seconds_elapsed": 37.617480516433716, "timestamp": "2026-08-18T17:36:50", "secondary_metrics": {"mae": 12.023339915692233, "mape": 0.26541964674292, "r2": 0.9465007690454922, "ic": 0.9702910882183658}, "per_fold_test_reports": [{"fold_id": 0, "regime": "calendar_2014_test", "task_type": "regression", "n": 7950, "rmse": 21.519628000787456, "mae": 12.023339915692233, "mape": 0.26541964674292, "r2": 0.9465007690454922, "ic": 0.9702910882183658}], "composite_fingerprint": "a12fd381fe9bbefb"}
{"experiment_num": 78, "backbone": "catboost", "description": "Exp78 CatBoost Plain boosting on Exp30 inversion+delta features (CatBoost cycle 4/50)", "config": {"paths": {"results_dir": "C:\\Users\\abhir\\autoresearch-uci\\beijing_pm25\\autoresearch_results"}, "task_type": "regression", "primary_metric": "rmse", "backbone": "catboost", "backbone_config": {"seed": 0, "n_jobs": 4, "iterations": 2000, "depth": 6, "learning_rate": 0.03, "l2_leaf_reg": 3, "early_stopping_rounds": 100, "boosting_type": "Plain"}, "data": {"format": "csv", "path": "C:\\Users\\abhir\\autoresearch-uci\\beijing_pm25\\data\\features_full.csv", "target_columns": ["pm25"], "feature_columns": ["DEWP", "TEMP", "PRES", "Iws", "Is", "Ir", "cbwd_NE", "cbwd_NW", "cbwd_SE", "cbwd_cv", "pm25_lag1", "pm25_lag2", "pm25_lag3", "pm25_lag4", "pm25_lag5", "pm25_lag6", "pm25_lag7", "pm25_lag8", "pm25_lag9", "pm25_lag10", "pm25_lag11", "pm25_lag12", "pm25_lag13", "pm25_lag14", "pm25_lag15", "pm25_lag16", "pm25_lag17", "pm25_lag18", "pm25_lag19", "pm25_lag20", "pm25_lag21", "pm25_lag22", "pm25_lag23", "pm25_lag24", "hour_sin", "hour_cos", "dow", "is_weekend", "pm25_delta1", "inversion_spread"]}, "split": {"name": "calendar_year", "manifest_dir": "C:\\Users\\abhir\\autoresearch-uci\\beijing_pm25\\data"}, "composite": {"higher_is_better": false, "penalty_weight": 0.1, "below_threshold": -40.0}, "hardware": {"n_threads": 4, "cpu_affinity": [0, 2, 4, 6]}, "description": "Exp78 CatBoost Plain boosting on Exp30 inversion+delta features (CatBoost cycle 4/50)", "seed": 0}, "composite": -22.471703069828216, "val_primary": 22.471703069828216, "test_primary": 21.057527466804917, "per_fold_test": [21.057527466804917], "per_fold_val": [22.471703069828216], "status": "DISCARD", "seconds_elapsed": 29.28187108039856, "timestamp": "2026-08-18T17:38:23", "secondary_metrics": {"mae": 11.495925914764243, "mape": 0.211583926640728, "r2": 0.9487737255944076, "ic": 0.9723131824922135}, "per_fold_test_reports": [{"fold_id": 0, "regime": "calendar_2014_test", "task_type": "regression", "n": 7950, "rmse": 21.057527466804917, "mae": 11.495925914764243, "mape": 0.211583926640728, "r2": 0.9487737255944076, "ic": 0.9723131824922135}], "composite_fingerprint": "a12fd381fe9bbefb"}
{"experiment_num": 79, "backbone": "catboost", "description": "Exp79 CatBoost Plain learning_rate 0.01 on Exp30 features (CatBoost cycle 5/50)", "config": {"paths": {"results_dir": "C:\\Users\\abhir\\autoresearch-uci\\beijing_pm25\\autoresearch_results"}, "task_type": "regression", "primary_metric": "rmse", "backbone": "catboost", "backbone_config": {"seed": 0, "n_jobs": 4, "iterations": 2000, "depth": 6, "learning_rate": 0.01, "l2_leaf_reg": 3, "early_stopping_rounds": 100, "boosting_type": "Plain"}, "data": {"format": "csv", "path": "C:\\Users\\abhir\\autoresearch-uci\\beijing_pm25\\data\\features_full.csv", "target_columns": ["pm25"], "feature_columns": ["DEWP", "TEMP", "PRES", "Iws", "Is", "Ir", "cbwd_NE", "cbwd_NW", "cbwd_SE", "cbwd_cv", "pm25_lag1", "pm25_lag2", "pm25_lag3", "pm25_lag4", "pm25_lag5", "pm25_lag6", "pm25_lag7", "pm25_lag8", "pm25_lag9", "pm25_lag10", "pm25_lag11", "pm25_lag12", "pm25_lag13", "pm25_lag14", "pm25_lag15", "pm25_lag16", "pm25_lag17", "pm25_lag18", "pm25_lag19", "pm25_lag20", "pm25_lag21", "pm25_lag22", "pm25_lag23", "pm25_lag24", "hour_sin", "hour_cos", "dow", "is_weekend", "pm25_delta1", "inversion_spread"]}, "split": {"name": "calendar_year", "manifest_dir": "C:\\Users\\abhir\\autoresearch-uci\\beijing_pm25\\data"}, "composite": {"higher_is_better": false, "penalty_weight": 0.1, "below_threshold": -40.0}, "hardware": {"n_threads": 4, "cpu_affinity": [0, 2, 4, 6]}, "description": "Exp79 CatBoost Plain learning_rate 0.01 on Exp30 features (CatBoost cycle 5/50)", "seed": 0}, "composite": -22.587454031284917, "val_primary": 22.587454031284917, "test_primary": 21.040179341992427, "per_fold_test": [21.040179341992427], "per_fold_val": [22.587454031284917], "status": "DISCARD", "seconds_elapsed": 38.84342980384827, "timestamp": "2026-08-18T18:06:41", "secondary_metrics": {"mae": 11.494359301286323, "mape": 0.2227417272015173, "r2": 0.9488580957785667, "ic": 0.972030148782805}, "per_fold_test_reports": [{"fold_id": 0, "regime": "calendar_2014_test", "task_type": "regression", "n": 7950, "rmse": 21.040179341992427, "mae": 11.494359301286323, "mape": 0.2227417272015173, "r2": 0.9488580957785667, "ic": 0.972030148782805}], "composite_fingerprint": "a12fd381fe9bbefb"}
{"experiment_num": 80, "backbone": "catboost", "description": "Exp80 CatBoost Plain depth 4 on Exp30 features (CatBoost cycle 6/50)", "config": {"paths": {"results_dir": "C:\\Users\\abhir\\autoresearch-uci\\beijing_pm25\\autoresearch_results"}, "task_type": "regression", "primary_metric": "rmse", "backbone": "catboost", "backbone_config": {"seed": 0, "n_jobs": 4, "iterations": 2000, "depth": 4, "learning_rate": 0.03, "l2_leaf_reg": 3, "early_stopping_rounds": 100, "boosting_type": "Plain"}, "data": {"format": "csv", "path": "C:\\Users\\abhir\\autoresearch-uci\\beijing_pm25\\data\\features_full.csv", "target_columns": ["pm25"], "feature_columns": ["DEWP", "TEMP", "PRES", "Iws", "Is", "Ir", "cbwd_NE", "cbwd_NW", "cbwd_SE", "cbwd_cv", "pm25_lag1", "pm25_lag2", "pm25_lag3", "pm25_lag4", "pm25_lag5", "pm25_lag6", "pm25_lag7", "pm25_lag8", "pm25_lag9", "pm25_lag10", "pm25_lag11", "pm25_lag12", "pm25_lag13", "pm25_lag14", "pm25_lag15", "pm25_lag16", "pm25_lag17", "pm25_lag18", "pm25_lag19", "pm25_lag20", "pm25_lag21", "pm25_lag22", "pm25_lag23", "pm25_lag24", "hour_sin", "hour_cos", "dow", "is_weekend", "pm25_delta1", "inversion_spread"]}, "split": {"name": "calendar_year", "manifest_dir": "C:\\Users\\abhir\\autoresearch-uci\\beijing_pm25\\data"}, "composite": {"higher_is_better": false, "penalty_weight": 0.1, "below_threshold": -40.0}, "hardware": {"n_threads": 4, "cpu_affinity": [0, 2, 4, 6]}, "description": "Exp80 CatBoost Plain depth 4 on Exp30 features (CatBoost cycle 6/50)", "seed": 0}, "composite": -22.795085833041743, "val_primary": 22.795085833041743, "test_primary": 21.05748730946601, "per_fold_test": [21.05748730946601], "per_fold_val": [22.795085833041743], "status": "DISCARD", "seconds_elapsed": 7.811170816421509, "timestamp": "2026-08-18T18:07:40", "secondary_metrics": {"mae": 11.556510129789677, "mape": 0.22627503537263835, "r2": 0.9487739209743167, "ic": 0.971395315322627}, "per_fold_test_reports": [{"fold_id": 0, "regime": "calendar_2014_test", "task_type": "regression", "n": 7950, "rmse": 21.05748730946601, "mae": 11.556510129789677, "mape": 0.22627503537263835, "r2": 0.9487739209743167, "ic": 0.971395315322627}], "composite_fingerprint": "a12fd381fe9bbefb"}
{"experiment_num": 81, "backbone": "catboost", "description": "Exp81 CatBoost Plain on Exp76 t+6 rh_magnus features (CatBoost cycle 7/50)", "config": {"paths": {"results_dir": "C:\\Users\\abhir\\autoresearch-uci\\beijing_pm25\\autoresearch_results"}, "task_type": "regression", "primary_metric": "rmse", "backbone": "catboost", "backbone_config": {"seed": 0, "n_jobs": 4, "iterations": 2000, "depth": 6, "learning_rate": 0.03, "l2_leaf_reg": 3, "early_stopping_rounds": 100, "boosting_type": "Plain"}, "data": {"format": "csv", "path": "C:\\Users\\abhir\\autoresearch-uci\\beijing_pm25\\data\\features_horizon6.csv", "target_columns": ["pm25"], "feature_columns": ["DEWP", "TEMP", "PRES", "Iws", "Is", "Ir", "cbwd_NE", "cbwd_NW", "cbwd_SE", "cbwd_cv", "pm25_lag1", "pm25_lag2", "pm25_lag3", "pm25_lag4", "pm25_lag5", "pm25_lag6", "pm25_lag7", "pm25_lag8", "pm25_lag9", "pm25_lag10", "pm25_lag11", "pm25_lag12", "pm25_lag13", "pm25_lag14", "pm25_lag15", "pm25_lag16", "pm25_lag17", "pm25_lag18", "pm25_lag19", "pm25_lag20", "pm25_lag21", "pm25_lag22", "pm25_lag23", "pm25_lag24", "hour_sin", "hour_cos", "dow", "is_weekend", "pm25_delta1", "inversion_spread", "month_sin", "pres_delta", "dewp_delta", "cbwd_prev_NW", "rh_magnus"]}, "split": {"name": "calendar_year", "manifest_dir": "C:\\Users\\abhir\\autoresearch-uci\\beijing_pm25\\data"}, "composite": {"higher_is_better": false, "penalty_weight": 0.1, "below_threshold": -40.0}, "hardware": {"n_threads": 4, "cpu_affinity": [0, 2, 4, 6]}, "description": "Exp81 CatBoost Plain on Exp76 t+6 rh_magnus features (CatBoost cycle 7/50)", "seed": 0}, "composite": -57.957069444240155, "val_primary": 57.85706944424015, "test_primary": 53.92861494261978, "per_fold_test": [53.92861494261978], "per_fold_val": [57.85706944424015], "status": "DISCARD", "seconds_elapsed": 24.758944749832153, "timestamp": "2026-08-18T18:37:14", "secondary_metrics": {"mae": 35.23518951515103, "mape": 0.9106171283442789, "r2": 0.6640175809700444, "ic": 0.7924859662679798}, "per_fold_test_reports": [{"fold_id": 0, "regime": "calendar_2014_test", "task_type": "regression", "n": 7950, "rmse": 53.92861494261978, "mae": 35.23518951515103, "mape": 0.9106171283442789, "r2": 0.6640175809700444, "ic": 0.7924859662679798}], "composite_fingerprint": "a12fd381fe9bbefb"}
{"experiment_num": 82, "backbone": "catboost", "description": "Exp82 CatBoost t+6 l2_leaf_reg=10 on Exp81 Plain (CatBoost cycle 8/50)", "config": {"paths": {"results_dir": "C:\\Users\\abhir\\autoresearch-uci\\beijing_pm25\\autoresearch_results"}, "task_type": "regression", "primary_metric": "rmse", "backbone": "catboost", "backbone_config": {"seed": 0, "n_jobs": 4, "iterations": 2000, "depth": 6, "learning_rate": 0.03, "l2_leaf_reg": 10, "early_stopping_rounds": 100, "boosting_type": "Plain"}, "data": {"format": "csv", "path": "C:\\Users\\abhir\\autoresearch-uci\\beijing_pm25\\data\\features_horizon6.csv", "target_columns": ["pm25"], "feature_columns": ["DEWP", "TEMP", "PRES", "Iws", "Is", "Ir", "cbwd_NE", "cbwd_NW", "cbwd_SE", "cbwd_cv", "pm25_lag1", "pm25_lag2", "pm25_lag3", "pm25_lag4", "pm25_lag5", "pm25_lag6", "pm25_lag7", "pm25_lag8", "pm25_lag9", "pm25_lag10", "pm25_lag11", "pm25_lag12", "pm25_lag13", "pm25_lag14", "pm25_lag15", "pm25_lag16", "pm25_lag17", "pm25_lag18", "pm25_lag19", "pm25_lag20", "pm25_lag21", "pm25_lag22", "pm25_lag23", "pm25_lag24", "hour_sin", "hour_cos", "dow", "is_weekend", "pm25_delta1", "inversion_spread", "month_sin", "pres_delta", "dewp_delta", "cbwd_prev_NW", "rh_magnus"]}, "split": {"name": "calendar_year", "manifest_dir": "C:\\Users\\abhir\\autoresearch-uci\\beijing_pm25\\data"}, "composite": {"higher_is_better": false, "penalty_weight": 0.1, "below_threshold": -40.0}, "hardware": {"n_threads": 4, "cpu_affinity": [0, 2, 4, 6]}, "description": "Exp82 CatBoost t+6 l2_leaf_reg=10 on Exp81 Plain (CatBoost cycle 8/50)", "seed": 0}, "composite": -58.25887644795917, "val_primary": 58.158876447959166, "test_primary": 53.8949323472746, "per_fold_test": [53.8949323472746], "per_fold_val": [58.158876447959166], "status": "DISCARD", "seconds_elapsed": 24.71741032600403, "timestamp": "2026-08-18T18:38:29", "secondary_metrics": {"mae": 35.17170425798976, "mape": 0.9092627945963412, "r2": 0.6644371439712067, "ic": 0.7922520131590677}, "per_fold_test_reports": [{"fold_id": 0, "regime": "calendar_2014_test", "task_type": "regression", "n": 7950, "rmse": 53.8949323472746, "mae": 35.17170425798976, "mape": 0.9092627945963412, "r2": 0.6644371439712067, "ic": 0.7922520131590677}], "composite_fingerprint": "a12fd381fe9bbefb"}
{"experiment_num": 83, "backbone": "catboost", "description": "Exp83 CatBoost t+6 bagging_temperature=2 on Exp81 Plain (CatBoost cycle 9/50)", "config": {"paths": {"results_dir": "C:\\Users\\abhir\\autoresearch-uci\\beijing_pm25\\autoresearch_results"}, "task_type": "regression", "primary_metric": "rmse", "backbone": "catboost", "backbone_config": {"seed": 0, "n_jobs": 4, "iterations": 2000, "depth": 6, "learning_rate": 0.03, "l2_leaf_reg": 3, "early_stopping_rounds": 100, "boosting_type": "Plain", "bagging_temperature": 2}, "data": {"format": "csv", "path": "C:\\Users\\abhir\\autoresearch-uci\\beijing_pm25\\data\\features_horizon6.csv", "target_columns": ["pm25"], "feature_columns": ["DEWP", "TEMP", "PRES", "Iws", "Is", "Ir", "cbwd_NE", "cbwd_NW", "cbwd_SE", "cbwd_cv", "pm25_lag1", "pm25_lag2", "pm25_lag3", "pm25_lag4", "pm25_lag5", "pm25_lag6", "pm25_lag7", "pm25_lag8", "pm25_lag9", "pm25_lag10", "pm25_lag11", "pm25_lag12", "pm25_lag13", "pm25_lag14", "pm25_lag15", "pm25_lag16", "pm25_lag17", "pm25_lag18", "pm25_lag19", "pm25_lag20", "pm25_lag21", "pm25_lag22", "pm25_lag23", "pm25_lag24", "hour_sin", "hour_cos", "dow", "is_weekend", "pm25_delta1", "inversion_spread", "month_sin", "pres_delta", "dewp_delta", "cbwd_prev_NW", "rh_magnus"]}, "split": {"name": "calendar_year", "manifest_dir": "C:\\Users\\abhir\\autoresearch-uci\\beijing_pm25\\data"}, "composite": {"higher_is_better": false, "penalty_weight": 0.1, "below_threshold": -40.0}, "hardware": {"n_threads": 4, "cpu_affinity": [0, 2, 4, 6]}, "description": "Exp83 CatBoost t+6 bagging_temperature=2 on Exp81 Plain (CatBoost cycle 9/50)", "seed": 0}, "composite": -57.957069444240155, "val_primary": 57.85706944424015, "test_primary": 53.92861494261978, "per_fold_test": [53.92861494261978], "per_fold_val": [57.85706944424015], "status": "DISCARD", "seconds_elapsed": 23.65558171272278, "timestamp": "2026-08-18T19:05:15", "secondary_metrics": {"mae": 35.23518951515103, "mape": 0.9106171283442789, "r2": 0.6640175809700444, "ic": 0.7924859662679798}, "per_fold_test_reports": [{"fold_id": 0, "regime": "calendar_2014_test", "task_type": "regression", "n": 7950, "rmse": 53.92861494261978, "mae": 35.23518951515103, "mape": 0.9106171283442789, "r2": 0.6640175809700444, "ic": 0.7924859662679798}], "composite_fingerprint": "a12fd381fe9bbefb"}
{"experiment_num": 84, "backbone": "catboost", "description": "Exp84 CatBoost t+6 drop rh_magnus from Exp81 Plain (CatBoost cycle 10/50)", "config": {"paths": {"results_dir": "C:\\Users\\abhir\\autoresearch-uci\\beijing_pm25\\autoresearch_results"}, "task_type": "regression", "primary_metric": "rmse", "backbone": "catboost", "backbone_config": {"seed": 0, "n_jobs": 4, "iterations": 2000, "depth": 6, "learning_rate": 0.03, "l2_leaf_reg": 3, "early_stopping_rounds": 100, "boosting_type": "Plain"}, "data": {"format": "csv", "path": "C:\\Users\\abhir\\autoresearch-uci\\beijing_pm25\\data\\features_horizon6.csv", "target_columns": ["pm25"], "feature_columns": ["DEWP", "TEMP", "PRES", "Iws", "Is", "Ir", "cbwd_NE", "cbwd_NW", "cbwd_SE", "cbwd_cv", "pm25_lag1", "pm25_lag2", "pm25_lag3", "pm25_lag4", "pm25_lag5", "pm25_lag6", "pm25_lag7", "pm25_lag8", "pm25_lag9", "pm25_lag10", "pm25_lag11", "pm25_lag12", "pm25_lag13", "pm25_lag14", "pm25_lag15", "pm25_lag16", "pm25_lag17", "pm25_lag18", "pm25_lag19", "pm25_lag20", "pm25_lag21", "pm25_lag22", "pm25_lag23", "pm25_lag24", "hour_sin", "hour_cos", "dow", "is_weekend", "pm25_delta1", "inversion_spread", "month_sin", "pres_delta", "dewp_delta", "cbwd_prev_NW"]}, "split": {"name": "calendar_year", "manifest_dir": "C:\\Users\\abhir\\autoresearch-uci\\beijing_pm25\\data"}, "composite": {"higher_is_better": false, "penalty_weight": 0.1, "below_threshold": -40.0}, "hardware": {"n_threads": 4, "cpu_affinity": [0, 2, 4, 6]}, "description": "Exp84 CatBoost t+6 drop rh_magnus from Exp81 Plain (CatBoost cycle 10/50)", "seed": 0}, "composite": -58.17464824122178, "val_primary": 58.07464824122178, "test_primary": 54.154910204752, "per_fold_test": [54.154910204752], "per_fold_val": [58.07464824122178], "status": "DISCARD", "seconds_elapsed": 18.111032009124756, "timestamp": "2026-08-18T19:06:24", "secondary_metrics": {"mae": 35.348451473522, "mape": 0.9110943743081532, "r2": 0.6611919660049362, "ic": 0.7918237473609185}, "per_fold_test_reports": [{"fold_id": 0, "regime": "calendar_2014_test", "task_type": "regression", "n": 7950, "rmse": 54.154910204752, "mae": 35.348451473522, "mape": 0.9110943743081532, "r2": 0.6611919660049362, "ic": 0.7918237473609185}], "composite_fingerprint": "a12fd381fe9bbefb"}
{"experiment_num": 85, "backbone": "catboost", "description": "Exp85 CatBoost Ordered t+6 on Exp81 features (CatBoost cycle 11/50)", "config": {"paths": {"results_dir": "C:\\Users\\abhir\\autoresearch-uci\\beijing_pm25\\autoresearch_results"}, "task_type": "regression", "primary_metric": "rmse", "backbone": "catboost", "backbone_config": {"seed": 0, "n_jobs": 4, "iterations": 2000, "depth": 6, "learning_rate": 0.03, "l2_leaf_reg": 3, "early_stopping_rounds": 100, "boosting_type": "Ordered"}, "data": {"format": "csv", "path": "C:\\Users\\abhir\\autoresearch-uci\\beijing_pm25\\data\\features_horizon6.csv", "target_columns": ["pm25"], "feature_columns": ["DEWP", "TEMP", "PRES", "Iws", "Is", "Ir", "cbwd_NE", "cbwd_NW", "cbwd_SE", "cbwd_cv", "pm25_lag1", "pm25_lag2", "pm25_lag3", "pm25_lag4", "pm25_lag5", "pm25_lag6", "pm25_lag7", "pm25_lag8", "pm25_lag9", "pm25_lag10", "pm25_lag11", "pm25_lag12", "pm25_lag13", "pm25_lag14", "pm25_lag15", "pm25_lag16", "pm25_lag17", "pm25_lag18", "pm25_lag19", "pm25_lag20", "pm25_lag21", "pm25_lag22", "pm25_lag23", "pm25_lag24", "hour_sin", "hour_cos", "dow", "is_weekend", "pm25_delta1", "inversion_spread", "month_sin", "pres_delta", "dewp_delta", "cbwd_prev_NW", "rh_magnus"]}, "split": {"name": "calendar_year", "manifest_dir": "C:\\Users\\abhir\\autoresearch-uci\\beijing_pm25\\data"}, "composite": {"higher_is_better": false, "penalty_weight": 0.1, "below_threshold": -40.0}, "hardware": {"n_threads": 4, "cpu_affinity": [0, 2, 4, 6]}, "description": "Exp85 CatBoost Ordered t+6 on Exp81 features (CatBoost cycle 11/50)", "seed": 0}, "composite": -57.758278414600795, "val_primary": 57.658278414600794, "test_primary": 53.93967467806938, "per_fold_test": [53.93967467806938], "per_fold_val": [57.658278414600794], "status": "DISCARD", "seconds_elapsed": 85.01184940338135, "timestamp": "2026-08-18T19:36:32", "secondary_metrics": {"mae": 35.12491108995514, "mape": 0.909512437259884, "r2": 0.6638797596037055, "ic": 0.7937303964981415}, "per_fold_test_reports": [{"fold_id": 0, "regime": "calendar_2014_test", "task_type": "regression", "n": 7950, "rmse": 53.93967467806938, "mae": 35.12491108995514, "mape": 0.909512437259884, "r2": 0.6638797596037055, "ic": 0.7937303964981415}], "composite_fingerprint": "a12fd381fe9bbefb"}
