{"experiment_num": 32, "backbone": "lightgbm", "description": "Exp32 LightGBM Ke2017 GOSS on Exp30 champion (isolated LGB paper cycle 6/50)", "config": {"paths": {"results_dir": "C:\\Users\\abhir\\autoresearch-uci\\beijing_pm25\\autoresearch_results"}, "task_type": "regression", "primary_metric": "rmse", "backbone": "lightgbm", "backbone_config": {"seed": 0, "n_jobs": 4, "n_estimators": 2000, "num_leaves": 63, "learning_rate": 0.01, "feature_fraction": 0.8, "bagging_fraction": 1.0, "early_stopping_rounds": 50, "boosting_type": "goss"}, "data": {"format": "csv", "path": "C:\\Users\\abhir\\autoresearch-uci\\beijing_pm25\\data\\features_full.csv", "target_columns": ["pm25"], "feature_columns": ["DEWP", "TEMP", "PRES", "Iws", "Is", "Ir", "cbwd_NE", "cbwd_NW", "cbwd_SE", "cbwd_cv", "pm25_lag1", "pm25_lag2", "pm25_lag3", "pm25_lag4", "pm25_lag5", "pm25_lag6", "pm25_lag7", "pm25_lag8", "pm25_lag9", "pm25_lag10", "pm25_lag11", "pm25_lag12", "pm25_lag13", "pm25_lag14", "pm25_lag15", "pm25_lag16", "pm25_lag17", "pm25_lag18", "pm25_lag19", "pm25_lag20", "pm25_lag21", "pm25_lag22", "pm25_lag23", "pm25_lag24", "hour_sin", "hour_cos", "dow", "is_weekend", "pm25_delta1", "inversion_spread"]}, "split": {"name": "calendar_year", "manifest_dir": "C:\\Users\\abhir\\autoresearch-uci\\beijing_pm25\\data"}, "composite": {"higher_is_better": false, "penalty_weight": 0.1, "below_threshold": -40.0}, "hardware": {"n_threads": 4, "cpu_affinity": [0, 2, 4, 6]}, "description": "Exp32 LightGBM Ke2017 GOSS on Exp30 champion (isolated LGB paper cycle 6/50)", "seed": 0}, "composite": -22.621243369991824, "val_primary": 22.621243369991824, "test_primary": 20.94910607276076, "per_fold_test": [20.94910607276076], "per_fold_val": [22.621243369991824], "status": "DISCARD", "seconds_elapsed": 5.952148914337158, "timestamp": "2026-08-18T01:47:59", "secondary_metrics": {"mae": 11.597799946617693, "mape": 0.21854330086218954, "r2": 0.9492998771817268, "ic": 0.972771344743761}, "per_fold_test_reports": [{"fold_id": 0, "regime": "calendar_2014_test", "task_type": "regression", "n": 7950, "rmse": 20.94910607276076, "mae": 11.597799946617693, "mape": 0.21854330086218954, "r2": 0.9492998771817268, "ic": 0.972771344743761}], "composite_fingerprint": "a12fd381fe9bbefb"}
{"experiment_num": 33, "backbone": "lightgbm", "description": "Exp33 LightGBM Rashmi2015 DART on Exp30 champion (isolated LGB paper cycle 7/50)", "config": {"paths": {"results_dir": "C:\\Users\\abhir\\autoresearch-uci\\beijing_pm25\\autoresearch_results"}, "task_type": "regression", "primary_metric": "rmse", "backbone": "lightgbm", "backbone_config": {"seed": 0, "n_jobs": 4, "n_estimators": 2000, "num_leaves": 63, "learning_rate": 0.01, "feature_fraction": 0.8, "bagging_fraction": 0.6, "early_stopping_rounds": 50, "boosting_type": "dart"}, "data": {"format": "csv", "path": "C:\\Users\\abhir\\autoresearch-uci\\beijing_pm25\\data\\features_full.csv", "target_columns": ["pm25"], "feature_columns": ["DEWP", "TEMP", "PRES", "Iws", "Is", "Ir", "cbwd_NE", "cbwd_NW", "cbwd_SE", "cbwd_cv", "pm25_lag1", "pm25_lag2", "pm25_lag3", "pm25_lag4", "pm25_lag5", "pm25_lag6", "pm25_lag7", "pm25_lag8", "pm25_lag9", "pm25_lag10", "pm25_lag11", "pm25_lag12", "pm25_lag13", "pm25_lag14", "pm25_lag15", "pm25_lag16", "pm25_lag17", "pm25_lag18", "pm25_lag19", "pm25_lag20", "pm25_lag21", "pm25_lag22", "pm25_lag23", "pm25_lag24", "hour_sin", "hour_cos", "dow", "is_weekend", "pm25_delta1", "inversion_spread"]}, "split": {"name": "calendar_year", "manifest_dir": "C:\\Users\\abhir\\autoresearch-uci\\beijing_pm25\\data"}, "composite": {"higher_is_better": false, "penalty_weight": 0.1, "below_threshold": -40.0}, "hardware": {"n_threads": 4, "cpu_affinity": [0, 2, 4, 6]}, "description": "Exp33 LightGBM Rashmi2015 DART on Exp30 champion (isolated LGB paper cycle 7/50)", "seed": 0}, "composite": -25.868825794786712, "val_primary": 25.868825794786712, "test_primary": 24.568721865130247, "per_fold_test": [24.568721865130247], "per_fold_val": [25.868825794786712], "status": "DISCARD", "seconds_elapsed": 116.34681749343872, "timestamp": "2026-08-18T02:08:06", "secondary_metrics": {"mae": 14.56735143092262, "mape": 0.21478217452769963, "r2": 0.9302662295906678, "ic": 0.9719436802410386}, "per_fold_test_reports": [{"fold_id": 0, "regime": "calendar_2014_test", "task_type": "regression", "n": 7950, "rmse": 24.568721865130247, "mae": 14.56735143092262, "mape": 0.21478217452769963, "r2": 0.9302662295906678, "ic": 0.9719436802410386}], "composite_fingerprint": "a12fd381fe9bbefb"}
{"experiment_num": 34, "backbone": "lightgbm", "description": "Exp34 LightGBM Huber loss on Exp30 champion (isolated LGB paper cycle 8/50)", "config": {"paths": {"results_dir": "C:\\Users\\abhir\\autoresearch-uci\\beijing_pm25\\autoresearch_results"}, "task_type": "regression", "primary_metric": "rmse", "backbone": "lightgbm", "backbone_config": {"seed": 0, "n_jobs": 4, "n_estimators": 2000, "num_leaves": 63, "learning_rate": 0.01, "feature_fraction": 0.8, "bagging_fraction": 0.6, "early_stopping_rounds": 50, "lgb_objective": "huber"}, "data": {"format": "csv", "path": "C:\\Users\\abhir\\autoresearch-uci\\beijing_pm25\\data\\features_full.csv", "target_columns": ["pm25"], "feature_columns": ["DEWP", "TEMP", "PRES", "Iws", "Is", "Ir", "cbwd_NE", "cbwd_NW", "cbwd_SE", "cbwd_cv", "pm25_lag1", "pm25_lag2", "pm25_lag3", "pm25_lag4", "pm25_lag5", "pm25_lag6", "pm25_lag7", "pm25_lag8", "pm25_lag9", "pm25_lag10", "pm25_lag11", "pm25_lag12", "pm25_lag13", "pm25_lag14", "pm25_lag15", "pm25_lag16", "pm25_lag17", "pm25_lag18", "pm25_lag19", "pm25_lag20", "pm25_lag21", "pm25_lag22", "pm25_lag23", "pm25_lag24", "hour_sin", "hour_cos", "dow", "is_weekend", "pm25_delta1", "inversion_spread"]}, "split": {"name": "calendar_year", "manifest_dir": "C:\\Users\\abhir\\autoresearch-uci\\beijing_pm25\\data"}, "composite": {"higher_is_better": false, "penalty_weight": 0.1, "below_threshold": -40.0}, "hardware": {"n_threads": 4, "cpu_affinity": [0, 2, 4, 6]}, "description": "Exp34 LightGBM Huber loss on Exp30 champion (isolated LGB paper cycle 8/50)", "seed": 0}, "composite": -81.561026468039, "val_primary": 80.88518417537004, "test_primary": 81.46102646803901, "per_fold_test": [81.46102646803901], "per_fold_val": [80.88518417537004], "status": "DISCARD", "seconds_elapsed": 19.137654066085815, "timestamp": "2026-08-18T02:10:08", "secondary_metrics": {"mae": 54.78356776190902, "mape": 1.7519267743713849, "r2": 0.2333841815443094, "ic": 0.9366170131378255}, "per_fold_test_reports": [{"fold_id": 0, "regime": "calendar_2014_test", "task_type": "regression", "n": 7950, "rmse": 81.46102646803901, "mae": 54.78356776190902, "mape": 1.7519267743713849, "r2": 0.2333841815443094, "ic": 0.9366170131378255}], "composite_fingerprint": "a12fd381fe9bbefb"}
{"experiment_num": 35, "backbone": "lightgbm", "description": "Exp35 LightGBM Geurts2006 extra_trees on Exp30 champion (isolated LGB paper cycle 9/50)", "config": {"paths": {"results_dir": "C:\\Users\\abhir\\autoresearch-uci\\beijing_pm25\\autoresearch_results"}, "task_type": "regression", "primary_metric": "rmse", "backbone": "lightgbm", "backbone_config": {"seed": 0, "n_jobs": 4, "n_estimators": 2000, "num_leaves": 63, "learning_rate": 0.01, "feature_fraction": 0.8, "bagging_fraction": 0.6, "early_stopping_rounds": 50, "extra_trees": true}, "data": {"format": "csv", "path": "C:\\Users\\abhir\\autoresearch-uci\\beijing_pm25\\data\\features_full.csv", "target_columns": ["pm25"], "feature_columns": ["DEWP", "TEMP", "PRES", "Iws", "Is", "Ir", "cbwd_NE", "cbwd_NW", "cbwd_SE", "cbwd_cv", "pm25_lag1", "pm25_lag2", "pm25_lag3", "pm25_lag4", "pm25_lag5", "pm25_lag6", "pm25_lag7", "pm25_lag8", "pm25_lag9", "pm25_lag10", "pm25_lag11", "pm25_lag12", "pm25_lag13", "pm25_lag14", "pm25_lag15", "pm25_lag16", "pm25_lag17", "pm25_lag18", "pm25_lag19", "pm25_lag20", "pm25_lag21", "pm25_lag22", "pm25_lag23", "pm25_lag24", "hour_sin", "hour_cos", "dow", "is_weekend", "pm25_delta1", "inversion_spread"]}, "split": {"name": "calendar_year", "manifest_dir": "C:\\Users\\abhir\\autoresearch-uci\\beijing_pm25\\data"}, "composite": {"higher_is_better": false, "penalty_weight": 0.1, "below_threshold": -40.0}, "hardware": {"n_threads": 4, "cpu_affinity": [0, 2, 4, 6]}, "description": "Exp35 LightGBM Geurts2006 extra_trees on Exp30 champion (isolated LGB paper cycle 9/50)", "seed": 0}, "composite": -22.988856463803682, "val_primary": 22.988856463803682, "test_primary": 21.238306799090598, "per_fold_test": [21.238306799090598], "per_fold_val": [22.988856463803682], "status": "DISCARD", "seconds_elapsed": 18.849785089492798, "timestamp": "2026-08-18T02:34:50", "secondary_metrics": {"mae": 11.862935875315475, "mape": 0.22097700436362394, "r2": 0.9478903927201696, "ic": 0.9719118354768109}, "per_fold_test_reports": [{"fold_id": 0, "regime": "calendar_2014_test", "task_type": "regression", "n": 7950, "rmse": 21.238306799090598, "mae": 11.862935875315475, "mape": 0.22097700436362394, "r2": 0.9478903927201696, "ic": 0.9719118354768109}], "composite_fingerprint": "a12fd381fe9bbefb"}
{"experiment_num": 36, "backbone": "lightgbm", "description": "Exp36 LightGBM Ke2017 min_data_in_leaf 100 on Exp30 champion (isolated LGB paper cycle 10/50)", "config": {"paths": {"results_dir": "C:\\Users\\abhir\\autoresearch-uci\\beijing_pm25\\autoresearch_results"}, "task_type": "regression", "primary_metric": "rmse", "backbone": "lightgbm", "backbone_config": {"seed": 0, "n_jobs": 4, "n_estimators": 2000, "num_leaves": 63, "learning_rate": 0.01, "feature_fraction": 0.8, "bagging_fraction": 0.6, "early_stopping_rounds": 50, "min_data_in_leaf": 100}, "data": {"format": "csv", "path": "C:\\Users\\abhir\\autoresearch-uci\\beijing_pm25\\data\\features_full.csv", "target_columns": ["pm25"], "feature_columns": ["DEWP", "TEMP", "PRES", "Iws", "Is", "Ir", "cbwd_NE", "cbwd_NW", "cbwd_SE", "cbwd_cv", "pm25_lag1", "pm25_lag2", "pm25_lag3", "pm25_lag4", "pm25_lag5", "pm25_lag6", "pm25_lag7", "pm25_lag8", "pm25_lag9", "pm25_lag10", "pm25_lag11", "pm25_lag12", "pm25_lag13", "pm25_lag14", "pm25_lag15", "pm25_lag16", "pm25_lag17", "pm25_lag18", "pm25_lag19", "pm25_lag20", "pm25_lag21", "pm25_lag22", "pm25_lag23", "pm25_lag24", "hour_sin", "hour_cos", "dow", "is_weekend", "pm25_delta1", "inversion_spread"]}, "split": {"name": "calendar_year", "manifest_dir": "C:\\Users\\abhir\\autoresearch-uci\\beijing_pm25\\data"}, "composite": {"higher_is_better": false, "penalty_weight": 0.1, "below_threshold": -40.0}, "hardware": {"n_threads": 4, "cpu_affinity": [0, 2, 4, 6]}, "description": "Exp36 LightGBM Ke2017 min_data_in_leaf 100 on Exp30 champion (isolated LGB paper cycle 10/50)", "seed": 0}, "composite": -22.661806772462096, "val_primary": 22.661806772462096, "test_primary": 21.127404327402225, "per_fold_test": [21.127404327402225], "per_fold_val": [22.661806772462096], "status": "DISCARD", "seconds_elapsed": 13.983810901641846, "timestamp": "2026-08-18T02:35:42", "secondary_metrics": {"mae": 11.617363220787075, "mape": 0.21343612174793625, "r2": 0.9484331851048213, "ic": 0.9727821106424025}, "per_fold_test_reports": [{"fold_id": 0, "regime": "calendar_2014_test", "task_type": "regression", "n": 7950, "rmse": 21.127404327402225, "mae": 11.617363220787075, "mape": 0.21343612174793625, "r2": 0.9484331851048213, "ic": 0.9727821106424025}], "composite_fingerprint": "a12fd381fe9bbefb"}
{"experiment_num": 37, "backbone": "lightgbm", "description": "Exp37 LightGBM Shi2018 linear_tree on Exp30 champion (isolated LGB paper cycle 11/50)", "config": {"paths": {"results_dir": "C:\\Users\\abhir\\autoresearch-uci\\beijing_pm25\\autoresearch_results"}, "task_type": "regression", "primary_metric": "rmse", "backbone": "lightgbm", "backbone_config": {"seed": 0, "n_jobs": 4, "n_estimators": 2000, "num_leaves": 63, "learning_rate": 0.01, "feature_fraction": 0.8, "bagging_fraction": 0.6, "early_stopping_rounds": 50, "linear_tree": true}, "data": {"format": "csv", "path": "C:\\Users\\abhir\\autoresearch-uci\\beijing_pm25\\data\\features_full.csv", "target_columns": ["pm25"], "feature_columns": ["DEWP", "TEMP", "PRES", "Iws", "Is", "Ir", "cbwd_NE", "cbwd_NW", "cbwd_SE", "cbwd_cv", "pm25_lag1", "pm25_lag2", "pm25_lag3", "pm25_lag4", "pm25_lag5", "pm25_lag6", "pm25_lag7", "pm25_lag8", "pm25_lag9", "pm25_lag10", "pm25_lag11", "pm25_lag12", "pm25_lag13", "pm25_lag14", "pm25_lag15", "pm25_lag16", "pm25_lag17", "pm25_lag18", "pm25_lag19", "pm25_lag20", "pm25_lag21", "pm25_lag22", "pm25_lag23", "pm25_lag24", "hour_sin", "hour_cos", "dow", "is_weekend", "pm25_delta1", "inversion_spread"]}, "split": {"name": "calendar_year", "manifest_dir": "C:\\Users\\abhir\\autoresearch-uci\\beijing_pm25\\data"}, "composite": {"higher_is_better": false, "penalty_weight": 0.1, "below_threshold": -40.0}, "hardware": {"n_threads": 4, "cpu_affinity": [0, 2, 4, 6]}, "description": "Exp37 LightGBM Shi2018 linear_tree on Exp30 champion (isolated LGB paper cycle 11/50)", "seed": 0}, "composite": -22.792515382165828, "val_primary": 22.792515382165828, "test_primary": 21.198405561717, "per_fold_test": [21.198405561717], "per_fold_val": [22.792515382165828], "status": "DISCARD", "seconds_elapsed": 16.163432836532593, "timestamp": "2026-08-18T03:04:36", "secondary_metrics": {"mae": 11.5343539520841, "mape": 0.2046241122276471, "r2": 0.9480860095041708, "ic": 0.9732041845669233}, "per_fold_test_reports": [{"fold_id": 0, "regime": "calendar_2014_test", "task_type": "regression", "n": 7950, "rmse": 21.198405561717, "mae": 11.5343539520841, "mape": 0.2046241122276471, "r2": 0.9480860095041708, "ic": 0.9732041845669233}], "composite_fingerprint": "a12fd381fe9bbefb"}
{"experiment_num": 38, "backbone": "lightgbm", "description": "Exp38 add pm25_accel second-diff onset feature on Exp30 (isolated LGB cycle 12/50)", "config": {"paths": {"results_dir": "C:\\Users\\abhir\\autoresearch-uci\\beijing_pm25\\autoresearch_results"}, "task_type": "regression", "primary_metric": "rmse", "backbone": "lightgbm", "backbone_config": {"seed": 0, "n_jobs": 4, "n_estimators": 2000, "num_leaves": 63, "learning_rate": 0.01, "feature_fraction": 0.8, "bagging_fraction": 0.6, "early_stopping_rounds": 50}, "data": {"format": "csv", "path": "C:\\Users\\abhir\\autoresearch-uci\\beijing_pm25\\data\\features_full.csv", "target_columns": ["pm25"], "feature_columns": ["DEWP", "TEMP", "PRES", "Iws", "Is", "Ir", "cbwd_NE", "cbwd_NW", "cbwd_SE", "cbwd_cv", "pm25_lag1", "pm25_lag2", "pm25_lag3", "pm25_lag4", "pm25_lag5", "pm25_lag6", "pm25_lag7", "pm25_lag8", "pm25_lag9", "pm25_lag10", "pm25_lag11", "pm25_lag12", "pm25_lag13", "pm25_lag14", "pm25_lag15", "pm25_lag16", "pm25_lag17", "pm25_lag18", "pm25_lag19", "pm25_lag20", "pm25_lag21", "pm25_lag22", "pm25_lag23", "pm25_lag24", "hour_sin", "hour_cos", "dow", "is_weekend", "pm25_delta1", "inversion_spread", "pm25_accel"]}, "split": {"name": "calendar_year", "manifest_dir": "C:\\Users\\abhir\\autoresearch-uci\\beijing_pm25\\data"}, "composite": {"higher_is_better": false, "penalty_weight": 0.1, "below_threshold": -40.0}, "hardware": {"n_threads": 4, "cpu_affinity": [0, 2, 4, 6]}, "description": "Exp38 add pm25_accel second-diff onset feature on Exp30 (isolated LGB cycle 12/50)", "seed": 0}, "composite": -22.42552263431796, "val_primary": 22.42552263431796, "test_primary": 20.98678004052188, "per_fold_test": [20.98678004052188], "per_fold_val": [22.42552263431796], "status": "DISCARD", "seconds_elapsed": 18.5661838054657, "timestamp": "2026-08-18T03:05:54", "secondary_metrics": {"mae": 11.534703267375138, "mape": 0.21062711123604388, "r2": 0.9491173593899017, "ic": 0.9728522355027359}, "per_fold_test_reports": [{"fold_id": 0, "regime": "calendar_2014_test", "task_type": "regression", "n": 7950, "rmse": 20.98678004052188, "mae": 11.534703267375138, "mape": 0.21062711123604388, "r2": 0.9491173593899017, "ic": 0.9728522355027359}], "composite_fingerprint": "a12fd381fe9bbefb"}
{"experiment_num": 39, "backbone": "lightgbm", "description": "Exp39 t+6 as-of-t-6 features on Exp30 LightGBM (same 2014 timestamps, isolated LGB 13/50)", "config": {"paths": {"results_dir": "C:\\Users\\abhir\\autoresearch-uci\\beijing_pm25\\autoresearch_results"}, "task_type": "regression", "primary_metric": "rmse", "backbone": "lightgbm", "backbone_config": {"seed": 0, "n_jobs": 4, "n_estimators": 2000, "num_leaves": 63, "learning_rate": 0.01, "feature_fraction": 0.8, "bagging_fraction": 0.6, "early_stopping_rounds": 50}, "data": {"format": "csv", "path": "C:\\Users\\abhir\\autoresearch-uci\\beijing_pm25\\data\\features_horizon6.csv", "target_columns": ["pm25"], "feature_columns": ["DEWP", "TEMP", "PRES", "Iws", "Is", "Ir", "cbwd_NE", "cbwd_NW", "cbwd_SE", "cbwd_cv", "pm25_lag1", "pm25_lag2", "pm25_lag3", "pm25_lag4", "pm25_lag5", "pm25_lag6", "pm25_lag7", "pm25_lag8", "pm25_lag9", "pm25_lag10", "pm25_lag11", "pm25_lag12", "pm25_lag13", "pm25_lag14", "pm25_lag15", "pm25_lag16", "pm25_lag17", "pm25_lag18", "pm25_lag19", "pm25_lag20", "pm25_lag21", "pm25_lag22", "pm25_lag23", "pm25_lag24", "hour_sin", "hour_cos", "dow", "is_weekend", "pm25_delta1", "inversion_spread"]}, "split": {"name": "calendar_year", "manifest_dir": "C:\\Users\\abhir\\autoresearch-uci\\beijing_pm25\\data"}, "composite": {"higher_is_better": false, "penalty_weight": 0.1, "below_threshold": -40.0}, "hardware": {"n_threads": 4, "cpu_affinity": [0, 2, 4, 6]}, "description": "Exp39 t+6 as-of-t-6 features on Exp30 LightGBM (same 2014 timestamps, isolated LGB 13/50)", "seed": 0}, "composite": -58.823581242275, "val_primary": 58.723581242274996, "test_primary": 55.32006229965263, "per_fold_test": [55.32006229965263], "per_fold_val": [58.723581242274996], "status": "DISCARD", "seconds_elapsed": 13.221590042114258, "timestamp": "2026-08-18T03:36:28", "secondary_metrics": {"mae": 35.84402347259535, "mape": 0.9204076298891969, "r2": 0.6464561060652263, "ic": 0.7875775084552594}, "per_fold_test_reports": [{"fold_id": 0, "regime": "calendar_2014_test", "task_type": "regression", "n": 7950, "rmse": 55.32006229965263, "mae": 35.84402347259535, "mape": 0.9204076298891969, "r2": 0.6464561060652263, "ic": 0.7875775084552594}], "composite_fingerprint": "a12fd381fe9bbefb"}
{"experiment_num": 40, "backbone": "lightgbm", "description": "Exp40 add vent_index Iws*inversion_spread on Exp30 (isolated LGB 1h cycle 14/50)", "config": {"paths": {"results_dir": "C:\\Users\\abhir\\autoresearch-uci\\beijing_pm25\\autoresearch_results"}, "task_type": "regression", "primary_metric": "rmse", "backbone": "lightgbm", "backbone_config": {"seed": 0, "n_jobs": 4, "n_estimators": 2000, "num_leaves": 63, "learning_rate": 0.01, "feature_fraction": 0.8, "bagging_fraction": 0.6, "early_stopping_rounds": 50}, "data": {"format": "csv", "path": "C:\\Users\\abhir\\autoresearch-uci\\beijing_pm25\\data\\features_full.csv", "target_columns": ["pm25"], "feature_columns": ["DEWP", "TEMP", "PRES", "Iws", "Is", "Ir", "cbwd_NE", "cbwd_NW", "cbwd_SE", "cbwd_cv", "pm25_lag1", "pm25_lag2", "pm25_lag3", "pm25_lag4", "pm25_lag5", "pm25_lag6", "pm25_lag7", "pm25_lag8", "pm25_lag9", "pm25_lag10", "pm25_lag11", "pm25_lag12", "pm25_lag13", "pm25_lag14", "pm25_lag15", "pm25_lag16", "pm25_lag17", "pm25_lag18", "pm25_lag19", "pm25_lag20", "pm25_lag21", "pm25_lag22", "pm25_lag23", "pm25_lag24", "hour_sin", "hour_cos", "dow", "is_weekend", "pm25_delta1", "inversion_spread", "vent_index"]}, "split": {"name": "calendar_year", "manifest_dir": "C:\\Users\\abhir\\autoresearch-uci\\beijing_pm25\\data"}, "composite": {"higher_is_better": false, "penalty_weight": 0.1, "below_threshold": -40.0}, "hardware": {"n_threads": 4, "cpu_affinity": [0, 2, 4, 6]}, "description": "Exp40 add vent_index Iws*inversion_spread on Exp30 (isolated LGB 1h cycle 14/50)", "seed": 0}, "composite": -22.439028001234064, "val_primary": 22.439028001234064, "test_primary": 20.938709695621327, "per_fold_test": [20.938709695621327], "per_fold_val": [22.439028001234064], "status": "DISCARD", "seconds_elapsed": 17.673836946487427, "timestamp": "2026-08-18T03:37:33", "secondary_metrics": {"mae": 11.580112582780442, "mape": 0.21470992421353768, "r2": 0.9493501864221394, "ic": 0.972912682527447}, "per_fold_test_reports": [{"fold_id": 0, "regime": "calendar_2014_test", "task_type": "regression", "n": 7950, "rmse": 20.938709695621327, "mae": 11.580112582780442, "mape": 0.21470992421353768, "r2": 0.9493501864221394, "ic": 0.972912682527447}], "composite_fingerprint": "a12fd381fe9bbefb"}
