{"experiment_num": 104, "backbone": "catboost", "description": "Exp104 CatBoost Plain min_data_in_leaf=20 on Exp97 (CatBoost cycle 30/50)", "config": {"paths": {"results_dir": "C:\\Users\\abhir\\autoresearch-uci\\beijing_pm25\\autoresearch_results"}, "task_type": "regression", "primary_metric": "rmse", "backbone": "catboost", "backbone_config": {"seed": 0, "n_jobs": 4, "iterations": 2000, "depth": 6, "learning_rate": 0.03, "l2_leaf_reg": 3, "early_stopping_rounds": 100, "boosting_type": "Plain", "min_data_in_leaf": 20}, "data": {"format": "csv", "path": "C:\\Users\\abhir\\autoresearch-uci\\beijing_pm25\\data\\features_full.csv", "target_columns": ["pm25"], "feature_columns": ["DEWP", "TEMP", "PRES", "Iws", "Is", "Ir", "cbwd_NE", "cbwd_NW", "cbwd_SE", "cbwd_cv", "pm25_lag1", "pm25_lag2", "pm25_lag3", "pm25_lag4", "pm25_lag5", "pm25_lag6", "pm25_lag7", "pm25_lag8", "pm25_lag9", "pm25_lag10", "pm25_lag11", "pm25_lag12", "pm25_lag13", "pm25_lag14", "pm25_lag15", "pm25_lag16", "pm25_lag17", "pm25_lag18", "pm25_lag19", "pm25_lag20", "pm25_lag21", "pm25_lag22", "pm25_lag23", "pm25_lag24", "hour_sin", "hour_cos", "dow", "is_weekend", "pm25_delta1", "inversion_spread", "rh_magnus", "dewp_delta", "is_heating"]}, "split": {"name": "calendar_year", "manifest_dir": "C:\\Users\\abhir\\autoresearch-uci\\beijing_pm25\\data"}, "composite": {"higher_is_better": false, "penalty_weight": 0.1, "below_threshold": -40.0}, "hardware": {"n_threads": 4, "cpu_affinity": [0, 2, 4, 6]}, "description": "Exp104 CatBoost Plain min_data_in_leaf=20 on Exp97 (CatBoost cycle 30/50)", "seed": 0}, "composite": -22.166611495156538, "val_primary": 22.166611495156538, "test_primary": 20.73514958690229, "per_fold_test": [20.73514958690229], "per_fold_val": [22.166611495156538], "status": "DISCARD", "seconds_elapsed": 27.43677520751953, "timestamp": "2026-08-19T02:05:31", "secondary_metrics": {"mae": 11.397541340218662, "mape": 0.2115776123881099, "r2": 0.9503302052401891, "ic": 0.9727164800634}, "per_fold_test_reports": [{"fold_id": 0, "regime": "calendar_2014_test", "task_type": "regression", "n": 7950, "rmse": 20.73514958690229, "mae": 11.397541340218662, "mape": 0.2115776123881099, "r2": 0.9503302052401891, "ic": 0.9727164800634}], "composite_fingerprint": "a12fd381fe9bbefb"}
{"experiment_num": 105, "backbone": "catboost", "description": "Exp105 CatBoost Plain early_stopping_rounds=50 on Exp97 (CatBoost cycle 31/50)", "config": {"paths": {"results_dir": "C:\\Users\\abhir\\autoresearch-uci\\beijing_pm25\\autoresearch_results"}, "task_type": "regression", "primary_metric": "rmse", "backbone": "catboost", "backbone_config": {"seed": 0, "n_jobs": 4, "iterations": 2000, "depth": 6, "learning_rate": 0.03, "l2_leaf_reg": 3, "early_stopping_rounds": 50, "boosting_type": "Plain"}, "data": {"format": "csv", "path": "C:\\Users\\abhir\\autoresearch-uci\\beijing_pm25\\data\\features_full.csv", "target_columns": ["pm25"], "feature_columns": ["DEWP", "TEMP", "PRES", "Iws", "Is", "Ir", "cbwd_NE", "cbwd_NW", "cbwd_SE", "cbwd_cv", "pm25_lag1", "pm25_lag2", "pm25_lag3", "pm25_lag4", "pm25_lag5", "pm25_lag6", "pm25_lag7", "pm25_lag8", "pm25_lag9", "pm25_lag10", "pm25_lag11", "pm25_lag12", "pm25_lag13", "pm25_lag14", "pm25_lag15", "pm25_lag16", "pm25_lag17", "pm25_lag18", "pm25_lag19", "pm25_lag20", "pm25_lag21", "pm25_lag22", "pm25_lag23", "pm25_lag24", "hour_sin", "hour_cos", "dow", "is_weekend", "pm25_delta1", "inversion_spread", "rh_magnus", "dewp_delta", "is_heating"]}, "split": {"name": "calendar_year", "manifest_dir": "C:\\Users\\abhir\\autoresearch-uci\\beijing_pm25\\data"}, "composite": {"higher_is_better": false, "penalty_weight": 0.1, "below_threshold": -40.0}, "hardware": {"n_threads": 4, "cpu_affinity": [0, 2, 4, 6]}, "description": "Exp105 CatBoost Plain early_stopping_rounds=50 on Exp97 (CatBoost cycle 31/50)", "seed": 0}, "composite": -22.166611495156538, "val_primary": 22.166611495156538, "test_primary": 20.73514958690229, "per_fold_test": [20.73514958690229], "per_fold_val": [22.166611495156538], "status": "DISCARD", "seconds_elapsed": 26.207004070281982, "timestamp": "2026-08-19T02:35:45", "secondary_metrics": {"mae": 11.397541340218662, "mape": 0.2115776123881099, "r2": 0.9503302052401891, "ic": 0.9727164800634}, "per_fold_test_reports": [{"fold_id": 0, "regime": "calendar_2014_test", "task_type": "regression", "n": 7950, "rmse": 20.73514958690229, "mae": 11.397541340218662, "mape": 0.2115776123881099, "r2": 0.9503302052401891, "ic": 0.9727164800634}], "composite_fingerprint": "a12fd381fe9bbefb"}
{"experiment_num": 106, "backbone": "catboost", "description": "Exp106 CatBoost Plain add pm25_delta6 on Exp97 (CatBoost cycle 32/50)", "config": {"paths": {"results_dir": "C:\\Users\\abhir\\autoresearch-uci\\beijing_pm25\\autoresearch_results"}, "task_type": "regression", "primary_metric": "rmse", "backbone": "catboost", "backbone_config": {"seed": 0, "n_jobs": 4, "iterations": 2000, "depth": 6, "learning_rate": 0.03, "l2_leaf_reg": 3, "early_stopping_rounds": 100, "boosting_type": "Plain"}, "data": {"format": "csv", "path": "C:\\Users\\abhir\\autoresearch-uci\\beijing_pm25\\data\\features_full.csv", "target_columns": ["pm25"], "feature_columns": ["DEWP", "TEMP", "PRES", "Iws", "Is", "Ir", "cbwd_NE", "cbwd_NW", "cbwd_SE", "cbwd_cv", "pm25_lag1", "pm25_lag2", "pm25_lag3", "pm25_lag4", "pm25_lag5", "pm25_lag6", "pm25_lag7", "pm25_lag8", "pm25_lag9", "pm25_lag10", "pm25_lag11", "pm25_lag12", "pm25_lag13", "pm25_lag14", "pm25_lag15", "pm25_lag16", "pm25_lag17", "pm25_lag18", "pm25_lag19", "pm25_lag20", "pm25_lag21", "pm25_lag22", "pm25_lag23", "pm25_lag24", "hour_sin", "hour_cos", "dow", "is_weekend", "pm25_delta1", "inversion_spread", "rh_magnus", "dewp_delta", "is_heating", "pm25_delta6"]}, "split": {"name": "calendar_year", "manifest_dir": "C:\\Users\\abhir\\autoresearch-uci\\beijing_pm25\\data"}, "composite": {"higher_is_better": false, "penalty_weight": 0.1, "below_threshold": -40.0}, "hardware": {"n_threads": 4, "cpu_affinity": [0, 2, 4, 6]}, "description": "Exp106 CatBoost Plain add pm25_delta6 on Exp97 (CatBoost cycle 32/50)", "seed": 0}, "composite": -22.345078242352013, "val_primary": 22.345078242352013, "test_primary": 20.67112326209131, "per_fold_test": [20.67112326209131], "per_fold_val": [22.345078242352013], "status": "DISCARD", "seconds_elapsed": 20.184021472930908, "timestamp": "2026-08-19T03:12:56", "secondary_metrics": {"mae": 11.380497202997905, "mape": 0.21568179284444955, "r2": 0.9506364740233202, "ic": 0.9725343774956123}, "per_fold_test_reports": [{"fold_id": 0, "regime": "calendar_2014_test", "task_type": "regression", "n": 7950, "rmse": 20.67112326209131, "mae": 11.380497202997905, "mape": 0.21568179284444955, "r2": 0.9506364740233202, "ic": 0.9725343774956123}], "composite_fingerprint": "a12fd381fe9bbefb"}
{"experiment_num": 107, "backbone": "catboost", "description": "Exp107 CatBoost Plain add log_iws on Exp97 (CatBoost cycle 33/50)", "config": {"paths": {"results_dir": "C:\\Users\\abhir\\autoresearch-uci\\beijing_pm25\\autoresearch_results"}, "task_type": "regression", "primary_metric": "rmse", "backbone": "catboost", "backbone_config": {"seed": 0, "n_jobs": 4, "iterations": 2000, "depth": 6, "learning_rate": 0.03, "l2_leaf_reg": 3, "early_stopping_rounds": 100, "boosting_type": "Plain"}, "data": {"format": "csv", "path": "C:\\Users\\abhir\\autoresearch-uci\\beijing_pm25\\data\\features_full.csv", "target_columns": ["pm25"], "feature_columns": ["DEWP", "TEMP", "PRES", "Iws", "Is", "Ir", "cbwd_NE", "cbwd_NW", "cbwd_SE", "cbwd_cv", "pm25_lag1", "pm25_lag2", "pm25_lag3", "pm25_lag4", "pm25_lag5", "pm25_lag6", "pm25_lag7", "pm25_lag8", "pm25_lag9", "pm25_lag10", "pm25_lag11", "pm25_lag12", "pm25_lag13", "pm25_lag14", "pm25_lag15", "pm25_lag16", "pm25_lag17", "pm25_lag18", "pm25_lag19", "pm25_lag20", "pm25_lag21", "pm25_lag22", "pm25_lag23", "pm25_lag24", "hour_sin", "hour_cos", "dow", "is_weekend", "pm25_delta1", "inversion_spread", "rh_magnus", "dewp_delta", "is_heating", "log_iws"]}, "split": {"name": "calendar_year", "manifest_dir": "C:\\Users\\abhir\\autoresearch-uci\\beijing_pm25\\data"}, "composite": {"higher_is_better": false, "penalty_weight": 0.1, "below_threshold": -40.0}, "hardware": {"n_threads": 4, "cpu_affinity": [0, 2, 4, 6]}, "description": "Exp107 CatBoost Plain add log_iws on Exp97 (CatBoost cycle 33/50)", "seed": 0}, "composite": -22.310065512651132, "val_primary": 22.310065512651132, "test_primary": 20.782813231080127, "per_fold_test": [20.782813231080127], "per_fold_val": [22.310065512651132], "status": "DISCARD", "seconds_elapsed": 26.81318736076355, "timestamp": "2026-08-19T03:17:13", "secondary_metrics": {"mae": 11.39949818924636, "mape": 0.21086748447509113, "r2": 0.9501015920420017, "ic": 0.9727476938279782}, "per_fold_test_reports": [{"fold_id": 0, "regime": "calendar_2014_test", "task_type": "regression", "n": 7950, "rmse": 20.782813231080127, "mae": 11.39949818924636, "mape": 0.21086748447509113, "r2": 0.9501015920420017, "ic": 0.9727476938279782}], "composite_fingerprint": "a12fd381fe9bbefb"}
{"experiment_num": 108, "backbone": "catboost", "description": "Exp108 CatBoost Plain add is_severe on Exp97 (CatBoost cycle 34/50)", "config": {"paths": {"results_dir": "C:\\Users\\abhir\\autoresearch-uci\\beijing_pm25\\autoresearch_results"}, "task_type": "regression", "primary_metric": "rmse", "backbone": "catboost", "backbone_config": {"seed": 0, "n_jobs": 4, "iterations": 2000, "depth": 6, "learning_rate": 0.03, "l2_leaf_reg": 3, "early_stopping_rounds": 100, "boosting_type": "Plain"}, "data": {"format": "csv", "path": "C:\\Users\\abhir\\autoresearch-uci\\beijing_pm25\\data\\features_full.csv", "target_columns": ["pm25"], "feature_columns": ["DEWP", "TEMP", "PRES", "Iws", "Is", "Ir", "cbwd_NE", "cbwd_NW", "cbwd_SE", "cbwd_cv", "pm25_lag1", "pm25_lag2", "pm25_lag3", "pm25_lag4", "pm25_lag5", "pm25_lag6", "pm25_lag7", "pm25_lag8", "pm25_lag9", "pm25_lag10", "pm25_lag11", "pm25_lag12", "pm25_lag13", "pm25_lag14", "pm25_lag15", "pm25_lag16", "pm25_lag17", "pm25_lag18", "pm25_lag19", "pm25_lag20", "pm25_lag21", "pm25_lag22", "pm25_lag23", "pm25_lag24", "hour_sin", "hour_cos", "dow", "is_weekend", "pm25_delta1", "inversion_spread", "rh_magnus", "dewp_delta", "is_heating", "is_severe"]}, "split": {"name": "calendar_year", "manifest_dir": "C:\\Users\\abhir\\autoresearch-uci\\beijing_pm25\\data"}, "composite": {"higher_is_better": false, "penalty_weight": 0.1, "below_threshold": -40.0}, "hardware": {"n_threads": 4, "cpu_affinity": [0, 2, 4, 6]}, "description": "Exp108 CatBoost Plain add is_severe on Exp97 (CatBoost cycle 34/50)", "seed": 0}, "composite": -22.313170815964387, "val_primary": 22.313170815964387, "test_primary": 20.898591985907345, "per_fold_test": [20.898591985907345], "per_fold_val": [22.313170815964387], "status": "DISCARD", "seconds_elapsed": 28.05578875541687, "timestamp": "2026-08-19T03:37:22", "secondary_metrics": {"mae": 11.407180099722034, "mape": 0.21115593416871567, "r2": 0.9495440864261893, "ic": 0.9727370199247438}, "per_fold_test_reports": [{"fold_id": 0, "regime": "calendar_2014_test", "task_type": "regression", "n": 7950, "rmse": 20.898591985907345, "mae": 11.407180099722034, "mape": 0.21115593416871567, "r2": 0.9495440864261893, "ic": 0.9727370199247438}], "composite_fingerprint": "a12fd381fe9bbefb"}
{"experiment_num": 109, "backbone": "catboost", "description": "Exp109 CatBoost Plain add evening_peak on Exp97 (CatBoost cycle 35/50)", "config": {"paths": {"results_dir": "C:\\Users\\abhir\\autoresearch-uci\\beijing_pm25\\autoresearch_results"}, "task_type": "regression", "primary_metric": "rmse", "backbone": "catboost", "backbone_config": {"seed": 0, "n_jobs": 4, "iterations": 2000, "depth": 6, "learning_rate": 0.03, "l2_leaf_reg": 3, "early_stopping_rounds": 100, "boosting_type": "Plain"}, "data": {"format": "csv", "path": "C:\\Users\\abhir\\autoresearch-uci\\beijing_pm25\\data\\features_full.csv", "target_columns": ["pm25"], "feature_columns": ["DEWP", "TEMP", "PRES", "Iws", "Is", "Ir", "cbwd_NE", "cbwd_NW", "cbwd_SE", "cbwd_cv", "pm25_lag1", "pm25_lag2", "pm25_lag3", "pm25_lag4", "pm25_lag5", "pm25_lag6", "pm25_lag7", "pm25_lag8", "pm25_lag9", "pm25_lag10", "pm25_lag11", "pm25_lag12", "pm25_lag13", "pm25_lag14", "pm25_lag15", "pm25_lag16", "pm25_lag17", "pm25_lag18", "pm25_lag19", "pm25_lag20", "pm25_lag21", "pm25_lag22", "pm25_lag23", "pm25_lag24", "hour_sin", "hour_cos", "dow", "is_weekend", "pm25_delta1", "inversion_spread", "rh_magnus", "dewp_delta", "is_heating", "evening_peak"]}, "split": {"name": "calendar_year", "manifest_dir": "C:\\Users\\abhir\\autoresearch-uci\\beijing_pm25\\data"}, "composite": {"higher_is_better": false, "penalty_weight": 0.1, "below_threshold": -40.0}, "hardware": {"n_threads": 4, "cpu_affinity": [0, 2, 4, 6]}, "description": "Exp109 CatBoost Plain add evening_peak on Exp97 (CatBoost cycle 35/50)", "seed": 0}, "composite": -22.34864373138394, "val_primary": 22.34864373138394, "test_primary": 20.756439328908584, "per_fold_test": [20.756439328908584], "per_fold_val": [22.34864373138394], "status": "DISCARD", "seconds_elapsed": 29.764411211013794, "timestamp": "2026-08-19T03:39:11", "secondary_metrics": {"mae": 11.3798189424216, "mape": 0.21013851754934953, "r2": 0.950228156303267, "ic": 0.9729040435330027}, "per_fold_test_reports": [{"fold_id": 0, "regime": "calendar_2014_test", "task_type": "regression", "n": 7950, "rmse": 20.756439328908584, "mae": 11.3798189424216, "mape": 0.21013851754934953, "r2": 0.950228156303267, "ic": 0.9729040435330027}], "composite_fingerprint": "a12fd381fe9bbefb"}
{"experiment_num": 110, "backbone": "catboost", "description": "Exp110 CatBoost Plain add rh_delta on Exp97 (CatBoost cycle 36/50)", "config": {"paths": {"results_dir": "C:\\Users\\abhir\\autoresearch-uci\\beijing_pm25\\autoresearch_results"}, "task_type": "regression", "primary_metric": "rmse", "backbone": "catboost", "backbone_config": {"seed": 0, "n_jobs": 4, "iterations": 2000, "depth": 6, "learning_rate": 0.03, "l2_leaf_reg": 3, "early_stopping_rounds": 100, "boosting_type": "Plain"}, "data": {"format": "csv", "path": "C:\\Users\\abhir\\autoresearch-uci\\beijing_pm25\\data\\features_full.csv", "target_columns": ["pm25"], "feature_columns": ["DEWP", "TEMP", "PRES", "Iws", "Is", "Ir", "cbwd_NE", "cbwd_NW", "cbwd_SE", "cbwd_cv", "pm25_lag1", "pm25_lag2", "pm25_lag3", "pm25_lag4", "pm25_lag5", "pm25_lag6", "pm25_lag7", "pm25_lag8", "pm25_lag9", "pm25_lag10", "pm25_lag11", "pm25_lag12", "pm25_lag13", "pm25_lag14", "pm25_lag15", "pm25_lag16", "pm25_lag17", "pm25_lag18", "pm25_lag19", "pm25_lag20", "pm25_lag21", "pm25_lag22", "pm25_lag23", "pm25_lag24", "hour_sin", "hour_cos", "dow", "is_weekend", "pm25_delta1", "inversion_spread", "rh_magnus", "dewp_delta", "is_heating", "rh_delta"]}, "split": {"name": "calendar_year", "manifest_dir": "C:\\Users\\abhir\\autoresearch-uci\\beijing_pm25\\data"}, "composite": {"higher_is_better": false, "penalty_weight": 0.1, "below_threshold": -40.0}, "hardware": {"n_threads": 4, "cpu_affinity": [0, 2, 4, 6]}, "description": "Exp110 CatBoost Plain add rh_delta on Exp97 (CatBoost cycle 36/50)", "seed": 0}, "composite": -22.235896888570515, "val_primary": 22.235896888570515, "test_primary": 20.661034621427596, "per_fold_test": [20.661034621427596], "per_fold_val": [22.235896888570515], "status": "DISCARD", "seconds_elapsed": 29.915745735168457, "timestamp": "2026-08-19T04:09:28", "secondary_metrics": {"mae": 11.382931345828112, "mape": 0.2099552605666456, "r2": 0.9506846464753794, "ic": 0.9727174605596193}, "per_fold_test_reports": [{"fold_id": 0, "regime": "calendar_2014_test", "task_type": "regression", "n": 7950, "rmse": 20.661034621427596, "mae": 11.382931345828112, "mape": 0.2099552605666456, "r2": 0.9506846464753794, "ic": 0.9727174605596193}], "composite_fingerprint": "a12fd381fe9bbefb"}
{"experiment_num": 111, "backbone": "catboost", "description": "Exp111 CatBoost Plain add temp_delta on Exp97 (CatBoost cycle 37/50)", "config": {"paths": {"results_dir": "C:\\Users\\abhir\\autoresearch-uci\\beijing_pm25\\autoresearch_results"}, "task_type": "regression", "primary_metric": "rmse", "backbone": "catboost", "backbone_config": {"seed": 0, "n_jobs": 4, "iterations": 2000, "depth": 6, "learning_rate": 0.03, "l2_leaf_reg": 3, "early_stopping_rounds": 100, "boosting_type": "Plain"}, "data": {"format": "csv", "path": "C:\\Users\\abhir\\autoresearch-uci\\beijing_pm25\\data\\features_full.csv", "target_columns": ["pm25"], "feature_columns": ["DEWP", "TEMP", "PRES", "Iws", "Is", "Ir", "cbwd_NE", "cbwd_NW", "cbwd_SE", "cbwd_cv", "pm25_lag1", "pm25_lag2", "pm25_lag3", "pm25_lag4", "pm25_lag5", "pm25_lag6", "pm25_lag7", "pm25_lag8", "pm25_lag9", "pm25_lag10", "pm25_lag11", "pm25_lag12", "pm25_lag13", "pm25_lag14", "pm25_lag15", "pm25_lag16", "pm25_lag17", "pm25_lag18", "pm25_lag19", "pm25_lag20", "pm25_lag21", "pm25_lag22", "pm25_lag23", "pm25_lag24", "hour_sin", "hour_cos", "dow", "is_weekend", "pm25_delta1", "inversion_spread", "rh_magnus", "dewp_delta", "is_heating", "temp_delta"]}, "split": {"name": "calendar_year", "manifest_dir": "C:\\Users\\abhir\\autoresearch-uci\\beijing_pm25\\data"}, "composite": {"higher_is_better": false, "penalty_weight": 0.1, "below_threshold": -40.0}, "hardware": {"n_threads": 4, "cpu_affinity": [0, 2, 4, 6]}, "description": "Exp111 CatBoost Plain add temp_delta on Exp97 (CatBoost cycle 37/50)", "seed": 0}, "composite": -22.357416916022654, "val_primary": 22.357416916022654, "test_primary": 20.714695102532197, "per_fold_test": [20.714695102532197], "per_fold_val": [22.357416916022654], "status": "DISCARD", "seconds_elapsed": 20.83648991584778, "timestamp": "2026-08-19T04:39:14", "secondary_metrics": {"mae": 11.39390659623421, "mape": 0.21535300596199933, "r2": 0.9504281518623967, "ic": 0.9725781683124377}, "per_fold_test_reports": [{"fold_id": 0, "regime": "calendar_2014_test", "task_type": "regression", "n": 7950, "rmse": 20.714695102532197, "mae": 11.39390659623421, "mape": 0.21535300596199933, "r2": 0.9504281518623967, "ic": 0.9725781683124377}], "composite_fingerprint": "a12fd381fe9bbefb"}
{"experiment_num": 112, "backbone": "catboost", "description": "Exp112 CatBoost Plain add se_iws on Exp97 (CatBoost cycle 38/50)", "config": {"paths": {"results_dir": "C:\\Users\\abhir\\autoresearch-uci\\beijing_pm25\\autoresearch_results"}, "task_type": "regression", "primary_metric": "rmse", "backbone": "catboost", "backbone_config": {"seed": 0, "n_jobs": 4, "iterations": 2000, "depth": 6, "learning_rate": 0.03, "l2_leaf_reg": 3, "early_stopping_rounds": 100, "boosting_type": "Plain"}, "data": {"format": "csv", "path": "C:\\Users\\abhir\\autoresearch-uci\\beijing_pm25\\data\\features_full.csv", "target_columns": ["pm25"], "feature_columns": ["DEWP", "TEMP", "PRES", "Iws", "Is", "Ir", "cbwd_NE", "cbwd_NW", "cbwd_SE", "cbwd_cv", "pm25_lag1", "pm25_lag2", "pm25_lag3", "pm25_lag4", "pm25_lag5", "pm25_lag6", "pm25_lag7", "pm25_lag8", "pm25_lag9", "pm25_lag10", "pm25_lag11", "pm25_lag12", "pm25_lag13", "pm25_lag14", "pm25_lag15", "pm25_lag16", "pm25_lag17", "pm25_lag18", "pm25_lag19", "pm25_lag20", "pm25_lag21", "pm25_lag22", "pm25_lag23", "pm25_lag24", "hour_sin", "hour_cos", "dow", "is_weekend", "pm25_delta1", "inversion_spread", "rh_magnus", "dewp_delta", "is_heating", "se_iws"]}, "split": {"name": "calendar_year", "manifest_dir": "C:\\Users\\abhir\\autoresearch-uci\\beijing_pm25\\data"}, "composite": {"higher_is_better": false, "penalty_weight": 0.1, "below_threshold": -40.0}, "hardware": {"n_threads": 4, "cpu_affinity": [0, 2, 4, 6]}, "description": "Exp112 CatBoost Plain add se_iws on Exp97 (CatBoost cycle 38/50)", "seed": 0}, "composite": -22.31642588627105, "val_primary": 22.31642588627105, "test_primary": 20.80416536517945, "per_fold_test": [20.80416536517945], "per_fold_val": [22.31642588627105], "status": "DISCARD", "seconds_elapsed": 33.87798523902893, "timestamp": "2026-08-19T05:08:39", "secondary_metrics": {"mae": 11.39421594365415, "mape": 0.20876347835289424, "r2": 0.9499990087393309, "ic": 0.9727774490641281}, "per_fold_test_reports": [{"fold_id": 0, "regime": "calendar_2014_test", "task_type": "regression", "n": 7950, "rmse": 20.80416536517945, "mae": 11.39421594365415, "mape": 0.20876347835289424, "r2": 0.9499990087393309, "ic": 0.9727774490641281}], "composite_fingerprint": "a12fd381fe9bbefb"}
