{"experiment_num": 59, "backbone": "lightgbm", "description": "Exp59 t+6 add cbwd_prev_NW previous-hour NW dummy on Exp56 recipe (LGB side ladder 33/50)", "config": {"paths": {"results_dir": "C:\\Users\\abhir\\autoresearch-uci\\beijing_pm25\\autoresearch_results"}, "task_type": "regression", "primary_metric": "rmse", "backbone": "lightgbm", "backbone_config": {"seed": 0, "n_jobs": 4, "n_estimators": 2000, "num_leaves": 31, "learning_rate": 0.01, "feature_fraction": 0.8, "bagging_fraction": 0.6, "early_stopping_rounds": 50}, "data": {"format": "csv", "path": "C:\\Users\\abhir\\autoresearch-uci\\beijing_pm25\\data\\features_horizon6.csv", "target_columns": ["pm25"], "feature_columns": ["DEWP", "TEMP", "PRES", "Iws", "Is", "Ir", "cbwd_NE", "cbwd_NW", "cbwd_SE", "cbwd_cv", "pm25_lag1", "pm25_lag2", "pm25_lag3", "pm25_lag4", "pm25_lag5", "pm25_lag6", "pm25_lag7", "pm25_lag8", "pm25_lag9", "pm25_lag10", "pm25_lag11", "pm25_lag12", "pm25_lag13", "pm25_lag14", "pm25_lag15", "pm25_lag16", "pm25_lag17", "pm25_lag18", "pm25_lag19", "pm25_lag20", "pm25_lag21", "pm25_lag22", "pm25_lag23", "pm25_lag24", "hour_sin", "hour_cos", "dow", "is_weekend", "pm25_delta1", "inversion_spread", "month_sin", "pres_delta", "dewp_delta", "cbwd_prev_NW"]}, "split": {"name": "calendar_year", "manifest_dir": "C:\\Users\\abhir\\autoresearch-uci\\beijing_pm25\\data"}, "composite": {"higher_is_better": false, "penalty_weight": 0.1, "below_threshold": -40.0}, "hardware": {"n_threads": 4, "cpu_affinity": [0, 2, 4, 6]}, "description": "Exp59 t+6 add cbwd_prev_NW previous-hour NW dummy on Exp56 recipe (LGB side ladder 33/50)", "seed": 0}, "composite": -57.70128889496701, "val_primary": 57.601288894967006, "test_primary": 54.41875999693485, "per_fold_test": [54.41875999693485], "per_fold_val": [57.601288894967006], "status": "DISCARD", "seconds_elapsed": 9.12459921836853, "timestamp": "2026-08-18T09:05:17", "secondary_metrics": {"mae": 35.24523588363919, "mape": 0.9042178234361528, "r2": 0.6578824895535639, "ic": 0.7933955076144025}, "per_fold_test_reports": [{"fold_id": 0, "regime": "calendar_2014_test", "task_type": "regression", "n": 7950, "rmse": 54.41875999693485, "mae": 35.24523588363919, "mape": 0.9042178234361528, "r2": 0.6578824895535639, "ic": 0.7933955076144025}], "composite_fingerprint": "a12fd381fe9bbefb"}
{"experiment_num": 60, "backbone": "lightgbm", "description": "Exp60 t+6 add rain_mass Ir times persist scavenging on Exp59 recipe (LGB side ladder 34/50)", "config": {"paths": {"results_dir": "C:\\Users\\abhir\\autoresearch-uci\\beijing_pm25\\autoresearch_results"}, "task_type": "regression", "primary_metric": "rmse", "backbone": "lightgbm", "backbone_config": {"seed": 0, "n_jobs": 4, "n_estimators": 2000, "num_leaves": 31, "learning_rate": 0.01, "feature_fraction": 0.8, "bagging_fraction": 0.6, "early_stopping_rounds": 50}, "data": {"format": "csv", "path": "C:\\Users\\abhir\\autoresearch-uci\\beijing_pm25\\data\\features_horizon6.csv", "target_columns": ["pm25"], "feature_columns": ["DEWP", "TEMP", "PRES", "Iws", "Is", "Ir", "cbwd_NE", "cbwd_NW", "cbwd_SE", "cbwd_cv", "pm25_lag1", "pm25_lag2", "pm25_lag3", "pm25_lag4", "pm25_lag5", "pm25_lag6", "pm25_lag7", "pm25_lag8", "pm25_lag9", "pm25_lag10", "pm25_lag11", "pm25_lag12", "pm25_lag13", "pm25_lag14", "pm25_lag15", "pm25_lag16", "pm25_lag17", "pm25_lag18", "pm25_lag19", "pm25_lag20", "pm25_lag21", "pm25_lag22", "pm25_lag23", "pm25_lag24", "hour_sin", "hour_cos", "dow", "is_weekend", "pm25_delta1", "inversion_spread", "month_sin", "pres_delta", "dewp_delta", "cbwd_prev_NW", "rain_mass"]}, "split": {"name": "calendar_year", "manifest_dir": "C:\\Users\\abhir\\autoresearch-uci\\beijing_pm25\\data"}, "composite": {"higher_is_better": false, "penalty_weight": 0.1, "below_threshold": -40.0}, "hardware": {"n_threads": 4, "cpu_affinity": [0, 2, 4, 6]}, "description": "Exp60 t+6 add rain_mass Ir times persist scavenging on Exp59 recipe (LGB side ladder 34/50)", "seed": 0}, "composite": -57.94852405474075, "val_primary": 57.84852405474075, "test_primary": 54.324225051051926, "per_fold_test": [54.324225051051926], "per_fold_val": [57.84852405474075], "status": "DISCARD", "seconds_elapsed": 10.174546718597412, "timestamp": "2026-08-18T09:34:56", "secondary_metrics": {"mae": 35.14333363336, "mape": 0.9057771456351968, "r2": 0.6590700935495866, "ic": 0.7937147609807296}, "per_fold_test_reports": [{"fold_id": 0, "regime": "calendar_2014_test", "task_type": "regression", "n": 7950, "rmse": 54.324225051051926, "mae": 35.14333363336, "mape": 0.9057771456351968, "r2": 0.6590700935495866, "ic": 0.7937147609807296}], "composite_fingerprint": "a12fd381fe9bbefb"}
{"experiment_num": 61, "backbone": "lightgbm", "description": "Exp61 t+6 bagging_freq=1 on Exp59 recipe to activate 0.6 bagging (LGB side ladder 35/50)", "config": {"paths": {"results_dir": "C:\\Users\\abhir\\autoresearch-uci\\beijing_pm25\\autoresearch_results"}, "task_type": "regression", "primary_metric": "rmse", "backbone": "lightgbm", "backbone_config": {"seed": 0, "n_jobs": 4, "n_estimators": 2000, "num_leaves": 31, "learning_rate": 0.01, "feature_fraction": 0.8, "bagging_fraction": 0.6, "early_stopping_rounds": 50, "bagging_freq": 1}, "data": {"format": "csv", "path": "C:\\Users\\abhir\\autoresearch-uci\\beijing_pm25\\data\\features_horizon6.csv", "target_columns": ["pm25"], "feature_columns": ["DEWP", "TEMP", "PRES", "Iws", "Is", "Ir", "cbwd_NE", "cbwd_NW", "cbwd_SE", "cbwd_cv", "pm25_lag1", "pm25_lag2", "pm25_lag3", "pm25_lag4", "pm25_lag5", "pm25_lag6", "pm25_lag7", "pm25_lag8", "pm25_lag9", "pm25_lag10", "pm25_lag11", "pm25_lag12", "pm25_lag13", "pm25_lag14", "pm25_lag15", "pm25_lag16", "pm25_lag17", "pm25_lag18", "pm25_lag19", "pm25_lag20", "pm25_lag21", "pm25_lag22", "pm25_lag23", "pm25_lag24", "hour_sin", "hour_cos", "dow", "is_weekend", "pm25_delta1", "inversion_spread", "month_sin", "pres_delta", "dewp_delta", "cbwd_prev_NW"]}, "split": {"name": "calendar_year", "manifest_dir": "C:\\Users\\abhir\\autoresearch-uci\\beijing_pm25\\data"}, "composite": {"higher_is_better": false, "penalty_weight": 0.1, "below_threshold": -40.0}, "hardware": {"n_threads": 4, "cpu_affinity": [0, 2, 4, 6]}, "description": "Exp61 t+6 bagging_freq=1 on Exp59 recipe to activate 0.6 bagging (LGB side ladder 35/50)", "seed": 0}, "composite": -57.836478953011785, "val_primary": 57.73647895301178, "test_primary": 54.429926941443284, "per_fold_test": [54.429926941443284], "per_fold_val": [57.73647895301178], "status": "DISCARD", "seconds_elapsed": 9.352991819381714, "timestamp": "2026-08-18T10:05:03", "secondary_metrics": {"mae": 35.19714271889439, "mape": 0.9020786289393922, "r2": 0.6577420674184007, "ic": 0.7941731247050847}, "per_fold_test_reports": [{"fold_id": 0, "regime": "calendar_2014_test", "task_type": "regression", "n": 7950, "rmse": 54.429926941443284, "mae": 35.19714271889439, "mape": 0.9020786289393922, "r2": 0.6577420674184007, "ic": 0.7941731247050847}], "composite_fingerprint": "a12fd381fe9bbefb"}
{"experiment_num": 62, "backbone": "lightgbm", "description": "Exp62 t+6 drop pm25_lag13-24 to free splits for NW-on-haze (LGB side ladder 36/50)", "config": {"paths": {"results_dir": "C:\\Users\\abhir\\autoresearch-uci\\beijing_pm25\\autoresearch_results"}, "task_type": "regression", "primary_metric": "rmse", "backbone": "lightgbm", "backbone_config": {"seed": 0, "n_jobs": 4, "n_estimators": 2000, "num_leaves": 31, "learning_rate": 0.01, "feature_fraction": 0.8, "bagging_fraction": 0.6, "early_stopping_rounds": 50}, "data": {"format": "csv", "path": "C:\\Users\\abhir\\autoresearch-uci\\beijing_pm25\\data\\features_horizon6.csv", "target_columns": ["pm25"], "feature_columns": ["DEWP", "TEMP", "PRES", "Iws", "Is", "Ir", "cbwd_NE", "cbwd_NW", "cbwd_SE", "cbwd_cv", "pm25_lag1", "pm25_lag2", "pm25_lag3", "pm25_lag4", "pm25_lag5", "pm25_lag6", "pm25_lag7", "pm25_lag8", "pm25_lag9", "pm25_lag10", "pm25_lag11", "pm25_lag12", "hour_sin", "hour_cos", "dow", "is_weekend", "pm25_delta1", "inversion_spread", "month_sin", "pres_delta", "dewp_delta", "cbwd_prev_NW"]}, "split": {"name": "calendar_year", "manifest_dir": "C:\\Users\\abhir\\autoresearch-uci\\beijing_pm25\\data"}, "composite": {"higher_is_better": false, "penalty_weight": 0.1, "below_threshold": -40.0}, "hardware": {"n_threads": 4, "cpu_affinity": [0, 2, 4, 6]}, "description": "Exp62 t+6 drop pm25_lag13-24 to free splits for NW-on-haze (LGB side ladder 36/50)", "seed": 0}, "composite": -58.15136927957469, "val_primary": 58.051369279574686, "test_primary": 53.83480654369528, "per_fold_test": [53.83480654369528], "per_fold_val": [58.051369279574686], "status": "DISCARD", "seconds_elapsed": 7.1410603523254395, "timestamp": "2026-08-18T10:35:29", "secondary_metrics": {"mae": 34.977526016102594, "mape": 0.8997410383255325, "r2": 0.6651854418616086, "ic": 0.7933699500627609}, "per_fold_test_reports": [{"fold_id": 0, "regime": "calendar_2014_test", "task_type": "regression", "n": 7950, "rmse": 53.83480654369528, "mae": 34.977526016102594, "mape": 0.8997410383255325, "r2": 0.6651854418616086, "ic": 0.7933699500627609}], "composite_fingerprint": "a12fd381fe9bbefb"}
{"experiment_num": 63, "backbone": "lightgbm", "description": "Exp63 t+6 regression_l1 MAE on Exp59 recipe to stop L2 sacrificing typical hours (LGB side ladder 37/50)", "config": {"paths": {"results_dir": "C:\\Users\\abhir\\autoresearch-uci\\beijing_pm25\\autoresearch_results"}, "task_type": "regression", "primary_metric": "rmse", "backbone": "lightgbm", "backbone_config": {"seed": 0, "n_jobs": 4, "n_estimators": 2000, "num_leaves": 31, "learning_rate": 0.01, "feature_fraction": 0.8, "bagging_fraction": 0.6, "early_stopping_rounds": 50, "lgb_objective": "regression_l1"}, "data": {"format": "csv", "path": "C:\\Users\\abhir\\autoresearch-uci\\beijing_pm25\\data\\features_horizon6.csv", "target_columns": ["pm25"], "feature_columns": ["DEWP", "TEMP", "PRES", "Iws", "Is", "Ir", "cbwd_NE", "cbwd_NW", "cbwd_SE", "cbwd_cv", "pm25_lag1", "pm25_lag2", "pm25_lag3", "pm25_lag4", "pm25_lag5", "pm25_lag6", "pm25_lag7", "pm25_lag8", "pm25_lag9", "pm25_lag10", "pm25_lag11", "pm25_lag12", "pm25_lag13", "pm25_lag14", "pm25_lag15", "pm25_lag16", "pm25_lag17", "pm25_lag18", "pm25_lag19", "pm25_lag20", "pm25_lag21", "pm25_lag22", "pm25_lag23", "pm25_lag24", "hour_sin", "hour_cos", "dow", "is_weekend", "pm25_delta1", "inversion_spread", "month_sin", "pres_delta", "dewp_delta", "cbwd_prev_NW"]}, "split": {"name": "calendar_year", "manifest_dir": "C:\\Users\\abhir\\autoresearch-uci\\beijing_pm25\\data"}, "composite": {"higher_is_better": false, "penalty_weight": 0.1, "below_threshold": -40.0}, "hardware": {"n_threads": 4, "cpu_affinity": [0, 2, 4, 6]}, "description": "Exp63 t+6 regression_l1 MAE on Exp59 recipe to stop L2 sacrificing typical hours (LGB side ladder 37/50)", "seed": 0}, "composite": -58.89816828296524, "val_primary": 58.798168282965236, "test_primary": 54.34969557627448, "per_fold_test": [54.34969557627448], "per_fold_val": [58.798168282965236], "status": "DISCARD", "seconds_elapsed": 19.68399930000305, "timestamp": "2026-08-18T11:07:04", "secondary_metrics": {"mae": 34.068020888909174, "mape": 0.81049210430174, "r2": 0.658750320943902, "ic": 0.7958663307654911}, "per_fold_test_reports": [{"fold_id": 0, "regime": "calendar_2014_test", "task_type": "regression", "n": 7950, "rmse": 54.34969557627448, "mae": 34.068020888909174, "mape": 0.81049210430174, "r2": 0.658750320943902, "ic": 0.7958663307654911}], "composite_fingerprint": "a12fd381fe9bbefb"}
{"experiment_num": 64, "backbone": "lightgbm", "description": "Exp64 t+6 add doy_sin to unalias January from May on Exp59 recipe (LGB side ladder 38/50)", "config": {"paths": {"results_dir": "C:\\Users\\abhir\\autoresearch-uci\\beijing_pm25\\autoresearch_results"}, "task_type": "regression", "primary_metric": "rmse", "backbone": "lightgbm", "backbone_config": {"seed": 0, "n_jobs": 4, "n_estimators": 2000, "num_leaves": 31, "learning_rate": 0.01, "feature_fraction": 0.8, "bagging_fraction": 0.6, "early_stopping_rounds": 50}, "data": {"format": "csv", "path": "C:\\Users\\abhir\\autoresearch-uci\\beijing_pm25\\data\\features_horizon6.csv", "target_columns": ["pm25"], "feature_columns": ["DEWP", "TEMP", "PRES", "Iws", "Is", "Ir", "cbwd_NE", "cbwd_NW", "cbwd_SE", "cbwd_cv", "pm25_lag1", "pm25_lag2", "pm25_lag3", "pm25_lag4", "pm25_lag5", "pm25_lag6", "pm25_lag7", "pm25_lag8", "pm25_lag9", "pm25_lag10", "pm25_lag11", "pm25_lag12", "pm25_lag13", "pm25_lag14", "pm25_lag15", "pm25_lag16", "pm25_lag17", "pm25_lag18", "pm25_lag19", "pm25_lag20", "pm25_lag21", "pm25_lag22", "pm25_lag23", "pm25_lag24", "hour_sin", "hour_cos", "dow", "is_weekend", "pm25_delta1", "inversion_spread", "month_sin", "pres_delta", "dewp_delta", "cbwd_prev_NW", "doy_sin"]}, "split": {"name": "calendar_year", "manifest_dir": "C:\\Users\\abhir\\autoresearch-uci\\beijing_pm25\\data"}, "composite": {"higher_is_better": false, "penalty_weight": 0.1, "below_threshold": -40.0}, "hardware": {"n_threads": 4, "cpu_affinity": [0, 2, 4, 6]}, "description": "Exp64 t+6 add doy_sin to unalias January from May on Exp59 recipe (LGB side ladder 38/50)", "seed": 0}, "composite": -58.15258029667836, "val_primary": 58.05258029667836, "test_primary": 54.13544235269201, "per_fold_test": [54.13544235269201], "per_fold_val": [58.05258029667836], "status": "DISCARD", "seconds_elapsed": 9.350255250930786, "timestamp": "2026-08-18T11:35:22", "secondary_metrics": {"mae": 35.14883573034497, "mape": 0.9092245120619878, "r2": 0.6614355147100115, "ic": 0.7934903759434492}, "per_fold_test_reports": [{"fold_id": 0, "regime": "calendar_2014_test", "task_type": "regression", "n": 7950, "rmse": 54.13544235269201, "mae": 35.14883573034497, "mape": 0.9092245120619878, "r2": 0.6614355147100115, "ic": 0.7934903759434492}], "composite_fingerprint": "a12fd381fe9bbefb"}
{"experiment_num": 65, "backbone": "lightgbm", "description": "Exp65 t+6 add heating_night Nov-Feb x 18-06 on Exp59 recipe (LGB side ladder 39/50)", "config": {"paths": {"results_dir": "C:\\Users\\abhir\\autoresearch-uci\\beijing_pm25\\autoresearch_results"}, "task_type": "regression", "primary_metric": "rmse", "backbone": "lightgbm", "backbone_config": {"seed": 0, "n_jobs": 4, "n_estimators": 2000, "num_leaves": 31, "learning_rate": 0.01, "feature_fraction": 0.8, "bagging_fraction": 0.6, "early_stopping_rounds": 50}, "data": {"format": "csv", "path": "C:\\Users\\abhir\\autoresearch-uci\\beijing_pm25\\data\\features_horizon6.csv", "target_columns": ["pm25"], "feature_columns": ["DEWP", "TEMP", "PRES", "Iws", "Is", "Ir", "cbwd_NE", "cbwd_NW", "cbwd_SE", "cbwd_cv", "pm25_lag1", "pm25_lag2", "pm25_lag3", "pm25_lag4", "pm25_lag5", "pm25_lag6", "pm25_lag7", "pm25_lag8", "pm25_lag9", "pm25_lag10", "pm25_lag11", "pm25_lag12", "pm25_lag13", "pm25_lag14", "pm25_lag15", "pm25_lag16", "pm25_lag17", "pm25_lag18", "pm25_lag19", "pm25_lag20", "pm25_lag21", "pm25_lag22", "pm25_lag23", "pm25_lag24", "hour_sin", "hour_cos", "dow", "is_weekend", "pm25_delta1", "inversion_spread", "month_sin", "pres_delta", "dewp_delta", "cbwd_prev_NW", "heating_night"]}, "split": {"name": "calendar_year", "manifest_dir": "C:\\Users\\abhir\\autoresearch-uci\\beijing_pm25\\data"}, "composite": {"higher_is_better": false, "penalty_weight": 0.1, "below_threshold": -40.0}, "hardware": {"n_threads": 4, "cpu_affinity": [0, 2, 4, 6]}, "description": "Exp65 t+6 add heating_night Nov-Feb x 18-06 on Exp59 recipe (LGB side ladder 39/50)", "seed": 0}, "composite": -57.74855155618843, "val_primary": 57.64855155618843, "test_primary": 54.32205544178898, "per_fold_test": [54.32205544178898], "per_fold_val": [57.64855155618843], "status": "DISCARD", "seconds_elapsed": 11.637669801712036, "timestamp": "2026-08-18T12:08:32", "secondary_metrics": {"mae": 35.151185933948604, "mape": 0.8982805621944673, "r2": 0.6590973252279597, "ic": 0.7946577526643875}, "per_fold_test_reports": [{"fold_id": 0, "regime": "calendar_2014_test", "task_type": "regression", "n": 7950, "rmse": 54.32205544178898, "mae": 35.151185933948604, "mape": 0.8982805621944673, "r2": 0.6590973252279597, "ic": 0.7946577526643875}], "composite_fingerprint": "a12fd381fe9bbefb"}
{"experiment_num": 66, "backbone": "lightgbm", "description": "Exp66 t+6 reg_alpha=1 L1 leaf shrink on Exp59 recipe (LGB side ladder 40/50)", "config": {"paths": {"results_dir": "C:\\Users\\abhir\\autoresearch-uci\\beijing_pm25\\autoresearch_results"}, "task_type": "regression", "primary_metric": "rmse", "backbone": "lightgbm", "backbone_config": {"seed": 0, "n_jobs": 4, "n_estimators": 2000, "num_leaves": 31, "learning_rate": 0.01, "feature_fraction": 0.8, "bagging_fraction": 0.6, "early_stopping_rounds": 50, "reg_alpha": 1}, "data": {"format": "csv", "path": "C:\\Users\\abhir\\autoresearch-uci\\beijing_pm25\\data\\features_horizon6.csv", "target_columns": ["pm25"], "feature_columns": ["DEWP", "TEMP", "PRES", "Iws", "Is", "Ir", "cbwd_NE", "cbwd_NW", "cbwd_SE", "cbwd_cv", "pm25_lag1", "pm25_lag2", "pm25_lag3", "pm25_lag4", "pm25_lag5", "pm25_lag6", "pm25_lag7", "pm25_lag8", "pm25_lag9", "pm25_lag10", "pm25_lag11", "pm25_lag12", "pm25_lag13", "pm25_lag14", "pm25_lag15", "pm25_lag16", "pm25_lag17", "pm25_lag18", "pm25_lag19", "pm25_lag20", "pm25_lag21", "pm25_lag22", "pm25_lag23", "pm25_lag24", "hour_sin", "hour_cos", "dow", "is_weekend", "pm25_delta1", "inversion_spread", "month_sin", "pres_delta", "dewp_delta", "cbwd_prev_NW"]}, "split": {"name": "calendar_year", "manifest_dir": "C:\\Users\\abhir\\autoresearch-uci\\beijing_pm25\\data"}, "composite": {"higher_is_better": false, "penalty_weight": 0.1, "below_threshold": -40.0}, "hardware": {"n_threads": 4, "cpu_affinity": [0, 2, 4, 6]}, "description": "Exp66 t+6 reg_alpha=1 L1 leaf shrink on Exp59 recipe (LGB side ladder 40/50)", "seed": 0}, "composite": -57.8189640114792, "val_primary": 57.7189640114792, "test_primary": 54.45359347988015, "per_fold_test": [54.45359347988015], "per_fold_val": [57.7189640114792], "status": "DISCARD", "seconds_elapsed": 10.869455337524414, "timestamp": "2026-08-18T12:37:33", "secondary_metrics": {"mae": 35.21528376112749, "mape": 0.9048941772303115, "r2": 0.657444370105345, "ic": 0.7931624491679886}, "per_fold_test_reports": [{"fold_id": 0, "regime": "calendar_2014_test", "task_type": "regression", "n": 7950, "rmse": 54.45359347988015, "mae": 35.21528376112749, "mape": 0.9048941772303115, "r2": 0.657444370105345, "ic": 0.7931624491679886}], "composite_fingerprint": "a12fd381fe9bbefb"}
{"experiment_num": 67, "backbone": "lightgbm", "description": "Exp67 t+6 num_leaves 31 to 15 on Exp59 recipe (LGB side ladder 41/50)", "config": {"paths": {"results_dir": "C:\\Users\\abhir\\autoresearch-uci\\beijing_pm25\\autoresearch_results"}, "task_type": "regression", "primary_metric": "rmse", "backbone": "lightgbm", "backbone_config": {"seed": 0, "n_jobs": 4, "n_estimators": 2000, "num_leaves": 15, "learning_rate": 0.01, "feature_fraction": 0.8, "bagging_fraction": 0.6, "early_stopping_rounds": 50}, "data": {"format": "csv", "path": "C:\\Users\\abhir\\autoresearch-uci\\beijing_pm25\\data\\features_horizon6.csv", "target_columns": ["pm25"], "feature_columns": ["DEWP", "TEMP", "PRES", "Iws", "Is", "Ir", "cbwd_NE", "cbwd_NW", "cbwd_SE", "cbwd_cv", "pm25_lag1", "pm25_lag2", "pm25_lag3", "pm25_lag4", "pm25_lag5", "pm25_lag6", "pm25_lag7", "pm25_lag8", "pm25_lag9", "pm25_lag10", "pm25_lag11", "pm25_lag12", "pm25_lag13", "pm25_lag14", "pm25_lag15", "pm25_lag16", "pm25_lag17", "pm25_lag18", "pm25_lag19", "pm25_lag20", "pm25_lag21", "pm25_lag22", "pm25_lag23", "pm25_lag24", "hour_sin", "hour_cos", "dow", "is_weekend", "pm25_delta1", "inversion_spread", "month_sin", "pres_delta", "dewp_delta", "cbwd_prev_NW"]}, "split": {"name": "calendar_year", "manifest_dir": "C:\\Users\\abhir\\autoresearch-uci\\beijing_pm25\\data"}, "composite": {"higher_is_better": false, "penalty_weight": 0.1, "below_threshold": -40.0}, "hardware": {"n_threads": 4, "cpu_affinity": [0, 2, 4, 6]}, "description": "Exp67 t+6 num_leaves 31 to 15 on Exp59 recipe (LGB side ladder 41/50)", "seed": 0}, "composite": -58.01606111092804, "val_primary": 57.91606111092804, "test_primary": 54.42406771391151, "per_fold_test": [54.42406771391151], "per_fold_val": [57.91606111092804], "status": "DISCARD", "seconds_elapsed": 6.656020164489746, "timestamp": "2026-08-18T13:07:07", "secondary_metrics": {"mae": 35.46612223339208, "mape": 0.9152974230430312, "r2": 0.6578157496472107, "ic": 0.7916800498902651}, "per_fold_test_reports": [{"fold_id": 0, "regime": "calendar_2014_test", "task_type": "regression", "n": 7950, "rmse": 54.42406771391151, "mae": 35.46612223339208, "mape": 0.9152974230430312, "r2": 0.6578157496472107, "ic": 0.7916800498902651}], "composite_fingerprint": "a12fd381fe9bbefb"}
