{"experiment_num": 113, "backbone": "catboost", "description": "Exp113 CatBoost Plain add pm25_roll3mean on Exp97 (CatBoost cycle 39/50)", "config": {"paths": {"results_dir": "C:\\Users\\abhir\\autoresearch-uci\\beijing_pm25\\autoresearch_results"}, "task_type": "regression", "primary_metric": "rmse", "backbone": "catboost", "backbone_config": {"seed": 0, "n_jobs": 4, "iterations": 2000, "depth": 6, "learning_rate": 0.03, "l2_leaf_reg": 3, "early_stopping_rounds": 100, "boosting_type": "Plain"}, "data": {"format": "csv", "path": "C:\\Users\\abhir\\autoresearch-uci\\beijing_pm25\\data\\features_full.csv", "target_columns": ["pm25"], "feature_columns": ["DEWP", "TEMP", "PRES", "Iws", "Is", "Ir", "cbwd_NE", "cbwd_NW", "cbwd_SE", "cbwd_cv", "pm25_lag1", "pm25_lag2", "pm25_lag3", "pm25_lag4", "pm25_lag5", "pm25_lag6", "pm25_lag7", "pm25_lag8", "pm25_lag9", "pm25_lag10", "pm25_lag11", "pm25_lag12", "pm25_lag13", "pm25_lag14", "pm25_lag15", "pm25_lag16", "pm25_lag17", "pm25_lag18", "pm25_lag19", "pm25_lag20", "pm25_lag21", "pm25_lag22", "pm25_lag23", "pm25_lag24", "hour_sin", "hour_cos", "dow", "is_weekend", "pm25_delta1", "inversion_spread", "rh_magnus", "dewp_delta", "is_heating", "pm25_roll3mean"]}, "split": {"name": "calendar_year", "manifest_dir": "C:\\Users\\abhir\\autoresearch-uci\\beijing_pm25\\data"}, "composite": {"higher_is_better": false, "penalty_weight": 0.1, "below_threshold": -40.0}, "hardware": {"n_threads": 4, "cpu_affinity": [0, 2, 4, 6]}, "description": "Exp113 CatBoost Plain add pm25_roll3mean on Exp97 (CatBoost cycle 39/50)", "seed": 0}, "composite": -22.359671786332537, "val_primary": 22.359671786332537, "test_primary": 20.743223076599165, "per_fold_test": [20.743223076599165], "per_fold_val": [22.359671786332537], "status": "DISCARD", "seconds_elapsed": 18.41610336303711, "timestamp": "2026-08-19T05:37:31", "secondary_metrics": {"mae": 11.422899232246099, "mape": 0.21906908781590534, "r2": 0.9502915185990911, "ic": 0.9725154263462281}, "per_fold_test_reports": [{"fold_id": 0, "regime": "calendar_2014_test", "task_type": "regression", "n": 7950, "rmse": 20.743223076599165, "mae": 11.422899232246099, "mape": 0.21906908781590534, "r2": 0.9502915185990911, "ic": 0.9725154263462281}], "composite_fingerprint": "a12fd381fe9bbefb"}
{"experiment_num": 114, "backbone": "catboost", "description": "Exp114 CatBoost Plain add is_janfeb on Exp97 (CatBoost cycle 40/50)", "config": {"paths": {"results_dir": "C:\\Users\\abhir\\autoresearch-uci\\beijing_pm25\\autoresearch_results"}, "task_type": "regression", "primary_metric": "rmse", "backbone": "catboost", "backbone_config": {"seed": 0, "n_jobs": 4, "iterations": 2000, "depth": 6, "learning_rate": 0.03, "l2_leaf_reg": 3, "early_stopping_rounds": 100, "boosting_type": "Plain"}, "data": {"format": "csv", "path": "C:\\Users\\abhir\\autoresearch-uci\\beijing_pm25\\data\\features_full.csv", "target_columns": ["pm25"], "feature_columns": ["DEWP", "TEMP", "PRES", "Iws", "Is", "Ir", "cbwd_NE", "cbwd_NW", "cbwd_SE", "cbwd_cv", "pm25_lag1", "pm25_lag2", "pm25_lag3", "pm25_lag4", "pm25_lag5", "pm25_lag6", "pm25_lag7", "pm25_lag8", "pm25_lag9", "pm25_lag10", "pm25_lag11", "pm25_lag12", "pm25_lag13", "pm25_lag14", "pm25_lag15", "pm25_lag16", "pm25_lag17", "pm25_lag18", "pm25_lag19", "pm25_lag20", "pm25_lag21", "pm25_lag22", "pm25_lag23", "pm25_lag24", "hour_sin", "hour_cos", "dow", "is_weekend", "pm25_delta1", "inversion_spread", "rh_magnus", "dewp_delta", "is_heating", "is_janfeb"]}, "split": {"name": "calendar_year", "manifest_dir": "C:\\Users\\abhir\\autoresearch-uci\\beijing_pm25\\data"}, "composite": {"higher_is_better": false, "penalty_weight": 0.1, "below_threshold": -40.0}, "hardware": {"n_threads": 4, "cpu_affinity": [0, 2, 4, 6]}, "description": "Exp114 CatBoost Plain add is_janfeb on Exp97 (CatBoost cycle 40/50)", "seed": 0}, "composite": -22.34193256292736, "val_primary": 22.34193256292736, "test_primary": 20.792025526669814, "per_fold_test": [20.792025526669814], "per_fold_val": [22.34193256292736], "status": "DISCARD", "seconds_elapsed": 6.3548290729522705, "timestamp": "2026-08-19T06:05:25", "secondary_metrics": {"mae": 11.406093016469093, "mape": 0.21537086049905219, "r2": 0.9500573457931178, "ic": 0.9726706110388043}, "per_fold_test_reports": [{"fold_id": 0, "regime": "calendar_2014_test", "task_type": "regression", "n": 7950, "rmse": 20.792025526669814, "mae": 11.406093016469093, "mape": 0.21537086049905219, "r2": 0.9500573457931178, "ic": 0.9726706110388043}], "composite_fingerprint": "a12fd381fe9bbefb"}
{"experiment_num": 115, "backbone": "catboost", "description": "Exp115 CatBoost Plain drop pm25_lag13-24 on Exp97 (CatBoost cycle 41/50)", "config": {"paths": {"results_dir": "C:\\Users\\abhir\\autoresearch-uci\\beijing_pm25\\autoresearch_results"}, "task_type": "regression", "primary_metric": "rmse", "backbone": "catboost", "backbone_config": {"seed": 0, "n_jobs": 4, "iterations": 2000, "depth": 6, "learning_rate": 0.03, "l2_leaf_reg": 3, "early_stopping_rounds": 100, "boosting_type": "Plain"}, "data": {"format": "csv", "path": "C:\\Users\\abhir\\autoresearch-uci\\beijing_pm25\\data\\features_full.csv", "target_columns": ["pm25"], "feature_columns": ["DEWP", "TEMP", "PRES", "Iws", "Is", "Ir", "cbwd_NE", "cbwd_NW", "cbwd_SE", "cbwd_cv", "pm25_lag1", "pm25_lag2", "pm25_lag3", "pm25_lag4", "pm25_lag5", "pm25_lag6", "pm25_lag7", "pm25_lag8", "pm25_lag9", "pm25_lag10", "pm25_lag11", "pm25_lag12", "hour_sin", "hour_cos", "dow", "is_weekend", "pm25_delta1", "inversion_spread", "rh_magnus", "dewp_delta", "is_heating"]}, "split": {"name": "calendar_year", "manifest_dir": "C:\\Users\\abhir\\autoresearch-uci\\beijing_pm25\\data"}, "composite": {"higher_is_better": false, "penalty_weight": 0.1, "below_threshold": -40.0}, "hardware": {"n_threads": 4, "cpu_affinity": [0, 2, 4, 6]}, "description": "Exp115 CatBoost Plain drop pm25_lag13-24 on Exp97 (CatBoost cycle 41/50)", "seed": 0}, "composite": -22.260153620275116, "val_primary": 22.260153620275116, "test_primary": 20.68845401561277, "per_fold_test": [20.68845401561277], "per_fold_val": [22.260153620275116], "status": "DISCARD", "seconds_elapsed": 5.339629650115967, "timestamp": "2026-08-19T06:36:54", "secondary_metrics": {"mae": 11.351727292022412, "mape": 0.20954207335372307, "r2": 0.9505536661641525, "ic": 0.9728620198543275}, "per_fold_test_reports": [{"fold_id": 0, "regime": "calendar_2014_test", "task_type": "regression", "n": 7950, "rmse": 20.68845401561277, "mae": 11.351727292022412, "mape": 0.20954207335372307, "r2": 0.9505536661641525, "ic": 0.9728620198543275}], "composite_fingerprint": "a12fd381fe9bbefb"}
{"experiment_num": 116, "backbone": "catboost", "description": "Exp116 CatBoost Plain replace Iws with iws_clip100 on Exp97 (CatBoost cycle 42/50)", "config": {"paths": {"results_dir": "C:\\Users\\abhir\\autoresearch-uci\\beijing_pm25\\autoresearch_results"}, "task_type": "regression", "primary_metric": "rmse", "backbone": "catboost", "backbone_config": {"seed": 0, "n_jobs": 4, "iterations": 2000, "depth": 6, "learning_rate": 0.03, "l2_leaf_reg": 3, "early_stopping_rounds": 100, "boosting_type": "Plain"}, "data": {"format": "csv", "path": "C:\\Users\\abhir\\autoresearch-uci\\beijing_pm25\\data\\features_full.csv", "target_columns": ["pm25"], "feature_columns": ["DEWP", "TEMP", "PRES", "Is", "Ir", "cbwd_NE", "cbwd_NW", "cbwd_SE", "cbwd_cv", "pm25_lag1", "pm25_lag2", "pm25_lag3", "pm25_lag4", "pm25_lag5", "pm25_lag6", "pm25_lag7", "pm25_lag8", "pm25_lag9", "pm25_lag10", "pm25_lag11", "pm25_lag12", "pm25_lag13", "pm25_lag14", "pm25_lag15", "pm25_lag16", "pm25_lag17", "pm25_lag18", "pm25_lag19", "pm25_lag20", "pm25_lag21", "pm25_lag22", "pm25_lag23", "pm25_lag24", "hour_sin", "hour_cos", "dow", "is_weekend", "pm25_delta1", "inversion_spread", "rh_magnus", "dewp_delta", "is_heating", "iws_clip100"]}, "split": {"name": "calendar_year", "manifest_dir": "C:\\Users\\abhir\\autoresearch-uci\\beijing_pm25\\data"}, "composite": {"higher_is_better": false, "penalty_weight": 0.1, "below_threshold": -40.0}, "hardware": {"n_threads": 4, "cpu_affinity": [0, 2, 4, 6]}, "description": "Exp116 CatBoost Plain replace Iws with iws_clip100 on Exp97 (CatBoost cycle 42/50)", "seed": 0}, "composite": -22.322918128552008, "val_primary": 22.322918128552008, "test_primary": 20.76657828345835, "per_fold_test": [20.76657828345835], "per_fold_val": [22.322918128552008], "status": "DISCARD", "seconds_elapsed": 5.77595329284668, "timestamp": "2026-08-19T07:06:14", "secondary_metrics": {"mae": 11.479031649850755, "mape": 0.22140671958652253, "r2": 0.9501795200508553, "ic": 0.9723527993398572}, "per_fold_test_reports": [{"fold_id": 0, "regime": "calendar_2014_test", "task_type": "regression", "n": 7950, "rmse": 20.76657828345835, "mae": 11.479031649850755, "mape": 0.22140671958652253, "r2": 0.9501795200508553, "ic": 0.9723527993398572}], "composite_fingerprint": "a12fd381fe9bbefb"}
{"experiment_num": 117, "backbone": "catboost", "description": "Exp117 CatBoost Plain drop dow on Exp97 (CatBoost cycle 43/50)", "config": {"paths": {"results_dir": "C:\\Users\\abhir\\autoresearch-uci\\beijing_pm25\\autoresearch_results"}, "task_type": "regression", "primary_metric": "rmse", "backbone": "catboost", "backbone_config": {"seed": 0, "n_jobs": 4, "iterations": 2000, "depth": 6, "learning_rate": 0.03, "l2_leaf_reg": 3, "early_stopping_rounds": 100, "boosting_type": "Plain"}, "data": {"format": "csv", "path": "C:\\Users\\abhir\\autoresearch-uci\\beijing_pm25\\data\\features_full.csv", "target_columns": ["pm25"], "feature_columns": ["DEWP", "TEMP", "PRES", "Iws", "Is", "Ir", "cbwd_NE", "cbwd_NW", "cbwd_SE", "cbwd_cv", "pm25_lag1", "pm25_lag2", "pm25_lag3", "pm25_lag4", "pm25_lag5", "pm25_lag6", "pm25_lag7", "pm25_lag8", "pm25_lag9", "pm25_lag10", "pm25_lag11", "pm25_lag12", "pm25_lag13", "pm25_lag14", "pm25_lag15", "pm25_lag16", "pm25_lag17", "pm25_lag18", "pm25_lag19", "pm25_lag20", "pm25_lag21", "pm25_lag22", "pm25_lag23", "pm25_lag24", "hour_sin", "hour_cos", "is_weekend", "pm25_delta1", "inversion_spread", "rh_magnus", "dewp_delta", "is_heating"]}, "split": {"name": "calendar_year", "manifest_dir": "C:\\Users\\abhir\\autoresearch-uci\\beijing_pm25\\data"}, "composite": {"higher_is_better": false, "penalty_weight": 0.1, "below_threshold": -40.0}, "hardware": {"n_threads": 4, "cpu_affinity": [0, 2, 4, 6]}, "description": "Exp117 CatBoost Plain drop dow on Exp97 (CatBoost cycle 43/50)", "seed": 0}, "composite": -22.21157012602188, "val_primary": 22.21157012602188, "test_primary": 20.79505167896662, "per_fold_test": [20.79505167896662], "per_fold_val": [22.21157012602188], "status": "DISCARD", "seconds_elapsed": 8.307031154632568, "timestamp": "2026-08-19T07:35:58", "secondary_metrics": {"mae": 11.398270146374644, "mape": 0.20969903394313097, "r2": 0.9500428070387417, "ic": 0.9728264701255406}, "per_fold_test_reports": [{"fold_id": 0, "regime": "calendar_2014_test", "task_type": "regression", "n": 7950, "rmse": 20.79505167896662, "mae": 11.398270146374644, "mape": 0.20969903394313097, "r2": 0.9500428070387417, "ic": 0.9728264701255406}], "composite_fingerprint": "a12fd381fe9bbefb"}
{"experiment_num": 118, "backbone": "catboost", "description": "Exp118 CatBoost Plain model_size_reg=1.0 on Exp97 (CatBoost cycle 44/50)", "config": {"paths": {"results_dir": "C:\\Users\\abhir\\autoresearch-uci\\beijing_pm25\\autoresearch_results"}, "task_type": "regression", "primary_metric": "rmse", "backbone": "catboost", "backbone_config": {"seed": 0, "n_jobs": 4, "iterations": 2000, "depth": 6, "learning_rate": 0.03, "l2_leaf_reg": 3, "early_stopping_rounds": 100, "boosting_type": "Plain", "model_size_reg": 1.0}, "data": {"format": "csv", "path": "C:\\Users\\abhir\\autoresearch-uci\\beijing_pm25\\data\\features_full.csv", "target_columns": ["pm25"], "feature_columns": ["DEWP", "TEMP", "PRES", "Iws", "Is", "Ir", "cbwd_NE", "cbwd_NW", "cbwd_SE", "cbwd_cv", "pm25_lag1", "pm25_lag2", "pm25_lag3", "pm25_lag4", "pm25_lag5", "pm25_lag6", "pm25_lag7", "pm25_lag8", "pm25_lag9", "pm25_lag10", "pm25_lag11", "pm25_lag12", "pm25_lag13", "pm25_lag14", "pm25_lag15", "pm25_lag16", "pm25_lag17", "pm25_lag18", "pm25_lag19", "pm25_lag20", "pm25_lag21", "pm25_lag22", "pm25_lag23", "pm25_lag24", "hour_sin", "hour_cos", "dow", "is_weekend", "pm25_delta1", "inversion_spread", "rh_magnus", "dewp_delta", "is_heating"]}, "split": {"name": "calendar_year", "manifest_dir": "C:\\Users\\abhir\\autoresearch-uci\\beijing_pm25\\data"}, "composite": {"higher_is_better": false, "penalty_weight": 0.1, "below_threshold": -40.0}, "hardware": {"n_threads": 4, "cpu_affinity": [0, 2, 4, 6]}, "description": "Exp118 CatBoost Plain model_size_reg=1.0 on Exp97 (CatBoost cycle 44/50)", "seed": 0}, "composite": -22.166611495156538, "val_primary": 22.166611495156538, "test_primary": 20.73514958690229, "per_fold_test": [20.73514958690229], "per_fold_val": [22.166611495156538], "status": "DISCARD", "seconds_elapsed": 8.354576587677002, "timestamp": "2026-08-19T10:42:20", "secondary_metrics": {"mae": 11.397541340218662, "mape": 0.2115776123881099, "r2": 0.9503302052401891, "ic": 0.9727164800634}, "per_fold_test_reports": [{"fold_id": 0, "regime": "calendar_2014_test", "task_type": "regression", "n": 7950, "rmse": 20.73514958690229, "mae": 11.397541340218662, "mape": 0.2115776123881099, "r2": 0.9503302052401891, "ic": 0.9727164800634}], "composite_fingerprint": "a12fd381fe9bbefb"}
{"experiment_num": 119, "backbone": "catboost", "description": "Exp119 CatBoost Plain Bernoulli subsample=0.8 on Exp97 (CatBoost cycle 45/50)", "config": {"paths": {"results_dir": "C:\\Users\\abhir\\autoresearch-uci\\beijing_pm25\\autoresearch_results"}, "task_type": "regression", "primary_metric": "rmse", "backbone": "catboost", "backbone_config": {"seed": 0, "n_jobs": 4, "iterations": 2000, "depth": 6, "learning_rate": 0.03, "l2_leaf_reg": 3, "early_stopping_rounds": 100, "boosting_type": "Plain", "bootstrap_type": "Bernoulli", "subsample": 0.8}, "data": {"format": "csv", "path": "C:\\Users\\abhir\\autoresearch-uci\\beijing_pm25\\data\\features_full.csv", "target_columns": ["pm25"], "feature_columns": ["DEWP", "TEMP", "PRES", "Iws", "Is", "Ir", "cbwd_NE", "cbwd_NW", "cbwd_SE", "cbwd_cv", "pm25_lag1", "pm25_lag2", "pm25_lag3", "pm25_lag4", "pm25_lag5", "pm25_lag6", "pm25_lag7", "pm25_lag8", "pm25_lag9", "pm25_lag10", "pm25_lag11", "pm25_lag12", "pm25_lag13", "pm25_lag14", "pm25_lag15", "pm25_lag16", "pm25_lag17", "pm25_lag18", "pm25_lag19", "pm25_lag20", "pm25_lag21", "pm25_lag22", "pm25_lag23", "pm25_lag24", "hour_sin", "hour_cos", "dow", "is_weekend", "pm25_delta1", "inversion_spread", "rh_magnus", "dewp_delta", "is_heating"]}, "split": {"name": "calendar_year", "manifest_dir": "C:\\Users\\abhir\\autoresearch-uci\\beijing_pm25\\data"}, "composite": {"higher_is_better": false, "penalty_weight": 0.1, "below_threshold": -40.0}, "hardware": {"n_threads": 4, "cpu_affinity": [0, 2, 4, 6]}, "description": "Exp119 CatBoost Plain Bernoulli subsample=0.8 on Exp97 (CatBoost cycle 45/50)", "seed": 0}, "composite": -22.231100416060134, "val_primary": 22.231100416060134, "test_primary": 20.818185146518275, "per_fold_test": [20.818185146518275], "per_fold_val": [22.231100416060134], "status": "DISCARD", "seconds_elapsed": 7.295740127563477, "timestamp": "2026-08-19T11:10:56", "secondary_metrics": {"mae": 11.432786902032642, "mape": 0.21509822628202843, "r2": 0.9499315953966291, "ic": 0.972625634957167}, "per_fold_test_reports": [{"fold_id": 0, "regime": "calendar_2014_test", "task_type": "regression", "n": 7950, "rmse": 20.818185146518275, "mae": 11.432786902032642, "mape": 0.21509822628202843, "r2": 0.9499315953966291, "ic": 0.972625634957167}], "composite_fingerprint": "a12fd381fe9bbefb"}
{"experiment_num": 120, "backbone": "catboost", "description": "Exp120 CatBoost Plain border_count=128 on Exp97 (CatBoost cycle 46/50)", "config": {"paths": {"results_dir": "C:\\Users\\abhir\\autoresearch-uci\\beijing_pm25\\autoresearch_results"}, "task_type": "regression", "primary_metric": "rmse", "backbone": "catboost", "backbone_config": {"seed": 0, "n_jobs": 4, "iterations": 2000, "depth": 6, "learning_rate": 0.03, "l2_leaf_reg": 3, "early_stopping_rounds": 100, "boosting_type": "Plain", "border_count": 128}, "data": {"format": "csv", "path": "C:\\Users\\abhir\\autoresearch-uci\\beijing_pm25\\data\\features_full.csv", "target_columns": ["pm25"], "feature_columns": ["DEWP", "TEMP", "PRES", "Iws", "Is", "Ir", "cbwd_NE", "cbwd_NW", "cbwd_SE", "cbwd_cv", "pm25_lag1", "pm25_lag2", "pm25_lag3", "pm25_lag4", "pm25_lag5", "pm25_lag6", "pm25_lag7", "pm25_lag8", "pm25_lag9", "pm25_lag10", "pm25_lag11", "pm25_lag12", "pm25_lag13", "pm25_lag14", "pm25_lag15", "pm25_lag16", "pm25_lag17", "pm25_lag18", "pm25_lag19", "pm25_lag20", "pm25_lag21", "pm25_lag22", "pm25_lag23", "pm25_lag24", "hour_sin", "hour_cos", "dow", "is_weekend", "pm25_delta1", "inversion_spread", "rh_magnus", "dewp_delta", "is_heating"]}, "split": {"name": "calendar_year", "manifest_dir": "C:\\Users\\abhir\\autoresearch-uci\\beijing_pm25\\data"}, "composite": {"higher_is_better": false, "penalty_weight": 0.1, "below_threshold": -40.0}, "hardware": {"n_threads": 4, "cpu_affinity": [0, 2, 4, 6]}, "description": "Exp120 CatBoost Plain border_count=128 on Exp97 (CatBoost cycle 46/50)", "seed": 0}, "composite": -22.26379151209592, "val_primary": 22.26379151209592, "test_primary": 21.13917759650902, "per_fold_test": [21.13917759650902], "per_fold_val": [22.26379151209592], "status": "DISCARD", "seconds_elapsed": 5.536747932434082, "timestamp": "2026-08-19T11:38:51", "secondary_metrics": {"mae": 11.571704456192608, "mape": 0.21109777269494454, "r2": 0.9483756977641445, "ic": 0.972589077482223}, "per_fold_test_reports": [{"fold_id": 0, "regime": "calendar_2014_test", "task_type": "regression", "n": 7950, "rmse": 21.13917759650902, "mae": 11.571704456192608, "mape": 0.21109777269494454, "r2": 0.9483756977641445, "ic": 0.972589077482223}], "composite_fingerprint": "a12fd381fe9bbefb"}
{"experiment_num": 121, "backbone": "catboost", "description": "Exp121 CatBoost Plain add nw_iws on Exp97 (CatBoost cycle 47/50)", "config": {"paths": {"results_dir": "C:\\Users\\abhir\\autoresearch-uci\\beijing_pm25\\autoresearch_results"}, "task_type": "regression", "primary_metric": "rmse", "backbone": "catboost", "backbone_config": {"seed": 0, "n_jobs": 4, "iterations": 2000, "depth": 6, "learning_rate": 0.03, "l2_leaf_reg": 3, "early_stopping_rounds": 100, "boosting_type": "Plain"}, "data": {"format": "csv", "path": "C:\\Users\\abhir\\autoresearch-uci\\beijing_pm25\\data\\features_full.csv", "target_columns": ["pm25"], "feature_columns": ["DEWP", "TEMP", "PRES", "Iws", "Is", "Ir", "cbwd_NE", "cbwd_NW", "cbwd_SE", "cbwd_cv", "pm25_lag1", "pm25_lag2", "pm25_lag3", "pm25_lag4", "pm25_lag5", "pm25_lag6", "pm25_lag7", "pm25_lag8", "pm25_lag9", "pm25_lag10", "pm25_lag11", "pm25_lag12", "pm25_lag13", "pm25_lag14", "pm25_lag15", "pm25_lag16", "pm25_lag17", "pm25_lag18", "pm25_lag19", "pm25_lag20", "pm25_lag21", "pm25_lag22", "pm25_lag23", "pm25_lag24", "hour_sin", "hour_cos", "dow", "is_weekend", "pm25_delta1", "inversion_spread", "rh_magnus", "dewp_delta", "is_heating", "nw_iws"]}, "split": {"name": "calendar_year", "manifest_dir": "C:\\Users\\abhir\\autoresearch-uci\\beijing_pm25\\data"}, "composite": {"higher_is_better": false, "penalty_weight": 0.1, "below_threshold": -40.0}, "hardware": {"n_threads": 4, "cpu_affinity": [0, 2, 4, 6]}, "description": "Exp121 CatBoost Plain add nw_iws on Exp97 (CatBoost cycle 47/50)", "seed": 0}, "composite": -22.239972846323752, "val_primary": 22.239972846323752, "test_primary": 20.80354747269816, "per_fold_test": [20.80354747269816], "per_fold_val": [22.239972846323752], "status": "DISCARD", "seconds_elapsed": 8.123032808303833, "timestamp": "2026-08-19T12:11:36", "secondary_metrics": {"mae": 11.390722652226522, "mape": 0.21051560923173462, "r2": 0.9500019787962607, "ic": 0.972822452730058}, "per_fold_test_reports": [{"fold_id": 0, "regime": "calendar_2014_test", "task_type": "regression", "n": 7950, "rmse": 20.80354747269816, "mae": 11.390722652226522, "mape": 0.21051560923173462, "r2": 0.9500019787962607, "ic": 0.972822452730058}], "composite_fingerprint": "a12fd381fe9bbefb"}
