{"experiment_num": 187, "backbone": "ft_transformer", "description": "Exp187 FT-Transformer Pre-LN add heating_night on Exp186 recipe (FT cycle 13/50)", "config": {"paths": {"results_dir": "C:\\Users\\abhir\\autoresearch-uci\\beijing_pm25\\autoresearch_results"}, "task_type": "regression", "primary_metric": "rmse", "backbone": "ft_transformer", "backbone_config": {"seed": 0, "n_jobs": 4, "d_model": 64, "n_heads": 4, "n_layers": 3, "dropout": 0.1, "lr": 0.0001, "epochs": 100, "patience": 15, "batch_size": 32, "weight_decay": 1e-05, "warmup": 10, "norm_first": true}, "data": {"format": "csv", "path": "C:\\Users\\abhir\\autoresearch-uci\\beijing_pm25\\data\\features_full.csv", "target_columns": ["pm25"], "feature_columns": ["DEWP", "TEMP", "PRES", "Iws", "Is", "Ir", "cbwd_NE", "cbwd_NW", "cbwd_SE", "cbwd_cv", "pm25_lag1", "pm25_lag2", "pm25_lag3", "pm25_lag4", "pm25_lag5", "pm25_lag6", "pm25_lag7", "pm25_lag8", "pm25_lag9", "pm25_lag10", "pm25_lag11", "pm25_lag12", "pm25_lag13", "pm25_lag14", "pm25_lag15", "pm25_lag16", "pm25_lag17", "pm25_lag18", "pm25_lag19", "pm25_lag20", "pm25_lag21", "pm25_lag22", "pm25_lag23", "pm25_lag24", "hour_sin", "hour_cos", "dow", "is_weekend", "pm25_delta1", "inversion_spread", "rh_magnus", "dewp_delta", "is_heating", "log_iws", "month_sin", "pm25_accel", "vent_index", "cbwd_prev_NW", "heating_night"]}, "split": {"name": "calendar_year", "manifest_dir": "C:\\Users\\abhir\\autoresearch-uci\\beijing_pm25\\data"}, "composite": {"higher_is_better": false, "penalty_weight": 0.1, "below_threshold": -40.0}, "hardware": {"n_threads": 4, "cpu_affinity": [0, 2, 4, 6]}, "description": "Exp187 FT-Transformer Pre-LN add heating_night on Exp186 recipe (FT cycle 13/50)", "seed": 0}, "composite": -22.221273655609426, "val_primary": 22.221273655609426, "test_primary": 20.350432023955346, "per_fold_test": [20.350432023955346], "per_fold_val": [22.221273655609426], "status": "DISCARD", "seconds_elapsed": 4182.97916841507, "timestamp": "2026-08-22T01:28:25", "secondary_metrics": {"mae": 11.218003147743033, "mape": 0.1958200329182043, "r2": 0.952156241815318, "ic": 0.9731979357574045}, "per_fold_test_reports": [{"fold_id": 0, "regime": "calendar_2014_test", "task_type": "regression", "n": 7950, "rmse": 20.350432023955346, "mae": 11.218003147743033, "mape": 0.1958200329182043, "r2": 0.952156241815318, "ic": 0.9731979357574045}], "composite_fingerprint": "a12fd381fe9bbefb"}
{"experiment_num": 188, "backbone": "ft_transformer", "description": "Exp188 FT-Transformer Pre-LN add pres_delta on Exp186 recipe (FT cycle 14/50)", "config": {"paths": {"results_dir": "C:\\Users\\abhir\\autoresearch-uci\\beijing_pm25\\autoresearch_results"}, "task_type": "regression", "primary_metric": "rmse", "backbone": "ft_transformer", "backbone_config": {"seed": 0, "n_jobs": 4, "d_model": 64, "n_heads": 4, "n_layers": 3, "dropout": 0.1, "lr": 0.0001, "epochs": 100, "patience": 15, "batch_size": 32, "weight_decay": 1e-05, "warmup": 10, "norm_first": true}, "data": {"format": "csv", "path": "C:\\Users\\abhir\\autoresearch-uci\\beijing_pm25\\data\\features_full.csv", "target_columns": ["pm25"], "feature_columns": ["DEWP", "TEMP", "PRES", "Iws", "Is", "Ir", "cbwd_NE", "cbwd_NW", "cbwd_SE", "cbwd_cv", "pm25_lag1", "pm25_lag2", "pm25_lag3", "pm25_lag4", "pm25_lag5", "pm25_lag6", "pm25_lag7", "pm25_lag8", "pm25_lag9", "pm25_lag10", "pm25_lag11", "pm25_lag12", "pm25_lag13", "pm25_lag14", "pm25_lag15", "pm25_lag16", "pm25_lag17", "pm25_lag18", "pm25_lag19", "pm25_lag20", "pm25_lag21", "pm25_lag22", "pm25_lag23", "pm25_lag24", "hour_sin", "hour_cos", "dow", "is_weekend", "pm25_delta1", "inversion_spread", "rh_magnus", "dewp_delta", "is_heating", "log_iws", "month_sin", "pm25_accel", "vent_index", "cbwd_prev_NW", "pres_delta"]}, "split": {"name": "calendar_year", "manifest_dir": "C:\\Users\\abhir\\autoresearch-uci\\beijing_pm25\\data"}, "composite": {"higher_is_better": false, "penalty_weight": 0.1, "below_threshold": -40.0}, "hardware": {"n_threads": 4, "cpu_affinity": [0, 2, 4, 6]}, "description": "Exp188 FT-Transformer Pre-LN add pres_delta on Exp186 recipe (FT cycle 14/50)", "seed": 0}, "composite": -22.53935784197054, "val_primary": 22.53935784197054, "test_primary": 20.913280193518855, "per_fold_test": [20.913280193518855], "per_fold_val": [22.53935784197054], "status": "DISCARD", "seconds_elapsed": 3868.4033737182617, "timestamp": "2026-08-22T02:52:57", "secondary_metrics": {"mae": 11.510366142710799, "mape": 0.18367397276161826, "r2": 0.9494731374004095, "ic": 0.9730489619250475}, "per_fold_test_reports": [{"fold_id": 0, "regime": "calendar_2014_test", "task_type": "regression", "n": 7950, "rmse": 20.913280193518855, "mae": 11.510366142710799, "mape": 0.18367397276161826, "r2": 0.9494731374004095, "ic": 0.9730489619250475}], "composite_fingerprint": "a12fd381fe9bbefb"}
{"experiment_num": 189, "backbone": "ft_transformer", "description": "Exp189 FT-Transformer Pre-LN add is_morning on Exp186 recipe (FT cycle 15/50)", "config": {"paths": {"results_dir": "C:\\Users\\abhir\\autoresearch-uci\\beijing_pm25\\autoresearch_results"}, "task_type": "regression", "primary_metric": "rmse", "backbone": "ft_transformer", "backbone_config": {"seed": 0, "n_jobs": 4, "d_model": 64, "n_heads": 4, "n_layers": 3, "dropout": 0.1, "lr": 0.0001, "epochs": 100, "patience": 15, "batch_size": 32, "weight_decay": 1e-05, "warmup": 10, "norm_first": true}, "data": {"format": "csv", "path": "C:\\Users\\abhir\\autoresearch-uci\\beijing_pm25\\data\\features_full.csv", "target_columns": ["pm25"], "feature_columns": ["DEWP", "TEMP", "PRES", "Iws", "Is", "Ir", "cbwd_NE", "cbwd_NW", "cbwd_SE", "cbwd_cv", "pm25_lag1", "pm25_lag2", "pm25_lag3", "pm25_lag4", "pm25_lag5", "pm25_lag6", "pm25_lag7", "pm25_lag8", "pm25_lag9", "pm25_lag10", "pm25_lag11", "pm25_lag12", "pm25_lag13", "pm25_lag14", "pm25_lag15", "pm25_lag16", "pm25_lag17", "pm25_lag18", "pm25_lag19", "pm25_lag20", "pm25_lag21", "pm25_lag22", "pm25_lag23", "pm25_lag24", "hour_sin", "hour_cos", "dow", "is_weekend", "pm25_delta1", "inversion_spread", "rh_magnus", "dewp_delta", "is_heating", "log_iws", "month_sin", "pm25_accel", "vent_index", "cbwd_prev_NW", "is_morning"]}, "split": {"name": "calendar_year", "manifest_dir": "C:\\Users\\abhir\\autoresearch-uci\\beijing_pm25\\data"}, "composite": {"higher_is_better": false, "penalty_weight": 0.1, "below_threshold": -40.0}, "hardware": {"n_threads": 4, "cpu_affinity": [0, 2, 4, 6]}, "description": "Exp189 FT-Transformer Pre-LN add is_morning on Exp186 recipe (FT cycle 15/50)", "seed": 0}, "composite": -22.25784227034809, "val_primary": 22.25784227034809, "test_primary": 20.724250393339748, "per_fold_test": [20.724250393339748], "per_fold_val": [22.25784227034809], "status": "DISCARD", "seconds_elapsed": 3176.407588005066, "timestamp": "2026-08-22T04:11:20", "secondary_metrics": {"mae": 11.373966321225437, "mape": 0.21790842583798492, "r2": 0.9503824082325049, "ic": 0.9726553808313753}, "per_fold_test_reports": [{"fold_id": 0, "regime": "calendar_2014_test", "task_type": "regression", "n": 7950, "rmse": 20.724250393339748, "mae": 11.373966321225437, "mape": 0.21790842583798492, "r2": 0.9503824082325049, "ic": 0.9726553808313753}], "composite_fingerprint": "a12fd381fe9bbefb"}
{"experiment_num": 190, "backbone": "ft_transformer", "description": "Exp190 FT-Transformer Pre-LN add pm25_roll3mean on Exp186 recipe (FT cycle 16/50)", "config": {"paths": {"results_dir": "C:\\Users\\abhir\\autoresearch-uci\\beijing_pm25\\autoresearch_results"}, "task_type": "regression", "primary_metric": "rmse", "backbone": "ft_transformer", "backbone_config": {"seed": 0, "n_jobs": 4, "d_model": 64, "n_heads": 4, "n_layers": 3, "dropout": 0.1, "lr": 0.0001, "epochs": 100, "patience": 15, "batch_size": 32, "weight_decay": 1e-05, "warmup": 10, "norm_first": true}, "data": {"format": "csv", "path": "C:\\Users\\abhir\\autoresearch-uci\\beijing_pm25\\data\\features_full.csv", "target_columns": ["pm25"], "feature_columns": ["DEWP", "TEMP", "PRES", "Iws", "Is", "Ir", "cbwd_NE", "cbwd_NW", "cbwd_SE", "cbwd_cv", "pm25_lag1", "pm25_lag2", "pm25_lag3", "pm25_lag4", "pm25_lag5", "pm25_lag6", "pm25_lag7", "pm25_lag8", "pm25_lag9", "pm25_lag10", "pm25_lag11", "pm25_lag12", "pm25_lag13", "pm25_lag14", "pm25_lag15", "pm25_lag16", "pm25_lag17", "pm25_lag18", "pm25_lag19", "pm25_lag20", "pm25_lag21", "pm25_lag22", "pm25_lag23", "pm25_lag24", "hour_sin", "hour_cos", "dow", "is_weekend", "pm25_delta1", "inversion_spread", "rh_magnus", "dewp_delta", "is_heating", "log_iws", "month_sin", "pm25_accel", "vent_index", "cbwd_prev_NW", "pm25_roll3mean"]}, "split": {"name": "calendar_year", "manifest_dir": "C:\\Users\\abhir\\autoresearch-uci\\beijing_pm25\\data"}, "composite": {"higher_is_better": false, "penalty_weight": 0.1, "below_threshold": -40.0}, "hardware": {"n_threads": 4, "cpu_affinity": [0, 2, 4, 6]}, "description": "Exp190 FT-Transformer Pre-LN add pm25_roll3mean on Exp186 recipe (FT cycle 16/50)", "seed": 0}, "composite": -22.354353088768843, "val_primary": 22.354353088768843, "test_primary": 20.702227561355922, "per_fold_test": [20.702227561355922], "per_fold_val": [22.354353088768843], "status": "DISCARD", "seconds_elapsed": 4677.524896144867, "timestamp": "2026-08-22T05:36:35", "secondary_metrics": {"mae": 11.190580179976218, "mape": 0.1887765974513728, "r2": 0.9504878054624504, "ic": 0.9732197017226432}, "per_fold_test_reports": [{"fold_id": 0, "regime": "calendar_2014_test", "task_type": "regression", "n": 7950, "rmse": 20.702227561355922, "mae": 11.190580179976218, "mape": 0.1887765974513728, "r2": 0.9504878054624504, "ic": 0.9732197017226432}], "composite_fingerprint": "a12fd381fe9bbefb"}
{"experiment_num": 191, "backbone": "ft_transformer", "description": "Exp191 FT-Transformer Pre-LN add iws_clip100 on Exp186 recipe (FT cycle 17/50)", "config": {"paths": {"results_dir": "C:\\Users\\abhir\\autoresearch-uci\\beijing_pm25\\autoresearch_results"}, "task_type": "regression", "primary_metric": "rmse", "backbone": "ft_transformer", "backbone_config": {"seed": 0, "n_jobs": 4, "d_model": 64, "n_heads": 4, "n_layers": 3, "dropout": 0.1, "lr": 0.0001, "epochs": 100, "patience": 15, "batch_size": 32, "weight_decay": 1e-05, "warmup": 10, "norm_first": true}, "data": {"format": "csv", "path": "C:\\Users\\abhir\\autoresearch-uci\\beijing_pm25\\data\\features_full.csv", "target_columns": ["pm25"], "feature_columns": ["DEWP", "TEMP", "PRES", "Iws", "Is", "Ir", "cbwd_NE", "cbwd_NW", "cbwd_SE", "cbwd_cv", "pm25_lag1", "pm25_lag2", "pm25_lag3", "pm25_lag4", "pm25_lag5", "pm25_lag6", "pm25_lag7", "pm25_lag8", "pm25_lag9", "pm25_lag10", "pm25_lag11", "pm25_lag12", "pm25_lag13", "pm25_lag14", "pm25_lag15", "pm25_lag16", "pm25_lag17", "pm25_lag18", "pm25_lag19", "pm25_lag20", "pm25_lag21", "pm25_lag22", "pm25_lag23", "pm25_lag24", "hour_sin", "hour_cos", "dow", "is_weekend", "pm25_delta1", "inversion_spread", "rh_magnus", "dewp_delta", "is_heating", "log_iws", "month_sin", "pm25_accel", "vent_index", "cbwd_prev_NW", "iws_clip100"]}, "split": {"name": "calendar_year", "manifest_dir": "C:\\Users\\abhir\\autoresearch-uci\\beijing_pm25\\data"}, "composite": {"higher_is_better": false, "penalty_weight": 0.1, "below_threshold": -40.0}, "hardware": {"n_threads": 4, "cpu_affinity": [0, 2, 4, 6]}, "description": "Exp191 FT-Transformer Pre-LN add iws_clip100 on Exp186 recipe (FT cycle 17/50)", "seed": 0}, "composite": -22.353590841704207, "val_primary": 22.353590841704207, "test_primary": 20.945996031020897, "per_fold_test": [20.945996031020897], "per_fold_val": [22.353590841704207], "status": "DISCARD", "seconds_elapsed": 3144.889037132263, "timestamp": "2026-08-22T06:42:15", "secondary_metrics": {"mae": 11.347713061158762, "mape": 0.19284253701098156, "r2": 0.9493149296420389, "ic": 0.9726401830802696}, "per_fold_test_reports": [{"fold_id": 0, "regime": "calendar_2014_test", "task_type": "regression", "n": 7950, "rmse": 20.945996031020897, "mae": 11.347713061158762, "mape": 0.19284253701098156, "r2": 0.9493149296420389, "ic": 0.9726401830802696}], "composite_fingerprint": "a12fd381fe9bbefb"}
{"experiment_num": 192, "backbone": "ft_transformer", "description": "Exp192 FT-Transformer Pre-LN add rh_iws on Exp186 recipe (FT cycle 18/50)", "config": {"paths": {"results_dir": "C:\\Users\\abhir\\autoresearch-uci\\beijing_pm25\\autoresearch_results"}, "task_type": "regression", "primary_metric": "rmse", "backbone": "ft_transformer", "backbone_config": {"seed": 0, "n_jobs": 4, "d_model": 64, "n_heads": 4, "n_layers": 3, "dropout": 0.1, "lr": 0.0001, "epochs": 100, "patience": 15, "batch_size": 32, "weight_decay": 1e-05, "warmup": 10, "norm_first": true}, "data": {"format": "csv", "path": "C:\\Users\\abhir\\autoresearch-uci\\beijing_pm25\\data\\features_full.csv", "target_columns": ["pm25"], "feature_columns": ["DEWP", "TEMP", "PRES", "Iws", "Is", "Ir", "cbwd_NE", "cbwd_NW", "cbwd_SE", "cbwd_cv", "pm25_lag1", "pm25_lag2", "pm25_lag3", "pm25_lag4", "pm25_lag5", "pm25_lag6", "pm25_lag7", "pm25_lag8", "pm25_lag9", "pm25_lag10", "pm25_lag11", "pm25_lag12", "pm25_lag13", "pm25_lag14", "pm25_lag15", "pm25_lag16", "pm25_lag17", "pm25_lag18", "pm25_lag19", "pm25_lag20", "pm25_lag21", "pm25_lag22", "pm25_lag23", "pm25_lag24", "hour_sin", "hour_cos", "dow", "is_weekend", "pm25_delta1", "inversion_spread", "rh_magnus", "dewp_delta", "is_heating", "log_iws", "month_sin", "pm25_accel", "vent_index", "cbwd_prev_NW", "rh_iws"]}, "split": {"name": "calendar_year", "manifest_dir": "C:\\Users\\abhir\\autoresearch-uci\\beijing_pm25\\data"}, "composite": {"higher_is_better": false, "penalty_weight": 0.1, "below_threshold": -40.0}, "hardware": {"n_threads": 4, "cpu_affinity": [0, 2, 4, 6]}, "description": "Exp192 FT-Transformer Pre-LN add rh_iws on Exp186 recipe (FT cycle 18/50)", "seed": 0}, "composite": -21.948362215847666, "val_primary": 21.948362215847666, "test_primary": 20.453385629755623, "per_fold_test": [20.453385629755623], "per_fold_val": [21.948362215847666], "status": "KEEP", "seconds_elapsed": 4167.589441537857, "timestamp": "2026-08-22T07:59:20", "secondary_metrics": {"mae": 11.233055142876488, "mape": 0.19879168750263154, "r2": 0.951670930541938, "ic": 0.97338365382589}, "per_fold_test_reports": [{"fold_id": 0, "regime": "calendar_2014_test", "task_type": "regression", "n": 7950, "rmse": 20.453385629755623, "mae": 11.233055142876488, "mape": 0.19879168750263154, "r2": 0.951670930541938, "ic": 0.97338365382589}], "composite_fingerprint": "a12fd381fe9bbefb"}
{"experiment_num": 193, "backbone": "ft_transformer", "description": "Exp193 FT-Transformer Pre-LN add se_iws on Exp192 recipe (FT cycle 19/50)", "config": {"paths": {"results_dir": "C:\\Users\\abhir\\autoresearch-uci\\beijing_pm25\\autoresearch_results"}, "task_type": "regression", "primary_metric": "rmse", "backbone": "ft_transformer", "backbone_config": {"seed": 0, "n_jobs": 4, "d_model": 64, "n_heads": 4, "n_layers": 3, "dropout": 0.1, "lr": 0.0001, "epochs": 100, "patience": 15, "batch_size": 32, "weight_decay": 1e-05, "warmup": 10, "norm_first": true}, "data": {"format": "csv", "path": "C:\\Users\\abhir\\autoresearch-uci\\beijing_pm25\\data\\features_full.csv", "target_columns": ["pm25"], "feature_columns": ["DEWP", "TEMP", "PRES", "Iws", "Is", "Ir", "cbwd_NE", "cbwd_NW", "cbwd_SE", "cbwd_cv", "pm25_lag1", "pm25_lag2", "pm25_lag3", "pm25_lag4", "pm25_lag5", "pm25_lag6", "pm25_lag7", "pm25_lag8", "pm25_lag9", "pm25_lag10", "pm25_lag11", "pm25_lag12", "pm25_lag13", "pm25_lag14", "pm25_lag15", "pm25_lag16", "pm25_lag17", "pm25_lag18", "pm25_lag19", "pm25_lag20", "pm25_lag21", "pm25_lag22", "pm25_lag23", "pm25_lag24", "hour_sin", "hour_cos", "dow", "is_weekend", "pm25_delta1", "inversion_spread", "rh_magnus", "dewp_delta", "is_heating", "log_iws", "month_sin", "pm25_accel", "vent_index", "cbwd_prev_NW", "rh_iws", "se_iws"]}, "split": {"name": "calendar_year", "manifest_dir": "C:\\Users\\abhir\\autoresearch-uci\\beijing_pm25\\data"}, "composite": {"higher_is_better": false, "penalty_weight": 0.1, "below_threshold": -40.0}, "hardware": {"n_threads": 4, "cpu_affinity": [0, 2, 4, 6]}, "description": "Exp193 FT-Transformer Pre-LN add se_iws on Exp192 recipe (FT cycle 19/50)", "seed": 0}, "composite": -22.265283629341333, "val_primary": 22.265283629341333, "test_primary": 20.63304619622686, "per_fold_test": [20.63304619622686], "per_fold_val": [22.265283629341333], "status": "DISCARD", "seconds_elapsed": 4337.019049167633, "timestamp": "2026-08-22T09:30:36", "secondary_metrics": {"mae": 11.235721833660918, "mape": 0.1947234110569725, "r2": 0.9508181658490387, "ic": 0.9729608722866454}, "per_fold_test_reports": [{"fold_id": 0, "regime": "calendar_2014_test", "task_type": "regression", "n": 7950, "rmse": 20.63304619622686, "mae": 11.235721833660918, "mape": 0.1947234110569725, "r2": 0.9508181658490387, "ic": 0.9729608722866454}], "composite_fingerprint": "a12fd381fe9bbefb"}
{"experiment_num": 194, "backbone": "ft_transformer", "description": "Exp194 FT-Transformer Pre-LN add is_severe on Exp192 recipe (FT cycle 20/50)", "config": {"paths": {"results_dir": "C:\\Users\\abhir\\autoresearch-uci\\beijing_pm25\\autoresearch_results"}, "task_type": "regression", "primary_metric": "rmse", "backbone": "ft_transformer", "backbone_config": {"seed": 0, "n_jobs": 4, "d_model": 64, "n_heads": 4, "n_layers": 3, "dropout": 0.1, "lr": 0.0001, "epochs": 100, "patience": 15, "batch_size": 32, "weight_decay": 1e-05, "warmup": 10, "norm_first": true}, "data": {"format": "csv", "path": "C:\\Users\\abhir\\autoresearch-uci\\beijing_pm25\\data\\features_full.csv", "target_columns": ["pm25"], "feature_columns": ["DEWP", "TEMP", "PRES", "Iws", "Is", "Ir", "cbwd_NE", "cbwd_NW", "cbwd_SE", "cbwd_cv", "pm25_lag1", "pm25_lag2", "pm25_lag3", "pm25_lag4", "pm25_lag5", "pm25_lag6", "pm25_lag7", "pm25_lag8", "pm25_lag9", "pm25_lag10", "pm25_lag11", "pm25_lag12", "pm25_lag13", "pm25_lag14", "pm25_lag15", "pm25_lag16", "pm25_lag17", "pm25_lag18", "pm25_lag19", "pm25_lag20", "pm25_lag21", "pm25_lag22", "pm25_lag23", "pm25_lag24", "hour_sin", "hour_cos", "dow", "is_weekend", "pm25_delta1", "inversion_spread", "rh_magnus", "dewp_delta", "is_heating", "log_iws", "month_sin", "pm25_accel", "vent_index", "cbwd_prev_NW", "rh_iws", "is_severe"]}, "split": {"name": "calendar_year", "manifest_dir": "C:\\Users\\abhir\\autoresearch-uci\\beijing_pm25\\data"}, "composite": {"higher_is_better": false, "penalty_weight": 0.1, "below_threshold": -40.0}, "hardware": {"n_threads": 4, "cpu_affinity": [0, 2, 4, 6]}, "description": "Exp194 FT-Transformer Pre-LN add is_severe on Exp192 recipe (FT cycle 20/50)", "seed": 0}, "composite": -22.159347473146532, "val_primary": 22.159347473146532, "test_primary": 20.63814680115459, "per_fold_test": [20.63814680115459], "per_fold_val": [22.159347473146532], "status": "DISCARD", "seconds_elapsed": 7934.39958524704, "timestamp": "2026-08-22T12:00:25", "secondary_metrics": {"mae": 11.243758347829184, "mape": 0.20575744935331072, "r2": 0.9507938467921353, "ic": 0.9733097379762161}, "per_fold_test_reports": [{"fold_id": 0, "regime": "calendar_2014_test", "task_type": "regression", "n": 7950, "rmse": 20.63814680115459, "mae": 11.243758347829184, "mape": 0.20575744935331072, "r2": 0.9507938467921353, "ic": 0.9733097379762161}], "composite_fingerprint": "a12fd381fe9bbefb"}
{"experiment_num": 195, "backbone": "ft_transformer", "description": "Exp195 FT-Transformer Pre-LN add pm25_delta6 on Exp192 recipe (FT cycle 21/50)", "config": {"paths": {"results_dir": "C:\\Users\\abhir\\autoresearch-uci\\beijing_pm25\\autoresearch_results"}, "task_type": "regression", "primary_metric": "rmse", "backbone": "ft_transformer", "backbone_config": {"seed": 0, "n_jobs": 4, "d_model": 64, "n_heads": 4, "n_layers": 3, "dropout": 0.1, "lr": 0.0001, "epochs": 100, "patience": 15, "batch_size": 32, "weight_decay": 1e-05, "warmup": 10, "norm_first": true}, "data": {"format": "csv", "path": "C:\\Users\\abhir\\autoresearch-uci\\beijing_pm25\\data\\features_full.csv", "target_columns": ["pm25"], "feature_columns": ["DEWP", "TEMP", "PRES", "Iws", "Is", "Ir", "cbwd_NE", "cbwd_NW", "cbwd_SE", "cbwd_cv", "pm25_lag1", "pm25_lag2", "pm25_lag3", "pm25_lag4", "pm25_lag5", "pm25_lag6", "pm25_lag7", "pm25_lag8", "pm25_lag9", "pm25_lag10", "pm25_lag11", "pm25_lag12", "pm25_lag13", "pm25_lag14", "pm25_lag15", "pm25_lag16", "pm25_lag17", "pm25_lag18", "pm25_lag19", "pm25_lag20", "pm25_lag21", "pm25_lag22", "pm25_lag23", "pm25_lag24", "hour_sin", "hour_cos", "dow", "is_weekend", "pm25_delta1", "inversion_spread", "rh_magnus", "dewp_delta", "is_heating", "log_iws", "month_sin", "pm25_accel", "vent_index", "cbwd_prev_NW", "rh_iws", "pm25_delta6"]}, "split": {"name": "calendar_year", "manifest_dir": "C:\\Users\\abhir\\autoresearch-uci\\beijing_pm25\\data"}, "composite": {"higher_is_better": false, "penalty_weight": 0.1, "below_threshold": -40.0}, "hardware": {"n_threads": 4, "cpu_affinity": [0, 2, 4, 6]}, "description": "Exp195 FT-Transformer Pre-LN add pm25_delta6 on Exp192 recipe (FT cycle 21/50)", "seed": 0}, "composite": -22.313317039437365, "val_primary": 22.313317039437365, "test_primary": 20.69853431561915, "per_fold_test": [20.69853431561915], "per_fold_val": [22.313317039437365], "status": "DISCARD", "seconds_elapsed": 6036.459444761276, "timestamp": "2026-08-22T13:58:37", "secondary_metrics": {"mae": 11.25163406905888, "mape": 0.1946035562807536, "r2": 0.9505054696862464, "ic": 0.9730242222058875}, "per_fold_test_reports": [{"fold_id": 0, "regime": "calendar_2014_test", "task_type": "regression", "n": 7950, "rmse": 20.69853431561915, "mae": 11.25163406905888, "mape": 0.1946035562807536, "r2": 0.9505054696862464, "ic": 0.9730242222058875}], "composite_fingerprint": "a12fd381fe9bbefb"}
