{"experiment_num": 95, "backbone": "catboost", "description": "Exp95 CatBoost Plain random_strength=2 on Exp91 rh_magnus (CatBoost cycle 21/50)", "config": {"paths": {"results_dir": "C:\\Users\\abhir\\autoresearch-uci\\beijing_pm25\\autoresearch_results"}, "task_type": "regression", "primary_metric": "rmse", "backbone": "catboost", "backbone_config": {"seed": 0, "n_jobs": 4, "iterations": 2000, "depth": 6, "learning_rate": 0.03, "l2_leaf_reg": 3, "early_stopping_rounds": 100, "boosting_type": "Plain", "random_strength": 2}, "data": {"format": "csv", "path": "C:\\Users\\abhir\\autoresearch-uci\\beijing_pm25\\data\\features_full.csv", "target_columns": ["pm25"], "feature_columns": ["DEWP", "TEMP", "PRES", "Iws", "Is", "Ir", "cbwd_NE", "cbwd_NW", "cbwd_SE", "cbwd_cv", "pm25_lag1", "pm25_lag2", "pm25_lag3", "pm25_lag4", "pm25_lag5", "pm25_lag6", "pm25_lag7", "pm25_lag8", "pm25_lag9", "pm25_lag10", "pm25_lag11", "pm25_lag12", "pm25_lag13", "pm25_lag14", "pm25_lag15", "pm25_lag16", "pm25_lag17", "pm25_lag18", "pm25_lag19", "pm25_lag20", "pm25_lag21", "pm25_lag22", "pm25_lag23", "pm25_lag24", "hour_sin", "hour_cos", "dow", "is_weekend", "pm25_delta1", "inversion_spread", "rh_magnus"]}, "split": {"name": "calendar_year", "manifest_dir": "C:\\Users\\abhir\\autoresearch-uci\\beijing_pm25\\data"}, "composite": {"higher_is_better": false, "penalty_weight": 0.1, "below_threshold": -40.0}, "hardware": {"n_threads": 4, "cpu_affinity": [0, 2, 4, 6]}, "description": "Exp95 CatBoost Plain random_strength=2 on Exp91 rh_magnus (CatBoost cycle 21/50)", "seed": 0}, "composite": -22.451224740895775, "val_primary": 22.451224740895775, "test_primary": 21.004802819058472, "per_fold_test": [21.004802819058472], "per_fold_val": [22.451224740895775], "status": "DISCARD", "seconds_elapsed": 35.35003995895386, "timestamp": "2026-08-18T22:20:12", "secondary_metrics": {"mae": 11.549018657803485, "mape": 0.21008068480018713, "r2": 0.9490299290812506, "ic": 0.9723033355684599}, "per_fold_test_reports": [{"fold_id": 0, "regime": "calendar_2014_test", "task_type": "regression", "n": 7950, "rmse": 21.004802819058472, "mae": 11.549018657803485, "mape": 0.21008068480018713, "r2": 0.9490299290812506, "ic": 0.9723033355684599}], "composite_fingerprint": "a12fd381fe9bbefb"}
{"experiment_num": 96, "backbone": "catboost", "description": "Exp96 CatBoost Plain add dewp_delta on Exp91 rh_magnus (CatBoost cycle 22/50)", "config": {"paths": {"results_dir": "C:\\Users\\abhir\\autoresearch-uci\\beijing_pm25\\autoresearch_results"}, "task_type": "regression", "primary_metric": "rmse", "backbone": "catboost", "backbone_config": {"seed": 0, "n_jobs": 4, "iterations": 2000, "depth": 6, "learning_rate": 0.03, "l2_leaf_reg": 3, "early_stopping_rounds": 100, "boosting_type": "Plain"}, "data": {"format": "csv", "path": "C:\\Users\\abhir\\autoresearch-uci\\beijing_pm25\\data\\features_full.csv", "target_columns": ["pm25"], "feature_columns": ["DEWP", "TEMP", "PRES", "Iws", "Is", "Ir", "cbwd_NE", "cbwd_NW", "cbwd_SE", "cbwd_cv", "pm25_lag1", "pm25_lag2", "pm25_lag3", "pm25_lag4", "pm25_lag5", "pm25_lag6", "pm25_lag7", "pm25_lag8", "pm25_lag9", "pm25_lag10", "pm25_lag11", "pm25_lag12", "pm25_lag13", "pm25_lag14", "pm25_lag15", "pm25_lag16", "pm25_lag17", "pm25_lag18", "pm25_lag19", "pm25_lag20", "pm25_lag21", "pm25_lag22", "pm25_lag23", "pm25_lag24", "hour_sin", "hour_cos", "dow", "is_weekend", "pm25_delta1", "inversion_spread", "rh_magnus", "dewp_delta"]}, "split": {"name": "calendar_year", "manifest_dir": "C:\\Users\\abhir\\autoresearch-uci\\beijing_pm25\\data"}, "composite": {"higher_is_better": false, "penalty_weight": 0.1, "below_threshold": -40.0}, "hardware": {"n_threads": 4, "cpu_affinity": [0, 2, 4, 6]}, "description": "Exp96 CatBoost Plain add dewp_delta on Exp91 rh_magnus (CatBoost cycle 22/50)", "seed": 0}, "composite": -22.356532556244133, "val_primary": 22.356532556244133, "test_primary": 20.880700654348953, "per_fold_test": [20.880700654348953], "per_fold_val": [22.356532556244133], "status": "KEEP", "seconds_elapsed": 15.874270915985107, "timestamp": "2026-08-18T22:36:05", "secondary_metrics": {"mae": 11.47256978396535, "mape": 0.22031579113122524, "r2": 0.9496304402884628, "ic": 0.9723351281732978}, "per_fold_test_reports": [{"fold_id": 0, "regime": "calendar_2014_test", "task_type": "regression", "n": 7950, "rmse": 20.880700654348953, "mae": 11.47256978396535, "mape": 0.22031579113122524, "r2": 0.9496304402884628, "ic": 0.9723351281732978}], "composite_fingerprint": "a12fd381fe9bbefb"}
{"experiment_num": 97, "backbone": "catboost", "description": "Exp97 CatBoost Plain add is_heating on Exp96 dewp_delta (CatBoost cycle 23/50)", "config": {"paths": {"results_dir": "C:\\Users\\abhir\\autoresearch-uci\\beijing_pm25\\autoresearch_results"}, "task_type": "regression", "primary_metric": "rmse", "backbone": "catboost", "backbone_config": {"seed": 0, "n_jobs": 4, "iterations": 2000, "depth": 6, "learning_rate": 0.03, "l2_leaf_reg": 3, "early_stopping_rounds": 100, "boosting_type": "Plain"}, "data": {"format": "csv", "path": "C:\\Users\\abhir\\autoresearch-uci\\beijing_pm25\\data\\features_full.csv", "target_columns": ["pm25"], "feature_columns": ["DEWP", "TEMP", "PRES", "Iws", "Is", "Ir", "cbwd_NE", "cbwd_NW", "cbwd_SE", "cbwd_cv", "pm25_lag1", "pm25_lag2", "pm25_lag3", "pm25_lag4", "pm25_lag5", "pm25_lag6", "pm25_lag7", "pm25_lag8", "pm25_lag9", "pm25_lag10", "pm25_lag11", "pm25_lag12", "pm25_lag13", "pm25_lag14", "pm25_lag15", "pm25_lag16", "pm25_lag17", "pm25_lag18", "pm25_lag19", "pm25_lag20", "pm25_lag21", "pm25_lag22", "pm25_lag23", "pm25_lag24", "hour_sin", "hour_cos", "dow", "is_weekend", "pm25_delta1", "inversion_spread", "rh_magnus", "dewp_delta", "is_heating"]}, "split": {"name": "calendar_year", "manifest_dir": "C:\\Users\\abhir\\autoresearch-uci\\beijing_pm25\\data"}, "composite": {"higher_is_better": false, "penalty_weight": 0.1, "below_threshold": -40.0}, "hardware": {"n_threads": 4, "cpu_affinity": [0, 2, 4, 6]}, "description": "Exp97 CatBoost Plain add is_heating on Exp96 dewp_delta (CatBoost cycle 23/50)", "seed": 0}, "composite": -22.166611495156538, "val_primary": 22.166611495156538, "test_primary": 20.73514958690229, "per_fold_test": [20.73514958690229], "per_fold_val": [22.166611495156538], "status": "KEEP", "seconds_elapsed": 27.24094557762146, "timestamp": "2026-08-18T23:05:33", "secondary_metrics": {"mae": 11.397541340218662, "mape": 0.2115776123881099, "r2": 0.9503302052401891, "ic": 0.9727164800634}, "per_fold_test_reports": [{"fold_id": 0, "regime": "calendar_2014_test", "task_type": "regression", "n": 7950, "rmse": 20.73514958690229, "mae": 11.397541340218662, "mape": 0.2115776123881099, "r2": 0.9503302052401891, "ic": 0.9727164800634}], "composite_fingerprint": "a12fd381fe9bbefb"}
{"experiment_num": 98, "backbone": "catboost", "description": "Exp98 CatBoost Plain add heating_night on Exp97 is_heating (CatBoost cycle 24/50)", "config": {"paths": {"results_dir": "C:\\Users\\abhir\\autoresearch-uci\\beijing_pm25\\autoresearch_results"}, "task_type": "regression", "primary_metric": "rmse", "backbone": "catboost", "backbone_config": {"seed": 0, "n_jobs": 4, "iterations": 2000, "depth": 6, "learning_rate": 0.03, "l2_leaf_reg": 3, "early_stopping_rounds": 100, "boosting_type": "Plain"}, "data": {"format": "csv", "path": "C:\\Users\\abhir\\autoresearch-uci\\beijing_pm25\\data\\features_full.csv", "target_columns": ["pm25"], "feature_columns": ["DEWP", "TEMP", "PRES", "Iws", "Is", "Ir", "cbwd_NE", "cbwd_NW", "cbwd_SE", "cbwd_cv", "pm25_lag1", "pm25_lag2", "pm25_lag3", "pm25_lag4", "pm25_lag5", "pm25_lag6", "pm25_lag7", "pm25_lag8", "pm25_lag9", "pm25_lag10", "pm25_lag11", "pm25_lag12", "pm25_lag13", "pm25_lag14", "pm25_lag15", "pm25_lag16", "pm25_lag17", "pm25_lag18", "pm25_lag19", "pm25_lag20", "pm25_lag21", "pm25_lag22", "pm25_lag23", "pm25_lag24", "hour_sin", "hour_cos", "dow", "is_weekend", "pm25_delta1", "inversion_spread", "rh_magnus", "dewp_delta", "is_heating", "heating_night"]}, "split": {"name": "calendar_year", "manifest_dir": "C:\\Users\\abhir\\autoresearch-uci\\beijing_pm25\\data"}, "composite": {"higher_is_better": false, "penalty_weight": 0.1, "below_threshold": -40.0}, "hardware": {"n_threads": 4, "cpu_affinity": [0, 2, 4, 6]}, "description": "Exp98 CatBoost Plain add heating_night on Exp97 is_heating (CatBoost cycle 24/50)", "seed": 0}, "composite": -22.34328478196189, "val_primary": 22.34328478196189, "test_primary": 20.786190463639894, "per_fold_test": [20.786190463639894], "per_fold_val": [22.34328478196189], "status": "DISCARD", "seconds_elapsed": 19.542317152023315, "timestamp": "2026-08-18T23:36:31", "secondary_metrics": {"mae": 11.411119083830393, "mape": 0.2162898733609968, "r2": 0.950085373619751, "ic": 0.9726452187540933}, "per_fold_test_reports": [{"fold_id": 0, "regime": "calendar_2014_test", "task_type": "regression", "n": 7950, "rmse": 20.786190463639894, "mae": 11.411119083830393, "mape": 0.2162898733609968, "r2": 0.950085373619751, "ic": 0.9726452187540933}], "composite_fingerprint": "a12fd381fe9bbefb"}
{"experiment_num": 99, "backbone": "catboost", "description": "Exp99 CatBoost Plain bagging_temperature=2 on Exp97 (CatBoost cycle 25/50)", "config": {"paths": {"results_dir": "C:\\Users\\abhir\\autoresearch-uci\\beijing_pm25\\autoresearch_results"}, "task_type": "regression", "primary_metric": "rmse", "backbone": "catboost", "backbone_config": {"seed": 0, "n_jobs": 4, "iterations": 2000, "depth": 6, "learning_rate": 0.03, "l2_leaf_reg": 3, "early_stopping_rounds": 100, "boosting_type": "Plain", "bagging_temperature": 2}, "data": {"format": "csv", "path": "C:\\Users\\abhir\\autoresearch-uci\\beijing_pm25\\data\\features_full.csv", "target_columns": ["pm25"], "feature_columns": ["DEWP", "TEMP", "PRES", "Iws", "Is", "Ir", "cbwd_NE", "cbwd_NW", "cbwd_SE", "cbwd_cv", "pm25_lag1", "pm25_lag2", "pm25_lag3", "pm25_lag4", "pm25_lag5", "pm25_lag6", "pm25_lag7", "pm25_lag8", "pm25_lag9", "pm25_lag10", "pm25_lag11", "pm25_lag12", "pm25_lag13", "pm25_lag14", "pm25_lag15", "pm25_lag16", "pm25_lag17", "pm25_lag18", "pm25_lag19", "pm25_lag20", "pm25_lag21", "pm25_lag22", "pm25_lag23", "pm25_lag24", "hour_sin", "hour_cos", "dow", "is_weekend", "pm25_delta1", "inversion_spread", "rh_magnus", "dewp_delta", "is_heating"]}, "split": {"name": "calendar_year", "manifest_dir": "C:\\Users\\abhir\\autoresearch-uci\\beijing_pm25\\data"}, "composite": {"higher_is_better": false, "penalty_weight": 0.1, "below_threshold": -40.0}, "hardware": {"n_threads": 4, "cpu_affinity": [0, 2, 4, 6]}, "description": "Exp99 CatBoost Plain bagging_temperature=2 on Exp97 (CatBoost cycle 25/50)", "seed": 0}, "composite": -22.166611495156538, "val_primary": 22.166611495156538, "test_primary": 20.73514958690229, "per_fold_test": [20.73514958690229], "per_fold_val": [22.166611495156538], "status": "DISCARD", "seconds_elapsed": 27.63905358314514, "timestamp": "2026-08-18T23:37:42", "secondary_metrics": {"mae": 11.397541340218662, "mape": 0.2115776123881099, "r2": 0.9503302052401891, "ic": 0.9727164800634}, "per_fold_test_reports": [{"fold_id": 0, "regime": "calendar_2014_test", "task_type": "regression", "n": 7950, "rmse": 20.73514958690229, "mae": 11.397541340218662, "mape": 0.2115776123881099, "r2": 0.9503302052401891, "ic": 0.9727164800634}], "composite_fingerprint": "a12fd381fe9bbefb"}
{"experiment_num": 100, "backbone": "catboost", "description": "Exp100 CatBoost Plain add rh_iws on Exp97 (CatBoost cycle 26/50)", "config": {"paths": {"results_dir": "C:\\Users\\abhir\\autoresearch-uci\\beijing_pm25\\autoresearch_results"}, "task_type": "regression", "primary_metric": "rmse", "backbone": "catboost", "backbone_config": {"seed": 0, "n_jobs": 4, "iterations": 2000, "depth": 6, "learning_rate": 0.03, "l2_leaf_reg": 3, "early_stopping_rounds": 100, "boosting_type": "Plain"}, "data": {"format": "csv", "path": "C:\\Users\\abhir\\autoresearch-uci\\beijing_pm25\\data\\features_full.csv", "target_columns": ["pm25"], "feature_columns": ["DEWP", "TEMP", "PRES", "Iws", "Is", "Ir", "cbwd_NE", "cbwd_NW", "cbwd_SE", "cbwd_cv", "pm25_lag1", "pm25_lag2", "pm25_lag3", "pm25_lag4", "pm25_lag5", "pm25_lag6", "pm25_lag7", "pm25_lag8", "pm25_lag9", "pm25_lag10", "pm25_lag11", "pm25_lag12", "pm25_lag13", "pm25_lag14", "pm25_lag15", "pm25_lag16", "pm25_lag17", "pm25_lag18", "pm25_lag19", "pm25_lag20", "pm25_lag21", "pm25_lag22", "pm25_lag23", "pm25_lag24", "hour_sin", "hour_cos", "dow", "is_weekend", "pm25_delta1", "inversion_spread", "rh_magnus", "dewp_delta", "is_heating", "rh_iws"]}, "split": {"name": "calendar_year", "manifest_dir": "C:\\Users\\abhir\\autoresearch-uci\\beijing_pm25\\data"}, "composite": {"higher_is_better": false, "penalty_weight": 0.1, "below_threshold": -40.0}, "hardware": {"n_threads": 4, "cpu_affinity": [0, 2, 4, 6]}, "description": "Exp100 CatBoost Plain add rh_iws on Exp97 (CatBoost cycle 26/50)", "seed": 0}, "composite": -22.178257633013395, "val_primary": 22.178257633013395, "test_primary": 20.725540067261143, "per_fold_test": [20.725540067261143], "per_fold_val": [22.178257633013395], "status": "DISCARD", "seconds_elapsed": 34.691715478897095, "timestamp": "2026-08-19T00:08:54", "secondary_metrics": {"mae": 11.347857760750259, "mape": 0.20819187255821944, "r2": 0.9503762326165959, "ic": 0.9728260732699647}, "per_fold_test_reports": [{"fold_id": 0, "regime": "calendar_2014_test", "task_type": "regression", "n": 7950, "rmse": 20.725540067261143, "mae": 11.347857760750259, "mape": 0.20819187255821944, "r2": 0.9503762326165959, "ic": 0.9728260732699647}], "composite_fingerprint": "a12fd381fe9bbefb"}
{"experiment_num": 101, "backbone": "catboost", "description": "Exp101 CatBoost Plain add heating_build on Exp97 (CatBoost cycle 27/50)", "config": {"paths": {"results_dir": "C:\\Users\\abhir\\autoresearch-uci\\beijing_pm25\\autoresearch_results"}, "task_type": "regression", "primary_metric": "rmse", "backbone": "catboost", "backbone_config": {"seed": 0, "n_jobs": 4, "iterations": 2000, "depth": 6, "learning_rate": 0.03, "l2_leaf_reg": 3, "early_stopping_rounds": 100, "boosting_type": "Plain"}, "data": {"format": "csv", "path": "C:\\Users\\abhir\\autoresearch-uci\\beijing_pm25\\data\\features_full.csv", "target_columns": ["pm25"], "feature_columns": ["DEWP", "TEMP", "PRES", "Iws", "Is", "Ir", "cbwd_NE", "cbwd_NW", "cbwd_SE", "cbwd_cv", "pm25_lag1", "pm25_lag2", "pm25_lag3", "pm25_lag4", "pm25_lag5", "pm25_lag6", "pm25_lag7", "pm25_lag8", "pm25_lag9", "pm25_lag10", "pm25_lag11", "pm25_lag12", "pm25_lag13", "pm25_lag14", "pm25_lag15", "pm25_lag16", "pm25_lag17", "pm25_lag18", "pm25_lag19", "pm25_lag20", "pm25_lag21", "pm25_lag22", "pm25_lag23", "pm25_lag24", "hour_sin", "hour_cos", "dow", "is_weekend", "pm25_delta1", "inversion_spread", "rh_magnus", "dewp_delta", "is_heating", "heating_build"]}, "split": {"name": "calendar_year", "manifest_dir": "C:\\Users\\abhir\\autoresearch-uci\\beijing_pm25\\data"}, "composite": {"higher_is_better": false, "penalty_weight": 0.1, "below_threshold": -40.0}, "hardware": {"n_threads": 4, "cpu_affinity": [0, 2, 4, 6]}, "description": "Exp101 CatBoost Plain add heating_build on Exp97 (CatBoost cycle 27/50)", "seed": 0}, "composite": -22.32171608812532, "val_primary": 22.32171608812532, "test_primary": 20.989536854390405, "per_fold_test": [20.989536854390405], "per_fold_val": [22.32171608812532], "status": "DISCARD", "seconds_elapsed": 17.269853591918945, "timestamp": "2026-08-19T00:35:21", "secondary_metrics": {"mae": 11.482809979335931, "mape": 0.21948697633677108, "r2": 0.9491039906709089, "ic": 0.9723755758216232}, "per_fold_test_reports": [{"fold_id": 0, "regime": "calendar_2014_test", "task_type": "regression", "n": 7950, "rmse": 20.989536854390405, "mae": 11.482809979335931, "mape": 0.21948697633677108, "r2": 0.9491039906709089, "ic": 0.9723755758216232}], "composite_fingerprint": "a12fd381fe9bbefb"}
{"experiment_num": 102, "backbone": "catboost", "description": "Exp102 CatBoost Plain grow_policy=Depthwise on Exp97 (CatBoost cycle 28/50)", "config": {"paths": {"results_dir": "C:\\Users\\abhir\\autoresearch-uci\\beijing_pm25\\autoresearch_results"}, "task_type": "regression", "primary_metric": "rmse", "backbone": "catboost", "backbone_config": {"seed": 0, "n_jobs": 4, "iterations": 2000, "depth": 6, "learning_rate": 0.03, "l2_leaf_reg": 3, "early_stopping_rounds": 100, "boosting_type": "Plain", "grow_policy": "Depthwise"}, "data": {"format": "csv", "path": "C:\\Users\\abhir\\autoresearch-uci\\beijing_pm25\\data\\features_full.csv", "target_columns": ["pm25"], "feature_columns": ["DEWP", "TEMP", "PRES", "Iws", "Is", "Ir", "cbwd_NE", "cbwd_NW", "cbwd_SE", "cbwd_cv", "pm25_lag1", "pm25_lag2", "pm25_lag3", "pm25_lag4", "pm25_lag5", "pm25_lag6", "pm25_lag7", "pm25_lag8", "pm25_lag9", "pm25_lag10", "pm25_lag11", "pm25_lag12", "pm25_lag13", "pm25_lag14", "pm25_lag15", "pm25_lag16", "pm25_lag17", "pm25_lag18", "pm25_lag19", "pm25_lag20", "pm25_lag21", "pm25_lag22", "pm25_lag23", "pm25_lag24", "hour_sin", "hour_cos", "dow", "is_weekend", "pm25_delta1", "inversion_spread", "rh_magnus", "dewp_delta", "is_heating"]}, "split": {"name": "calendar_year", "manifest_dir": "C:\\Users\\abhir\\autoresearch-uci\\beijing_pm25\\data"}, "composite": {"higher_is_better": false, "penalty_weight": 0.1, "below_threshold": -40.0}, "hardware": {"n_threads": 4, "cpu_affinity": [0, 2, 4, 6]}, "description": "Exp102 CatBoost Plain grow_policy=Depthwise on Exp97 (CatBoost cycle 28/50)", "seed": 0}, "composite": -22.321966551928707, "val_primary": 22.321966551928707, "test_primary": 21.040034644479903, "per_fold_test": [21.040034644479903], "per_fold_val": [22.321966551928707], "status": "DISCARD", "seconds_elapsed": 35.26829552650452, "timestamp": "2026-08-19T01:05:36", "secondary_metrics": {"mae": 11.392285429671672, "mape": 0.2062141991634863, "r2": 0.9488587992023123, "ic": 0.9731829011238043}, "per_fold_test_reports": [{"fold_id": 0, "regime": "calendar_2014_test", "task_type": "regression", "n": 7950, "rmse": 21.040034644479903, "mae": 11.392285429671672, "mape": 0.2062141991634863, "r2": 0.9488587992023123, "ic": 0.9731829011238043}], "composite_fingerprint": "a12fd381fe9bbefb"}
{"experiment_num": 103, "backbone": "catboost", "description": "Exp103 CatBoost Plain add pres_delta on Exp97 (CatBoost cycle 29/50)", "config": {"paths": {"results_dir": "C:\\Users\\abhir\\autoresearch-uci\\beijing_pm25\\autoresearch_results"}, "task_type": "regression", "primary_metric": "rmse", "backbone": "catboost", "backbone_config": {"seed": 0, "n_jobs": 4, "iterations": 2000, "depth": 6, "learning_rate": 0.03, "l2_leaf_reg": 3, "early_stopping_rounds": 100, "boosting_type": "Plain"}, "data": {"format": "csv", "path": "C:\\Users\\abhir\\autoresearch-uci\\beijing_pm25\\data\\features_full.csv", "target_columns": ["pm25"], "feature_columns": ["DEWP", "TEMP", "PRES", "Iws", "Is", "Ir", "cbwd_NE", "cbwd_NW", "cbwd_SE", "cbwd_cv", "pm25_lag1", "pm25_lag2", "pm25_lag3", "pm25_lag4", "pm25_lag5", "pm25_lag6", "pm25_lag7", "pm25_lag8", "pm25_lag9", "pm25_lag10", "pm25_lag11", "pm25_lag12", "pm25_lag13", "pm25_lag14", "pm25_lag15", "pm25_lag16", "pm25_lag17", "pm25_lag18", "pm25_lag19", "pm25_lag20", "pm25_lag21", "pm25_lag22", "pm25_lag23", "pm25_lag24", "hour_sin", "hour_cos", "dow", "is_weekend", "pm25_delta1", "inversion_spread", "rh_magnus", "dewp_delta", "is_heating", "pres_delta"]}, "split": {"name": "calendar_year", "manifest_dir": "C:\\Users\\abhir\\autoresearch-uci\\beijing_pm25\\data"}, "composite": {"higher_is_better": false, "penalty_weight": 0.1, "below_threshold": -40.0}, "hardware": {"n_threads": 4, "cpu_affinity": [0, 2, 4, 6]}, "description": "Exp103 CatBoost Plain add pres_delta on Exp97 (CatBoost cycle 29/50)", "seed": 0}, "composite": -22.35211184397729, "val_primary": 22.35211184397729, "test_primary": 20.820129824518105, "per_fold_test": [20.820129824518105], "per_fold_val": [22.35211184397729], "status": "DISCARD", "seconds_elapsed": 16.49630117416382, "timestamp": "2026-08-19T01:39:20", "secondary_metrics": {"mae": 11.43970379559343, "mape": 0.2184300255463795, "r2": 0.9499222409335119, "ic": 0.9723605712322133}, "per_fold_test_reports": [{"fold_id": 0, "regime": "calendar_2014_test", "task_type": "regression", "n": 7950, "rmse": 20.820129824518105, "mae": 11.43970379559343, "mape": 0.2184300255463795, "r2": 0.9499222409335119, "ic": 0.9723605712322133}], "composite_fingerprint": "a12fd381fe9bbefb"}
