{"experiment_num": 1, "backbone": "xgboost", "description": "Exp1 baseline XGBoost nowcast, Chen-Guestrin 2016 defaults, frozen calendar split train2010-12/val2013/test2014", "config": {"paths": {"results_dir": "C:/Users/abhir/grok-autoresearch/benchmarks/beijing_pm25/autoresearch_results", "seed_reasoning": "C:/Users/abhir/grok-autoresearch/benchmarks/beijing_pm25/seed_reasoning_exp1.json"}, "task_type": "regression", "primary_metric": "rmse", "backbone": "xgboost", "backbone_config": {"n_estimators": 1500, "max_depth": 6, "learning_rate": 0.03, "subsample": 0.8, "colsample_bytree": 0.8, "reg_lambda": 1.0, "early_stopping_rounds": 50, "seed": 0, "n_jobs": 4, "tree_method": "hist", "uncertainty_samples": 1}, "data": {"format": "csv", "path": "C:/Users/abhir/grok-autoresearch/benchmarks/beijing_pm25/data/features.csv", "target_columns": ["pm25"], "feature_columns": null}, "split": {"name": "calendar_year", "manifest_dir": "C:/Users/abhir/grok-autoresearch/benchmarks/beijing_pm25/data"}, "composite": {"higher_is_better": false, "penalty_weight": 0.1, "below_threshold": -40.0}, "hardware": {"n_threads": 4, "cpu_affinity": [0, 2, 4, 6]}, "description": "Exp1 baseline XGBoost nowcast, Chen-Guestrin 2016 defaults, frozen calendar split train2010-12/val2013/test2014", "seed": 0}, "composite": -23.354286785425597, "val_primary": 23.354286785425597, "test_primary": 21.768400509591736, "per_fold_test": [21.768400509591736], "per_fold_val": [23.354286785425597], "status": "KEEP", "seconds_elapsed": 1.6254501342773438, "timestamp": "2026-08-18T01:03:47", "secondary_metrics": {"mae": 11.721970321967166, "mape": 0.20905476370348722, "r2": 0.9452566893193216, "ic": 0.9724805636693287}, "per_fold_test_reports": [{"fold_id": 0, "regime": "calendar_2014_test", "task_type": "regression", "n": 7950, "rmse": 21.768400509591736, "mae": 11.721970321967166, "mape": 0.20905476370348722, "r2": 0.9452566893193216, "ic": 0.9724805636693287}], "composite_fingerprint": "a12fd381fe9bbefb"}
{"experiment_num": 2, "backbone": "xgboost", "description": "Exp2 from champion: max_depth 4", "config": {"paths": {"results_dir": "C:\\Users\\abhir\\autoresearch-uci\\beijing_pm25\\autoresearch_results"}, "task_type": "regression", "primary_metric": "rmse", "backbone": "xgboost", "backbone_config": {"n_estimators": 1500, "max_depth": 4, "learning_rate": 0.03, "subsample": 0.8, "colsample_bytree": 0.8, "reg_lambda": 1.0, "early_stopping_rounds": 50, "seed": 0, "n_jobs": 4, "tree_method": "hist", "uncertainty_samples": 1}, "data": {"format": "csv", "path": "C:\\Users\\abhir\\grok-autoresearch\\benchmarks\\beijing_pm25\\data\\features.csv", "target_columns": ["pm25"], "feature_columns": null}, "split": {"name": "calendar_year", "manifest_dir": "C:\\Users\\abhir\\autoresearch-uci\\beijing_pm25\\data"}, "composite": {"higher_is_better": false, "penalty_weight": 0.1, "below_threshold": -40.0}, "hardware": {"n_threads": 4, "cpu_affinity": [0, 2, 4, 6]}, "description": "Exp2 from champion: max_depth 4", "seed": 0}, "composite": -23.204665531656815, "val_primary": 23.204665531656815, "test_primary": 21.995917405954906, "per_fold_test": [21.995917405954906], "per_fold_val": [23.204665531656815], "status": "KEEP", "seconds_elapsed": 1.3850502967834473, "timestamp": "2026-08-18T01:13:47", "secondary_metrics": {"mae": 11.901095789003673, "mape": 0.22024299413450243, "r2": 0.9441063874148722, "ic": 0.9716902960160507}, "per_fold_test_reports": [{"fold_id": 0, "regime": "calendar_2014_test", "task_type": "regression", "n": 7950, "rmse": 21.995917405954906, "mae": 11.901095789003673, "mape": 0.22024299413450243, "r2": 0.9441063874148722, "ic": 0.9716902960160507}], "composite_fingerprint": "a12fd381fe9bbefb"}
{"experiment_num": 3, "backbone": "xgboost", "description": "Exp3 from champion: max_depth 8", "config": {"paths": {"results_dir": "C:\\Users\\abhir\\autoresearch-uci\\beijing_pm25\\autoresearch_results"}, "task_type": "regression", "primary_metric": "rmse", "backbone": "xgboost", "backbone_config": {"n_estimators": 1500, "max_depth": 8, "learning_rate": 0.03, "subsample": 0.8, "colsample_bytree": 0.8, "reg_lambda": 1.0, "early_stopping_rounds": 50, "seed": 0, "n_jobs": 4, "tree_method": "hist", "uncertainty_samples": 1}, "data": {"format": "csv", "path": "C:\\Users\\abhir\\grok-autoresearch\\benchmarks\\beijing_pm25\\data\\features.csv", "target_columns": ["pm25"], "feature_columns": null}, "split": {"name": "calendar_year", "manifest_dir": "C:\\Users\\abhir\\autoresearch-uci\\beijing_pm25\\data"}, "composite": {"higher_is_better": false, "penalty_weight": 0.1, "below_threshold": -40.0}, "hardware": {"n_threads": 4, "cpu_affinity": [0, 2, 4, 6]}, "description": "Exp3 from champion: max_depth 8", "seed": 0}, "composite": -23.363623077389153, "val_primary": 23.363623077389153, "test_primary": 21.7569677318378, "per_fold_test": [21.7569677318378], "per_fold_val": [23.363623077389153], "status": "DISCARD", "seconds_elapsed": 5.76809549331665, "timestamp": "2026-08-18T01:14:24", "secondary_metrics": {"mae": 11.794608516933033, "mape": 0.20959287109421254, "r2": 0.9453141766621411, "ic": 0.9720935017112426}, "per_fold_test_reports": [{"fold_id": 0, "regime": "calendar_2014_test", "task_type": "regression", "n": 7950, "rmse": 21.7569677318378, "mae": 11.794608516933033, "mape": 0.20959287109421254, "r2": 0.9453141766621411, "ic": 0.9720935017112426}], "composite_fingerprint": "a12fd381fe9bbefb"}
{"experiment_num": 4, "backbone": "xgboost", "description": "Exp4 from champion: learning_rate 0.01", "config": {"paths": {"results_dir": "C:\\Users\\abhir\\autoresearch-uci\\beijing_pm25\\autoresearch_results"}, "task_type": "regression", "primary_metric": "rmse", "backbone": "xgboost", "backbone_config": {"n_estimators": 1500, "max_depth": 4, "learning_rate": 0.01, "subsample": 0.8, "colsample_bytree": 0.8, "reg_lambda": 1.0, "early_stopping_rounds": 50, "seed": 0, "n_jobs": 4, "tree_method": "hist", "uncertainty_samples": 1}, "data": {"format": "csv", "path": "C:\\Users\\abhir\\grok-autoresearch\\benchmarks\\beijing_pm25\\data\\features.csv", "target_columns": ["pm25"], "feature_columns": null}, "split": {"name": "calendar_year", "manifest_dir": "C:\\Users\\abhir\\autoresearch-uci\\beijing_pm25\\data"}, "composite": {"higher_is_better": false, "penalty_weight": 0.1, "below_threshold": -40.0}, "hardware": {"n_threads": 4, "cpu_affinity": [0, 2, 4, 6]}, "description": "Exp4 from champion: learning_rate 0.01", "seed": 0}, "composite": -23.12394078492414, "val_primary": 23.12394078492414, "test_primary": 22.007927506049416, "per_fold_test": [22.007927506049416], "per_fold_val": [23.12394078492414], "status": "KEEP", "seconds_elapsed": 2.8493878841400146, "timestamp": "2026-08-18T01:14:45", "secondary_metrics": {"mae": 11.902869336410138, "mape": 0.22321285743307093, "r2": 0.9440453332532281, "ic": 0.9716497274506054}, "per_fold_test_reports": [{"fold_id": 0, "regime": "calendar_2014_test", "task_type": "regression", "n": 7950, "rmse": 22.007927506049416, "mae": 11.902869336410138, "mape": 0.22321285743307093, "r2": 0.9440453332532281, "ic": 0.9716497274506054}], "composite_fingerprint": "a12fd381fe9bbefb"}
{"experiment_num": 5, "backbone": "xgboost", "description": "Exp5 from champion: learning_rate 0.05", "config": {"paths": {"results_dir": "C:\\Users\\abhir\\autoresearch-uci\\beijing_pm25\\autoresearch_results"}, "task_type": "regression", "primary_metric": "rmse", "backbone": "xgboost", "backbone_config": {"n_estimators": 1500, "max_depth": 4, "learning_rate": 0.05, "subsample": 0.8, "colsample_bytree": 0.8, "reg_lambda": 1.0, "early_stopping_rounds": 50, "seed": 0, "n_jobs": 4, "tree_method": "hist", "uncertainty_samples": 1}, "data": {"format": "csv", "path": "C:\\Users\\abhir\\grok-autoresearch\\benchmarks\\beijing_pm25\\data\\features.csv", "target_columns": ["pm25"], "feature_columns": null}, "split": {"name": "calendar_year", "manifest_dir": "C:\\Users\\abhir\\autoresearch-uci\\beijing_pm25\\data"}, "composite": {"higher_is_better": false, "penalty_weight": 0.1, "below_threshold": -40.0}, "hardware": {"n_threads": 4, "cpu_affinity": [0, 2, 4, 6]}, "description": "Exp5 from champion: learning_rate 0.05", "seed": 0}, "composite": -23.208073356445578, "val_primary": 23.208073356445578, "test_primary": 22.011554109175826, "per_fold_test": [22.011554109175826], "per_fold_val": [23.208073356445578], "status": "DISCARD", "seconds_elapsed": 1.1226329803466797, "timestamp": "2026-08-18T01:14:52", "secondary_metrics": {"mae": 11.892440376341717, "mape": 0.22232630800249914, "r2": 0.9440268906180497, "ic": 0.9715484091258229}, "per_fold_test_reports": [{"fold_id": 0, "regime": "calendar_2014_test", "task_type": "regression", "n": 7950, "rmse": 22.011554109175826, "mae": 11.892440376341717, "mape": 0.22232630800249914, "r2": 0.9440268906180497, "ic": 0.9715484091258229}], "composite_fingerprint": "a12fd381fe9bbefb"}
{"experiment_num": 6, "backbone": "xgboost", "description": "Exp6 from champion: min_child_weight 10", "config": {"paths": {"results_dir": "C:\\Users\\abhir\\autoresearch-uci\\beijing_pm25\\autoresearch_results"}, "task_type": "regression", "primary_metric": "rmse", "backbone": "xgboost", "backbone_config": {"n_estimators": 1500, "max_depth": 4, "learning_rate": 0.01, "subsample": 0.8, "colsample_bytree": 0.8, "reg_lambda": 1.0, "early_stopping_rounds": 50, "seed": 0, "n_jobs": 4, "tree_method": "hist", "uncertainty_samples": 1, "min_child_weight": 10}, "data": {"format": "csv", "path": "C:\\Users\\abhir\\grok-autoresearch\\benchmarks\\beijing_pm25\\data\\features.csv", "target_columns": ["pm25"], "feature_columns": null}, "split": {"name": "calendar_year", "manifest_dir": "C:\\Users\\abhir\\autoresearch-uci\\beijing_pm25\\data"}, "composite": {"higher_is_better": false, "penalty_weight": 0.1, "below_threshold": -40.0}, "hardware": {"n_threads": 4, "cpu_affinity": [0, 2, 4, 6]}, "description": "Exp6 from champion: min_child_weight 10", "seed": 0}, "composite": -23.14237265910819, "val_primary": 23.14237265910819, "test_primary": 21.697013729957284, "per_fold_test": [21.697013729957284], "per_fold_val": [23.14237265910819], "status": "DISCARD", "seconds_elapsed": 5.206618070602417, "timestamp": "2026-08-18T01:15:01", "secondary_metrics": {"mae": 11.904307717017408, "mape": 0.22522058068841286, "r2": 0.9456151484387171, "ic": 0.9715746618971685}, "per_fold_test_reports": [{"fold_id": 0, "regime": "calendar_2014_test", "task_type": "regression", "n": 7950, "rmse": 21.697013729957284, "mae": 11.904307717017408, "mape": 0.22522058068841286, "r2": 0.9456151484387171, "ic": 0.9715746618971685}], "composite_fingerprint": "a12fd381fe9bbefb"}
{"experiment_num": 7, "backbone": "xgboost", "description": "Exp7 from champion: gamma 1.0", "config": {"paths": {"results_dir": "C:\\Users\\abhir\\autoresearch-uci\\beijing_pm25\\autoresearch_results"}, "task_type": "regression", "primary_metric": "rmse", "backbone": "xgboost", "backbone_config": {"n_estimators": 1500, "max_depth": 4, "learning_rate": 0.01, "subsample": 0.8, "colsample_bytree": 0.8, "reg_lambda": 1.0, "early_stopping_rounds": 50, "seed": 0, "n_jobs": 4, "tree_method": "hist", "uncertainty_samples": 1, "gamma": 1.0}, "data": {"format": "csv", "path": "C:\\Users\\abhir\\grok-autoresearch\\benchmarks\\beijing_pm25\\data\\features.csv", "target_columns": ["pm25"], "feature_columns": null}, "split": {"name": "calendar_year", "manifest_dir": "C:\\Users\\abhir\\autoresearch-uci\\beijing_pm25\\data"}, "composite": {"higher_is_better": false, "penalty_weight": 0.1, "below_threshold": -40.0}, "hardware": {"n_threads": 4, "cpu_affinity": [0, 2, 4, 6]}, "description": "Exp7 from champion: gamma 1.0", "seed": 0}, "composite": -23.12394078492414, "val_primary": 23.12394078492414, "test_primary": 22.007927506049416, "per_fold_test": [22.007927506049416], "per_fold_val": [23.12394078492414], "status": "DISCARD", "seconds_elapsed": 4.72391939163208, "timestamp": "2026-08-18T01:15:10", "secondary_metrics": {"mae": 11.902869336410138, "mape": 0.22321285743307093, "r2": 0.9440453332532281, "ic": 0.9716497274506054}, "per_fold_test_reports": [{"fold_id": 0, "regime": "calendar_2014_test", "task_type": "regression", "n": 7950, "rmse": 22.007927506049416, "mae": 11.902869336410138, "mape": 0.22321285743307093, "r2": 0.9440453332532281, "ic": 0.9716497274506054}], "composite_fingerprint": "a12fd381fe9bbefb"}
{"experiment_num": 8, "backbone": "xgboost", "description": "Exp8 from champion: subsample 0.6", "config": {"paths": {"results_dir": "C:\\Users\\abhir\\autoresearch-uci\\beijing_pm25\\autoresearch_results"}, "task_type": "regression", "primary_metric": "rmse", "backbone": "xgboost", "backbone_config": {"n_estimators": 1500, "max_depth": 4, "learning_rate": 0.01, "subsample": 0.6, "colsample_bytree": 0.8, "reg_lambda": 1.0, "early_stopping_rounds": 50, "seed": 0, "n_jobs": 4, "tree_method": "hist", "uncertainty_samples": 1}, "data": {"format": "csv", "path": "C:\\Users\\abhir\\grok-autoresearch\\benchmarks\\beijing_pm25\\data\\features.csv", "target_columns": ["pm25"], "feature_columns": null}, "split": {"name": "calendar_year", "manifest_dir": "C:\\Users\\abhir\\autoresearch-uci\\beijing_pm25\\data"}, "composite": {"higher_is_better": false, "penalty_weight": 0.1, "below_threshold": -40.0}, "hardware": {"n_threads": 4, "cpu_affinity": [0, 2, 4, 6]}, "description": "Exp8 from champion: subsample 0.6", "seed": 0}, "composite": -22.98348984706462, "val_primary": 22.98348984706462, "test_primary": 22.034103235088445, "per_fold_test": [22.034103235088445], "per_fold_val": [22.98348984706462], "status": "KEEP", "seconds_elapsed": 4.899494171142578, "timestamp": "2026-08-18T01:15:19", "secondary_metrics": {"mae": 11.918383711449005, "mape": 0.22710932391969638, "r2": 0.9439121516796297, "ic": 0.9715027131538543}, "per_fold_test_reports": [{"fold_id": 0, "regime": "calendar_2014_test", "task_type": "regression", "n": 7950, "rmse": 22.034103235088445, "mae": 11.918383711449005, "mape": 0.22710932391969638, "r2": 0.9439121516796297, "ic": 0.9715027131538543}], "composite_fingerprint": "a12fd381fe9bbefb"}
{"experiment_num": 9, "backbone": "xgboost", "description": "Exp9 from champion: colsample_bytree 0.5", "config": {"paths": {"results_dir": "C:\\Users\\abhir\\autoresearch-uci\\beijing_pm25\\autoresearch_results"}, "task_type": "regression", "primary_metric": "rmse", "backbone": "xgboost", "backbone_config": {"n_estimators": 1500, "max_depth": 4, "learning_rate": 0.01, "subsample": 0.6, "colsample_bytree": 0.5, "reg_lambda": 1.0, "early_stopping_rounds": 50, "seed": 0, "n_jobs": 4, "tree_method": "hist", "uncertainty_samples": 1}, "data": {"format": "csv", "path": "C:\\Users\\abhir\\grok-autoresearch\\benchmarks\\beijing_pm25\\data\\features.csv", "target_columns": ["pm25"], "feature_columns": null}, "split": {"name": "calendar_year", "manifest_dir": "C:\\Users\\abhir\\autoresearch-uci\\beijing_pm25\\data"}, "composite": {"higher_is_better": false, "penalty_weight": 0.1, "below_threshold": -40.0}, "hardware": {"n_threads": 4, "cpu_affinity": [0, 2, 4, 6]}, "description": "Exp9 from champion: colsample_bytree 0.5", "seed": 0}, "composite": -23.28228202736368, "val_primary": 23.28228202736368, "test_primary": 22.018817650426772, "per_fold_test": [22.018817650426772], "per_fold_val": [23.28228202736368], "status": "DISCARD", "seconds_elapsed": 6.966362476348877, "timestamp": "2026-08-18T01:15:31", "secondary_metrics": {"mae": 12.220930623108487, "mape": 0.2320560293202421, "r2": 0.9439899436521692, "ic": 0.9703284615196611}, "per_fold_test_reports": [{"fold_id": 0, "regime": "calendar_2014_test", "task_type": "regression", "n": 7950, "rmse": 22.018817650426772, "mae": 12.220930623108487, "mape": 0.2320560293202421, "r2": 0.9439899436521692, "ic": 0.9703284615196611}], "composite_fingerprint": "a12fd381fe9bbefb"}
{"experiment_num": 10, "backbone": "xgboost", "description": "Exp10 from champion: reg_lambda 5.0", "config": {"paths": {"results_dir": "C:\\Users\\abhir\\autoresearch-uci\\beijing_pm25\\autoresearch_results"}, "task_type": "regression", "primary_metric": "rmse", "backbone": "xgboost", "backbone_config": {"n_estimators": 1500, "max_depth": 4, "learning_rate": 0.01, "subsample": 0.6, "colsample_bytree": 0.8, "reg_lambda": 5.0, "early_stopping_rounds": 50, "seed": 0, "n_jobs": 4, "tree_method": "hist", "uncertainty_samples": 1}, "data": {"format": "csv", "path": "C:\\Users\\abhir\\grok-autoresearch\\benchmarks\\beijing_pm25\\data\\features.csv", "target_columns": ["pm25"], "feature_columns": null}, "split": {"name": "calendar_year", "manifest_dir": "C:\\Users\\abhir\\autoresearch-uci\\beijing_pm25\\data"}, "composite": {"higher_is_better": false, "penalty_weight": 0.1, "below_threshold": -40.0}, "hardware": {"n_threads": 4, "cpu_affinity": [0, 2, 4, 6]}, "description": "Exp10 from champion: reg_lambda 5.0", "seed": 0}, "composite": -23.059826091444112, "val_primary": 23.059826091444112, "test_primary": 21.611654553152768, "per_fold_test": [21.611654553152768], "per_fold_val": [23.059826091444112], "status": "DISCARD", "seconds_elapsed": 6.034126281738281, "timestamp": "2026-08-18T01:15:41", "secondary_metrics": {"mae": 11.874853357279076, "mape": 0.22853831700467178, "r2": 0.9460422223747976, "ic": 0.9714753440664868}, "per_fold_test_reports": [{"fold_id": 0, "regime": "calendar_2014_test", "task_type": "regression", "n": 7950, "rmse": 21.611654553152768, "mae": 11.874853357279076, "mape": 0.22853831700467178, "r2": 0.9460422223747976, "ic": 0.9714753440664868}], "composite_fingerprint": "a12fd381fe9bbefb"}
{"experiment_num": 11, "backbone": "xgboost", "description": "Exp11 from champion: reg_alpha 1.0", "config": {"paths": {"results_dir": "C:\\Users\\abhir\\autoresearch-uci\\beijing_pm25\\autoresearch_results"}, "task_type": "regression", "primary_metric": "rmse", "backbone": "xgboost", "backbone_config": {"n_estimators": 1500, "max_depth": 4, "learning_rate": 0.01, "subsample": 0.6, "colsample_bytree": 0.8, "reg_lambda": 1.0, "early_stopping_rounds": 50, "seed": 0, "n_jobs": 4, "tree_method": "hist", "uncertainty_samples": 1, "reg_alpha": 1.0}, "data": {"format": "csv", "path": "C:\\Users\\abhir\\grok-autoresearch\\benchmarks\\beijing_pm25\\data\\features.csv", "target_columns": ["pm25"], "feature_columns": null}, "split": {"name": "calendar_year", "manifest_dir": "C:\\Users\\abhir\\autoresearch-uci\\beijing_pm25\\data"}, "composite": {"higher_is_better": false, "penalty_weight": 0.1, "below_threshold": -40.0}, "hardware": {"n_threads": 4, "cpu_affinity": [0, 2, 4, 6]}, "description": "Exp11 from champion: reg_alpha 1.0", "seed": 0}, "composite": -23.016710598535273, "val_primary": 23.016710598535273, "test_primary": 22.045797422684895, "per_fold_test": [22.045797422684895], "per_fold_val": [23.016710598535273], "status": "DISCARD", "seconds_elapsed": 10.951125383377075, "timestamp": "2026-08-18T01:15:58", "secondary_metrics": {"mae": 11.963573645525758, "mape": 0.2312664164636055, "r2": 0.9438526007310895, "ic": 0.971367710538823}, "per_fold_test_reports": [{"fold_id": 0, "regime": "calendar_2014_test", "task_type": "regression", "n": 7950, "rmse": 22.045797422684895, "mae": 11.963573645525758, "mape": 0.2312664164636055, "r2": 0.9438526007310895, "ic": 0.971367710538823}], "composite_fingerprint": "a12fd381fe9bbefb"}
{"experiment_num": 12, "backbone": "xgboost", "description": "Exp12 from champion: max_depth 5", "config": {"paths": {"results_dir": "C:\\Users\\abhir\\autoresearch-uci\\beijing_pm25\\autoresearch_results"}, "task_type": "regression", "primary_metric": "rmse", "backbone": "xgboost", "backbone_config": {"n_estimators": 1500, "max_depth": 5, "learning_rate": 0.01, "subsample": 0.6, "colsample_bytree": 0.8, "reg_lambda": 1.0, "early_stopping_rounds": 50, "seed": 0, "n_jobs": 4, "tree_method": "hist", "uncertainty_samples": 1}, "data": {"format": "csv", "path": "C:\\Users\\abhir\\grok-autoresearch\\benchmarks\\beijing_pm25\\data\\features.csv", "target_columns": ["pm25"], "feature_columns": null}, "split": {"name": "calendar_year", "manifest_dir": "C:\\Users\\abhir\\autoresearch-uci\\beijing_pm25\\data"}, "composite": {"higher_is_better": false, "penalty_weight": 0.1, "below_threshold": -40.0}, "hardware": {"n_threads": 4, "cpu_affinity": [0, 2, 4, 6]}, "description": "Exp12 from champion: max_depth 5", "seed": 0}, "composite": -23.032241732820356, "val_primary": 23.032241732820356, "test_primary": 21.834935009474535, "per_fold_test": [21.834935009474535], "per_fold_val": [23.032241732820356], "status": "DISCARD", "seconds_elapsed": 5.861325979232788, "timestamp": "2026-08-18T01:16:10", "secondary_metrics": {"mae": 11.790962863238352, "mape": 0.21857846192544608, "r2": 0.9449215351476952, "ic": 0.9721279588632171}, "per_fold_test_reports": [{"fold_id": 0, "regime": "calendar_2014_test", "task_type": "regression", "n": 7950, "rmse": 21.834935009474535, "mae": 11.790962863238352, "mape": 0.21857846192544608, "r2": 0.9449215351476952, "ic": 0.9721279588632171}], "composite_fingerprint": "a12fd381fe9bbefb"}
