{"experiment_num": 41, "backbone": "lightgbm", "description": "Exp41 LightGBM Ke2017 max_bin 127 on Exp30 champion (isolated LGB 1h cycle 15/50)", "config": {"paths": {"results_dir": "C:\\Users\\abhir\\autoresearch-uci\\beijing_pm25\\autoresearch_results"}, "task_type": "regression", "primary_metric": "rmse", "backbone": "lightgbm", "backbone_config": {"seed": 0, "n_jobs": 4, "n_estimators": 2000, "num_leaves": 63, "learning_rate": 0.01, "feature_fraction": 0.8, "bagging_fraction": 0.6, "early_stopping_rounds": 50, "max_bin": 127}, "data": {"format": "csv", "path": "C:\\Users\\abhir\\autoresearch-uci\\beijing_pm25\\data\\features_full.csv", "target_columns": ["pm25"], "feature_columns": ["DEWP", "TEMP", "PRES", "Iws", "Is", "Ir", "cbwd_NE", "cbwd_NW", "cbwd_SE", "cbwd_cv", "pm25_lag1", "pm25_lag2", "pm25_lag3", "pm25_lag4", "pm25_lag5", "pm25_lag6", "pm25_lag7", "pm25_lag8", "pm25_lag9", "pm25_lag10", "pm25_lag11", "pm25_lag12", "pm25_lag13", "pm25_lag14", "pm25_lag15", "pm25_lag16", "pm25_lag17", "pm25_lag18", "pm25_lag19", "pm25_lag20", "pm25_lag21", "pm25_lag22", "pm25_lag23", "pm25_lag24", "hour_sin", "hour_cos", "dow", "is_weekend", "pm25_delta1", "inversion_spread"]}, "split": {"name": "calendar_year", "manifest_dir": "C:\\Users\\abhir\\autoresearch-uci\\beijing_pm25\\data"}, "composite": {"higher_is_better": false, "penalty_weight": 0.1, "below_threshold": -40.0}, "hardware": {"n_threads": 4, "cpu_affinity": [0, 2, 4, 6]}, "description": "Exp41 LightGBM Ke2017 max_bin 127 on Exp30 champion (isolated LGB 1h cycle 15/50)", "seed": 0}, "composite": -22.737608924258318, "val_primary": 22.737608924258318, "test_primary": 21.367823533928945, "per_fold_test": [21.367823533928945], "per_fold_val": [22.737608924258318], "status": "DISCARD", "seconds_elapsed": 12.709946870803833, "timestamp": "2026-08-18T04:04:54", "secondary_metrics": {"mae": 11.741851271101135, "mape": 0.21594374998155216, "r2": 0.9472528988713725, "ic": 0.9728354805406939}, "per_fold_test_reports": [{"fold_id": 0, "regime": "calendar_2014_test", "task_type": "regression", "n": 7950, "rmse": 21.367823533928945, "mae": 11.741851271101135, "mape": 0.21594374998155216, "r2": 0.9472528988713725, "ic": 0.9728354805406939}], "composite_fingerprint": "a12fd381fe9bbefb"}
{"experiment_num": 42, "backbone": "lightgbm", "description": "Exp42 add pm25_roll6max episode-peak feature on Exp30 (isolated LGB 1h cycle 16/50)", "config": {"paths": {"results_dir": "C:\\Users\\abhir\\autoresearch-uci\\beijing_pm25\\autoresearch_results"}, "task_type": "regression", "primary_metric": "rmse", "backbone": "lightgbm", "backbone_config": {"seed": 0, "n_jobs": 4, "n_estimators": 2000, "num_leaves": 63, "learning_rate": 0.01, "feature_fraction": 0.8, "bagging_fraction": 0.6, "early_stopping_rounds": 50}, "data": {"format": "csv", "path": "C:\\Users\\abhir\\autoresearch-uci\\beijing_pm25\\data\\features_full.csv", "target_columns": ["pm25"], "feature_columns": ["DEWP", "TEMP", "PRES", "Iws", "Is", "Ir", "cbwd_NE", "cbwd_NW", "cbwd_SE", "cbwd_cv", "pm25_lag1", "pm25_lag2", "pm25_lag3", "pm25_lag4", "pm25_lag5", "pm25_lag6", "pm25_lag7", "pm25_lag8", "pm25_lag9", "pm25_lag10", "pm25_lag11", "pm25_lag12", "pm25_lag13", "pm25_lag14", "pm25_lag15", "pm25_lag16", "pm25_lag17", "pm25_lag18", "pm25_lag19", "pm25_lag20", "pm25_lag21", "pm25_lag22", "pm25_lag23", "pm25_lag24", "hour_sin", "hour_cos", "dow", "is_weekend", "pm25_delta1", "inversion_spread", "pm25_roll6max"]}, "split": {"name": "calendar_year", "manifest_dir": "C:\\Users\\abhir\\autoresearch-uci\\beijing_pm25\\data"}, "composite": {"higher_is_better": false, "penalty_weight": 0.1, "below_threshold": -40.0}, "hardware": {"n_threads": 4, "cpu_affinity": [0, 2, 4, 6]}, "description": "Exp42 add pm25_roll6max episode-peak feature on Exp30 (isolated LGB 1h cycle 16/50)", "seed": 0}, "composite": -22.515379440474955, "val_primary": 22.515379440474955, "test_primary": 20.956491190163305, "per_fold_test": [20.956491190163305], "per_fold_val": [22.515379440474955], "status": "DISCARD", "seconds_elapsed": 16.05122709274292, "timestamp": "2026-08-18T04:05:49", "secondary_metrics": {"mae": 11.581886929658289, "mape": 0.21191096611914068, "r2": 0.9492641245958491, "ic": 0.9729068566531994}, "per_fold_test_reports": [{"fold_id": 0, "regime": "calendar_2014_test", "task_type": "regression", "n": 7950, "rmse": 20.956491190163305, "mae": 11.581886929658289, "mape": 0.21191096611914068, "r2": 0.9492641245958491, "ic": 0.9729068566531994}], "composite_fingerprint": "a12fd381fe9bbefb"}
{"experiment_num": 43, "backbone": "lightgbm", "description": "Exp43 enable LightGBM bagging_freq=1 on Exp30 0.6 bagging (isolated LGB 1h cycle 17/50)", "config": {"paths": {"results_dir": "C:\\Users\\abhir\\autoresearch-uci\\beijing_pm25\\autoresearch_results"}, "task_type": "regression", "primary_metric": "rmse", "backbone": "lightgbm", "backbone_config": {"seed": 0, "n_jobs": 4, "n_estimators": 2000, "num_leaves": 63, "learning_rate": 0.01, "feature_fraction": 0.8, "bagging_fraction": 0.6, "early_stopping_rounds": 50, "bagging_freq": 1}, "data": {"format": "csv", "path": "C:\\Users\\abhir\\autoresearch-uci\\beijing_pm25\\data\\features_full.csv", "target_columns": ["pm25"], "feature_columns": ["DEWP", "TEMP", "PRES", "Iws", "Is", "Ir", "cbwd_NE", "cbwd_NW", "cbwd_SE", "cbwd_cv", "pm25_lag1", "pm25_lag2", "pm25_lag3", "pm25_lag4", "pm25_lag5", "pm25_lag6", "pm25_lag7", "pm25_lag8", "pm25_lag9", "pm25_lag10", "pm25_lag11", "pm25_lag12", "pm25_lag13", "pm25_lag14", "pm25_lag15", "pm25_lag16", "pm25_lag17", "pm25_lag18", "pm25_lag19", "pm25_lag20", "pm25_lag21", "pm25_lag22", "pm25_lag23", "pm25_lag24", "hour_sin", "hour_cos", "dow", "is_weekend", "pm25_delta1", "inversion_spread"]}, "split": {"name": "calendar_year", "manifest_dir": "C:\\Users\\abhir\\autoresearch-uci\\beijing_pm25\\data"}, "composite": {"higher_is_better": false, "penalty_weight": 0.1, "below_threshold": -40.0}, "hardware": {"n_threads": 4, "cpu_affinity": [0, 2, 4, 6]}, "description": "Exp43 enable LightGBM bagging_freq=1 on Exp30 0.6 bagging (isolated LGB 1h cycle 17/50)", "seed": 0}, "composite": -22.497831978009746, "val_primary": 22.497831978009746, "test_primary": 20.806935463197117, "per_fold_test": [20.806935463197117], "per_fold_val": [22.497831978009746], "status": "DISCARD", "seconds_elapsed": 13.635857820510864, "timestamp": "2026-08-18T04:35:06", "secondary_metrics": {"mae": 11.50215863494131, "mape": 0.21630604578440962, "r2": 0.9499856924764032, "ic": 0.9728441761127915}, "per_fold_test_reports": [{"fold_id": 0, "regime": "calendar_2014_test", "task_type": "regression", "n": 7950, "rmse": 20.806935463197117, "mae": 11.50215863494131, "mape": 0.21630604578440962, "r2": 0.9499856924764032, "ic": 0.9728441761127915}], "composite_fingerprint": "a12fd381fe9bbefb"}
{"experiment_num": 44, "backbone": "lightgbm", "description": "Exp44 seed=1 noise-floor probe on Exp30 LightGBM (isolated LGB 1h cycle 18/50)", "config": {"paths": {"results_dir": "C:\\Users\\abhir\\autoresearch-uci\\beijing_pm25\\autoresearch_results"}, "task_type": "regression", "primary_metric": "rmse", "backbone": "lightgbm", "backbone_config": {"seed": 1, "n_jobs": 4, "n_estimators": 2000, "num_leaves": 63, "learning_rate": 0.01, "feature_fraction": 0.8, "bagging_fraction": 0.6, "early_stopping_rounds": 50}, "data": {"format": "csv", "path": "C:\\Users\\abhir\\autoresearch-uci\\beijing_pm25\\data\\features_full.csv", "target_columns": ["pm25"], "feature_columns": ["DEWP", "TEMP", "PRES", "Iws", "Is", "Ir", "cbwd_NE", "cbwd_NW", "cbwd_SE", "cbwd_cv", "pm25_lag1", "pm25_lag2", "pm25_lag3", "pm25_lag4", "pm25_lag5", "pm25_lag6", "pm25_lag7", "pm25_lag8", "pm25_lag9", "pm25_lag10", "pm25_lag11", "pm25_lag12", "pm25_lag13", "pm25_lag14", "pm25_lag15", "pm25_lag16", "pm25_lag17", "pm25_lag18", "pm25_lag19", "pm25_lag20", "pm25_lag21", "pm25_lag22", "pm25_lag23", "pm25_lag24", "hour_sin", "hour_cos", "dow", "is_weekend", "pm25_delta1", "inversion_spread"]}, "split": {"name": "calendar_year", "manifest_dir": "C:\\Users\\abhir\\autoresearch-uci\\beijing_pm25\\data"}, "composite": {"higher_is_better": false, "penalty_weight": 0.1, "below_threshold": -40.0}, "hardware": {"n_threads": 4, "cpu_affinity": [0, 2, 4, 6]}, "description": "Exp44 seed=1 noise-floor probe on Exp30 LightGBM (isolated LGB 1h cycle 18/50)", "seed": 1}, "composite": -22.47124788127403, "val_primary": 22.47124788127403, "test_primary": 20.911937079674097, "per_fold_test": [20.911937079674097], "per_fold_val": [22.47124788127403], "status": "DISCARD", "seconds_elapsed": 16.41858434677124, "timestamp": "2026-08-18T04:36:07", "secondary_metrics": {"mae": 11.507896049117702, "mape": 0.20975967256860034, "r2": 0.9494796271666125, "ic": 0.9729517774229566}, "per_fold_test_reports": [{"fold_id": 0, "regime": "calendar_2014_test", "task_type": "regression", "n": 7950, "rmse": 20.911937079674097, "mae": 11.507896049117702, "mape": 0.20975967256860034, "r2": 0.9494796271666125, "ic": 0.9729517774229566}], "composite_fingerprint": "a12fd381fe9bbefb"}
{"experiment_num": 45, "backbone": "lightgbm", "description": "Exp45 t+6 add pm25_delta6 issue-time 6h momentum on Exp39 recipe (LGB side ladder 19/50)", "config": {"paths": {"results_dir": "C:\\Users\\abhir\\autoresearch-uci\\beijing_pm25\\autoresearch_results"}, "task_type": "regression", "primary_metric": "rmse", "backbone": "lightgbm", "backbone_config": {"seed": 0, "n_jobs": 4, "n_estimators": 2000, "num_leaves": 63, "learning_rate": 0.01, "feature_fraction": 0.8, "bagging_fraction": 0.6, "early_stopping_rounds": 50}, "data": {"format": "csv", "path": "C:\\Users\\abhir\\autoresearch-uci\\beijing_pm25\\data\\features_horizon6.csv", "target_columns": ["pm25"], "feature_columns": ["DEWP", "TEMP", "PRES", "Iws", "Is", "Ir", "cbwd_NE", "cbwd_NW", "cbwd_SE", "cbwd_cv", "pm25_lag1", "pm25_lag2", "pm25_lag3", "pm25_lag4", "pm25_lag5", "pm25_lag6", "pm25_lag7", "pm25_lag8", "pm25_lag9", "pm25_lag10", "pm25_lag11", "pm25_lag12", "pm25_lag13", "pm25_lag14", "pm25_lag15", "pm25_lag16", "pm25_lag17", "pm25_lag18", "pm25_lag19", "pm25_lag20", "pm25_lag21", "pm25_lag22", "pm25_lag23", "pm25_lag24", "hour_sin", "hour_cos", "dow", "is_weekend", "pm25_delta1", "inversion_spread", "pm25_delta6"]}, "split": {"name": "calendar_year", "manifest_dir": "C:\\Users\\abhir\\autoresearch-uci\\beijing_pm25\\data"}, "composite": {"higher_is_better": false, "penalty_weight": 0.1, "below_threshold": -40.0}, "hardware": {"n_threads": 4, "cpu_affinity": [0, 2, 4, 6]}, "description": "Exp45 t+6 add pm25_delta6 issue-time 6h momentum on Exp39 recipe (LGB side ladder 19/50)", "seed": 0}, "composite": -58.81039916438377, "val_primary": 58.710399164383766, "test_primary": 55.48638304894793, "per_fold_test": [55.48638304894793], "per_fold_val": [58.710399164383766], "status": "DISCARD", "seconds_elapsed": 12.98383355140686, "timestamp": "2026-08-18T05:05:25", "secondary_metrics": {"mae": 35.88561402000912, "mape": 0.9196132852274824, "r2": 0.6443270383434869, "ic": 0.7873925172985613}, "per_fold_test_reports": [{"fold_id": 0, "regime": "calendar_2014_test", "task_type": "regression", "n": 7950, "rmse": 55.48638304894793, "mae": 35.88561402000912, "mape": 0.9196132852274824, "r2": 0.6443270383434869, "ic": 0.7873925172985613}], "composite_fingerprint": "a12fd381fe9bbefb"}
{"experiment_num": 46, "backbone": "lightgbm", "description": "Exp46 t+6 num_leaves 63 to 31 on Exp39 recipe (LGB side ladder 20/50)", "config": {"paths": {"results_dir": "C:\\Users\\abhir\\autoresearch-uci\\beijing_pm25\\autoresearch_results"}, "task_type": "regression", "primary_metric": "rmse", "backbone": "lightgbm", "backbone_config": {"seed": 0, "n_jobs": 4, "n_estimators": 2000, "num_leaves": 31, "learning_rate": 0.01, "feature_fraction": 0.8, "bagging_fraction": 0.6, "early_stopping_rounds": 50}, "data": {"format": "csv", "path": "C:\\Users\\abhir\\autoresearch-uci\\beijing_pm25\\data\\features_horizon6.csv", "target_columns": ["pm25"], "feature_columns": ["DEWP", "TEMP", "PRES", "Iws", "Is", "Ir", "cbwd_NE", "cbwd_NW", "cbwd_SE", "cbwd_cv", "pm25_lag1", "pm25_lag2", "pm25_lag3", "pm25_lag4", "pm25_lag5", "pm25_lag6", "pm25_lag7", "pm25_lag8", "pm25_lag9", "pm25_lag10", "pm25_lag11", "pm25_lag12", "pm25_lag13", "pm25_lag14", "pm25_lag15", "pm25_lag16", "pm25_lag17", "pm25_lag18", "pm25_lag19", "pm25_lag20", "pm25_lag21", "pm25_lag22", "pm25_lag23", "pm25_lag24", "hour_sin", "hour_cos", "dow", "is_weekend", "pm25_delta1", "inversion_spread"]}, "split": {"name": "calendar_year", "manifest_dir": "C:\\Users\\abhir\\autoresearch-uci\\beijing_pm25\\data"}, "composite": {"higher_is_better": false, "penalty_weight": 0.1, "below_threshold": -40.0}, "hardware": {"n_threads": 4, "cpu_affinity": [0, 2, 4, 6]}, "description": "Exp46 t+6 num_leaves 63 to 31 on Exp39 recipe (LGB side ladder 20/50)", "seed": 0}, "composite": -58.465021025221056, "val_primary": 58.365021025221054, "test_primary": 55.336525042348924, "per_fold_test": [55.336525042348924], "per_fold_val": [58.365021025221054], "status": "DISCARD", "seconds_elapsed": 6.904942274093628, "timestamp": "2026-08-18T05:05:56", "secondary_metrics": {"mae": 35.94159442331818, "mape": 0.929161334277819, "r2": 0.6462456519207459, "ic": 0.7873853418717532}, "per_fold_test_reports": [{"fold_id": 0, "regime": "calendar_2014_test", "task_type": "regression", "n": 7950, "rmse": 55.336525042348924, "mae": 35.94159442331818, "mape": 0.929161334277819, "r2": 0.6462456519207459, "ic": 0.7873853418717532}], "composite_fingerprint": "a12fd381fe9bbefb"}
{"experiment_num": 47, "backbone": "lightgbm", "description": "Exp47 t+6 add month_sin on Exp46 31-leaf recipe (LGB side ladder 21/50)", "config": {"paths": {"results_dir": "C:\\Users\\abhir\\autoresearch-uci\\beijing_pm25\\autoresearch_results"}, "task_type": "regression", "primary_metric": "rmse", "backbone": "lightgbm", "backbone_config": {"seed": 0, "n_jobs": 4, "n_estimators": 2000, "num_leaves": 31, "learning_rate": 0.01, "feature_fraction": 0.8, "bagging_fraction": 0.6, "early_stopping_rounds": 50}, "data": {"format": "csv", "path": "C:\\Users\\abhir\\autoresearch-uci\\beijing_pm25\\data\\features_horizon6.csv", "target_columns": ["pm25"], "feature_columns": ["DEWP", "TEMP", "PRES", "Iws", "Is", "Ir", "cbwd_NE", "cbwd_NW", "cbwd_SE", "cbwd_cv", "pm25_lag1", "pm25_lag2", "pm25_lag3", "pm25_lag4", "pm25_lag5", "pm25_lag6", "pm25_lag7", "pm25_lag8", "pm25_lag9", "pm25_lag10", "pm25_lag11", "pm25_lag12", "pm25_lag13", "pm25_lag14", "pm25_lag15", "pm25_lag16", "pm25_lag17", "pm25_lag18", "pm25_lag19", "pm25_lag20", "pm25_lag21", "pm25_lag22", "pm25_lag23", "pm25_lag24", "hour_sin", "hour_cos", "dow", "is_weekend", "pm25_delta1", "inversion_spread", "month_sin"]}, "split": {"name": "calendar_year", "manifest_dir": "C:\\Users\\abhir\\autoresearch-uci\\beijing_pm25\\data"}, "composite": {"higher_is_better": false, "penalty_weight": 0.1, "below_threshold": -40.0}, "hardware": {"n_threads": 4, "cpu_affinity": [0, 2, 4, 6]}, "description": "Exp47 t+6 add month_sin on Exp46 31-leaf recipe (LGB side ladder 21/50)", "seed": 0}, "composite": -58.23849361149061, "val_primary": 58.13849361149061, "test_primary": 55.05917826333132, "per_fold_test": [55.05917826333132], "per_fold_val": [58.13849361149061], "status": "DISCARD", "seconds_elapsed": 7.8931663036346436, "timestamp": "2026-08-18T05:35:16", "secondary_metrics": {"mae": 35.73697464159586, "mape": 0.9253130577389516, "r2": 0.6497828006151274, "ic": 0.7879367909529043}, "per_fold_test_reports": [{"fold_id": 0, "regime": "calendar_2014_test", "task_type": "regression", "n": 7950, "rmse": 55.05917826333132, "mae": 35.73697464159586, "mape": 0.9253130577389516, "r2": 0.6497828006151274, "ic": 0.7879367909529043}], "composite_fingerprint": "a12fd381fe9bbefb"}
{"experiment_num": 48, "backbone": "lightgbm", "description": "Exp48 t+6 add month_cos to Exp47 month_sin recipe (LGB side ladder 22/50)", "config": {"paths": {"results_dir": "C:\\Users\\abhir\\autoresearch-uci\\beijing_pm25\\autoresearch_results"}, "task_type": "regression", "primary_metric": "rmse", "backbone": "lightgbm", "backbone_config": {"seed": 0, "n_jobs": 4, "n_estimators": 2000, "num_leaves": 31, "learning_rate": 0.01, "feature_fraction": 0.8, "bagging_fraction": 0.6, "early_stopping_rounds": 50}, "data": {"format": "csv", "path": "C:\\Users\\abhir\\autoresearch-uci\\beijing_pm25\\data\\features_horizon6.csv", "target_columns": ["pm25"], "feature_columns": ["DEWP", "TEMP", "PRES", "Iws", "Is", "Ir", "cbwd_NE", "cbwd_NW", "cbwd_SE", "cbwd_cv", "pm25_lag1", "pm25_lag2", "pm25_lag3", "pm25_lag4", "pm25_lag5", "pm25_lag6", "pm25_lag7", "pm25_lag8", "pm25_lag9", "pm25_lag10", "pm25_lag11", "pm25_lag12", "pm25_lag13", "pm25_lag14", "pm25_lag15", "pm25_lag16", "pm25_lag17", "pm25_lag18", "pm25_lag19", "pm25_lag20", "pm25_lag21", "pm25_lag22", "pm25_lag23", "pm25_lag24", "hour_sin", "hour_cos", "dow", "is_weekend", "pm25_delta1", "inversion_spread", "month_sin", "month_cos"]}, "split": {"name": "calendar_year", "manifest_dir": "C:\\Users\\abhir\\autoresearch-uci\\beijing_pm25\\data"}, "composite": {"higher_is_better": false, "penalty_weight": 0.1, "below_threshold": -40.0}, "hardware": {"n_threads": 4, "cpu_affinity": [0, 2, 4, 6]}, "description": "Exp48 t+6 add month_cos to Exp47 month_sin recipe (LGB side ladder 22/50)", "seed": 0}, "composite": -58.459034246462025, "val_primary": 58.35903424646202, "test_primary": 54.647847380597966, "per_fold_test": [54.647847380597966], "per_fold_val": [58.35903424646202], "status": "DISCARD", "seconds_elapsed": 8.430923461914062, "timestamp": "2026-08-18T05:36:22", "secondary_metrics": {"mae": 35.33827614479051, "mape": 0.9143225657352645, "r2": 0.6549959933117351, "ic": 0.7907026539304975}, "per_fold_test_reports": [{"fold_id": 0, "regime": "calendar_2014_test", "task_type": "regression", "n": 7950, "rmse": 54.647847380597966, "mae": 35.33827614479051, "mape": 0.9143225657352645, "r2": 0.6549959933117351, "ic": 0.7907026539304975}], "composite_fingerprint": "a12fd381fe9bbefb"}
{"experiment_num": 49, "backbone": "lightgbm", "description": "Exp49 t+6 add stagn_index inversion/(Iws+1) on Exp47 recipe (LGB side ladder 23/50)", "config": {"paths": {"results_dir": "C:\\Users\\abhir\\autoresearch-uci\\beijing_pm25\\autoresearch_results"}, "task_type": "regression", "primary_metric": "rmse", "backbone": "lightgbm", "backbone_config": {"seed": 0, "n_jobs": 4, "n_estimators": 2000, "num_leaves": 31, "learning_rate": 0.01, "feature_fraction": 0.8, "bagging_fraction": 0.6, "early_stopping_rounds": 50}, "data": {"format": "csv", "path": "C:\\Users\\abhir\\autoresearch-uci\\beijing_pm25\\data\\features_horizon6.csv", "target_columns": ["pm25"], "feature_columns": ["DEWP", "TEMP", "PRES", "Iws", "Is", "Ir", "cbwd_NE", "cbwd_NW", "cbwd_SE", "cbwd_cv", "pm25_lag1", "pm25_lag2", "pm25_lag3", "pm25_lag4", "pm25_lag5", "pm25_lag6", "pm25_lag7", "pm25_lag8", "pm25_lag9", "pm25_lag10", "pm25_lag11", "pm25_lag12", "pm25_lag13", "pm25_lag14", "pm25_lag15", "pm25_lag16", "pm25_lag17", "pm25_lag18", "pm25_lag19", "pm25_lag20", "pm25_lag21", "pm25_lag22", "pm25_lag23", "pm25_lag24", "hour_sin", "hour_cos", "dow", "is_weekend", "pm25_delta1", "inversion_spread", "month_sin", "stagn_index"]}, "split": {"name": "calendar_year", "manifest_dir": "C:\\Users\\abhir\\autoresearch-uci\\beijing_pm25\\data"}, "composite": {"higher_is_better": false, "penalty_weight": 0.1, "below_threshold": -40.0}, "hardware": {"n_threads": 4, "cpu_affinity": [0, 2, 4, 6]}, "description": "Exp49 t+6 add stagn_index inversion/(Iws+1) on Exp47 recipe (LGB side ladder 23/50)", "seed": 0}, "composite": -58.7258064691108, "val_primary": 58.6258064691108, "test_primary": 55.06541221816585, "per_fold_test": [55.06541221816585], "per_fold_val": [58.6258064691108], "status": "DISCARD", "seconds_elapsed": 9.288465023040771, "timestamp": "2026-08-18T06:04:51", "secondary_metrics": {"mae": 35.77051492104373, "mape": 0.9283562727329001, "r2": 0.6497034909752712, "ic": 0.7878323365209352}, "per_fold_test_reports": [{"fold_id": 0, "regime": "calendar_2014_test", "task_type": "regression", "n": 7950, "rmse": 55.06541221816585, "mae": 35.77051492104373, "mape": 0.9283562727329001, "r2": 0.6497034909752712, "ic": 0.7878323365209352}], "composite_fingerprint": "a12fd381fe9bbefb"}
