{"experiment_num": 86, "backbone": "catboost", "description": "Exp86 CatBoost Ordered t+6 random_strength=2 on Exp85 (CatBoost cycle 12/50)", "config": {"paths": {"results_dir": "C:\\Users\\abhir\\autoresearch-uci\\beijing_pm25\\autoresearch_results"}, "task_type": "regression", "primary_metric": "rmse", "backbone": "catboost", "backbone_config": {"seed": 0, "n_jobs": 4, "iterations": 2000, "depth": 6, "learning_rate": 0.03, "l2_leaf_reg": 3, "early_stopping_rounds": 100, "boosting_type": "Ordered", "random_strength": 2}, "data": {"format": "csv", "path": "C:\\Users\\abhir\\autoresearch-uci\\beijing_pm25\\data\\features_horizon6.csv", "target_columns": ["pm25"], "feature_columns": ["DEWP", "TEMP", "PRES", "Iws", "Is", "Ir", "cbwd_NE", "cbwd_NW", "cbwd_SE", "cbwd_cv", "pm25_lag1", "pm25_lag2", "pm25_lag3", "pm25_lag4", "pm25_lag5", "pm25_lag6", "pm25_lag7", "pm25_lag8", "pm25_lag9", "pm25_lag10", "pm25_lag11", "pm25_lag12", "pm25_lag13", "pm25_lag14", "pm25_lag15", "pm25_lag16", "pm25_lag17", "pm25_lag18", "pm25_lag19", "pm25_lag20", "pm25_lag21", "pm25_lag22", "pm25_lag23", "pm25_lag24", "hour_sin", "hour_cos", "dow", "is_weekend", "pm25_delta1", "inversion_spread", "month_sin", "pres_delta", "dewp_delta", "cbwd_prev_NW", "rh_magnus"]}, "split": {"name": "calendar_year", "manifest_dir": "C:\\Users\\abhir\\autoresearch-uci\\beijing_pm25\\data"}, "composite": {"higher_is_better": false, "penalty_weight": 0.1, "below_threshold": -40.0}, "hardware": {"n_threads": 4, "cpu_affinity": [0, 2, 4, 6]}, "description": "Exp86 CatBoost Ordered t+6 random_strength=2 on Exp85 (CatBoost cycle 12/50)", "seed": 0}, "composite": -57.78385096467834, "val_primary": 57.683850964678335, "test_primary": 54.254485579519866, "per_fold_test": [54.254485579519866], "per_fold_val": [57.683850964678335], "status": "DISCARD", "seconds_elapsed": 124.74115872383118, "timestamp": "2026-08-18T19:39:29", "secondary_metrics": {"mae": 35.30453070267292, "mape": 0.9172719858565195, "r2": 0.6599448785989864, "ic": 0.7926500570330475}, "per_fold_test_reports": [{"fold_id": 0, "regime": "calendar_2014_test", "task_type": "regression", "n": 7950, "rmse": 54.254485579519866, "mae": 35.30453070267292, "mape": 0.9172719858565195, "r2": 0.6599448785989864, "ic": 0.7926500570330475}], "composite_fingerprint": "a12fd381fe9bbefb"}
{"experiment_num": 87, "backbone": "catboost", "description": "Exp87 CatBoost Plain grow_policy=Lossguide on Exp30 features (CatBoost cycle 13/50)", "config": {"paths": {"results_dir": "C:\\Users\\abhir\\autoresearch-uci\\beijing_pm25\\autoresearch_results"}, "task_type": "regression", "primary_metric": "rmse", "backbone": "catboost", "backbone_config": {"seed": 0, "n_jobs": 4, "iterations": 2000, "depth": 6, "learning_rate": 0.03, "l2_leaf_reg": 3, "early_stopping_rounds": 100, "boosting_type": "Plain", "grow_policy": "Lossguide"}, "data": {"format": "csv", "path": "C:\\Users\\abhir\\autoresearch-uci\\beijing_pm25\\data\\features_full.csv", "target_columns": ["pm25"], "feature_columns": ["DEWP", "TEMP", "PRES", "Iws", "Is", "Ir", "cbwd_NE", "cbwd_NW", "cbwd_SE", "cbwd_cv", "pm25_lag1", "pm25_lag2", "pm25_lag3", "pm25_lag4", "pm25_lag5", "pm25_lag6", "pm25_lag7", "pm25_lag8", "pm25_lag9", "pm25_lag10", "pm25_lag11", "pm25_lag12", "pm25_lag13", "pm25_lag14", "pm25_lag15", "pm25_lag16", "pm25_lag17", "pm25_lag18", "pm25_lag19", "pm25_lag20", "pm25_lag21", "pm25_lag22", "pm25_lag23", "pm25_lag24", "hour_sin", "hour_cos", "dow", "is_weekend", "pm25_delta1", "inversion_spread"]}, "split": {"name": "calendar_year", "manifest_dir": "C:\\Users\\abhir\\autoresearch-uci\\beijing_pm25\\data"}, "composite": {"higher_is_better": false, "penalty_weight": 0.1, "below_threshold": -40.0}, "hardware": {"n_threads": 4, "cpu_affinity": [0, 2, 4, 6]}, "description": "Exp87 CatBoost Plain grow_policy=Lossguide on Exp30 features (CatBoost cycle 13/50)", "seed": 0}, "composite": -22.475963557314397, "val_primary": 22.475963557314397, "test_primary": 21.188344679814715, "per_fold_test": [21.188344679814715], "per_fold_val": [22.475963557314397], "status": "DISCARD", "seconds_elapsed": 30.670207500457764, "timestamp": "2026-08-18T20:06:47", "secondary_metrics": {"mae": 11.442039105507265, "mape": 0.20758673164355532, "r2": 0.9481352751513024, "ic": 0.9729548625171137}, "per_fold_test_reports": [{"fold_id": 0, "regime": "calendar_2014_test", "task_type": "regression", "n": 7950, "rmse": 21.188344679814715, "mae": 11.442039105507265, "mape": 0.20758673164355532, "r2": 0.9481352751513024, "ic": 0.9729548625171137}], "composite_fingerprint": "a12fd381fe9bbefb"}
{"experiment_num": 88, "backbone": "catboost", "description": "Exp88 CatBoost Plain l2_leaf_reg=10 on Exp30 features (CatBoost cycle 14/50)", "config": {"paths": {"results_dir": "C:\\Users\\abhir\\autoresearch-uci\\beijing_pm25\\autoresearch_results"}, "task_type": "regression", "primary_metric": "rmse", "backbone": "catboost", "backbone_config": {"seed": 0, "n_jobs": 4, "iterations": 2000, "depth": 6, "learning_rate": 0.03, "l2_leaf_reg": 10, "early_stopping_rounds": 100, "boosting_type": "Plain"}, "data": {"format": "csv", "path": "C:\\Users\\abhir\\autoresearch-uci\\beijing_pm25\\data\\features_full.csv", "target_columns": ["pm25"], "feature_columns": ["DEWP", "TEMP", "PRES", "Iws", "Is", "Ir", "cbwd_NE", "cbwd_NW", "cbwd_SE", "cbwd_cv", "pm25_lag1", "pm25_lag2", "pm25_lag3", "pm25_lag4", "pm25_lag5", "pm25_lag6", "pm25_lag7", "pm25_lag8", "pm25_lag9", "pm25_lag10", "pm25_lag11", "pm25_lag12", "pm25_lag13", "pm25_lag14", "pm25_lag15", "pm25_lag16", "pm25_lag17", "pm25_lag18", "pm25_lag19", "pm25_lag20", "pm25_lag21", "pm25_lag22", "pm25_lag23", "pm25_lag24", "hour_sin", "hour_cos", "dow", "is_weekend", "pm25_delta1", "inversion_spread"]}, "split": {"name": "calendar_year", "manifest_dir": "C:\\Users\\abhir\\autoresearch-uci\\beijing_pm25\\data"}, "composite": {"higher_is_better": false, "penalty_weight": 0.1, "below_threshold": -40.0}, "hardware": {"n_threads": 4, "cpu_affinity": [0, 2, 4, 6]}, "description": "Exp88 CatBoost Plain l2_leaf_reg=10 on Exp30 features (CatBoost cycle 14/50)", "seed": 0}, "composite": -22.488329067247243, "val_primary": 22.488329067247243, "test_primary": 20.80160746467524, "per_fold_test": [20.80160746467524], "per_fold_val": [22.488329067247243], "status": "DISCARD", "seconds_elapsed": 25.42164921760559, "timestamp": "2026-08-18T20:09:01", "secondary_metrics": {"mae": 11.475336101097138, "mape": 0.21849003574054188, "r2": 0.9500113033635968, "ic": 0.9720583875993363}, "per_fold_test_reports": [{"fold_id": 0, "regime": "calendar_2014_test", "task_type": "regression", "n": 7950, "rmse": 20.80160746467524, "mae": 11.475336101097138, "mape": 0.21849003574054188, "r2": 0.9500113033635968, "ic": 0.9720583875993363}], "composite_fingerprint": "a12fd381fe9bbefb"}
{"experiment_num": 89, "backbone": "catboost", "description": "Exp89 CatBoost Plain add month_sin on Exp30 features (CatBoost cycle 15/50)", "config": {"paths": {"results_dir": "C:\\Users\\abhir\\autoresearch-uci\\beijing_pm25\\autoresearch_results"}, "task_type": "regression", "primary_metric": "rmse", "backbone": "catboost", "backbone_config": {"seed": 0, "n_jobs": 4, "iterations": 2000, "depth": 6, "learning_rate": 0.03, "l2_leaf_reg": 3, "early_stopping_rounds": 100, "boosting_type": "Plain"}, "data": {"format": "csv", "path": "C:\\Users\\abhir\\autoresearch-uci\\beijing_pm25\\data\\features_full.csv", "target_columns": ["pm25"], "feature_columns": ["DEWP", "TEMP", "PRES", "Iws", "Is", "Ir", "cbwd_NE", "cbwd_NW", "cbwd_SE", "cbwd_cv", "pm25_lag1", "pm25_lag2", "pm25_lag3", "pm25_lag4", "pm25_lag5", "pm25_lag6", "pm25_lag7", "pm25_lag8", "pm25_lag9", "pm25_lag10", "pm25_lag11", "pm25_lag12", "pm25_lag13", "pm25_lag14", "pm25_lag15", "pm25_lag16", "pm25_lag17", "pm25_lag18", "pm25_lag19", "pm25_lag20", "pm25_lag21", "pm25_lag22", "pm25_lag23", "pm25_lag24", "hour_sin", "hour_cos", "dow", "is_weekend", "pm25_delta1", "inversion_spread", "month_sin"]}, "split": {"name": "calendar_year", "manifest_dir": "C:\\Users\\abhir\\autoresearch-uci\\beijing_pm25\\data"}, "composite": {"higher_is_better": false, "penalty_weight": 0.1, "below_threshold": -40.0}, "hardware": {"n_threads": 4, "cpu_affinity": [0, 2, 4, 6]}, "description": "Exp89 CatBoost Plain add month_sin on Exp30 features (CatBoost cycle 15/50)", "seed": 0}, "composite": -22.70842912160356, "val_primary": 22.70842912160356, "test_primary": 21.055926864760742, "per_fold_test": [21.055926864760742], "per_fold_val": [22.70842912160356], "status": "DISCARD", "seconds_elapsed": 15.957265853881836, "timestamp": "2026-08-18T20:36:24", "secondary_metrics": {"mae": 11.524508553043065, "mape": 0.22141490093775207, "r2": 0.9487815128109724, "ic": 0.9720198313259494}, "per_fold_test_reports": [{"fold_id": 0, "regime": "calendar_2014_test", "task_type": "regression", "n": 7950, "rmse": 21.055926864760742, "mae": 11.524508553043065, "mape": 0.22141490093775207, "r2": 0.9487815128109724, "ic": 0.9720198313259494}], "composite_fingerprint": "a12fd381fe9bbefb"}
{"experiment_num": 90, "backbone": "catboost", "description": "Exp90 CatBoost Plain add pm25_accel on Exp30 features (CatBoost cycle 16/50)", "config": {"paths": {"results_dir": "C:\\Users\\abhir\\autoresearch-uci\\beijing_pm25\\autoresearch_results"}, "task_type": "regression", "primary_metric": "rmse", "backbone": "catboost", "backbone_config": {"seed": 0, "n_jobs": 4, "iterations": 2000, "depth": 6, "learning_rate": 0.03, "l2_leaf_reg": 3, "early_stopping_rounds": 100, "boosting_type": "Plain"}, "data": {"format": "csv", "path": "C:\\Users\\abhir\\autoresearch-uci\\beijing_pm25\\data\\features_full.csv", "target_columns": ["pm25"], "feature_columns": ["DEWP", "TEMP", "PRES", "Iws", "Is", "Ir", "cbwd_NE", "cbwd_NW", "cbwd_SE", "cbwd_cv", "pm25_lag1", "pm25_lag2", "pm25_lag3", "pm25_lag4", "pm25_lag5", "pm25_lag6", "pm25_lag7", "pm25_lag8", "pm25_lag9", "pm25_lag10", "pm25_lag11", "pm25_lag12", "pm25_lag13", "pm25_lag14", "pm25_lag15", "pm25_lag16", "pm25_lag17", "pm25_lag18", "pm25_lag19", "pm25_lag20", "pm25_lag21", "pm25_lag22", "pm25_lag23", "pm25_lag24", "hour_sin", "hour_cos", "dow", "is_weekend", "pm25_delta1", "inversion_spread", "pm25_accel"]}, "split": {"name": "calendar_year", "manifest_dir": "C:\\Users\\abhir\\autoresearch-uci\\beijing_pm25\\data"}, "composite": {"higher_is_better": false, "penalty_weight": 0.1, "below_threshold": -40.0}, "hardware": {"n_threads": 4, "cpu_affinity": [0, 2, 4, 6]}, "description": "Exp90 CatBoost Plain add pm25_accel on Exp30 features (CatBoost cycle 16/50)", "seed": 0}, "composite": -22.46671983168254, "val_primary": 22.46671983168254, "test_primary": 21.13256408957488, "per_fold_test": [21.13256408957488], "per_fold_val": [22.46671983168254], "status": "DISCARD", "seconds_elapsed": 28.90645456314087, "timestamp": "2026-08-18T20:37:44", "secondary_metrics": {"mae": 11.500438750536452, "mape": 0.21105275818170904, "r2": 0.9484079945999185, "ic": 0.9724577058437525}, "per_fold_test_reports": [{"fold_id": 0, "regime": "calendar_2014_test", "task_type": "regression", "n": 7950, "rmse": 21.13256408957488, "mae": 11.500438750536452, "mape": 0.21105275818170904, "r2": 0.9484079945999185, "ic": 0.9724577058437525}], "composite_fingerprint": "a12fd381fe9bbefb"}
{"experiment_num": 91, "backbone": "catboost", "description": "Exp91 CatBoost Plain add rh_magnus on Exp30 features (CatBoost cycle 17/50)", "config": {"paths": {"results_dir": "C:\\Users\\abhir\\autoresearch-uci\\beijing_pm25\\autoresearch_results"}, "task_type": "regression", "primary_metric": "rmse", "backbone": "catboost", "backbone_config": {"seed": 0, "n_jobs": 4, "iterations": 2000, "depth": 6, "learning_rate": 0.03, "l2_leaf_reg": 3, "early_stopping_rounds": 100, "boosting_type": "Plain"}, "data": {"format": "csv", "path": "C:\\Users\\abhir\\autoresearch-uci\\beijing_pm25\\data\\features_full.csv", "target_columns": ["pm25"], "feature_columns": ["DEWP", "TEMP", "PRES", "Iws", "Is", "Ir", "cbwd_NE", "cbwd_NW", "cbwd_SE", "cbwd_cv", "pm25_lag1", "pm25_lag2", "pm25_lag3", "pm25_lag4", "pm25_lag5", "pm25_lag6", "pm25_lag7", "pm25_lag8", "pm25_lag9", "pm25_lag10", "pm25_lag11", "pm25_lag12", "pm25_lag13", "pm25_lag14", "pm25_lag15", "pm25_lag16", "pm25_lag17", "pm25_lag18", "pm25_lag19", "pm25_lag20", "pm25_lag21", "pm25_lag22", "pm25_lag23", "pm25_lag24", "hour_sin", "hour_cos", "dow", "is_weekend", "pm25_delta1", "inversion_spread", "rh_magnus"]}, "split": {"name": "calendar_year", "manifest_dir": "C:\\Users\\abhir\\autoresearch-uci\\beijing_pm25\\data"}, "composite": {"higher_is_better": false, "penalty_weight": 0.1, "below_threshold": -40.0}, "hardware": {"n_threads": 4, "cpu_affinity": [0, 2, 4, 6]}, "description": "Exp91 CatBoost Plain add rh_magnus on Exp30 features (CatBoost cycle 17/50)", "seed": 0}, "composite": -22.44935830552556, "val_primary": 22.44935830552556, "test_primary": 21.045142537302937, "per_fold_test": [21.045142537302937], "per_fold_val": [22.44935830552556], "status": "DISCARD", "seconds_elapsed": 27.713300704956055, "timestamp": "2026-08-18T21:05:10", "secondary_metrics": {"mae": 11.510248522803343, "mape": 0.21076436965500467, "r2": 0.9488339650719888, "ic": 0.9724382440625412}, "per_fold_test_reports": [{"fold_id": 0, "regime": "calendar_2014_test", "task_type": "regression", "n": 7950, "rmse": 21.045142537302937, "mae": 11.510248522803343, "mape": 0.21076436965500467, "r2": 0.9488339650719888, "ic": 0.9724382440625412}], "composite_fingerprint": "a12fd381fe9bbefb"}
{"experiment_num": 92, "backbone": "catboost", "description": "Exp92 CatBoost Plain rh_magnus l2=10 on Exp91 (CatBoost cycle 18/50)", "config": {"paths": {"results_dir": "C:\\Users\\abhir\\autoresearch-uci\\beijing_pm25\\autoresearch_results"}, "task_type": "regression", "primary_metric": "rmse", "backbone": "catboost", "backbone_config": {"seed": 0, "n_jobs": 4, "iterations": 2000, "depth": 6, "learning_rate": 0.03, "l2_leaf_reg": 10, "early_stopping_rounds": 100, "boosting_type": "Plain"}, "data": {"format": "csv", "path": "C:\\Users\\abhir\\autoresearch-uci\\beijing_pm25\\data\\features_full.csv", "target_columns": ["pm25"], "feature_columns": ["DEWP", "TEMP", "PRES", "Iws", "Is", "Ir", "cbwd_NE", "cbwd_NW", "cbwd_SE", "cbwd_cv", "pm25_lag1", "pm25_lag2", "pm25_lag3", "pm25_lag4", "pm25_lag5", "pm25_lag6", "pm25_lag7", "pm25_lag8", "pm25_lag9", "pm25_lag10", "pm25_lag11", "pm25_lag12", "pm25_lag13", "pm25_lag14", "pm25_lag15", "pm25_lag16", "pm25_lag17", "pm25_lag18", "pm25_lag19", "pm25_lag20", "pm25_lag21", "pm25_lag22", "pm25_lag23", "pm25_lag24", "hour_sin", "hour_cos", "dow", "is_weekend", "pm25_delta1", "inversion_spread", "rh_magnus"]}, "split": {"name": "calendar_year", "manifest_dir": "C:\\Users\\abhir\\autoresearch-uci\\beijing_pm25\\data"}, "composite": {"higher_is_better": false, "penalty_weight": 0.1, "below_threshold": -40.0}, "hardware": {"n_threads": 4, "cpu_affinity": [0, 2, 4, 6]}, "description": "Exp92 CatBoost Plain rh_magnus l2=10 on Exp91 (CatBoost cycle 18/50)", "seed": 0}, "composite": -22.596323748628333, "val_primary": 22.596323748628333, "test_primary": 20.822296608211815, "per_fold_test": [20.822296608211815], "per_fold_val": [22.596323748628333], "status": "DISCARD", "seconds_elapsed": 24.664936304092407, "timestamp": "2026-08-18T21:06:17", "secondary_metrics": {"mae": 11.540673949773518, "mape": 0.21953275388401838, "r2": 0.9499118170486505, "ic": 0.972041438114296}, "per_fold_test_reports": [{"fold_id": 0, "regime": "calendar_2014_test", "task_type": "regression", "n": 7950, "rmse": 20.822296608211815, "mae": 11.540673949773518, "mape": 0.21953275388401838, "r2": 0.9499118170486505, "ic": 0.972041438114296}], "composite_fingerprint": "a12fd381fe9bbefb"}
{"experiment_num": 93, "backbone": "catboost", "description": "Exp93 CatBoost Plain rsm=0.8 on Exp91 rh_magnus (CatBoost cycle 19/50)", "config": {"paths": {"results_dir": "C:\\Users\\abhir\\autoresearch-uci\\beijing_pm25\\autoresearch_results"}, "task_type": "regression", "primary_metric": "rmse", "backbone": "catboost", "backbone_config": {"seed": 0, "n_jobs": 4, "iterations": 2000, "depth": 6, "learning_rate": 0.03, "l2_leaf_reg": 3, "early_stopping_rounds": 100, "boosting_type": "Plain", "rsm": 0.8}, "data": {"format": "csv", "path": "C:\\Users\\abhir\\autoresearch-uci\\beijing_pm25\\data\\features_full.csv", "target_columns": ["pm25"], "feature_columns": ["DEWP", "TEMP", "PRES", "Iws", "Is", "Ir", "cbwd_NE", "cbwd_NW", "cbwd_SE", "cbwd_cv", "pm25_lag1", "pm25_lag2", "pm25_lag3", "pm25_lag4", "pm25_lag5", "pm25_lag6", "pm25_lag7", "pm25_lag8", "pm25_lag9", "pm25_lag10", "pm25_lag11", "pm25_lag12", "pm25_lag13", "pm25_lag14", "pm25_lag15", "pm25_lag16", "pm25_lag17", "pm25_lag18", "pm25_lag19", "pm25_lag20", "pm25_lag21", "pm25_lag22", "pm25_lag23", "pm25_lag24", "hour_sin", "hour_cos", "dow", "is_weekend", "pm25_delta1", "inversion_spread", "rh_magnus"]}, "split": {"name": "calendar_year", "manifest_dir": "C:\\Users\\abhir\\autoresearch-uci\\beijing_pm25\\data"}, "composite": {"higher_is_better": false, "penalty_weight": 0.1, "below_threshold": -40.0}, "hardware": {"n_threads": 4, "cpu_affinity": [0, 2, 4, 6]}, "description": "Exp93 CatBoost Plain rsm=0.8 on Exp91 rh_magnus (CatBoost cycle 19/50)", "seed": 0}, "composite": -22.56922389439763, "val_primary": 22.56922389439763, "test_primary": 20.945175170921814, "per_fold_test": [20.945175170921814], "per_fold_val": [22.56922389439763], "status": "DISCARD", "seconds_elapsed": 29.793304443359375, "timestamp": "2026-08-18T21:34:54", "secondary_metrics": {"mae": 11.531234275161117, "mape": 0.21267408652303693, "r2": 0.9493189021947475, "ic": 0.9722765432196917}, "per_fold_test_reports": [{"fold_id": 0, "regime": "calendar_2014_test", "task_type": "regression", "n": 7950, "rmse": 20.945175170921814, "mae": 11.531234275161117, "mape": 0.21267408652303693, "r2": 0.9493189021947475, "ic": 0.9722765432196917}], "composite_fingerprint": "a12fd381fe9bbefb"}
{"experiment_num": 94, "backbone": "catboost", "description": "Exp94 CatBoost Plain add cbwd_prev_NW on Exp91 rh_magnus (CatBoost cycle 20/50)", "config": {"paths": {"results_dir": "C:\\Users\\abhir\\autoresearch-uci\\beijing_pm25\\autoresearch_results"}, "task_type": "regression", "primary_metric": "rmse", "backbone": "catboost", "backbone_config": {"seed": 0, "n_jobs": 4, "iterations": 2000, "depth": 6, "learning_rate": 0.03, "l2_leaf_reg": 3, "early_stopping_rounds": 100, "boosting_type": "Plain"}, "data": {"format": "csv", "path": "C:\\Users\\abhir\\autoresearch-uci\\beijing_pm25\\data\\features_full.csv", "target_columns": ["pm25"], "feature_columns": ["DEWP", "TEMP", "PRES", "Iws", "Is", "Ir", "cbwd_NE", "cbwd_NW", "cbwd_SE", "cbwd_cv", "pm25_lag1", "pm25_lag2", "pm25_lag3", "pm25_lag4", "pm25_lag5", "pm25_lag6", "pm25_lag7", "pm25_lag8", "pm25_lag9", "pm25_lag10", "pm25_lag11", "pm25_lag12", "pm25_lag13", "pm25_lag14", "pm25_lag15", "pm25_lag16", "pm25_lag17", "pm25_lag18", "pm25_lag19", "pm25_lag20", "pm25_lag21", "pm25_lag22", "pm25_lag23", "pm25_lag24", "hour_sin", "hour_cos", "dow", "is_weekend", "pm25_delta1", "inversion_spread", "rh_magnus", "cbwd_prev_NW"]}, "split": {"name": "calendar_year", "manifest_dir": "C:\\Users\\abhir\\autoresearch-uci\\beijing_pm25\\data"}, "composite": {"higher_is_better": false, "penalty_weight": 0.1, "below_threshold": -40.0}, "hardware": {"n_threads": 4, "cpu_affinity": [0, 2, 4, 6]}, "description": "Exp94 CatBoost Plain add cbwd_prev_NW on Exp91 rh_magnus (CatBoost cycle 20/50)", "seed": 0}, "composite": -22.52812737529436, "val_primary": 22.52812737529436, "test_primary": 21.06343895928576, "per_fold_test": [21.06343895928576], "per_fold_val": [22.52812737529436], "status": "DISCARD", "seconds_elapsed": 17.16899609565735, "timestamp": "2026-08-18T22:16:11", "secondary_metrics": {"mae": 11.501543807767247, "mape": 0.21884226040545557, "r2": 0.9487449599910011, "ic": 0.9721544852802984}, "per_fold_test_reports": [{"fold_id": 0, "regime": "calendar_2014_test", "task_type": "regression", "n": 7950, "rmse": 21.06343895928576, "mae": 11.501543807767247, "mape": 0.21884226040545557, "r2": 0.9487449599910011, "ic": 0.9721544852802984}], "composite_fingerprint": "a12fd381fe9bbefb"}
