{"experiment_num": 170, "backbone": "mlp", "description": "Exp170 MLP persist_residual y=lag1+delta on Exp167 residual recipe (MLP cycle 46/50)", "config": {"paths": {"results_dir": "C:\\Users\\abhir\\autoresearch-uci\\beijing_pm25\\autoresearch_results"}, "task_type": "regression", "primary_metric": "rmse", "backbone": "mlp", "backbone_config": {"seed": 0, "n_jobs": 4, "weight_decay": 0.0001, "batch_size": 16, "hidden": [512, 256, 128], "residual": true, "persist_residual": true}, "data": {"format": "csv", "path": "C:\\Users\\abhir\\autoresearch-uci\\beijing_pm25\\data\\features_full.csv", "target_columns": ["pm25"], "feature_columns": ["DEWP", "TEMP", "PRES", "Iws", "Is", "Ir", "cbwd_NE", "cbwd_NW", "cbwd_SE", "cbwd_cv", "pm25_lag1", "pm25_lag2", "pm25_lag3", "pm25_lag4", "pm25_lag5", "pm25_lag6", "pm25_lag7", "pm25_lag8", "pm25_lag9", "pm25_lag10", "pm25_lag11", "pm25_lag12", "pm25_lag13", "pm25_lag14", "pm25_lag15", "pm25_lag16", "pm25_lag17", "pm25_lag18", "pm25_lag19", "pm25_lag20", "pm25_lag21", "pm25_lag22", "pm25_lag23", "pm25_lag24", "hour_sin", "hour_cos", "dow", "is_weekend", "pm25_delta1", "inversion_spread", "rh_magnus", "dewp_delta", "is_heating", "log_iws", "month_sin", "pm25_accel", "vent_index"]}, "split": {"name": "calendar_year", "manifest_dir": "C:\\Users\\abhir\\autoresearch-uci\\beijing_pm25\\data"}, "composite": {"higher_is_better": false, "penalty_weight": 0.1, "below_threshold": -40.0}, "hardware": {"n_threads": 4, "cpu_affinity": [0, 2, 4, 6]}, "description": "Exp170 MLP persist_residual y=lag1+delta on Exp167 residual recipe (MLP cycle 46/50)", "seed": 0}, "composite": -22.0715892970872, "val_primary": 22.0715892970872, "test_primary": 20.143968403470403, "per_fold_test": [20.143968403470403], "per_fold_val": [22.0715892970872], "status": "DISCARD", "seconds_elapsed": 851.4392366409302, "timestamp": "2026-08-20T18:39:13", "secondary_metrics": {"mae": 11.021247398472807, "mape": 0.19155674849091006, "r2": 0.9531221070439863, "ic": 0.9732149027483208}, "per_fold_test_reports": [{"fold_id": 0, "regime": "calendar_2014_test", "task_type": "regression", "n": 7950, "rmse": 20.143968403470403, "mae": 11.021247398472807, "mape": 0.19155674849091006, "r2": 0.9531221070439863, "ic": 0.9732149027483208}], "composite_fingerprint": "a12fd381fe9bbefb"}
{"experiment_num": 171, "backbone": "mlp", "description": "Exp171 MLP underpred_weight=2 on Exp167 residual recipe (MLP cycle 47/50)", "config": {"paths": {"results_dir": "C:\\Users\\abhir\\autoresearch-uci\\beijing_pm25\\autoresearch_results"}, "task_type": "regression", "primary_metric": "rmse", "backbone": "mlp", "backbone_config": {"seed": 0, "n_jobs": 4, "weight_decay": 0.0001, "batch_size": 16, "hidden": [512, 256, 128], "residual": true, "underpred_weight": 2}, "data": {"format": "csv", "path": "C:\\Users\\abhir\\autoresearch-uci\\beijing_pm25\\data\\features_full.csv", "target_columns": ["pm25"], "feature_columns": ["DEWP", "TEMP", "PRES", "Iws", "Is", "Ir", "cbwd_NE", "cbwd_NW", "cbwd_SE", "cbwd_cv", "pm25_lag1", "pm25_lag2", "pm25_lag3", "pm25_lag4", "pm25_lag5", "pm25_lag6", "pm25_lag7", "pm25_lag8", "pm25_lag9", "pm25_lag10", "pm25_lag11", "pm25_lag12", "pm25_lag13", "pm25_lag14", "pm25_lag15", "pm25_lag16", "pm25_lag17", "pm25_lag18", "pm25_lag19", "pm25_lag20", "pm25_lag21", "pm25_lag22", "pm25_lag23", "pm25_lag24", "hour_sin", "hour_cos", "dow", "is_weekend", "pm25_delta1", "inversion_spread", "rh_magnus", "dewp_delta", "is_heating", "log_iws", "month_sin", "pm25_accel", "vent_index"]}, "split": {"name": "calendar_year", "manifest_dir": "C:\\Users\\abhir\\autoresearch-uci\\beijing_pm25\\data"}, "composite": {"higher_is_better": false, "penalty_weight": 0.1, "below_threshold": -40.0}, "hardware": {"n_threads": 4, "cpu_affinity": [0, 2, 4, 6]}, "description": "Exp171 MLP underpred_weight=2 on Exp167 residual recipe (MLP cycle 47/50)", "seed": 0}, "composite": -22.643027384252907, "val_primary": 22.643027384252907, "test_primary": 20.676994244123023, "per_fold_test": [20.676994244123023], "per_fold_val": [22.643027384252907], "status": "DISCARD", "seconds_elapsed": 1547.2845079898834, "timestamp": "2026-08-20T19:16:53", "secondary_metrics": {"mae": 11.74148294274912, "mape": 0.24344283157405522, "r2": 0.9506084297292199, "ic": 0.9728595388442376}, "per_fold_test_reports": [{"fold_id": 0, "regime": "calendar_2014_test", "task_type": "regression", "n": 7950, "rmse": 20.676994244123023, "mae": 11.74148294274912, "mape": 0.24344283157405522, "r2": 0.9506084297292199, "ic": 0.9728595388442376}], "composite_fingerprint": "a12fd381fe9bbefb"}
{"experiment_num": 172, "backbone": "mlp", "description": "Exp172 MLP residual + stagn_onset (non-NW winter high-lag1 calm) MLP 48/50", "config": {"paths": {"results_dir": "C:\\Users\\abhir\\autoresearch-uci\\beijing_pm25\\autoresearch_results"}, "task_type": "regression", "primary_metric": "rmse", "backbone": "mlp", "backbone_config": {"seed": 0, "n_jobs": 4, "weight_decay": 0.0001, "batch_size": 16, "hidden": [512, 256, 128], "residual": true}, "data": {"format": "csv", "path": "C:\\Users\\abhir\\autoresearch-uci\\beijing_pm25\\data\\features_full.csv", "target_columns": ["pm25"], "feature_columns": ["DEWP", "TEMP", "PRES", "Iws", "Is", "Ir", "cbwd_NE", "cbwd_NW", "cbwd_SE", "cbwd_cv", "pm25_lag1", "pm25_lag2", "pm25_lag3", "pm25_lag4", "pm25_lag5", "pm25_lag6", "pm25_lag7", "pm25_lag8", "pm25_lag9", "pm25_lag10", "pm25_lag11", "pm25_lag12", "pm25_lag13", "pm25_lag14", "pm25_lag15", "pm25_lag16", "pm25_lag17", "pm25_lag18", "pm25_lag19", "pm25_lag20", "pm25_lag21", "pm25_lag22", "pm25_lag23", "pm25_lag24", "hour_sin", "hour_cos", "dow", "is_weekend", "pm25_delta1", "inversion_spread", "rh_magnus", "dewp_delta", "is_heating", "log_iws", "month_sin", "pm25_accel", "vent_index", "stagn_onset"]}, "split": {"name": "calendar_year", "manifest_dir": "C:\\Users\\abhir\\autoresearch-uci\\beijing_pm25\\data"}, "composite": {"higher_is_better": false, "penalty_weight": 0.1, "below_threshold": -40.0}, "hardware": {"n_threads": 4, "cpu_affinity": [0, 2, 4, 6]}, "description": "Exp172 MLP residual + stagn_onset (non-NW winter high-lag1 calm) MLP 48/50", "seed": 0}, "composite": -21.999508806016856, "val_primary": 21.999508806016856, "test_primary": 20.01835240812982, "per_fold_test": [20.01835240812982], "per_fold_val": [21.999508806016856], "status": "DISCARD", "seconds_elapsed": 1045.952122926712, "timestamp": "2026-08-20T19:52:09", "secondary_metrics": {"mae": 11.061769059079248, "mape": 0.2013498617019289, "r2": 0.9537049368649556, "ic": 0.9733021255712246}, "per_fold_test_reports": [{"fold_id": 0, "regime": "calendar_2014_test", "task_type": "regression", "n": 7950, "rmse": 20.01835240812982, "mae": 11.061769059079248, "mape": 0.2013498617019289, "r2": 0.9537049368649556, "ic": 0.9733021255712246}], "composite_fingerprint": "a12fd381fe9bbefb"}
{"experiment_num": 173, "backbone": "mlp", "description": "Exp173 MLP add nw_rh on Exp167 residual recipe (MLP cycle 48/50)", "config": {"paths": {"results_dir": "C:\\Users\\abhir\\autoresearch-uci\\beijing_pm25\\autoresearch_results"}, "task_type": "regression", "primary_metric": "rmse", "backbone": "mlp", "backbone_config": {"seed": 0, "n_jobs": 4, "weight_decay": 0.0001, "batch_size": 16, "hidden": [512, 256, 128], "residual": true}, "data": {"format": "csv", "path": "C:\\Users\\abhir\\autoresearch-uci\\beijing_pm25\\data\\features_full.csv", "target_columns": ["pm25"], "feature_columns": ["DEWP", "TEMP", "PRES", "Iws", "Is", "Ir", "cbwd_NE", "cbwd_NW", "cbwd_SE", "cbwd_cv", "pm25_lag1", "pm25_lag2", "pm25_lag3", "pm25_lag4", "pm25_lag5", "pm25_lag6", "pm25_lag7", "pm25_lag8", "pm25_lag9", "pm25_lag10", "pm25_lag11", "pm25_lag12", "pm25_lag13", "pm25_lag14", "pm25_lag15", "pm25_lag16", "pm25_lag17", "pm25_lag18", "pm25_lag19", "pm25_lag20", "pm25_lag21", "pm25_lag22", "pm25_lag23", "pm25_lag24", "hour_sin", "hour_cos", "dow", "is_weekend", "pm25_delta1", "inversion_spread", "rh_magnus", "dewp_delta", "is_heating", "log_iws", "month_sin", "pm25_accel", "vent_index", "nw_rh"]}, "split": {"name": "calendar_year", "manifest_dir": "C:\\Users\\abhir\\autoresearch-uci\\beijing_pm25\\data"}, "composite": {"higher_is_better": false, "penalty_weight": 0.1, "below_threshold": -40.0}, "hardware": {"n_threads": 4, "cpu_affinity": [0, 2, 4, 6]}, "description": "Exp172 MLP add nw_rh on Exp167 residual recipe (MLP cycle 48/50)", "seed": 0}, "composite": -22.07389041005393, "val_primary": 22.07389041005393, "test_primary": 20.09339878346706, "per_fold_test": [20.09339878346706], "per_fold_val": [22.07389041005393], "status": "DISCARD", "seconds_elapsed": 1775.3143858909607, "timestamp": "2026-08-20T20:19:03", "secondary_metrics": {"mae": 11.074915304603817, "mape": 0.20187893477920024, "r2": 0.9533571770759088, "ic": 0.9733641578926974}, "per_fold_test_reports": [{"fold_id": 0, "regime": "calendar_2014_test", "task_type": "regression", "n": 7950, "rmse": 20.09339878346706, "mae": 11.074915304603817, "mape": 0.20187893477920024, "r2": 0.9533571770759088, "ic": 0.9733641578926974}], "composite_fingerprint": "a12fd381fe9bbefb"}
{"experiment_num": 174, "backbone": "mlp", "description": "Exp174 MLP residual onset_underpred_weight=2 only when y-lag1>50 (MLP 49/50)", "config": {"paths": {"results_dir": "C:\\Users\\abhir\\autoresearch-uci\\beijing_pm25\\autoresearch_results"}, "task_type": "regression", "primary_metric": "rmse", "backbone": "mlp", "backbone_config": {"seed": 0, "n_jobs": 4, "weight_decay": 0.0001, "batch_size": 16, "hidden": [512, 256, 128], "residual": true, "onset_underpred_weight": 2, "onset_gap": 50}, "data": {"format": "csv", "path": "C:\\Users\\abhir\\autoresearch-uci\\beijing_pm25\\data\\features_full.csv", "target_columns": ["pm25"], "feature_columns": ["DEWP", "TEMP", "PRES", "Iws", "Is", "Ir", "cbwd_NE", "cbwd_NW", "cbwd_SE", "cbwd_cv", "pm25_lag1", "pm25_lag2", "pm25_lag3", "pm25_lag4", "pm25_lag5", "pm25_lag6", "pm25_lag7", "pm25_lag8", "pm25_lag9", "pm25_lag10", "pm25_lag11", "pm25_lag12", "pm25_lag13", "pm25_lag14", "pm25_lag15", "pm25_lag16", "pm25_lag17", "pm25_lag18", "pm25_lag19", "pm25_lag20", "pm25_lag21", "pm25_lag22", "pm25_lag23", "pm25_lag24", "hour_sin", "hour_cos", "dow", "is_weekend", "pm25_delta1", "inversion_spread", "rh_magnus", "dewp_delta", "is_heating", "log_iws", "month_sin", "pm25_accel", "vent_index"]}, "split": {"name": "calendar_year", "manifest_dir": "C:\\Users\\abhir\\autoresearch-uci\\beijing_pm25\\data"}, "composite": {"higher_is_better": false, "penalty_weight": 0.1, "below_threshold": -40.0}, "hardware": {"n_threads": 4, "cpu_affinity": [0, 2, 4, 6]}, "description": "Exp173 MLP residual onset_underpred_weight=2 only when y-lag1>50 (MLP 49/50)", "seed": 0}, "composite": -22.057137924957313, "val_primary": 22.057137924957313, "test_primary": 20.068402204355596, "per_fold_test": [20.068402204355596], "per_fold_val": [22.057137924957313], "status": "DISCARD", "seconds_elapsed": 1699.0665712356567, "timestamp": "2026-08-20T20:22:48", "secondary_metrics": {"mae": 11.056053438186645, "mape": 0.20112914561350556, "r2": 0.9534731540510105, "ic": 0.9733190977446443}, "per_fold_test_reports": [{"fold_id": 0, "regime": "calendar_2014_test", "task_type": "regression", "n": 7950, "rmse": 20.068402204355596, "mae": 11.056053438186645, "mape": 0.20112914561350556, "r2": 0.9534731540510105, "ic": 0.9733190977446443}], "composite_fingerprint": "a12fd381fe9bbefb"}
{"experiment_num": 174, "backbone": "mlp", "description": "Exp174 MLP residual mixup_alpha=0.2 Zhang 2018 (MLP 50/50)", "config": {"paths": {"results_dir": "C:\\Users\\abhir\\autoresearch-uci\\beijing_pm25\\autoresearch_results"}, "task_type": "regression", "primary_metric": "rmse", "backbone": "mlp", "backbone_config": {"seed": 0, "n_jobs": 4, "weight_decay": 0.0001, "batch_size": 16, "hidden": [512, 256, 128], "residual": true, "mixup_alpha": 0.2}, "data": {"format": "csv", "path": "C:\\Users\\abhir\\autoresearch-uci\\beijing_pm25\\data\\features_full.csv", "target_columns": ["pm25"], "feature_columns": ["DEWP", "TEMP", "PRES", "Iws", "Is", "Ir", "cbwd_NE", "cbwd_NW", "cbwd_SE", "cbwd_cv", "pm25_lag1", "pm25_lag2", "pm25_lag3", "pm25_lag4", "pm25_lag5", "pm25_lag6", "pm25_lag7", "pm25_lag8", "pm25_lag9", "pm25_lag10", "pm25_lag11", "pm25_lag12", "pm25_lag13", "pm25_lag14", "pm25_lag15", "pm25_lag16", "pm25_lag17", "pm25_lag18", "pm25_lag19", "pm25_lag20", "pm25_lag21", "pm25_lag22", "pm25_lag23", "pm25_lag24", "hour_sin", "hour_cos", "dow", "is_weekend", "pm25_delta1", "inversion_spread", "rh_magnus", "dewp_delta", "is_heating", "log_iws", "month_sin", "pm25_accel", "vent_index"]}, "split": {"name": "calendar_year", "manifest_dir": "C:\\Users\\abhir\\autoresearch-uci\\beijing_pm25\\data"}, "composite": {"higher_is_better": false, "penalty_weight": 0.1, "below_threshold": -40.0}, "hardware": {"n_threads": 4, "cpu_affinity": [0, 2, 4, 6]}, "description": "Exp174 MLP residual mixup_alpha=0.2 Zhang 2018 (MLP 50/50)", "seed": 0}, "composite": -22.013736234479243, "val_primary": 22.013736234479243, "test_primary": 20.113082510588328, "per_fold_test": [20.113082510588328], "per_fold_val": [22.013736234479243], "status": "DISCARD", "seconds_elapsed": 1046.4724261760712, "timestamp": "2026-08-20T20:40:52", "secondary_metrics": {"mae": 11.014734566346654, "mape": 0.20228281114604485, "r2": 0.9532657486121161, "ic": 0.9732845306853845}, "per_fold_test_reports": [{"fold_id": 0, "regime": "calendar_2014_test", "task_type": "regression", "n": 7950, "rmse": 20.113082510588328, "mae": 11.014734566346654, "mape": 0.20228281114604485, "r2": 0.9532657486121161, "ic": 0.9732845306853845}], "composite_fingerprint": "a12fd381fe9bbefb"}
{"experiment_num": 175, "backbone": "ft_transformer", "description": "Exp175 FT-Transformer Gorishniy 2021 paper default on Exp167 features (isolated cycle 1/50)", "config": {"paths": {"results_dir": "C:\\Users\\abhir\\autoresearch-uci\\beijing_pm25\\autoresearch_results"}, "task_type": "regression", "primary_metric": "rmse", "backbone": "ft_transformer", "backbone_config": {"seed": 0, "n_jobs": 4, "d_model": 64, "n_heads": 4, "n_layers": 3, "dropout": 0.1, "lr": 0.0001, "epochs": 100, "patience": 15, "batch_size": 32, "weight_decay": 1e-05, "warmup": 10}, "data": {"format": "csv", "path": "C:\\Users\\abhir\\autoresearch-uci\\beijing_pm25\\data\\features_full.csv", "target_columns": ["pm25"], "feature_columns": ["DEWP", "TEMP", "PRES", "Iws", "Is", "Ir", "cbwd_NE", "cbwd_NW", "cbwd_SE", "cbwd_cv", "pm25_lag1", "pm25_lag2", "pm25_lag3", "pm25_lag4", "pm25_lag5", "pm25_lag6", "pm25_lag7", "pm25_lag8", "pm25_lag9", "pm25_lag10", "pm25_lag11", "pm25_lag12", "pm25_lag13", "pm25_lag14", "pm25_lag15", "pm25_lag16", "pm25_lag17", "pm25_lag18", "pm25_lag19", "pm25_lag20", "pm25_lag21", "pm25_lag22", "pm25_lag23", "pm25_lag24", "hour_sin", "hour_cos", "dow", "is_weekend", "pm25_delta1", "inversion_spread", "rh_magnus", "dewp_delta", "is_heating", "log_iws", "month_sin", "pm25_accel", "vent_index"]}, "split": {"name": "calendar_year", "manifest_dir": "C:\\Users\\abhir\\autoresearch-uci\\beijing_pm25\\data"}, "composite": {"higher_is_better": false, "penalty_weight": 0.1, "below_threshold": -40.0}, "hardware": {"n_threads": 4, "cpu_affinity": [0, 2, 4, 6]}, "description": "Exp175 FT-Transformer Gorishniy 2021 paper default on Exp167 features (isolated cycle 1/50)", "seed": 0}, "composite": -23.130365795729876, "val_primary": 22.697970579409937, "test_primary": 23.130365795729876, "per_fold_test": [23.130365795729876], "per_fold_val": [22.697970579409937], "status": "DISCARD", "seconds_elapsed": 22203.30976510048, "timestamp": "2026-08-21T02:51:26", "secondary_metrics": {"mae": 11.778721149432585, "mape": 0.19605501494957508, "r2": 0.9381922375210734, "ic": 0.9731168635869264}, "per_fold_test_reports": [{"fold_id": 0, "regime": "calendar_2014_test", "task_type": "regression", "n": 7950, "rmse": 23.130365795729876, "mae": 11.778721149432585, "mape": 0.19605501494957508, "r2": 0.9381922375210734, "ic": 0.9731168635869264}], "composite_fingerprint": "a12fd381fe9bbefb"}
{"experiment_num": 176, "backbone": "ft_transformer", "description": "Exp176 FT-Transformer n_layers=1 on Exp167 features (FT cycle 2/50)", "config": {"paths": {"results_dir": "C:\\Users\\abhir\\autoresearch-uci\\beijing_pm25\\autoresearch_results"}, "task_type": "regression", "primary_metric": "rmse", "backbone": "ft_transformer", "backbone_config": {"seed": 0, "n_jobs": 4, "d_model": 64, "n_heads": 4, "n_layers": 1, "dropout": 0.1, "lr": 0.0001, "epochs": 100, "patience": 15, "batch_size": 32, "weight_decay": 1e-05, "warmup": 10}, "data": {"format": "csv", "path": "C:\\Users\\abhir\\autoresearch-uci\\beijing_pm25\\data\\features_full.csv", "target_columns": ["pm25"], "feature_columns": ["DEWP", "TEMP", "PRES", "Iws", "Is", "Ir", "cbwd_NE", "cbwd_NW", "cbwd_SE", "cbwd_cv", "pm25_lag1", "pm25_lag2", "pm25_lag3", "pm25_lag4", "pm25_lag5", "pm25_lag6", "pm25_lag7", "pm25_lag8", "pm25_lag9", "pm25_lag10", "pm25_lag11", "pm25_lag12", "pm25_lag13", "pm25_lag14", "pm25_lag15", "pm25_lag16", "pm25_lag17", "pm25_lag18", "pm25_lag19", "pm25_lag20", "pm25_lag21", "pm25_lag22", "pm25_lag23", "pm25_lag24", "hour_sin", "hour_cos", "dow", "is_weekend", "pm25_delta1", "inversion_spread", "rh_magnus", "dewp_delta", "is_heating", "log_iws", "month_sin", "pm25_accel", "vent_index"]}, "split": {"name": "calendar_year", "manifest_dir": "C:\\Users\\abhir\\autoresearch-uci\\beijing_pm25\\data"}, "composite": {"higher_is_better": false, "penalty_weight": 0.1, "below_threshold": -40.0}, "hardware": {"n_threads": 4, "cpu_affinity": [0, 2, 4, 6]}, "description": "Exp176 FT-Transformer n_layers=1 on Exp167 features (FT cycle 2/50)", "seed": 0}, "composite": -25.954240431747316, "val_primary": 25.44283939440187, "test_primary": 25.954240431747316, "per_fold_test": [25.954240431747316], "per_fold_val": [25.44283939440187], "status": "DISCARD", "seconds_elapsed": 1604.2374422550201, "timestamp": "2026-08-21T03:45:46", "secondary_metrics": {"mae": 12.709479322538435, "mape": 0.22250259022605312, "r2": 0.9221793835259741, "ic": 0.9700498914025655}, "per_fold_test_reports": [{"fold_id": 0, "regime": "calendar_2014_test", "task_type": "regression", "n": 7950, "rmse": 25.954240431747316, "mae": 12.709479322538435, "mape": 0.22250259022605312, "r2": 0.9221793835259741, "ic": 0.9700498914025655}], "composite_fingerprint": "a12fd381fe9bbefb"}
{"experiment_num": 177, "backbone": "ft_transformer", "description": "Exp177 FT-Transformer n_layers=2 on Exp167 features (FT cycle 3/50)", "config": {"paths": {"results_dir": "C:\\Users\\abhir\\autoresearch-uci\\beijing_pm25\\autoresearch_results"}, "task_type": "regression", "primary_metric": "rmse", "backbone": "ft_transformer", "backbone_config": {"seed": 0, "n_jobs": 4, "d_model": 64, "n_heads": 4, "n_layers": 2, "dropout": 0.1, "lr": 0.0001, "epochs": 100, "patience": 15, "batch_size": 32, "weight_decay": 1e-05, "warmup": 10}, "data": {"format": "csv", "path": "C:\\Users\\abhir\\autoresearch-uci\\beijing_pm25\\data\\features_full.csv", "target_columns": ["pm25"], "feature_columns": ["DEWP", "TEMP", "PRES", "Iws", "Is", "Ir", "cbwd_NE", "cbwd_NW", "cbwd_SE", "cbwd_cv", "pm25_lag1", "pm25_lag2", "pm25_lag3", "pm25_lag4", "pm25_lag5", "pm25_lag6", "pm25_lag7", "pm25_lag8", "pm25_lag9", "pm25_lag10", "pm25_lag11", "pm25_lag12", "pm25_lag13", "pm25_lag14", "pm25_lag15", "pm25_lag16", "pm25_lag17", "pm25_lag18", "pm25_lag19", "pm25_lag20", "pm25_lag21", "pm25_lag22", "pm25_lag23", "pm25_lag24", "hour_sin", "hour_cos", "dow", "is_weekend", "pm25_delta1", "inversion_spread", "rh_magnus", "dewp_delta", "is_heating", "log_iws", "month_sin", "pm25_accel", "vent_index"]}, "split": {"name": "calendar_year", "manifest_dir": "C:\\Users\\abhir\\autoresearch-uci\\beijing_pm25\\data"}, "composite": {"higher_is_better": false, "penalty_weight": 0.1, "below_threshold": -40.0}, "hardware": {"n_threads": 4, "cpu_affinity": [0, 2, 4, 6]}, "description": "Exp177 FT-Transformer n_layers=2 on Exp167 features (FT cycle 3/50)", "seed": 0}, "composite": -23.512869876707818, "val_primary": 23.22234713766782, "test_primary": 23.512869876707818, "per_fold_test": [23.512869876707818], "per_fold_val": [23.22234713766782], "status": "DISCARD", "seconds_elapsed": 3065.28355884552, "timestamp": "2026-08-21T05:09:23", "secondary_metrics": {"mae": 11.920757962412804, "mape": 0.19926472887015179, "r2": 0.9361311199625981, "ic": 0.9727818175801906}, "per_fold_test_reports": [{"fold_id": 0, "regime": "calendar_2014_test", "task_type": "regression", "n": 7950, "rmse": 23.512869876707818, "mae": 11.920757962412804, "mape": 0.19926472887015179, "r2": 0.9361311199625981, "ic": 0.9727818175801906}], "composite_fingerprint": "a12fd381fe9bbefb"}
