{"experiment_num": 205, "backbone": "ft_transformer", "description": "Exp205 FT-Transformer Pre-LN periodic embeddings on Exp192 recipe (FT cycle 31/50)", "config": {"paths": {"results_dir": "C:\\Users\\abhir\\autoresearch-uci\\beijing_pm25\\autoresearch_results"}, "task_type": "regression", "primary_metric": "rmse", "backbone": "ft_transformer", "backbone_config": {"seed": 0, "n_jobs": 4, "d_model": 64, "n_heads": 4, "n_layers": 3, "dropout": 0.1, "lr": 0.0001, "epochs": 100, "patience": 15, "batch_size": 32, "weight_decay": 1e-05, "warmup": 10, "norm_first": true, "num_embedding": "periodic"}, "data": {"format": "csv", "path": "C:\\Users\\abhir\\autoresearch-uci\\beijing_pm25\\data\\features_full.csv", "target_columns": ["pm25"], "feature_columns": ["DEWP", "TEMP", "PRES", "Iws", "Is", "Ir", "cbwd_NE", "cbwd_NW", "cbwd_SE", "cbwd_cv", "pm25_lag1", "pm25_lag2", "pm25_lag3", "pm25_lag4", "pm25_lag5", "pm25_lag6", "pm25_lag7", "pm25_lag8", "pm25_lag9", "pm25_lag10", "pm25_lag11", "pm25_lag12", "pm25_lag13", "pm25_lag14", "pm25_lag15", "pm25_lag16", "pm25_lag17", "pm25_lag18", "pm25_lag19", "pm25_lag20", "pm25_lag21", "pm25_lag22", "pm25_lag23", "pm25_lag24", "hour_sin", "hour_cos", "dow", "is_weekend", "pm25_delta1", "inversion_spread", "rh_magnus", "dewp_delta", "is_heating", "log_iws", "month_sin", "pm25_accel", "vent_index", "cbwd_prev_NW", "rh_iws"]}, "split": {"name": "calendar_year", "manifest_dir": "C:\\Users\\abhir\\autoresearch-uci\\beijing_pm25\\data"}, "composite": {"higher_is_better": false, "penalty_weight": 0.1, "below_threshold": -40.0}, "hardware": {"n_threads": 4, "cpu_affinity": [0, 2, 4, 6]}, "description": "Exp205 FT-Transformer Pre-LN periodic embeddings on Exp192 recipe (FT cycle 31/50)", "seed": 0}, "composite": -22.83113058346612, "val_primary": 22.83113058346612, "test_primary": 21.66240763330545, "per_fold_test": [21.66240763330545], "per_fold_val": [22.83113058346612], "status": "DISCARD", "seconds_elapsed": 4286.812274694443, "timestamp": "2026-08-23T09:00:38", "secondary_metrics": {"mae": 11.67672339697304, "mape": 0.22520441098941893, "r2": 0.9457884945542585, "ic": 0.9726788982439586}, "per_fold_test_reports": [{"fold_id": 0, "regime": "calendar_2014_test", "task_type": "regression", "n": 7950, "rmse": 21.66240763330545, "mae": 11.67672339697304, "mape": 0.22520441098941893, "r2": 0.9457884945542585, "ic": 0.9726788982439586}], "composite_fingerprint": "a12fd381fe9bbefb"}
{"experiment_num": 206, "backbone": "ft_transformer", "description": "Exp206 FT-Transformer Pre-LN pooling=mean on Exp192 recipe (FT cycle 32/50)", "config": {"paths": {"results_dir": "C:\\Users\\abhir\\autoresearch-uci\\beijing_pm25\\autoresearch_results"}, "task_type": "regression", "primary_metric": "rmse", "backbone": "ft_transformer", "backbone_config": {"seed": 0, "n_jobs": 4, "d_model": 64, "n_heads": 4, "n_layers": 3, "dropout": 0.1, "lr": 0.0001, "epochs": 100, "patience": 15, "batch_size": 32, "weight_decay": 1e-05, "warmup": 10, "norm_first": true, "pooling": "mean"}, "data": {"format": "csv", "path": "C:\\Users\\abhir\\autoresearch-uci\\beijing_pm25\\data\\features_full.csv", "target_columns": ["pm25"], "feature_columns": ["DEWP", "TEMP", "PRES", "Iws", "Is", "Ir", "cbwd_NE", "cbwd_NW", "cbwd_SE", "cbwd_cv", "pm25_lag1", "pm25_lag2", "pm25_lag3", "pm25_lag4", "pm25_lag5", "pm25_lag6", "pm25_lag7", "pm25_lag8", "pm25_lag9", "pm25_lag10", "pm25_lag11", "pm25_lag12", "pm25_lag13", "pm25_lag14", "pm25_lag15", "pm25_lag16", "pm25_lag17", "pm25_lag18", "pm25_lag19", "pm25_lag20", "pm25_lag21", "pm25_lag22", "pm25_lag23", "pm25_lag24", "hour_sin", "hour_cos", "dow", "is_weekend", "pm25_delta1", "inversion_spread", "rh_magnus", "dewp_delta", "is_heating", "log_iws", "month_sin", "pm25_accel", "vent_index", "cbwd_prev_NW", "rh_iws"]}, "split": {"name": "calendar_year", "manifest_dir": "C:\\Users\\abhir\\autoresearch-uci\\beijing_pm25\\data"}, "composite": {"higher_is_better": false, "penalty_weight": 0.1, "below_threshold": -40.0}, "hardware": {"n_threads": 4, "cpu_affinity": [0, 2, 4, 6]}, "description": "Exp206 FT-Transformer Pre-LN pooling=mean on Exp192 recipe (FT cycle 32/50)", "seed": 0}, "composite": -22.400963315548807, "val_primary": 22.400963315548807, "test_primary": 20.931599429631635, "per_fold_test": [20.931599429631635], "per_fold_val": [22.400963315548807], "status": "DISCARD", "seconds_elapsed": 20486.32216835022, "timestamp": "2026-08-23T15:00:12", "secondary_metrics": {"mae": 11.480180520381568, "mape": 0.18720477067040892, "r2": 0.9493845794201682, "ic": 0.972667621952315}, "per_fold_test_reports": [{"fold_id": 0, "regime": "calendar_2014_test", "task_type": "regression", "n": 7950, "rmse": 20.931599429631635, "mae": 11.480180520381568, "mape": 0.18720477067040892, "r2": 0.9493845794201682, "ic": 0.972667621952315}], "composite_fingerprint": "a12fd381fe9bbefb"}
{"experiment_num": 207, "backbone": "ft_transformer", "description": "Exp207 FT-Transformer Pre-LN per-feature tokenizer on Exp192 recipe (FT cycle 33/50)", "config": {"paths": {"results_dir": "C:\\Users\\abhir\\autoresearch-uci\\beijing_pm25\\autoresearch_results"}, "task_type": "regression", "primary_metric": "rmse", "backbone": "ft_transformer", "backbone_config": {"seed": 0, "n_jobs": 4, "d_model": 64, "n_heads": 4, "n_layers": 3, "dropout": 0.1, "lr": 0.0001, "epochs": 100, "patience": 15, "batch_size": 32, "weight_decay": 1e-05, "warmup": 10, "norm_first": true, "feature_tokenizer": "per_feature"}, "data": {"format": "csv", "path": "C:\\Users\\abhir\\autoresearch-uci\\beijing_pm25\\data\\features_full.csv", "target_columns": ["pm25"], "feature_columns": ["DEWP", "TEMP", "PRES", "Iws", "Is", "Ir", "cbwd_NE", "cbwd_NW", "cbwd_SE", "cbwd_cv", "pm25_lag1", "pm25_lag2", "pm25_lag3", "pm25_lag4", "pm25_lag5", "pm25_lag6", "pm25_lag7", "pm25_lag8", "pm25_lag9", "pm25_lag10", "pm25_lag11", "pm25_lag12", "pm25_lag13", "pm25_lag14", "pm25_lag15", "pm25_lag16", "pm25_lag17", "pm25_lag18", "pm25_lag19", "pm25_lag20", "pm25_lag21", "pm25_lag22", "pm25_lag23", "pm25_lag24", "hour_sin", "hour_cos", "dow", "is_weekend", "pm25_delta1", "inversion_spread", "rh_magnus", "dewp_delta", "is_heating", "log_iws", "month_sin", "pm25_accel", "vent_index", "cbwd_prev_NW", "rh_iws"]}, "split": {"name": "calendar_year", "manifest_dir": "C:\\Users\\abhir\\autoresearch-uci\\beijing_pm25\\data"}, "composite": {"higher_is_better": false, "penalty_weight": 0.1, "below_threshold": -40.0}, "hardware": {"n_threads": 4, "cpu_affinity": [0, 2, 4, 6]}, "description": "Exp207 FT-Transformer Pre-LN per-feature tokenizer on Exp192 recipe (FT cycle 33/50)", "seed": 0}, "composite": -23.109454507025003, "val_primary": 23.109454507025003, "test_primary": 22.550365334034215, "per_fold_test": [22.550365334034215], "per_fold_val": [23.109454507025003], "status": "DISCARD", "seconds_elapsed": 2028.9698600769043, "timestamp": "2026-08-23T16:29:59", "secondary_metrics": {"mae": 12.076874211029436, "mape": 0.24465245558884366, "r2": 0.9412530689030482, "ic": 0.9708087014508953}, "per_fold_test_reports": [{"fold_id": 0, "regime": "calendar_2014_test", "task_type": "regression", "n": 7950, "rmse": 22.550365334034215, "mae": 12.076874211029436, "mape": 0.24465245558884366, "r2": 0.9412530689030482, "ic": 0.9708087014508953}], "composite_fingerprint": "a12fd381fe9bbefb"}
{"experiment_num": 208, "backbone": "ft_transformer", "description": "Exp208 FT-Transformer Pre-LN activation=relu on Exp192 recipe (FT cycle 34/50)", "config": {"paths": {"results_dir": "C:\\Users\\abhir\\autoresearch-uci\\beijing_pm25\\autoresearch_results"}, "task_type": "regression", "primary_metric": "rmse", "backbone": "ft_transformer", "backbone_config": {"seed": 0, "n_jobs": 4, "d_model": 64, "n_heads": 4, "n_layers": 3, "dropout": 0.1, "lr": 0.0001, "epochs": 100, "patience": 15, "batch_size": 32, "weight_decay": 1e-05, "warmup": 10, "norm_first": true, "activation": "relu"}, "data": {"format": "csv", "path": "C:\\Users\\abhir\\autoresearch-uci\\beijing_pm25\\data\\features_full.csv", "target_columns": ["pm25"], "feature_columns": ["DEWP", "TEMP", "PRES", "Iws", "Is", "Ir", "cbwd_NE", "cbwd_NW", "cbwd_SE", "cbwd_cv", "pm25_lag1", "pm25_lag2", "pm25_lag3", "pm25_lag4", "pm25_lag5", "pm25_lag6", "pm25_lag7", "pm25_lag8", "pm25_lag9", "pm25_lag10", "pm25_lag11", "pm25_lag12", "pm25_lag13", "pm25_lag14", "pm25_lag15", "pm25_lag16", "pm25_lag17", "pm25_lag18", "pm25_lag19", "pm25_lag20", "pm25_lag21", "pm25_lag22", "pm25_lag23", "pm25_lag24", "hour_sin", "hour_cos", "dow", "is_weekend", "pm25_delta1", "inversion_spread", "rh_magnus", "dewp_delta", "is_heating", "log_iws", "month_sin", "pm25_accel", "vent_index", "cbwd_prev_NW", "rh_iws"]}, "split": {"name": "calendar_year", "manifest_dir": "C:\\Users\\abhir\\autoresearch-uci\\beijing_pm25\\data"}, "composite": {"higher_is_better": false, "penalty_weight": 0.1, "below_threshold": -40.0}, "hardware": {"n_threads": 4, "cpu_affinity": [0, 2, 4, 6]}, "description": "Exp208 FT-Transformer Pre-LN activation=relu on Exp192 recipe (FT cycle 34/50)", "seed": 0}, "composite": -22.458319153774443, "val_primary": 22.458319153774443, "test_primary": 20.991661656366663, "per_fold_test": [20.991661656366663], "per_fold_val": [22.458319153774443], "status": "DISCARD", "seconds_elapsed": 2853.635111093521, "timestamp": "2026-08-23T17:41:15", "secondary_metrics": {"mae": 11.65652790081576, "mape": 0.18746938243192396, "r2": 0.9490936855921697, "ic": 0.9725807801747695}, "per_fold_test_reports": [{"fold_id": 0, "regime": "calendar_2014_test", "task_type": "regression", "n": 7950, "rmse": 20.991661656366663, "mae": 11.65652790081576, "mape": 0.18746938243192396, "r2": 0.9490936855921697, "ic": 0.9725807801747695}], "composite_fingerprint": "a12fd381fe9bbefb"}
{"experiment_num": 209, "backbone": "ft_transformer", "description": "Exp209 FT-Transformer Pre-LN LayerScale 0.1 on Exp192 recipe (FT cycle 35/50)", "config": {"paths": {"results_dir": "C:\\Users\\abhir\\autoresearch-uci\\beijing_pm25\\autoresearch_results"}, "task_type": "regression", "primary_metric": "rmse", "backbone": "ft_transformer", "backbone_config": {"seed": 0, "n_jobs": 4, "d_model": 64, "n_heads": 4, "n_layers": 3, "dropout": 0.1, "lr": 0.0001, "epochs": 100, "patience": 15, "batch_size": 32, "weight_decay": 1e-05, "warmup": 10, "norm_first": true, "layer_scale": 0.1}, "data": {"format": "csv", "path": "C:\\Users\\abhir\\autoresearch-uci\\beijing_pm25\\data\\features_full.csv", "target_columns": ["pm25"], "feature_columns": ["DEWP", "TEMP", "PRES", "Iws", "Is", "Ir", "cbwd_NE", "cbwd_NW", "cbwd_SE", "cbwd_cv", "pm25_lag1", "pm25_lag2", "pm25_lag3", "pm25_lag4", "pm25_lag5", "pm25_lag6", "pm25_lag7", "pm25_lag8", "pm25_lag9", "pm25_lag10", "pm25_lag11", "pm25_lag12", "pm25_lag13", "pm25_lag14", "pm25_lag15", "pm25_lag16", "pm25_lag17", "pm25_lag18", "pm25_lag19", "pm25_lag20", "pm25_lag21", "pm25_lag22", "pm25_lag23", "pm25_lag24", "hour_sin", "hour_cos", "dow", "is_weekend", "pm25_delta1", "inversion_spread", "rh_magnus", "dewp_delta", "is_heating", "log_iws", "month_sin", "pm25_accel", "vent_index", "cbwd_prev_NW", "rh_iws"]}, "split": {"name": "calendar_year", "manifest_dir": "C:\\Users\\abhir\\autoresearch-uci\\beijing_pm25\\data"}, "composite": {"higher_is_better": false, "penalty_weight": 0.1, "below_threshold": -40.0}, "hardware": {"n_threads": 4, "cpu_affinity": [0, 2, 4, 6]}, "description": "Exp209 FT-Transformer Pre-LN LayerScale 0.1 on Exp192 recipe (FT cycle 35/50)", "seed": 0}, "composite": -23.467700702734057, "val_primary": 23.467700702734057, "test_primary": 22.650724607035873, "per_fold_test": [22.650724607035873], "per_fold_val": [23.467700702734057], "status": "DISCARD", "seconds_elapsed": 7038.004691123962, "timestamp": "2026-08-23T19:51:29", "secondary_metrics": {"mae": 12.545260156475523, "mape": 0.2021955451399641, "r2": 0.9407290047747401, "ic": 0.9715315607354235}, "per_fold_test_reports": [{"fold_id": 0, "regime": "calendar_2014_test", "task_type": "regression", "n": 7950, "rmse": 22.650724607035873, "mae": 12.545260156475523, "mape": 0.2021955451399641, "r2": 0.9407290047747401, "ic": 0.9715315607354235}], "composite_fingerprint": "a12fd381fe9bbefb"}
{"experiment_num": 210, "backbone": "ft_transformer", "description": "Exp210 FT-Transformer Pre-LN drop_path=0.1 on Exp192 recipe (FT cycle 36/50)", "config": {"paths": {"results_dir": "C:\\Users\\abhir\\autoresearch-uci\\beijing_pm25\\autoresearch_results"}, "task_type": "regression", "primary_metric": "rmse", "backbone": "ft_transformer", "backbone_config": {"seed": 0, "n_jobs": 4, "d_model": 64, "n_heads": 4, "n_layers": 3, "dropout": 0.1, "lr": 0.0001, "epochs": 100, "patience": 15, "batch_size": 32, "weight_decay": 1e-05, "warmup": 10, "norm_first": true, "drop_path": 0.1}, "data": {"format": "csv", "path": "C:\\Users\\abhir\\autoresearch-uci\\beijing_pm25\\data\\features_full.csv", "target_columns": ["pm25"], "feature_columns": ["DEWP", "TEMP", "PRES", "Iws", "Is", "Ir", "cbwd_NE", "cbwd_NW", "cbwd_SE", "cbwd_cv", "pm25_lag1", "pm25_lag2", "pm25_lag3", "pm25_lag4", "pm25_lag5", "pm25_lag6", "pm25_lag7", "pm25_lag8", "pm25_lag9", "pm25_lag10", "pm25_lag11", "pm25_lag12", "pm25_lag13", "pm25_lag14", "pm25_lag15", "pm25_lag16", "pm25_lag17", "pm25_lag18", "pm25_lag19", "pm25_lag20", "pm25_lag21", "pm25_lag22", "pm25_lag23", "pm25_lag24", "hour_sin", "hour_cos", "dow", "is_weekend", "pm25_delta1", "inversion_spread", "rh_magnus", "dewp_delta", "is_heating", "log_iws", "month_sin", "pm25_accel", "vent_index", "cbwd_prev_NW", "rh_iws"]}, "split": {"name": "calendar_year", "manifest_dir": "C:\\Users\\abhir\\autoresearch-uci\\beijing_pm25\\data"}, "composite": {"higher_is_better": false, "penalty_weight": 0.1, "below_threshold": -40.0}, "hardware": {"n_threads": 4, "cpu_affinity": [0, 2, 4, 6]}, "description": "Exp210 FT-Transformer Pre-LN drop_path=0.1 on Exp192 recipe (FT cycle 36/50)", "seed": 0}, "composite": -22.62826095114521, "val_primary": 22.62826095114521, "test_primary": 21.141551275746547, "per_fold_test": [21.141551275746547], "per_fold_val": [22.62826095114521], "status": "DISCARD", "seconds_elapsed": 4463.783898591995, "timestamp": "2026-08-23T21:38:47", "secondary_metrics": {"mae": 11.536829414427656, "mape": 0.20887396426186186, "r2": 0.9483641035179939, "ic": 0.9724929484435326}, "per_fold_test_reports": [{"fold_id": 0, "regime": "calendar_2014_test", "task_type": "regression", "n": 7950, "rmse": 21.141551275746547, "mae": 11.536829414427656, "mape": 0.20887396426186186, "r2": 0.9483641035179939, "ic": 0.9724929484435326}], "composite_fingerprint": "a12fd381fe9bbefb"}
{"experiment_num": 211, "backbone": "ft_transformer", "description": "Exp211 FT-Transformer Pre-LN n_heads=1 on Exp192 recipe (FT cycle 37/50)", "config": {"paths": {"results_dir": "C:\\Users\\abhir\\autoresearch-uci\\beijing_pm25\\autoresearch_results"}, "task_type": "regression", "primary_metric": "rmse", "backbone": "ft_transformer", "backbone_config": {"seed": 0, "n_jobs": 4, "d_model": 64, "n_heads": 1, "n_layers": 3, "dropout": 0.1, "lr": 0.0001, "epochs": 100, "patience": 15, "batch_size": 32, "weight_decay": 1e-05, "warmup": 10, "norm_first": true}, "data": {"format": "csv", "path": "C:\\Users\\abhir\\autoresearch-uci\\beijing_pm25\\data\\features_full.csv", "target_columns": ["pm25"], "feature_columns": ["DEWP", "TEMP", "PRES", "Iws", "Is", "Ir", "cbwd_NE", "cbwd_NW", "cbwd_SE", "cbwd_cv", "pm25_lag1", "pm25_lag2", "pm25_lag3", "pm25_lag4", "pm25_lag5", "pm25_lag6", "pm25_lag7", "pm25_lag8", "pm25_lag9", "pm25_lag10", "pm25_lag11", "pm25_lag12", "pm25_lag13", "pm25_lag14", "pm25_lag15", "pm25_lag16", "pm25_lag17", "pm25_lag18", "pm25_lag19", "pm25_lag20", "pm25_lag21", "pm25_lag22", "pm25_lag23", "pm25_lag24", "hour_sin", "hour_cos", "dow", "is_weekend", "pm25_delta1", "inversion_spread", "rh_magnus", "dewp_delta", "is_heating", "log_iws", "month_sin", "pm25_accel", "vent_index", "cbwd_prev_NW", "rh_iws"]}, "split": {"name": "calendar_year", "manifest_dir": "C:\\Users\\abhir\\autoresearch-uci\\beijing_pm25\\data"}, "composite": {"higher_is_better": false, "penalty_weight": 0.1, "below_threshold": -40.0}, "hardware": {"n_threads": 4, "cpu_affinity": [0, 2, 4, 6]}, "description": "Exp211 FT-Transformer Pre-LN n_heads=1 on Exp192 recipe (FT cycle 37/50)", "seed": 0}, "composite": -22.490153841644137, "val_primary": 22.490153841644137, "test_primary": 20.96118333885668, "per_fold_test": [20.96118333885668], "per_fold_val": [22.490153841644137], "status": "DISCARD", "seconds_elapsed": 7293.272587776184, "timestamp": "2026-08-23T23:54:37", "secondary_metrics": {"mae": 11.330199330704017, "mape": 0.1869775360650437, "r2": 0.9492414025742933, "ic": 0.9728807516429087}, "per_fold_test_reports": [{"fold_id": 0, "regime": "calendar_2014_test", "task_type": "regression", "n": 7950, "rmse": 20.96118333885668, "mae": 11.330199330704017, "mape": 0.1869775360650437, "r2": 0.9492414025742933, "ic": 0.9728807516429087}], "composite_fingerprint": "a12fd381fe9bbefb"}
{"experiment_num": 212, "backbone": "ft_transformer", "description": "Exp212 FT-Transformer Pre-LN SAM rho=0.05 on Exp192 recipe (FT cycle 38/50)", "config": {"paths": {"results_dir": "C:\\Users\\abhir\\autoresearch-uci\\beijing_pm25\\autoresearch_results"}, "task_type": "regression", "primary_metric": "rmse", "backbone": "ft_transformer", "backbone_config": {"seed": 0, "n_jobs": 4, "d_model": 64, "n_heads": 4, "n_layers": 3, "dropout": 0.1, "lr": 0.0001, "epochs": 100, "patience": 15, "batch_size": 32, "weight_decay": 1e-05, "warmup": 10, "norm_first": true, "sam_rho": 0.05}, "data": {"format": "csv", "path": "C:\\Users\\abhir\\autoresearch-uci\\beijing_pm25\\data\\features_full.csv", "target_columns": ["pm25"], "feature_columns": ["DEWP", "TEMP", "PRES", "Iws", "Is", "Ir", "cbwd_NE", "cbwd_NW", "cbwd_SE", "cbwd_cv", "pm25_lag1", "pm25_lag2", "pm25_lag3", "pm25_lag4", "pm25_lag5", "pm25_lag6", "pm25_lag7", "pm25_lag8", "pm25_lag9", "pm25_lag10", "pm25_lag11", "pm25_lag12", "pm25_lag13", "pm25_lag14", "pm25_lag15", "pm25_lag16", "pm25_lag17", "pm25_lag18", "pm25_lag19", "pm25_lag20", "pm25_lag21", "pm25_lag22", "pm25_lag23", "pm25_lag24", "hour_sin", "hour_cos", "dow", "is_weekend", "pm25_delta1", "inversion_spread", "rh_magnus", "dewp_delta", "is_heating", "log_iws", "month_sin", "pm25_accel", "vent_index", "cbwd_prev_NW", "rh_iws"]}, "split": {"name": "calendar_year", "manifest_dir": "C:\\Users\\abhir\\autoresearch-uci\\beijing_pm25\\data"}, "composite": {"higher_is_better": false, "penalty_weight": 0.1, "below_threshold": -40.0}, "hardware": {"n_threads": 4, "cpu_affinity": [0, 2, 4, 6]}, "description": "Exp212 FT-Transformer Pre-LN SAM rho=0.05 on Exp192 recipe (FT cycle 38/50)", "seed": 0}, "composite": -22.28085595396576, "val_primary": 22.28085595396576, "test_primary": 21.080321091262242, "per_fold_test": [21.080321091262242], "per_fold_val": [22.28085595396576], "status": "DISCARD", "seconds_elapsed": 12776.096191167831, "timestamp": "2026-08-24T03:56:36", "secondary_metrics": {"mae": 11.357071158451104, "mape": 0.20130406715527446, "r2": 0.9486627662795304, "ic": 0.9727428233733199}, "per_fold_test_reports": [{"fold_id": 0, "regime": "calendar_2014_test", "task_type": "regression", "n": 7950, "rmse": 21.080321091262242, "mae": 11.357071158451104, "mape": 0.20130406715527446, "r2": 0.9486627662795304, "ic": 0.9727428233733199}], "composite_fingerprint": "a12fd381fe9bbefb"}
{"experiment_num": 213, "backbone": "ft_transformer", "description": "Exp213 FT-Transformer Pre-LN loss=mse on Exp192 recipe (FT cycle 39/50)", "config": {"paths": {"results_dir": "C:\\Users\\abhir\\autoresearch-uci\\beijing_pm25\\autoresearch_results"}, "task_type": "regression", "primary_metric": "rmse", "backbone": "ft_transformer", "backbone_config": {"seed": 0, "n_jobs": 4, "d_model": 64, "n_heads": 4, "n_layers": 3, "dropout": 0.1, "lr": 0.0001, "epochs": 100, "patience": 15, "batch_size": 32, "weight_decay": 1e-05, "warmup": 10, "norm_first": true, "loss": "mse"}, "data": {"format": "csv", "path": "C:\\Users\\abhir\\autoresearch-uci\\beijing_pm25\\data\\features_full.csv", "target_columns": ["pm25"], "feature_columns": ["DEWP", "TEMP", "PRES", "Iws", "Is", "Ir", "cbwd_NE", "cbwd_NW", "cbwd_SE", "cbwd_cv", "pm25_lag1", "pm25_lag2", "pm25_lag3", "pm25_lag4", "pm25_lag5", "pm25_lag6", "pm25_lag7", "pm25_lag8", "pm25_lag9", "pm25_lag10", "pm25_lag11", "pm25_lag12", "pm25_lag13", "pm25_lag14", "pm25_lag15", "pm25_lag16", "pm25_lag17", "pm25_lag18", "pm25_lag19", "pm25_lag20", "pm25_lag21", "pm25_lag22", "pm25_lag23", "pm25_lag24", "hour_sin", "hour_cos", "dow", "is_weekend", "pm25_delta1", "inversion_spread", "rh_magnus", "dewp_delta", "is_heating", "log_iws", "month_sin", "pm25_accel", "vent_index", "cbwd_prev_NW", "rh_iws"]}, "split": {"name": "calendar_year", "manifest_dir": "C:\\Users\\abhir\\autoresearch-uci\\beijing_pm25\\data"}, "composite": {"higher_is_better": false, "penalty_weight": 0.1, "below_threshold": -40.0}, "hardware": {"n_threads": 4, "cpu_affinity": [0, 2, 4, 6]}, "description": "Exp213 FT-Transformer Pre-LN loss=mse on Exp192 recipe (FT cycle 39/50)", "seed": 0}, "composite": -22.664548891100836, "val_primary": 22.664548891100836, "test_primary": 21.067455989864, "per_fold_test": [21.067455989864], "per_fold_val": [22.664548891100836], "status": "DISCARD", "seconds_elapsed": 3257.976329088211, "timestamp": "2026-08-24T06:22:20", "secondary_metrics": {"mae": 11.891806294139498, "mape": 0.2010170320465179, "r2": 0.9487254083217371, "ic": 0.9717217832591869}, "per_fold_test_reports": [{"fold_id": 0, "regime": "calendar_2014_test", "task_type": "regression", "n": 7950, "rmse": 21.067455989864, "mae": 11.891806294139498, "mape": 0.2010170320465179, "r2": 0.9487254083217371, "ic": 0.9717217832591869}], "composite_fingerprint": "a12fd381fe9bbefb"}
