{"experiment_num": 196, "backbone": "ft_transformer", "description": "Exp196 FT-Transformer Pre-LN drop pm25_accel keep delta1 on Exp192 recipe (FT cycle 22/50)", "config": {"paths": {"results_dir": "C:\\Users\\abhir\\autoresearch-uci\\beijing_pm25\\autoresearch_results"}, "task_type": "regression", "primary_metric": "rmse", "backbone": "ft_transformer", "backbone_config": {"seed": 0, "n_jobs": 4, "d_model": 64, "n_heads": 4, "n_layers": 3, "dropout": 0.1, "lr": 0.0001, "epochs": 100, "patience": 15, "batch_size": 32, "weight_decay": 1e-05, "warmup": 10, "norm_first": true}, "data": {"format": "csv", "path": "C:\\Users\\abhir\\autoresearch-uci\\beijing_pm25\\data\\features_full.csv", "target_columns": ["pm25"], "feature_columns": ["DEWP", "TEMP", "PRES", "Iws", "Is", "Ir", "cbwd_NE", "cbwd_NW", "cbwd_SE", "cbwd_cv", "pm25_lag1", "pm25_lag2", "pm25_lag3", "pm25_lag4", "pm25_lag5", "pm25_lag6", "pm25_lag7", "pm25_lag8", "pm25_lag9", "pm25_lag10", "pm25_lag11", "pm25_lag12", "pm25_lag13", "pm25_lag14", "pm25_lag15", "pm25_lag16", "pm25_lag17", "pm25_lag18", "pm25_lag19", "pm25_lag20", "pm25_lag21", "pm25_lag22", "pm25_lag23", "pm25_lag24", "hour_sin", "hour_cos", "dow", "is_weekend", "pm25_delta1", "inversion_spread", "rh_magnus", "dewp_delta", "is_heating", "log_iws", "month_sin", "vent_index", "cbwd_prev_NW", "rh_iws"]}, "split": {"name": "calendar_year", "manifest_dir": "C:\\Users\\abhir\\autoresearch-uci\\beijing_pm25\\data"}, "composite": {"higher_is_better": false, "penalty_weight": 0.1, "below_threshold": -40.0}, "hardware": {"n_threads": 4, "cpu_affinity": [0, 2, 4, 6]}, "description": "Exp196 FT-Transformer Pre-LN drop pm25_accel keep delta1 on Exp192 recipe (FT cycle 22/50)", "seed": 0}, "composite": -23.277330966402854, "val_primary": 23.277330966402854, "test_primary": 21.638412418146885, "per_fold_test": [21.638412418146885], "per_fold_val": [23.277330966402854], "status": "DISCARD", "seconds_elapsed": 2919.1897773742676, "timestamp": "2026-08-22T15:06:42", "secondary_metrics": {"mae": 11.908962348036047, "mape": 0.18953312081260715, "r2": 0.9459085270371586, "ic": 0.9725123069806773}, "per_fold_test_reports": [{"fold_id": 0, "regime": "calendar_2014_test", "task_type": "regression", "n": 7950, "rmse": 21.638412418146885, "mae": 11.908962348036047, "mape": 0.18953312081260715, "r2": 0.9459085270371586, "ic": 0.9725123069806773}], "composite_fingerprint": "a12fd381fe9bbefb"}
{"experiment_num": 197, "backbone": "ft_transformer", "description": "Exp197 FT-Transformer Pre-LN drop is_weekend keep dow on Exp192 recipe (FT cycle 23/50)", "config": {"paths": {"results_dir": "C:\\Users\\abhir\\autoresearch-uci\\beijing_pm25\\autoresearch_results"}, "task_type": "regression", "primary_metric": "rmse", "backbone": "ft_transformer", "backbone_config": {"seed": 0, "n_jobs": 4, "d_model": 64, "n_heads": 4, "n_layers": 3, "dropout": 0.1, "lr": 0.0001, "epochs": 100, "patience": 15, "batch_size": 32, "weight_decay": 1e-05, "warmup": 10, "norm_first": true}, "data": {"format": "csv", "path": "C:\\Users\\abhir\\autoresearch-uci\\beijing_pm25\\data\\features_full.csv", "target_columns": ["pm25"], "feature_columns": ["DEWP", "TEMP", "PRES", "Iws", "Is", "Ir", "cbwd_NE", "cbwd_NW", "cbwd_SE", "cbwd_cv", "pm25_lag1", "pm25_lag2", "pm25_lag3", "pm25_lag4", "pm25_lag5", "pm25_lag6", "pm25_lag7", "pm25_lag8", "pm25_lag9", "pm25_lag10", "pm25_lag11", "pm25_lag12", "pm25_lag13", "pm25_lag14", "pm25_lag15", "pm25_lag16", "pm25_lag17", "pm25_lag18", "pm25_lag19", "pm25_lag20", "pm25_lag21", "pm25_lag22", "pm25_lag23", "pm25_lag24", "hour_sin", "hour_cos", "dow", "pm25_delta1", "inversion_spread", "rh_magnus", "dewp_delta", "is_heating", "log_iws", "month_sin", "pm25_accel", "vent_index", "cbwd_prev_NW", "rh_iws"]}, "split": {"name": "calendar_year", "manifest_dir": "C:\\Users\\abhir\\autoresearch-uci\\beijing_pm25\\data"}, "composite": {"higher_is_better": false, "penalty_weight": 0.1, "below_threshold": -40.0}, "hardware": {"n_threads": 4, "cpu_affinity": [0, 2, 4, 6]}, "description": "Exp197 FT-Transformer Pre-LN drop is_weekend keep dow on Exp192 recipe (FT cycle 23/50)", "seed": 0}, "composite": -22.08306269104585, "val_primary": 22.08306269104585, "test_primary": 20.566471300756028, "per_fold_test": [20.566471300756028], "per_fold_val": [22.08306269104585], "status": "DISCARD", "seconds_elapsed": 3290.0336995124817, "timestamp": "2026-08-22T16:13:54", "secondary_metrics": {"mae": 11.261692536671957, "mape": 0.20121391744808434, "r2": 0.9511350354981905, "ic": 0.9731334780720771}, "per_fold_test_reports": [{"fold_id": 0, "regime": "calendar_2014_test", "task_type": "regression", "n": 7950, "rmse": 20.566471300756028, "mae": 11.261692536671957, "mape": 0.20121391744808434, "r2": 0.9511350354981905, "ic": 0.9731334780720771}], "composite_fingerprint": "a12fd381fe9bbefb"}
{"experiment_num": 198, "backbone": "ft_transformer", "description": "Exp198 FT-Transformer Pre-LN drop inversion_spread keep TEMP DEWP on Exp192 recipe (FT cycle 24/50)", "config": {"paths": {"results_dir": "C:\\Users\\abhir\\autoresearch-uci\\beijing_pm25\\autoresearch_results"}, "task_type": "regression", "primary_metric": "rmse", "backbone": "ft_transformer", "backbone_config": {"seed": 0, "n_jobs": 4, "d_model": 64, "n_heads": 4, "n_layers": 3, "dropout": 0.1, "lr": 0.0001, "epochs": 100, "patience": 15, "batch_size": 32, "weight_decay": 1e-05, "warmup": 10, "norm_first": true}, "data": {"format": "csv", "path": "C:\\Users\\abhir\\autoresearch-uci\\beijing_pm25\\data\\features_full.csv", "target_columns": ["pm25"], "feature_columns": ["DEWP", "TEMP", "PRES", "Iws", "Is", "Ir", "cbwd_NE", "cbwd_NW", "cbwd_SE", "cbwd_cv", "pm25_lag1", "pm25_lag2", "pm25_lag3", "pm25_lag4", "pm25_lag5", "pm25_lag6", "pm25_lag7", "pm25_lag8", "pm25_lag9", "pm25_lag10", "pm25_lag11", "pm25_lag12", "pm25_lag13", "pm25_lag14", "pm25_lag15", "pm25_lag16", "pm25_lag17", "pm25_lag18", "pm25_lag19", "pm25_lag20", "pm25_lag21", "pm25_lag22", "pm25_lag23", "pm25_lag24", "hour_sin", "hour_cos", "dow", "is_weekend", "pm25_delta1", "rh_magnus", "dewp_delta", "is_heating", "log_iws", "month_sin", "pm25_accel", "vent_index", "cbwd_prev_NW", "rh_iws"]}, "split": {"name": "calendar_year", "manifest_dir": "C:\\Users\\abhir\\autoresearch-uci\\beijing_pm25\\data"}, "composite": {"higher_is_better": false, "penalty_weight": 0.1, "below_threshold": -40.0}, "hardware": {"n_threads": 4, "cpu_affinity": [0, 2, 4, 6]}, "description": "Exp198 FT-Transformer Pre-LN drop inversion_spread keep TEMP DEWP on Exp192 recipe (FT cycle 24/50)", "seed": 0}, "composite": -22.749442555556527, "val_primary": 22.749442555556527, "test_primary": 21.406120257732216, "per_fold_test": [21.406120257732216], "per_fold_val": [22.749442555556527], "status": "DISCARD", "seconds_elapsed": 2738.3367223739624, "timestamp": "2026-08-22T17:04:12", "secondary_metrics": {"mae": 11.76309860057051, "mape": 0.18855686623764703, "r2": 0.9470636562579668, "ic": 0.9723125116804291}, "per_fold_test_reports": [{"fold_id": 0, "regime": "calendar_2014_test", "task_type": "regression", "n": 7950, "rmse": 21.406120257732216, "mae": 11.76309860057051, "mape": 0.18855686623764703, "r2": 0.9470636562579668, "ic": 0.9723125116804291}], "composite_fingerprint": "a12fd381fe9bbefb"}
{"experiment_num": 199, "backbone": "ft_transformer", "description": "Exp199 FT-Transformer Pre-LN patience=8 on Exp192 recipe (FT cycle 25/50)", "config": {"paths": {"results_dir": "C:\\Users\\abhir\\autoresearch-uci\\beijing_pm25\\autoresearch_results"}, "task_type": "regression", "primary_metric": "rmse", "backbone": "ft_transformer", "backbone_config": {"seed": 0, "n_jobs": 4, "d_model": 64, "n_heads": 4, "n_layers": 3, "dropout": 0.1, "lr": 0.0001, "epochs": 100, "patience": 8, "batch_size": 32, "weight_decay": 1e-05, "warmup": 10, "norm_first": true}, "data": {"format": "csv", "path": "C:\\Users\\abhir\\autoresearch-uci\\beijing_pm25\\data\\features_full.csv", "target_columns": ["pm25"], "feature_columns": ["DEWP", "TEMP", "PRES", "Iws", "Is", "Ir", "cbwd_NE", "cbwd_NW", "cbwd_SE", "cbwd_cv", "pm25_lag1", "pm25_lag2", "pm25_lag3", "pm25_lag4", "pm25_lag5", "pm25_lag6", "pm25_lag7", "pm25_lag8", "pm25_lag9", "pm25_lag10", "pm25_lag11", "pm25_lag12", "pm25_lag13", "pm25_lag14", "pm25_lag15", "pm25_lag16", "pm25_lag17", "pm25_lag18", "pm25_lag19", "pm25_lag20", "pm25_lag21", "pm25_lag22", "pm25_lag23", "pm25_lag24", "hour_sin", "hour_cos", "dow", "is_weekend", "pm25_delta1", "inversion_spread", "rh_magnus", "dewp_delta", "is_heating", "log_iws", "month_sin", "pm25_accel", "vent_index", "cbwd_prev_NW", "rh_iws"]}, "split": {"name": "calendar_year", "manifest_dir": "C:\\Users\\abhir\\autoresearch-uci\\beijing_pm25\\data"}, "composite": {"higher_is_better": false, "penalty_weight": 0.1, "below_threshold": -40.0}, "hardware": {"n_threads": 4, "cpu_affinity": [0, 2, 4, 6]}, "description": "Exp199 FT-Transformer Pre-LN patience=8 on Exp192 recipe (FT cycle 25/50)", "seed": 0}, "composite": -22.736517937937133, "val_primary": 22.736517937937133, "test_primary": 21.19603999675781, "per_fold_test": [21.19603999675781], "per_fold_val": [22.736517937937133], "status": "DISCARD", "seconds_elapsed": 2788.9152007102966, "timestamp": "2026-08-22T18:05:12", "secondary_metrics": {"mae": 11.493919852304758, "mape": 0.21094503869538178, "r2": 0.9480975951929523, "ic": 0.9721944074657612}, "per_fold_test_reports": [{"fold_id": 0, "regime": "calendar_2014_test", "task_type": "regression", "n": 7950, "rmse": 21.19603999675781, "mae": 11.493919852304758, "mape": 0.21094503869538178, "r2": 0.9480975951929523, "ic": 0.9721944074657612}], "composite_fingerprint": "a12fd381fe9bbefb"}
{"experiment_num": 200, "backbone": "ft_transformer", "description": "Exp200 FT-Transformer Pre-LN patience=25 on Exp192 recipe (FT cycle 26/50)", "config": {"paths": {"results_dir": "C:\\Users\\abhir\\autoresearch-uci\\beijing_pm25\\autoresearch_results"}, "task_type": "regression", "primary_metric": "rmse", "backbone": "ft_transformer", "backbone_config": {"seed": 0, "n_jobs": 4, "d_model": 64, "n_heads": 4, "n_layers": 3, "dropout": 0.1, "lr": 0.0001, "epochs": 100, "patience": 25, "batch_size": 32, "weight_decay": 1e-05, "warmup": 10, "norm_first": true}, "data": {"format": "csv", "path": "C:\\Users\\abhir\\autoresearch-uci\\beijing_pm25\\data\\features_full.csv", "target_columns": ["pm25"], "feature_columns": ["DEWP", "TEMP", "PRES", "Iws", "Is", "Ir", "cbwd_NE", "cbwd_NW", "cbwd_SE", "cbwd_cv", "pm25_lag1", "pm25_lag2", "pm25_lag3", "pm25_lag4", "pm25_lag5", "pm25_lag6", "pm25_lag7", "pm25_lag8", "pm25_lag9", "pm25_lag10", "pm25_lag11", "pm25_lag12", "pm25_lag13", "pm25_lag14", "pm25_lag15", "pm25_lag16", "pm25_lag17", "pm25_lag18", "pm25_lag19", "pm25_lag20", "pm25_lag21", "pm25_lag22", "pm25_lag23", "pm25_lag24", "hour_sin", "hour_cos", "dow", "is_weekend", "pm25_delta1", "inversion_spread", "rh_magnus", "dewp_delta", "is_heating", "log_iws", "month_sin", "pm25_accel", "vent_index", "cbwd_prev_NW", "rh_iws"]}, "split": {"name": "calendar_year", "manifest_dir": "C:\\Users\\abhir\\autoresearch-uci\\beijing_pm25\\data"}, "composite": {"higher_is_better": false, "penalty_weight": 0.1, "below_threshold": -40.0}, "hardware": {"n_threads": 4, "cpu_affinity": [0, 2, 4, 6]}, "description": "Exp200 FT-Transformer Pre-LN patience=25 on Exp192 recipe (FT cycle 26/50)", "seed": 0}, "composite": -22.00974392738198, "val_primary": 22.00974392738198, "test_primary": 20.402496355620922, "per_fold_test": [20.402496355620922], "per_fold_val": [22.00974392738198], "status": "DISCARD", "seconds_elapsed": 7618.019210100174, "timestamp": "2026-08-22T20:25:43", "secondary_metrics": {"mae": 11.202614349569165, "mape": 0.19138722916881878, "r2": 0.9519111227234285, "ic": 0.9733949797453777}, "per_fold_test_reports": [{"fold_id": 0, "regime": "calendar_2014_test", "task_type": "regression", "n": 7950, "rmse": 20.402496355620922, "mae": 11.202614349569165, "mape": 0.19138722916881878, "r2": 0.9519111227234285, "ic": 0.9733949797453777}], "composite_fingerprint": "a12fd381fe9bbefb"}
{"experiment_num": 201, "backbone": "ft_transformer", "description": "Exp201 FT-Transformer Pre-LN batch_size=16 on Exp192 recipe (FT cycle 27/50)", "config": {"paths": {"results_dir": "C:\\Users\\abhir\\autoresearch-uci\\beijing_pm25\\autoresearch_results"}, "task_type": "regression", "primary_metric": "rmse", "backbone": "ft_transformer", "backbone_config": {"seed": 0, "n_jobs": 4, "d_model": 64, "n_heads": 4, "n_layers": 3, "dropout": 0.1, "lr": 0.0001, "epochs": 100, "patience": 15, "batch_size": 16, "weight_decay": 1e-05, "warmup": 10, "norm_first": true}, "data": {"format": "csv", "path": "C:\\Users\\abhir\\autoresearch-uci\\beijing_pm25\\data\\features_full.csv", "target_columns": ["pm25"], "feature_columns": ["DEWP", "TEMP", "PRES", "Iws", "Is", "Ir", "cbwd_NE", "cbwd_NW", "cbwd_SE", "cbwd_cv", "pm25_lag1", "pm25_lag2", "pm25_lag3", "pm25_lag4", "pm25_lag5", "pm25_lag6", "pm25_lag7", "pm25_lag8", "pm25_lag9", "pm25_lag10", "pm25_lag11", "pm25_lag12", "pm25_lag13", "pm25_lag14", "pm25_lag15", "pm25_lag16", "pm25_lag17", "pm25_lag18", "pm25_lag19", "pm25_lag20", "pm25_lag21", "pm25_lag22", "pm25_lag23", "pm25_lag24", "hour_sin", "hour_cos", "dow", "is_weekend", "pm25_delta1", "inversion_spread", "rh_magnus", "dewp_delta", "is_heating", "log_iws", "month_sin", "pm25_accel", "vent_index", "cbwd_prev_NW", "rh_iws"]}, "split": {"name": "calendar_year", "manifest_dir": "C:\\Users\\abhir\\autoresearch-uci\\beijing_pm25\\data"}, "composite": {"higher_is_better": false, "penalty_weight": 0.1, "below_threshold": -40.0}, "hardware": {"n_threads": 4, "cpu_affinity": [0, 2, 4, 6]}, "description": "Exp201 FT-Transformer Pre-LN batch_size=16 on Exp192 recipe (FT cycle 27/50)", "seed": 0}, "composite": -22.629394229458285, "val_primary": 22.629394229458285, "test_primary": 20.915252778861774, "per_fold_test": [20.915252778861774], "per_fold_val": [22.629394229458285], "status": "DISCARD", "seconds_elapsed": 17960.777807235718, "timestamp": "2026-08-23T01:48:34", "secondary_metrics": {"mae": 11.657669907545893, "mape": 0.1860485563178331, "r2": 0.94946360534727, "ic": 0.9730720678420797}, "per_fold_test_reports": [{"fold_id": 0, "regime": "calendar_2014_test", "task_type": "regression", "n": 7950, "rmse": 20.915252778861774, "mae": 11.657669907545893, "mape": 0.1860485563178331, "r2": 0.94946360534727, "ic": 0.9730720678420797}], "composite_fingerprint": "a12fd381fe9bbefb"}
{"experiment_num": 202, "backbone": "ft_transformer", "description": "Exp202 FT-Transformer Pre-LN lr=5e-5 on Exp192 recipe (FT cycle 28/50)", "config": {"paths": {"results_dir": "C:\\Users\\abhir\\autoresearch-uci\\beijing_pm25\\autoresearch_results"}, "task_type": "regression", "primary_metric": "rmse", "backbone": "ft_transformer", "backbone_config": {"seed": 0, "n_jobs": 4, "d_model": 64, "n_heads": 4, "n_layers": 3, "dropout": 0.1, "lr": 5e-05, "epochs": 100, "patience": 15, "batch_size": 32, "weight_decay": 1e-05, "warmup": 10, "norm_first": true}, "data": {"format": "csv", "path": "C:\\Users\\abhir\\autoresearch-uci\\beijing_pm25\\data\\features_full.csv", "target_columns": ["pm25"], "feature_columns": ["DEWP", "TEMP", "PRES", "Iws", "Is", "Ir", "cbwd_NE", "cbwd_NW", "cbwd_SE", "cbwd_cv", "pm25_lag1", "pm25_lag2", "pm25_lag3", "pm25_lag4", "pm25_lag5", "pm25_lag6", "pm25_lag7", "pm25_lag8", "pm25_lag9", "pm25_lag10", "pm25_lag11", "pm25_lag12", "pm25_lag13", "pm25_lag14", "pm25_lag15", "pm25_lag16", "pm25_lag17", "pm25_lag18", "pm25_lag19", "pm25_lag20", "pm25_lag21", "pm25_lag22", "pm25_lag23", "pm25_lag24", "hour_sin", "hour_cos", "dow", "is_weekend", "pm25_delta1", "inversion_spread", "rh_magnus", "dewp_delta", "is_heating", "log_iws", "month_sin", "pm25_accel", "vent_index", "cbwd_prev_NW", "rh_iws"]}, "split": {"name": "calendar_year", "manifest_dir": "C:\\Users\\abhir\\autoresearch-uci\\beijing_pm25\\data"}, "composite": {"higher_is_better": false, "penalty_weight": 0.1, "below_threshold": -40.0}, "hardware": {"n_threads": 4, "cpu_affinity": [0, 2, 4, 6]}, "description": "Exp202 FT-Transformer Pre-LN lr=5e-5 on Exp192 recipe (FT cycle 28/50)", "seed": 0}, "composite": -22.654369284161554, "val_primary": 22.654369284161554, "test_primary": 21.549288559820027, "per_fold_test": [21.549288559820027], "per_fold_val": [22.654369284161554], "status": "DISCARD", "seconds_elapsed": 2598.751326084137, "timestamp": "2026-08-23T03:04:36", "secondary_metrics": {"mae": 11.667031904886354, "mape": 0.19516928913920562, "r2": 0.9463531911547476, "ic": 0.9718765675138112}, "per_fold_test_reports": [{"fold_id": 0, "regime": "calendar_2014_test", "task_type": "regression", "n": 7950, "rmse": 21.549288559820027, "mae": 11.667031904886354, "mape": 0.19516928913920562, "r2": 0.9463531911547476, "ic": 0.9718765675138112}], "composite_fingerprint": "a12fd381fe9bbefb"}
{"experiment_num": 203, "backbone": "ft_transformer", "description": "Exp203 FT-Transformer Pre-LN ff_factor=4 on Exp192 recipe (FT cycle 29/50)", "config": {"paths": {"results_dir": "C:\\Users\\abhir\\autoresearch-uci\\beijing_pm25\\autoresearch_results"}, "task_type": "regression", "primary_metric": "rmse", "backbone": "ft_transformer", "backbone_config": {"seed": 0, "n_jobs": 4, "d_model": 64, "n_heads": 4, "n_layers": 3, "dropout": 0.1, "lr": 0.0001, "epochs": 100, "patience": 15, "batch_size": 32, "weight_decay": 1e-05, "warmup": 10, "norm_first": true, "ff_factor": 4}, "data": {"format": "csv", "path": "C:\\Users\\abhir\\autoresearch-uci\\beijing_pm25\\data\\features_full.csv", "target_columns": ["pm25"], "feature_columns": ["DEWP", "TEMP", "PRES", "Iws", "Is", "Ir", "cbwd_NE", "cbwd_NW", "cbwd_SE", "cbwd_cv", "pm25_lag1", "pm25_lag2", "pm25_lag3", "pm25_lag4", "pm25_lag5", "pm25_lag6", "pm25_lag7", "pm25_lag8", "pm25_lag9", "pm25_lag10", "pm25_lag11", "pm25_lag12", "pm25_lag13", "pm25_lag14", "pm25_lag15", "pm25_lag16", "pm25_lag17", "pm25_lag18", "pm25_lag19", "pm25_lag20", "pm25_lag21", "pm25_lag22", "pm25_lag23", "pm25_lag24", "hour_sin", "hour_cos", "dow", "is_weekend", "pm25_delta1", "inversion_spread", "rh_magnus", "dewp_delta", "is_heating", "log_iws", "month_sin", "pm25_accel", "vent_index", "cbwd_prev_NW", "rh_iws"]}, "split": {"name": "calendar_year", "manifest_dir": "C:\\Users\\abhir\\autoresearch-uci\\beijing_pm25\\data"}, "composite": {"higher_is_better": false, "penalty_weight": 0.1, "below_threshold": -40.0}, "hardware": {"n_threads": 4, "cpu_affinity": [0, 2, 4, 6]}, "description": "Exp203 FT-Transformer Pre-LN ff_factor=4 on Exp192 recipe (FT cycle 29/50)", "seed": 0}, "composite": -22.26658267149413, "val_primary": 22.26658267149413, "test_primary": 20.75456589483411, "per_fold_test": [20.75456589483411], "per_fold_val": [22.26658267149413], "status": "DISCARD", "seconds_elapsed": 5114.642612457275, "timestamp": "2026-08-23T04:44:19", "secondary_metrics": {"mae": 11.289510864521722, "mape": 0.18595913362159414, "r2": 0.9502371405089329, "ic": 0.9732006329758072}, "per_fold_test_reports": [{"fold_id": 0, "regime": "calendar_2014_test", "task_type": "regression", "n": 7950, "rmse": 20.75456589483411, "mae": 11.289510864521722, "mape": 0.18595913362159414, "r2": 0.9502371405089329, "ic": 0.9732006329758072}], "composite_fingerprint": "a12fd381fe9bbefb"}
{"experiment_num": 204, "backbone": "ft_transformer", "description": "Exp204 FT-Transformer Pre-LN weight_decay=1e-6 on Exp192 recipe (FT cycle 30/50)", "config": {"paths": {"results_dir": "C:\\Users\\abhir\\autoresearch-uci\\beijing_pm25\\autoresearch_results"}, "task_type": "regression", "primary_metric": "rmse", "backbone": "ft_transformer", "backbone_config": {"seed": 0, "n_jobs": 4, "d_model": 64, "n_heads": 4, "n_layers": 3, "dropout": 0.1, "lr": 0.0001, "epochs": 100, "patience": 15, "batch_size": 32, "weight_decay": 1e-06, "warmup": 10, "norm_first": true}, "data": {"format": "csv", "path": "C:\\Users\\abhir\\autoresearch-uci\\beijing_pm25\\data\\features_full.csv", "target_columns": ["pm25"], "feature_columns": ["DEWP", "TEMP", "PRES", "Iws", "Is", "Ir", "cbwd_NE", "cbwd_NW", "cbwd_SE", "cbwd_cv", "pm25_lag1", "pm25_lag2", "pm25_lag3", "pm25_lag4", "pm25_lag5", "pm25_lag6", "pm25_lag7", "pm25_lag8", "pm25_lag9", "pm25_lag10", "pm25_lag11", "pm25_lag12", "pm25_lag13", "pm25_lag14", "pm25_lag15", "pm25_lag16", "pm25_lag17", "pm25_lag18", "pm25_lag19", "pm25_lag20", "pm25_lag21", "pm25_lag22", "pm25_lag23", "pm25_lag24", "hour_sin", "hour_cos", "dow", "is_weekend", "pm25_delta1", "inversion_spread", "rh_magnus", "dewp_delta", "is_heating", "log_iws", "month_sin", "pm25_accel", "vent_index", "cbwd_prev_NW", "rh_iws"]}, "split": {"name": "calendar_year", "manifest_dir": "C:\\Users\\abhir\\autoresearch-uci\\beijing_pm25\\data"}, "composite": {"higher_is_better": false, "penalty_weight": 0.1, "below_threshold": -40.0}, "hardware": {"n_threads": 4, "cpu_affinity": [0, 2, 4, 6]}, "description": "Exp204 FT-Transformer Pre-LN weight_decay=1e-6 on Exp192 recipe (FT cycle 30/50)", "seed": 0}, "composite": -22.290069115299897, "val_primary": 22.290069115299897, "test_primary": 20.527910787636326, "per_fold_test": [20.527910787636326], "per_fold_val": [22.290069115299897], "status": "DISCARD", "seconds_elapsed": 7720.903999328613, "timestamp": "2026-08-23T07:27:14", "secondary_metrics": {"mae": 11.210143050307748, "mape": 0.1848580287126937, "r2": 0.9513180996378282, "ic": 0.9730124042351611}, "per_fold_test_reports": [{"fold_id": 0, "regime": "calendar_2014_test", "task_type": "regression", "n": 7950, "rmse": 20.527910787636326, "mae": 11.210143050307748, "mape": 0.1848580287126937, "r2": 0.9513180996378282, "ic": 0.9730124042351611}], "composite_fingerprint": "a12fd381fe9bbefb"}
