{"experiment_num": 122, "backbone": "catboost", "description": "Exp122 CatBoost Plain add is_morning on Exp97 (CatBoost cycle 48/50)", "config": {"paths": {"results_dir": "C:\\Users\\abhir\\autoresearch-uci\\beijing_pm25\\autoresearch_results"}, "task_type": "regression", "primary_metric": "rmse", "backbone": "catboost", "backbone_config": {"seed": 0, "n_jobs": 4, "iterations": 2000, "depth": 6, "learning_rate": 0.03, "l2_leaf_reg": 3, "early_stopping_rounds": 100, "boosting_type": "Plain"}, "data": {"format": "csv", "path": "C:\\Users\\abhir\\autoresearch-uci\\beijing_pm25\\data\\features_full.csv", "target_columns": ["pm25"], "feature_columns": ["DEWP", "TEMP", "PRES", "Iws", "Is", "Ir", "cbwd_NE", "cbwd_NW", "cbwd_SE", "cbwd_cv", "pm25_lag1", "pm25_lag2", "pm25_lag3", "pm25_lag4", "pm25_lag5", "pm25_lag6", "pm25_lag7", "pm25_lag8", "pm25_lag9", "pm25_lag10", "pm25_lag11", "pm25_lag12", "pm25_lag13", "pm25_lag14", "pm25_lag15", "pm25_lag16", "pm25_lag17", "pm25_lag18", "pm25_lag19", "pm25_lag20", "pm25_lag21", "pm25_lag22", "pm25_lag23", "pm25_lag24", "hour_sin", "hour_cos", "dow", "is_weekend", "pm25_delta1", "inversion_spread", "rh_magnus", "dewp_delta", "is_heating", "is_morning"]}, "split": {"name": "calendar_year", "manifest_dir": "C:\\Users\\abhir\\autoresearch-uci\\beijing_pm25\\data"}, "composite": {"higher_is_better": false, "penalty_weight": 0.1, "below_threshold": -40.0}, "hardware": {"n_threads": 4, "cpu_affinity": [0, 2, 4, 6]}, "description": "Exp122 CatBoost Plain add is_morning on Exp97 (CatBoost cycle 48/50)", "seed": 0}, "composite": -22.34555296697924, "val_primary": 22.34555296697924, "test_primary": 20.763252811242758, "per_fold_test": [20.763252811242758], "per_fold_val": [22.34555296697924], "status": "DISCARD", "seconds_elapsed": 7.128777503967285, "timestamp": "2026-08-19T12:39:26", "secondary_metrics": {"mae": 11.396790319042898, "mape": 0.21162872731893265, "r2": 0.950195474856139, "ic": 0.9728423811037586}, "per_fold_test_reports": [{"fold_id": 0, "regime": "calendar_2014_test", "task_type": "regression", "n": 7950, "rmse": 20.763252811242758, "mae": 11.396790319042898, "mape": 0.21162872731893265, "r2": 0.950195474856139, "ic": 0.9728423811037586}], "composite_fingerprint": "a12fd381fe9bbefb"}
{"experiment_num": 123, "backbone": "catboost", "description": "Exp123 CatBoost Plain add dow_sin on Exp97 (CatBoost cycle 49/50)", "config": {"paths": {"results_dir": "C:\\Users\\abhir\\autoresearch-uci\\beijing_pm25\\autoresearch_results"}, "task_type": "regression", "primary_metric": "rmse", "backbone": "catboost", "backbone_config": {"seed": 0, "n_jobs": 4, "iterations": 2000, "depth": 6, "learning_rate": 0.03, "l2_leaf_reg": 3, "early_stopping_rounds": 100, "boosting_type": "Plain"}, "data": {"format": "csv", "path": "C:\\Users\\abhir\\autoresearch-uci\\beijing_pm25\\data\\features_full.csv", "target_columns": ["pm25"], "feature_columns": ["DEWP", "TEMP", "PRES", "Iws", "Is", "Ir", "cbwd_NE", "cbwd_NW", "cbwd_SE", "cbwd_cv", "pm25_lag1", "pm25_lag2", "pm25_lag3", "pm25_lag4", "pm25_lag5", "pm25_lag6", "pm25_lag7", "pm25_lag8", "pm25_lag9", "pm25_lag10", "pm25_lag11", "pm25_lag12", "pm25_lag13", "pm25_lag14", "pm25_lag15", "pm25_lag16", "pm25_lag17", "pm25_lag18", "pm25_lag19", "pm25_lag20", "pm25_lag21", "pm25_lag22", "pm25_lag23", "pm25_lag24", "hour_sin", "hour_cos", "dow", "is_weekend", "pm25_delta1", "inversion_spread", "rh_magnus", "dewp_delta", "is_heating", "dow_sin"]}, "split": {"name": "calendar_year", "manifest_dir": "C:\\Users\\abhir\\autoresearch-uci\\beijing_pm25\\data"}, "composite": {"higher_is_better": false, "penalty_weight": 0.1, "below_threshold": -40.0}, "hardware": {"n_threads": 4, "cpu_affinity": [0, 2, 4, 6]}, "description": "Exp123 CatBoost Plain add dow_sin on Exp97 (CatBoost cycle 49/50)", "seed": 0}, "composite": -22.359858564940353, "val_primary": 22.359858564940353, "test_primary": 20.82862856072751, "per_fold_test": [20.82862856072751], "per_fold_val": [22.359858564940353], "status": "DISCARD", "seconds_elapsed": 4.392942667007446, "timestamp": "2026-08-19T13:09:47", "secondary_metrics": {"mae": 11.436706301480896, "mape": 0.21973232658887207, "r2": 0.9498813493029679, "ic": 0.9724350574916228}, "per_fold_test_reports": [{"fold_id": 0, "regime": "calendar_2014_test", "task_type": "regression", "n": 7950, "rmse": 20.82862856072751, "mae": 11.436706301480896, "mape": 0.21973232658887207, "r2": 0.9498813493029679, "ic": 0.9724350574916228}], "composite_fingerprint": "a12fd381fe9bbefb"}
{"experiment_num": 124, "backbone": "catboost", "description": "Exp124 CatBoost Plain add cv_inv on Exp97 (CatBoost cycle 50/50)", "config": {"paths": {"results_dir": "C:\\Users\\abhir\\autoresearch-uci\\beijing_pm25\\autoresearch_results"}, "task_type": "regression", "primary_metric": "rmse", "backbone": "catboost", "backbone_config": {"seed": 0, "n_jobs": 4, "iterations": 2000, "depth": 6, "learning_rate": 0.03, "l2_leaf_reg": 3, "early_stopping_rounds": 100, "boosting_type": "Plain"}, "data": {"format": "csv", "path": "C:\\Users\\abhir\\autoresearch-uci\\beijing_pm25\\data\\features_full.csv", "target_columns": ["pm25"], "feature_columns": ["DEWP", "TEMP", "PRES", "Iws", "Is", "Ir", "cbwd_NE", "cbwd_NW", "cbwd_SE", "cbwd_cv", "pm25_lag1", "pm25_lag2", "pm25_lag3", "pm25_lag4", "pm25_lag5", "pm25_lag6", "pm25_lag7", "pm25_lag8", "pm25_lag9", "pm25_lag10", "pm25_lag11", "pm25_lag12", "pm25_lag13", "pm25_lag14", "pm25_lag15", "pm25_lag16", "pm25_lag17", "pm25_lag18", "pm25_lag19", "pm25_lag20", "pm25_lag21", "pm25_lag22", "pm25_lag23", "pm25_lag24", "hour_sin", "hour_cos", "dow", "is_weekend", "pm25_delta1", "inversion_spread", "rh_magnus", "dewp_delta", "is_heating", "cv_inv"]}, "split": {"name": "calendar_year", "manifest_dir": "C:\\Users\\abhir\\autoresearch-uci\\beijing_pm25\\data"}, "composite": {"higher_is_better": false, "penalty_weight": 0.1, "below_threshold": -40.0}, "hardware": {"n_threads": 4, "cpu_affinity": [0, 2, 4, 6]}, "description": "Exp124 CatBoost Plain add cv_inv on Exp97 (CatBoost cycle 50/50)", "seed": 0}, "composite": -22.250073581639782, "val_primary": 22.250073581639782, "test_primary": 20.754312178909682, "per_fold_test": [20.754312178909682], "per_fold_val": [22.250073581639782], "status": "DISCARD", "seconds_elapsed": 7.5600550174713135, "timestamp": "2026-08-19T13:39:21", "secondary_metrics": {"mae": 11.41022081464991, "mape": 0.21035323915488582, "r2": 0.9502383571619615, "ic": 0.9725792660239887}, "per_fold_test_reports": [{"fold_id": 0, "regime": "calendar_2014_test", "task_type": "regression", "n": 7950, "rmse": 20.754312178909682, "mae": 11.41022081464991, "mape": 0.21035323915488582, "r2": 0.9502383571619615, "ic": 0.9725792660239887}], "composite_fingerprint": "a12fd381fe9bbefb"}
{"experiment_num": 125, "backbone": "mlp", "description": "Exp125 MLP default 256-128-64 on Exp97 features (MLP cycle 1/50)", "config": {"paths": {"results_dir": "C:\\Users\\abhir\\autoresearch-uci\\beijing_pm25\\autoresearch_results"}, "task_type": "regression", "primary_metric": "rmse", "backbone": "mlp", "backbone_config": {"seed": 0, "n_jobs": 4}, "data": {"format": "csv", "path": "C:\\Users\\abhir\\autoresearch-uci\\beijing_pm25\\data\\features_full.csv", "target_columns": ["pm25"], "feature_columns": ["DEWP", "TEMP", "PRES", "Iws", "Is", "Ir", "cbwd_NE", "cbwd_NW", "cbwd_SE", "cbwd_cv", "pm25_lag1", "pm25_lag2", "pm25_lag3", "pm25_lag4", "pm25_lag5", "pm25_lag6", "pm25_lag7", "pm25_lag8", "pm25_lag9", "pm25_lag10", "pm25_lag11", "pm25_lag12", "pm25_lag13", "pm25_lag14", "pm25_lag15", "pm25_lag16", "pm25_lag17", "pm25_lag18", "pm25_lag19", "pm25_lag20", "pm25_lag21", "pm25_lag22", "pm25_lag23", "pm25_lag24", "hour_sin", "hour_cos", "dow", "is_weekend", "pm25_delta1", "inversion_spread", "rh_magnus", "dewp_delta", "is_heating"]}, "split": {"name": "calendar_year", "manifest_dir": "C:\\Users\\abhir\\autoresearch-uci\\beijing_pm25\\data"}, "composite": {"higher_is_better": false, "penalty_weight": 0.1, "below_threshold": -40.0}, "hardware": {"n_threads": 4, "cpu_affinity": [0, 2, 4, 6]}, "description": "Exp125 MLP default 256-128-64 on Exp97 features (MLP cycle 1/50)", "seed": 0}, "composite": -22.62260414291738, "val_primary": 22.62260414291738, "test_primary": 20.647587437656455, "per_fold_test": [20.647587437656455], "per_fold_val": [22.62260414291738], "status": "DISCARD", "seconds_elapsed": 87.31997060775757, "timestamp": "2026-08-19T14:11:28", "secondary_metrics": {"mae": 11.331706090603234, "mape": 0.2012534872268255, "r2": 0.9507488191393434, "ic": 0.9728512217620705}, "per_fold_test_reports": [{"fold_id": 0, "regime": "calendar_2014_test", "task_type": "regression", "n": 7950, "rmse": 20.647587437656455, "mae": 11.331706090603234, "mape": 0.2012534872268255, "r2": 0.9507488191393434, "ic": 0.9728512217620705}], "composite_fingerprint": "a12fd381fe9bbefb"}
{"experiment_num": 126, "backbone": "mlp", "description": "Exp126 MLP dropout=0.3 on Exp125 default recipe (MLP cycle 2/50)", "config": {"paths": {"results_dir": "C:\\Users\\abhir\\autoresearch-uci\\beijing_pm25\\autoresearch_results"}, "task_type": "regression", "primary_metric": "rmse", "backbone": "mlp", "backbone_config": {"seed": 0, "n_jobs": 4, "dropout": 0.3}, "data": {"format": "csv", "path": "C:\\Users\\abhir\\autoresearch-uci\\beijing_pm25\\data\\features_full.csv", "target_columns": ["pm25"], "feature_columns": ["DEWP", "TEMP", "PRES", "Iws", "Is", "Ir", "cbwd_NE", "cbwd_NW", "cbwd_SE", "cbwd_cv", "pm25_lag1", "pm25_lag2", "pm25_lag3", "pm25_lag4", "pm25_lag5", "pm25_lag6", "pm25_lag7", "pm25_lag8", "pm25_lag9", "pm25_lag10", "pm25_lag11", "pm25_lag12", "pm25_lag13", "pm25_lag14", "pm25_lag15", "pm25_lag16", "pm25_lag17", "pm25_lag18", "pm25_lag19", "pm25_lag20", "pm25_lag21", "pm25_lag22", "pm25_lag23", "pm25_lag24", "hour_sin", "hour_cos", "dow", "is_weekend", "pm25_delta1", "inversion_spread", "rh_magnus", "dewp_delta", "is_heating"]}, "split": {"name": "calendar_year", "manifest_dir": "C:\\Users\\abhir\\autoresearch-uci\\beijing_pm25\\data"}, "composite": {"higher_is_better": false, "penalty_weight": 0.1, "below_threshold": -40.0}, "hardware": {"n_threads": 4, "cpu_affinity": [0, 2, 4, 6]}, "description": "Exp126 MLP dropout=0.3 on Exp125 default recipe (MLP cycle 2/50)", "seed": 0}, "composite": -22.729313428895487, "val_primary": 22.729313428895487, "test_primary": 20.48305824226018, "per_fold_test": [20.48305824226018], "per_fold_val": [22.729313428895487], "status": "DISCARD", "seconds_elapsed": 78.59205436706543, "timestamp": "2026-08-19T14:39:44", "secondary_metrics": {"mae": 11.437072708861633, "mape": 0.20716306524208286, "r2": 0.9515306026768345, "ic": 0.9726810134696108}, "per_fold_test_reports": [{"fold_id": 0, "regime": "calendar_2014_test", "task_type": "regression", "n": 7950, "rmse": 20.48305824226018, "mae": 11.437072708861633, "mape": 0.20716306524208286, "r2": 0.9515306026768345, "ic": 0.9726810134696108}], "composite_fingerprint": "a12fd381fe9bbefb"}
{"experiment_num": 127, "backbone": "mlp", "description": "Exp127 MLP weight_decay=1e-4 on Exp125 default recipe (MLP cycle 3/50)", "config": {"paths": {"results_dir": "C:\\Users\\abhir\\autoresearch-uci\\beijing_pm25\\autoresearch_results"}, "task_type": "regression", "primary_metric": "rmse", "backbone": "mlp", "backbone_config": {"seed": 0, "n_jobs": 4, "weight_decay": 0.0001}, "data": {"format": "csv", "path": "C:\\Users\\abhir\\autoresearch-uci\\beijing_pm25\\data\\features_full.csv", "target_columns": ["pm25"], "feature_columns": ["DEWP", "TEMP", "PRES", "Iws", "Is", "Ir", "cbwd_NE", "cbwd_NW", "cbwd_SE", "cbwd_cv", "pm25_lag1", "pm25_lag2", "pm25_lag3", "pm25_lag4", "pm25_lag5", "pm25_lag6", "pm25_lag7", "pm25_lag8", "pm25_lag9", "pm25_lag10", "pm25_lag11", "pm25_lag12", "pm25_lag13", "pm25_lag14", "pm25_lag15", "pm25_lag16", "pm25_lag17", "pm25_lag18", "pm25_lag19", "pm25_lag20", "pm25_lag21", "pm25_lag22", "pm25_lag23", "pm25_lag24", "hour_sin", "hour_cos", "dow", "is_weekend", "pm25_delta1", "inversion_spread", "rh_magnus", "dewp_delta", "is_heating"]}, "split": {"name": "calendar_year", "manifest_dir": "C:\\Users\\abhir\\autoresearch-uci\\beijing_pm25\\data"}, "composite": {"higher_is_better": false, "penalty_weight": 0.1, "below_threshold": -40.0}, "hardware": {"n_threads": 4, "cpu_affinity": [0, 2, 4, 6]}, "description": "Exp127 MLP weight_decay=1e-4 on Exp125 default recipe (MLP cycle 3/50)", "seed": 0}, "composite": -22.527987822865715, "val_primary": 22.527987822865715, "test_primary": 20.773019333653046, "per_fold_test": [20.773019333653046], "per_fold_val": [22.527987822865715], "status": "DISCARD", "seconds_elapsed": 75.45427393913269, "timestamp": "2026-08-19T15:11:51", "secondary_metrics": {"mae": 11.379681609411659, "mape": 0.20647499703556432, "r2": 0.9501486101943577, "ic": 0.9727099155271727}, "per_fold_test_reports": [{"fold_id": 0, "regime": "calendar_2014_test", "task_type": "regression", "n": 7950, "rmse": 20.773019333653046, "mae": 11.379681609411659, "mape": 0.20647499703556432, "r2": 0.9501486101943577, "ic": 0.9727099155271727}], "composite_fingerprint": "a12fd381fe9bbefb"}
{"experiment_num": 128, "backbone": "mlp", "description": "Exp128 MLP hidden 128-64-32 on Exp127 recipe (MLP cycle 4/50)", "config": {"paths": {"results_dir": "C:\\Users\\abhir\\autoresearch-uci\\beijing_pm25\\autoresearch_results"}, "task_type": "regression", "primary_metric": "rmse", "backbone": "mlp", "backbone_config": {"seed": 0, "n_jobs": 4, "weight_decay": 0.0001, "hidden": [128, 64, 32]}, "data": {"format": "csv", "path": "C:\\Users\\abhir\\autoresearch-uci\\beijing_pm25\\data\\features_full.csv", "target_columns": ["pm25"], "feature_columns": ["DEWP", "TEMP", "PRES", "Iws", "Is", "Ir", "cbwd_NE", "cbwd_NW", "cbwd_SE", "cbwd_cv", "pm25_lag1", "pm25_lag2", "pm25_lag3", "pm25_lag4", "pm25_lag5", "pm25_lag6", "pm25_lag7", "pm25_lag8", "pm25_lag9", "pm25_lag10", "pm25_lag11", "pm25_lag12", "pm25_lag13", "pm25_lag14", "pm25_lag15", "pm25_lag16", "pm25_lag17", "pm25_lag18", "pm25_lag19", "pm25_lag20", "pm25_lag21", "pm25_lag22", "pm25_lag23", "pm25_lag24", "hour_sin", "hour_cos", "dow", "is_weekend", "pm25_delta1", "inversion_spread", "rh_magnus", "dewp_delta", "is_heating"]}, "split": {"name": "calendar_year", "manifest_dir": "C:\\Users\\abhir\\autoresearch-uci\\beijing_pm25\\data"}, "composite": {"higher_is_better": false, "penalty_weight": 0.1, "below_threshold": -40.0}, "hardware": {"n_threads": 4, "cpu_affinity": [0, 2, 4, 6]}, "description": "Exp128 MLP hidden 128-64-32 on Exp127 recipe (MLP cycle 4/50)", "seed": 0}, "composite": -23.079596143127272, "val_primary": 23.079596143127272, "test_primary": 21.344016200718077, "per_fold_test": [21.344016200718077], "per_fold_val": [23.079596143127272], "status": "DISCARD", "seconds_elapsed": 51.38782739639282, "timestamp": "2026-08-19T15:41:24", "secondary_metrics": {"mae": 11.755513220493148, "mape": 0.2125394283983595, "r2": 0.9473703715978466, "ic": 0.9723904092690062}, "per_fold_test_reports": [{"fold_id": 0, "regime": "calendar_2014_test", "task_type": "regression", "n": 7950, "rmse": 21.344016200718077, "mae": 11.755513220493148, "mape": 0.2125394283983595, "r2": 0.9473703715978466, "ic": 0.9723904092690062}], "composite_fingerprint": "a12fd381fe9bbefb"}
{"experiment_num": 129, "backbone": "mlp", "description": "Exp129 MLP Adam lr=1e-4 on Exp127 recipe (MLP cycle 5/50)", "config": {"paths": {"results_dir": "C:\\Users\\abhir\\autoresearch-uci\\beijing_pm25\\autoresearch_results"}, "task_type": "regression", "primary_metric": "rmse", "backbone": "mlp", "backbone_config": {"seed": 0, "n_jobs": 4, "weight_decay": 0.0001, "lr": 0.0001}, "data": {"format": "csv", "path": "C:\\Users\\abhir\\autoresearch-uci\\beijing_pm25\\data\\features_full.csv", "target_columns": ["pm25"], "feature_columns": ["DEWP", "TEMP", "PRES", "Iws", "Is", "Ir", "cbwd_NE", "cbwd_NW", "cbwd_SE", "cbwd_cv", "pm25_lag1", "pm25_lag2", "pm25_lag3", "pm25_lag4", "pm25_lag5", "pm25_lag6", "pm25_lag7", "pm25_lag8", "pm25_lag9", "pm25_lag10", "pm25_lag11", "pm25_lag12", "pm25_lag13", "pm25_lag14", "pm25_lag15", "pm25_lag16", "pm25_lag17", "pm25_lag18", "pm25_lag19", "pm25_lag20", "pm25_lag21", "pm25_lag22", "pm25_lag23", "pm25_lag24", "hour_sin", "hour_cos", "dow", "is_weekend", "pm25_delta1", "inversion_spread", "rh_magnus", "dewp_delta", "is_heating"]}, "split": {"name": "calendar_year", "manifest_dir": "C:\\Users\\abhir\\autoresearch-uci\\beijing_pm25\\data"}, "composite": {"higher_is_better": false, "penalty_weight": 0.1, "below_threshold": -40.0}, "hardware": {"n_threads": 4, "cpu_affinity": [0, 2, 4, 6]}, "description": "Exp129 MLP Adam lr=1e-4 on Exp127 recipe (MLP cycle 5/50)", "seed": 0}, "composite": -23.06944515182658, "val_primary": 23.06944515182658, "test_primary": 21.348804139379425, "per_fold_test": [21.348804139379425], "per_fold_val": [23.06944515182658], "status": "DISCARD", "seconds_elapsed": 70.42064380645752, "timestamp": "2026-08-19T16:10:13", "secondary_metrics": {"mae": 11.783909757422201, "mape": 0.21297125645786993, "r2": 0.9473467569516255, "ic": 0.9718339114025364}, "per_fold_test_reports": [{"fold_id": 0, "regime": "calendar_2014_test", "task_type": "regression", "n": 7950, "rmse": 21.348804139379425, "mae": 11.783909757422201, "mape": 0.21297125645786993, "r2": 0.9473467569516255, "ic": 0.9718339114025364}], "composite_fingerprint": "a12fd381fe9bbefb"}
{"experiment_num": 130, "backbone": "mlp", "description": "Exp130 MLP batch_size=16 on Exp127 recipe (MLP cycle 6/50)", "config": {"paths": {"results_dir": "C:\\Users\\abhir\\autoresearch-uci\\beijing_pm25\\autoresearch_results"}, "task_type": "regression", "primary_metric": "rmse", "backbone": "mlp", "backbone_config": {"seed": 0, "n_jobs": 4, "weight_decay": 0.0001, "batch_size": 16}, "data": {"format": "csv", "path": "C:\\Users\\abhir\\autoresearch-uci\\beijing_pm25\\data\\features_full.csv", "target_columns": ["pm25"], "feature_columns": ["DEWP", "TEMP", "PRES", "Iws", "Is", "Ir", "cbwd_NE", "cbwd_NW", "cbwd_SE", "cbwd_cv", "pm25_lag1", "pm25_lag2", "pm25_lag3", "pm25_lag4", "pm25_lag5", "pm25_lag6", "pm25_lag7", "pm25_lag8", "pm25_lag9", "pm25_lag10", "pm25_lag11", "pm25_lag12", "pm25_lag13", "pm25_lag14", "pm25_lag15", "pm25_lag16", "pm25_lag17", "pm25_lag18", "pm25_lag19", "pm25_lag20", "pm25_lag21", "pm25_lag22", "pm25_lag23", "pm25_lag24", "hour_sin", "hour_cos", "dow", "is_weekend", "pm25_delta1", "inversion_spread", "rh_magnus", "dewp_delta", "is_heating"]}, "split": {"name": "calendar_year", "manifest_dir": "C:\\Users\\abhir\\autoresearch-uci\\beijing_pm25\\data"}, "composite": {"higher_is_better": false, "penalty_weight": 0.1, "below_threshold": -40.0}, "hardware": {"n_threads": 4, "cpu_affinity": [0, 2, 4, 6]}, "description": "Exp130 MLP batch_size=16 on Exp127 recipe (MLP cycle 6/50)", "seed": 0}, "composite": -22.5270905056088, "val_primary": 22.5270905056088, "test_primary": 20.45704331070297, "per_fold_test": [20.45704331070297], "per_fold_val": [22.5270905056088], "status": "DISCARD", "seconds_elapsed": 143.10340976715088, "timestamp": "2026-08-19T16:43:17", "secondary_metrics": {"mae": 11.320595138297891, "mape": 0.20270229484075047, "r2": 0.9516536436119534, "ic": 0.9728701894620301}, "per_fold_test_reports": [{"fold_id": 0, "regime": "calendar_2014_test", "task_type": "regression", "n": 7950, "rmse": 20.45704331070297, "mae": 11.320595138297891, "mape": 0.20270229484075047, "r2": 0.9516536436119534, "ic": 0.9728701894620301}], "composite_fingerprint": "a12fd381fe9bbefb"}
{"experiment_num": 131, "backbone": "mlp", "description": "Exp131 MLP epochs=80 on Exp130 recipe (MLP cycle 7/50)", "config": {"paths": {"results_dir": "C:\\Users\\abhir\\autoresearch-uci\\beijing_pm25\\autoresearch_results"}, "task_type": "regression", "primary_metric": "rmse", "backbone": "mlp", "backbone_config": {"seed": 0, "n_jobs": 4, "weight_decay": 0.0001, "batch_size": 16, "epochs": 80}, "data": {"format": "csv", "path": "C:\\Users\\abhir\\autoresearch-uci\\beijing_pm25\\data\\features_full.csv", "target_columns": ["pm25"], "feature_columns": ["DEWP", "TEMP", "PRES", "Iws", "Is", "Ir", "cbwd_NE", "cbwd_NW", "cbwd_SE", "cbwd_cv", "pm25_lag1", "pm25_lag2", "pm25_lag3", "pm25_lag4", "pm25_lag5", "pm25_lag6", "pm25_lag7", "pm25_lag8", "pm25_lag9", "pm25_lag10", "pm25_lag11", "pm25_lag12", "pm25_lag13", "pm25_lag14", "pm25_lag15", "pm25_lag16", "pm25_lag17", "pm25_lag18", "pm25_lag19", "pm25_lag20", "pm25_lag21", "pm25_lag22", "pm25_lag23", "pm25_lag24", "hour_sin", "hour_cos", "dow", "is_weekend", "pm25_delta1", "inversion_spread", "rh_magnus", "dewp_delta", "is_heating"]}, "split": {"name": "calendar_year", "manifest_dir": "C:\\Users\\abhir\\autoresearch-uci\\beijing_pm25\\data"}, "composite": {"higher_is_better": false, "penalty_weight": 0.1, "below_threshold": -40.0}, "hardware": {"n_threads": 4, "cpu_affinity": [0, 2, 4, 6]}, "description": "Exp131 MLP epochs=80 on Exp130 recipe (MLP cycle 7/50)", "seed": 0}, "composite": -22.544563493340352, "val_primary": 22.544563493340352, "test_primary": 20.606981432774905, "per_fold_test": [20.606981432774905], "per_fold_val": [22.544563493340352], "status": "DISCARD", "seconds_elapsed": 150.51067996025085, "timestamp": "2026-08-19T17:12:06", "secondary_metrics": {"mae": 11.310901403607062, "mape": 0.19948587512864355, "r2": 0.9509423455916485, "ic": 0.9726292708535235}, "per_fold_test_reports": [{"fold_id": 0, "regime": "calendar_2014_test", "task_type": "regression", "n": 7950, "rmse": 20.606981432774905, "mae": 11.310901403607062, "mape": 0.19948587512864355, "r2": 0.9509423455916485, "ic": 0.9726292708535235}], "composite_fingerprint": "a12fd381fe9bbefb"}
