{"experiment_num": 50, "backbone": "lightgbm", "description": "Exp50 t+6 path_smooth=1 on Exp47 31-leaf month_sin recipe (LGB side ladder 24/50)", "config": {"paths": {"results_dir": "C:\\Users\\abhir\\autoresearch-uci\\beijing_pm25\\autoresearch_results"}, "task_type": "regression", "primary_metric": "rmse", "backbone": "lightgbm", "backbone_config": {"seed": 0, "n_jobs": 4, "n_estimators": 2000, "num_leaves": 31, "learning_rate": 0.01, "feature_fraction": 0.8, "bagging_fraction": 0.6, "early_stopping_rounds": 50, "path_smooth": 1}, "data": {"format": "csv", "path": "C:\\Users\\abhir\\autoresearch-uci\\beijing_pm25\\data\\features_horizon6.csv", "target_columns": ["pm25"], "feature_columns": ["DEWP", "TEMP", "PRES", "Iws", "Is", "Ir", "cbwd_NE", "cbwd_NW", "cbwd_SE", "cbwd_cv", "pm25_lag1", "pm25_lag2", "pm25_lag3", "pm25_lag4", "pm25_lag5", "pm25_lag6", "pm25_lag7", "pm25_lag8", "pm25_lag9", "pm25_lag10", "pm25_lag11", "pm25_lag12", "pm25_lag13", "pm25_lag14", "pm25_lag15", "pm25_lag16", "pm25_lag17", "pm25_lag18", "pm25_lag19", "pm25_lag20", "pm25_lag21", "pm25_lag22", "pm25_lag23", "pm25_lag24", "hour_sin", "hour_cos", "dow", "is_weekend", "pm25_delta1", "inversion_spread", "month_sin"]}, "split": {"name": "calendar_year", "manifest_dir": "C:\\Users\\abhir\\autoresearch-uci\\beijing_pm25\\data"}, "composite": {"higher_is_better": false, "penalty_weight": 0.1, "below_threshold": -40.0}, "hardware": {"n_threads": 4, "cpu_affinity": [0, 2, 4, 6]}, "description": "Exp50 t+6 path_smooth=1 on Exp47 31-leaf month_sin recipe (LGB side ladder 24/50)", "seed": 0}, "composite": -58.35931126885862, "val_primary": 58.25931126885862, "test_primary": 55.08970337208535, "per_fold_test": [55.08970337208535], "per_fold_val": [58.25931126885862], "status": "DISCARD", "seconds_elapsed": 11.906753301620483, "timestamp": "2026-08-18T06:05:39", "secondary_metrics": {"mae": 35.74386026315677, "mape": 0.922994911685723, "r2": 0.6493943683192196, "ic": 0.7880013271877889}, "per_fold_test_reports": [{"fold_id": 0, "regime": "calendar_2014_test", "task_type": "regression", "n": 7950, "rmse": 55.08970337208535, "mae": 35.74386026315677, "mape": 0.922994911685723, "r2": 0.6493943683192196, "ic": 0.7880013271877889}], "composite_fingerprint": "a12fd381fe9bbefb"}
{"experiment_num": 51, "backbone": "lightgbm", "description": "Exp51 t+6 learning_rate 0.02 on Exp47 31-leaf month_sin recipe (LGB side ladder 25/50)", "config": {"paths": {"results_dir": "C:\\Users\\abhir\\autoresearch-uci\\beijing_pm25\\autoresearch_results"}, "task_type": "regression", "primary_metric": "rmse", "backbone": "lightgbm", "backbone_config": {"seed": 0, "n_jobs": 4, "n_estimators": 2000, "num_leaves": 31, "learning_rate": 0.02, "feature_fraction": 0.8, "bagging_fraction": 0.6, "early_stopping_rounds": 50}, "data": {"format": "csv", "path": "C:\\Users\\abhir\\autoresearch-uci\\beijing_pm25\\data\\features_horizon6.csv", "target_columns": ["pm25"], "feature_columns": ["DEWP", "TEMP", "PRES", "Iws", "Is", "Ir", "cbwd_NE", "cbwd_NW", "cbwd_SE", "cbwd_cv", "pm25_lag1", "pm25_lag2", "pm25_lag3", "pm25_lag4", "pm25_lag5", "pm25_lag6", "pm25_lag7", "pm25_lag8", "pm25_lag9", "pm25_lag10", "pm25_lag11", "pm25_lag12", "pm25_lag13", "pm25_lag14", "pm25_lag15", "pm25_lag16", "pm25_lag17", "pm25_lag18", "pm25_lag19", "pm25_lag20", "pm25_lag21", "pm25_lag22", "pm25_lag23", "pm25_lag24", "hour_sin", "hour_cos", "dow", "is_weekend", "pm25_delta1", "inversion_spread", "month_sin"]}, "split": {"name": "calendar_year", "manifest_dir": "C:\\Users\\abhir\\autoresearch-uci\\beijing_pm25\\data"}, "composite": {"higher_is_better": false, "penalty_weight": 0.1, "below_threshold": -40.0}, "hardware": {"n_threads": 4, "cpu_affinity": [0, 2, 4, 6]}, "description": "Exp51 t+6 learning_rate 0.02 on Exp47 31-leaf month_sin recipe (LGB side ladder 25/50)", "seed": 0}, "composite": -58.40170609999525, "val_primary": 58.30170609999525, "test_primary": 55.15416214631924, "per_fold_test": [55.15416214631924], "per_fold_val": [58.30170609999525], "status": "DISCARD", "seconds_elapsed": 4.828065872192383, "timestamp": "2026-08-18T06:34:43", "secondary_metrics": {"mae": 35.77747121193796, "mape": 0.9249519033911067, "r2": 0.6485734225007196, "ic": 0.7876082291177686}, "per_fold_test_reports": [{"fold_id": 0, "regime": "calendar_2014_test", "task_type": "regression", "n": 7950, "rmse": 55.15416214631924, "mae": 35.77747121193796, "mape": 0.9249519033911067, "r2": 0.6485734225007196, "ic": 0.7876082291177686}], "composite_fingerprint": "a12fd381fe9bbefb"}
{"experiment_num": 52, "backbone": "lightgbm", "description": "Exp52 t+6 feature_fraction 0.6 on Exp47 31-leaf month_sin recipe (LGB side ladder 26/50)", "config": {"paths": {"results_dir": "C:\\Users\\abhir\\autoresearch-uci\\beijing_pm25\\autoresearch_results"}, "task_type": "regression", "primary_metric": "rmse", "backbone": "lightgbm", "backbone_config": {"seed": 0, "n_jobs": 4, "n_estimators": 2000, "num_leaves": 31, "learning_rate": 0.01, "feature_fraction": 0.6, "bagging_fraction": 0.6, "early_stopping_rounds": 50}, "data": {"format": "csv", "path": "C:\\Users\\abhir\\autoresearch-uci\\beijing_pm25\\data\\features_horizon6.csv", "target_columns": ["pm25"], "feature_columns": ["DEWP", "TEMP", "PRES", "Iws", "Is", "Ir", "cbwd_NE", "cbwd_NW", "cbwd_SE", "cbwd_cv", "pm25_lag1", "pm25_lag2", "pm25_lag3", "pm25_lag4", "pm25_lag5", "pm25_lag6", "pm25_lag7", "pm25_lag8", "pm25_lag9", "pm25_lag10", "pm25_lag11", "pm25_lag12", "pm25_lag13", "pm25_lag14", "pm25_lag15", "pm25_lag16", "pm25_lag17", "pm25_lag18", "pm25_lag19", "pm25_lag20", "pm25_lag21", "pm25_lag22", "pm25_lag23", "pm25_lag24", "hour_sin", "hour_cos", "dow", "is_weekend", "pm25_delta1", "inversion_spread", "month_sin"]}, "split": {"name": "calendar_year", "manifest_dir": "C:\\Users\\abhir\\autoresearch-uci\\beijing_pm25\\data"}, "composite": {"higher_is_better": false, "penalty_weight": 0.1, "below_threshold": -40.0}, "hardware": {"n_threads": 4, "cpu_affinity": [0, 2, 4, 6]}, "description": "Exp52 t+6 feature_fraction 0.6 on Exp47 31-leaf month_sin recipe (LGB side ladder 26/50)", "seed": 0}, "composite": -58.4234054194731, "val_primary": 58.3234054194731, "test_primary": 55.05346345138173, "per_fold_test": [55.05346345138173], "per_fold_val": [58.3234054194731], "status": "DISCARD", "seconds_elapsed": 6.4992687702178955, "timestamp": "2026-08-18T06:36:10", "secondary_metrics": {"mae": 35.866718225408285, "mape": 0.9293684967893393, "r2": 0.649855497725079, "ic": 0.7872378851277252}, "per_fold_test_reports": [{"fold_id": 0, "regime": "calendar_2014_test", "task_type": "regression", "n": 7950, "rmse": 55.05346345138173, "mae": 35.866718225408285, "mape": 0.9293684967893393, "r2": 0.649855497725079, "ic": 0.7872378851277252}], "composite_fingerprint": "a12fd381fe9bbefb"}
{"experiment_num": 53, "backbone": "lightgbm", "description": "Exp53 t+6 persist-6 residual target on Exp47 31-leaf month_sin recipe (LGB side ladder 27/50)", "config": {"paths": {"results_dir": "C:\\Users\\abhir\\autoresearch-uci\\beijing_pm25\\autoresearch_results"}, "task_type": "regression", "primary_metric": "rmse", "backbone": "lightgbm", "backbone_config": {"seed": 0, "n_jobs": 4, "n_estimators": 2000, "num_leaves": 31, "learning_rate": 0.01, "feature_fraction": 0.8, "bagging_fraction": 0.6, "early_stopping_rounds": 50}, "data": {"format": "csv", "path": "C:\\Users\\abhir\\autoresearch-uci\\beijing_pm25\\data\\features_horizon6_resid.csv", "target_columns": ["pm25"], "feature_columns": ["DEWP", "TEMP", "PRES", "Iws", "Is", "Ir", "cbwd_NE", "cbwd_NW", "cbwd_SE", "cbwd_cv", "pm25_lag1", "pm25_lag2", "pm25_lag3", "pm25_lag4", "pm25_lag5", "pm25_lag6", "pm25_lag7", "pm25_lag8", "pm25_lag9", "pm25_lag10", "pm25_lag11", "pm25_lag12", "pm25_lag13", "pm25_lag14", "pm25_lag15", "pm25_lag16", "pm25_lag17", "pm25_lag18", "pm25_lag19", "pm25_lag20", "pm25_lag21", "pm25_lag22", "pm25_lag23", "pm25_lag24", "hour_sin", "hour_cos", "dow", "is_weekend", "pm25_delta1", "inversion_spread", "month_sin"]}, "split": {"name": "calendar_year", "manifest_dir": "C:\\Users\\abhir\\autoresearch-uci\\beijing_pm25\\data"}, "composite": {"higher_is_better": false, "penalty_weight": 0.1, "below_threshold": -40.0}, "hardware": {"n_threads": 4, "cpu_affinity": [0, 2, 4, 6]}, "description": "Exp53 t+6 persist-6 residual target on Exp47 31-leaf month_sin recipe (LGB side ladder 27/50)", "seed": 0}, "composite": -58.783962054346006, "val_primary": 58.683962054346004, "test_primary": 55.04448226308678, "per_fold_test": [55.04448226308678], "per_fold_val": [58.683962054346004], "status": "DISCARD", "seconds_elapsed": 12.972671747207642, "timestamp": "2026-08-18T07:08:28", "secondary_metrics": {"mae": 35.49650950354167, "mape": 1.9215119857977172, "r2": 0.24038112000666478, "ic": 0.45503850139586977}, "per_fold_test_reports": [{"fold_id": 0, "regime": "calendar_2014_test", "task_type": "regression", "n": 7950, "rmse": 55.04448226308678, "mae": 35.49650950354167, "mape": 1.9215119857977172, "r2": 0.24038112000666478, "ic": 0.45503850139586977}], "composite_fingerprint": "a12fd381fe9bbefb"}
{"experiment_num": 54, "backbone": "lightgbm", "description": "Exp54 t+6 Tweedie objective on Exp47 31-leaf month_sin recipe (LGB side ladder 28/50)", "config": {"paths": {"results_dir": "C:\\Users\\abhir\\autoresearch-uci\\beijing_pm25\\autoresearch_results"}, "task_type": "regression", "primary_metric": "rmse", "backbone": "lightgbm", "backbone_config": {"seed": 0, "n_jobs": 4, "n_estimators": 2000, "num_leaves": 31, "learning_rate": 0.01, "feature_fraction": 0.8, "bagging_fraction": 0.6, "early_stopping_rounds": 50, "lgb_objective": "tweedie"}, "data": {"format": "csv", "path": "C:\\Users\\abhir\\autoresearch-uci\\beijing_pm25\\data\\features_horizon6.csv", "target_columns": ["pm25"], "feature_columns": ["DEWP", "TEMP", "PRES", "Iws", "Is", "Ir", "cbwd_NE", "cbwd_NW", "cbwd_SE", "cbwd_cv", "pm25_lag1", "pm25_lag2", "pm25_lag3", "pm25_lag4", "pm25_lag5", "pm25_lag6", "pm25_lag7", "pm25_lag8", "pm25_lag9", "pm25_lag10", "pm25_lag11", "pm25_lag12", "pm25_lag13", "pm25_lag14", "pm25_lag15", "pm25_lag16", "pm25_lag17", "pm25_lag18", "pm25_lag19", "pm25_lag20", "pm25_lag21", "pm25_lag22", "pm25_lag23", "pm25_lag24", "hour_sin", "hour_cos", "dow", "is_weekend", "pm25_delta1", "inversion_spread", "month_sin"]}, "split": {"name": "calendar_year", "manifest_dir": "C:\\Users\\abhir\\autoresearch-uci\\beijing_pm25\\data"}, "composite": {"higher_is_better": false, "penalty_weight": 0.1, "below_threshold": -40.0}, "hardware": {"n_threads": 4, "cpu_affinity": [0, 2, 4, 6]}, "description": "Exp54 t+6 Tweedie objective on Exp47 31-leaf month_sin recipe (LGB side ladder 28/50)", "seed": 0}, "composite": -58.77211625023915, "val_primary": 58.67211625023915, "test_primary": 54.790076829064645, "per_fold_test": [54.790076829064645], "per_fold_val": [58.67211625023915], "status": "DISCARD", "seconds_elapsed": 9.926597833633423, "timestamp": "2026-08-18T07:10:42", "secondary_metrics": {"mae": 35.31781013638341, "mape": 0.8663945935372019, "r2": 0.6531978040796391, "ic": 0.7927180404686213}, "per_fold_test_reports": [{"fold_id": 0, "regime": "calendar_2014_test", "task_type": "regression", "n": 7950, "rmse": 54.790076829064645, "mae": 35.31781013638341, "mape": 0.8663945935372019, "r2": 0.6531978040796391, "ic": 0.7927180404686213}], "composite_fingerprint": "a12fd381fe9bbefb"}
{"experiment_num": 55, "backbone": "lightgbm", "description": "Exp55 t+6 add pres_delta issue-time pressure tendency on Exp47 recipe (LGB side ladder 29/50)", "config": {"paths": {"results_dir": "C:\\Users\\abhir\\autoresearch-uci\\beijing_pm25\\autoresearch_results"}, "task_type": "regression", "primary_metric": "rmse", "backbone": "lightgbm", "backbone_config": {"seed": 0, "n_jobs": 4, "n_estimators": 2000, "num_leaves": 31, "learning_rate": 0.01, "feature_fraction": 0.8, "bagging_fraction": 0.6, "early_stopping_rounds": 50}, "data": {"format": "csv", "path": "C:\\Users\\abhir\\autoresearch-uci\\beijing_pm25\\data\\features_horizon6.csv", "target_columns": ["pm25"], "feature_columns": ["DEWP", "TEMP", "PRES", "Iws", "Is", "Ir", "cbwd_NE", "cbwd_NW", "cbwd_SE", "cbwd_cv", "pm25_lag1", "pm25_lag2", "pm25_lag3", "pm25_lag4", "pm25_lag5", "pm25_lag6", "pm25_lag7", "pm25_lag8", "pm25_lag9", "pm25_lag10", "pm25_lag11", "pm25_lag12", "pm25_lag13", "pm25_lag14", "pm25_lag15", "pm25_lag16", "pm25_lag17", "pm25_lag18", "pm25_lag19", "pm25_lag20", "pm25_lag21", "pm25_lag22", "pm25_lag23", "pm25_lag24", "hour_sin", "hour_cos", "dow", "is_weekend", "pm25_delta1", "inversion_spread", "month_sin", "pres_delta"]}, "split": {"name": "calendar_year", "manifest_dir": "C:\\Users\\abhir\\autoresearch-uci\\beijing_pm25\\data"}, "composite": {"higher_is_better": false, "penalty_weight": 0.1, "below_threshold": -40.0}, "hardware": {"n_threads": 4, "cpu_affinity": [0, 2, 4, 6]}, "description": "Exp55 t+6 add pres_delta issue-time pressure tendency on Exp47 recipe (LGB side ladder 29/50)", "seed": 0}, "composite": -58.13814974145406, "val_primary": 58.038149741454056, "test_primary": 54.75134206732053, "per_fold_test": [54.75134206732053], "per_fold_val": [58.038149741454056], "status": "DISCARD", "seconds_elapsed": 11.373445987701416, "timestamp": "2026-08-18T07:36:27", "secondary_metrics": {"mae": 35.50664078376503, "mape": 0.9092974056385765, "r2": 0.6536879859797278, "ic": 0.7900030788458967}, "per_fold_test_reports": [{"fold_id": 0, "regime": "calendar_2014_test", "task_type": "regression", "n": 7950, "rmse": 54.75134206732053, "mae": 35.50664078376503, "mape": 0.9092974056385765, "r2": 0.6536879859797278, "ic": 0.7900030788458967}], "composite_fingerprint": "a12fd381fe9bbefb"}
{"experiment_num": 56, "backbone": "lightgbm", "description": "Exp56 t+6 add dewp_delta issue-time dewpoint tendency on Exp55 recipe (LGB side ladder 30/50)", "config": {"paths": {"results_dir": "C:\\Users\\abhir\\autoresearch-uci\\beijing_pm25\\autoresearch_results"}, "task_type": "regression", "primary_metric": "rmse", "backbone": "lightgbm", "backbone_config": {"seed": 0, "n_jobs": 4, "n_estimators": 2000, "num_leaves": 31, "learning_rate": 0.01, "feature_fraction": 0.8, "bagging_fraction": 0.6, "early_stopping_rounds": 50}, "data": {"format": "csv", "path": "C:\\Users\\abhir\\autoresearch-uci\\beijing_pm25\\data\\features_horizon6.csv", "target_columns": ["pm25"], "feature_columns": ["DEWP", "TEMP", "PRES", "Iws", "Is", "Ir", "cbwd_NE", "cbwd_NW", "cbwd_SE", "cbwd_cv", "pm25_lag1", "pm25_lag2", "pm25_lag3", "pm25_lag4", "pm25_lag5", "pm25_lag6", "pm25_lag7", "pm25_lag8", "pm25_lag9", "pm25_lag10", "pm25_lag11", "pm25_lag12", "pm25_lag13", "pm25_lag14", "pm25_lag15", "pm25_lag16", "pm25_lag17", "pm25_lag18", "pm25_lag19", "pm25_lag20", "pm25_lag21", "pm25_lag22", "pm25_lag23", "pm25_lag24", "hour_sin", "hour_cos", "dow", "is_weekend", "pm25_delta1", "inversion_spread", "month_sin", "pres_delta", "dewp_delta"]}, "split": {"name": "calendar_year", "manifest_dir": "C:\\Users\\abhir\\autoresearch-uci\\beijing_pm25\\data"}, "composite": {"higher_is_better": false, "penalty_weight": 0.1, "below_threshold": -40.0}, "hardware": {"n_threads": 4, "cpu_affinity": [0, 2, 4, 6]}, "description": "Exp56 t+6 add dewp_delta issue-time dewpoint tendency on Exp55 recipe (LGB side ladder 30/50)", "seed": 0}, "composite": -57.75807003440833, "val_primary": 57.658070034408325, "test_primary": 54.48652595686482, "per_fold_test": [54.48652595686482], "per_fold_val": [57.658070034408325], "status": "DISCARD", "seconds_elapsed": 10.369587421417236, "timestamp": "2026-08-18T08:05:22", "secondary_metrics": {"mae": 35.27936243188131, "mape": 0.9031663715239144, "r2": 0.6570299028129805, "ic": 0.792791292527967}, "per_fold_test_reports": [{"fold_id": 0, "regime": "calendar_2014_test", "task_type": "regression", "n": 7950, "rmse": 54.48652595686482, "mae": 35.27936243188131, "mape": 0.9031663715239144, "r2": 0.6570299028129805, "ic": 0.792791292527967}], "composite_fingerprint": "a12fd381fe9bbefb"}
{"experiment_num": 57, "backbone": "lightgbm", "description": "Exp57 t+6 add haze_hours6 episode-length count on Exp56 recipe (LGB side ladder 31/50)", "config": {"paths": {"results_dir": "C:\\Users\\abhir\\autoresearch-uci\\beijing_pm25\\autoresearch_results"}, "task_type": "regression", "primary_metric": "rmse", "backbone": "lightgbm", "backbone_config": {"seed": 0, "n_jobs": 4, "n_estimators": 2000, "num_leaves": 31, "learning_rate": 0.01, "feature_fraction": 0.8, "bagging_fraction": 0.6, "early_stopping_rounds": 50}, "data": {"format": "csv", "path": "C:\\Users\\abhir\\autoresearch-uci\\beijing_pm25\\data\\features_horizon6.csv", "target_columns": ["pm25"], "feature_columns": ["DEWP", "TEMP", "PRES", "Iws", "Is", "Ir", "cbwd_NE", "cbwd_NW", "cbwd_SE", "cbwd_cv", "pm25_lag1", "pm25_lag2", "pm25_lag3", "pm25_lag4", "pm25_lag5", "pm25_lag6", "pm25_lag7", "pm25_lag8", "pm25_lag9", "pm25_lag10", "pm25_lag11", "pm25_lag12", "pm25_lag13", "pm25_lag14", "pm25_lag15", "pm25_lag16", "pm25_lag17", "pm25_lag18", "pm25_lag19", "pm25_lag20", "pm25_lag21", "pm25_lag22", "pm25_lag23", "pm25_lag24", "hour_sin", "hour_cos", "dow", "is_weekend", "pm25_delta1", "inversion_spread", "month_sin", "pres_delta", "dewp_delta", "haze_hours6"]}, "split": {"name": "calendar_year", "manifest_dir": "C:\\Users\\abhir\\autoresearch-uci\\beijing_pm25\\data"}, "composite": {"higher_is_better": false, "penalty_weight": 0.1, "below_threshold": -40.0}, "hardware": {"n_threads": 4, "cpu_affinity": [0, 2, 4, 6]}, "description": "Exp57 t+6 add haze_hours6 episode-length count on Exp56 recipe (LGB side ladder 31/50)", "seed": 0}, "composite": -57.96351948975934, "val_primary": 57.86351948975934, "test_primary": 54.384885120470734, "per_fold_test": [54.384885120470734], "per_fold_val": [57.86351948975934], "status": "DISCARD", "seconds_elapsed": 8.515623092651367, "timestamp": "2026-08-18T08:35:17", "secondary_metrics": {"mae": 35.27770778427605, "mape": 0.9070579298523348, "r2": 0.6583082832083147, "ic": 0.7922269371503626}, "per_fold_test_reports": [{"fold_id": 0, "regime": "calendar_2014_test", "task_type": "regression", "n": 7950, "rmse": 54.384885120470734, "mae": 35.27770778427605, "mape": 0.9070579298523348, "r2": 0.6583082832083147, "ic": 0.7922269371503626}], "composite_fingerprint": "a12fd381fe9bbefb"}
{"experiment_num": 58, "backbone": "lightgbm", "description": "Exp58 t+6 reg_lambda=1 on Exp56 31-leaf pres_delta dewp_delta recipe (LGB side ladder 32/50)", "config": {"paths": {"results_dir": "C:\\Users\\abhir\\autoresearch-uci\\beijing_pm25\\autoresearch_results"}, "task_type": "regression", "primary_metric": "rmse", "backbone": "lightgbm", "backbone_config": {"seed": 0, "n_jobs": 4, "n_estimators": 2000, "num_leaves": 31, "learning_rate": 0.01, "feature_fraction": 0.8, "bagging_fraction": 0.6, "early_stopping_rounds": 50, "reg_lambda": 1}, "data": {"format": "csv", "path": "C:\\Users\\abhir\\autoresearch-uci\\beijing_pm25\\data\\features_horizon6.csv", "target_columns": ["pm25"], "feature_columns": ["DEWP", "TEMP", "PRES", "Iws", "Is", "Ir", "cbwd_NE", "cbwd_NW", "cbwd_SE", "cbwd_cv", "pm25_lag1", "pm25_lag2", "pm25_lag3", "pm25_lag4", "pm25_lag5", "pm25_lag6", "pm25_lag7", "pm25_lag8", "pm25_lag9", "pm25_lag10", "pm25_lag11", "pm25_lag12", "pm25_lag13", "pm25_lag14", "pm25_lag15", "pm25_lag16", "pm25_lag17", "pm25_lag18", "pm25_lag19", "pm25_lag20", "pm25_lag21", "pm25_lag22", "pm25_lag23", "pm25_lag24", "hour_sin", "hour_cos", "dow", "is_weekend", "pm25_delta1", "inversion_spread", "month_sin", "pres_delta", "dewp_delta"]}, "split": {"name": "calendar_year", "manifest_dir": "C:\\Users\\abhir\\autoresearch-uci\\beijing_pm25\\data"}, "composite": {"higher_is_better": false, "penalty_weight": 0.1, "below_threshold": -40.0}, "hardware": {"n_threads": 4, "cpu_affinity": [0, 2, 4, 6]}, "description": "Exp58 t+6 reg_lambda=1 on Exp56 31-leaf pres_delta dewp_delta recipe (LGB side ladder 32/50)", "seed": 0}, "composite": -57.80434272881044, "val_primary": 57.70434272881044, "test_primary": 54.539863124895334, "per_fold_test": [54.539863124895334], "per_fold_val": [57.70434272881044], "status": "DISCARD", "seconds_elapsed": 10.97861623764038, "timestamp": "2026-08-18T08:36:08", "secondary_metrics": {"mae": 35.29933067389698, "mape": 0.9034467052035363, "r2": 0.6563581034288759, "ic": 0.7923510889644494}, "per_fold_test_reports": [{"fold_id": 0, "regime": "calendar_2014_test", "task_type": "regression", "n": 7950, "rmse": 54.539863124895334, "mae": 35.29933067389698, "mape": 0.9034467052035363, "r2": 0.6563581034288759, "ic": 0.7923510889644494}], "composite_fingerprint": "a12fd381fe9bbefb"}
